Date,Last trade price,Max,Min,Avg. Price,%chg.,Volume,Turnover in BEST in denars,Total turnover in denars,Issuer,datetime_object
13.11.2014,"305,00","305,00","305,00","305,00","22,00",581,"177.205,00","177.205,00",ADIN,2014-11-13
02.12.2014,"450,00","450,00","450,00","450,00","47,54",180,"81.000,00","81.000,00",ADIN,2014-12-02
04.12.2014,"409,00","409,00","409,00","409,00","-9,11",100,"40.900,00","40.900,00",ADIN,2014-12-04
05.12.2014,"410,00","410,00","410,00","410,00","0,24",683,"280.030,00","280.030,00",ADIN,2014-12-05
22.12.2014,"357,00","357,00","357,00","357,00","-12,93",100,"35.700,00","35.700,00",ADIN,2014-12-22
26.01.2015,"367,00","367,00","367,00","367,00","2,80",25,"9.175,00","9.175,00",ADIN,2015-01-26
02.02.2015,"367,00","367,00","367,00","367,00","0,00",575,"211.025,00","211.025,00",ADIN,2015-02-02
03.02.2015,"367,00","367,00","367,00","367,00","0,00",396,"145.332,00","145.332,00",ADIN,2015-02-03
13.02.2015,"367,00","367,00","367,00","367,00","0,00",50,"18.350,00","18.350,00",ADIN,2015-02-13
25.03.2015,"375,00","375,00","375,00","375,00","2,18",5,"1.875,00","1.875,00",ADIN,2015-03-25
14.04.2015,"310,00","310,00","310,00","310,00","-17,33",100,"31.000,00","31.000,00",ADIN,2015-04-14
25.06.2015,"250,00","250,00","250,00","250,00","-19,35",576,"144.000,00","144.000,00",ADIN,2015-06-25
18.08.2015,"265,00","265,00","265,00","265,00","6,00","1,467","388.755,00","388.755,00",ADIN,2015-08-18
05.10.2015,"300,00","300,00","300,00","300,00","13,21",100,"30.000,00","30.000,00",ADIN,2015-10-05
22.10.2015,"300,00","300,00","300,00","300,00","0,00",446,"133.800,00","133.800,00",ADIN,2015-10-22
28.10.2015,"299,00","299,00","299,00","299,00","-0,33",330,"98.670,00","98.670,00",ADIN,2015-10-28
30.10.2015,"299,00","299,00","299,00","299,00","0,00",50,"14.950,00","14.950,00",ADIN,2015-10-30
04.11.2015,"270,00","270,00","270,00","270,00","-9,70","1,167","315.090,00","315.090,00",ADIN,2015-11-04
05.11.2015,"290,00","290,00","290,00","290,00","7,41",100,"29.000,00","29.000,00",ADIN,2015-11-05
10.11.2015,"290,00","290,00","290,00","290,00","0,00",200,"58.000,00","58.000,00",ADIN,2015-11-10
19.11.2015,"290,00","290,00","290,00","290,00","0,00",54,"15.660,00","15.660,00",ADIN,2015-11-19
25.11.2015,"345,00","345,00","345,00","345,00","18,97",60,"20.700,00","20.700,00",ADIN,2015-11-25
24.12.2015,"345,00","345,00","345,00","345,00","0,00",10,"3.450,00","3.450,00",ADIN,2015-12-24
05.01.2016,"345,00","345,00","345,00","345,00","0,00",50,"17.250,00","17.250,00",ADIN,2016-01-05
04.03.2016,"311,00","311,00","311,00","311,00","-9,86",50,"15.550,00","15.550,00",ADIN,2016-03-04
09.03.2016,"340,00","340,00","340,00","340,00","9,32",90,"30.600,00","30.600,00",ADIN,2016-03-09
11.03.2016,"339,00","339,00","339,00","339,00","-0,29",41,"13.899,00","13.899,00",ADIN,2016-03-11
15.03.2016,"338,00","338,00","338,00","338,00","-0,29",30,"10.140,00","10.140,00",ADIN,2016-03-15
22.03.2016,"335,00","335,00","335,00","335,00","-0,89",30,"10.050,00","10.050,00",ADIN,2016-03-22
31.03.2016,"325,00","325,00","325,00","325,00","-2,99","1,115","362.375,00","362.375,00",ADIN,2016-03-31
01.04.2016,"300,00","300,00","300,00","300,00","-7,69","1,150","345.000,00","345.000,00",ADIN,2016-04-01
05.04.2016,"300,00","300,00","300,00","300,00","0,00",750,"225.000,00","225.000,00",ADIN,2016-04-05
03.05.2016,"299,00","299,00","299,00","299,00","-0,33",500,"149.500,00","149.500,00",ADIN,2016-05-03
05.05.2016,"300,00","300,00","300,00","300,00","0,33",70,"21.000,00","21.000,00",ADIN,2016-05-05
18.05.2016,"299,00","299,00","299,00","299,00","-0,33",200,"59.800,00","59.800,00",ADIN,2016-05-18
23.05.2016,"300,00","300,00","300,00","300,00","0,33","1,157","347.100,00","347.100,00",ADIN,2016-05-23
31.05.2016,"301,00","301,00","301,00","301,00","0,33",110,"33.110,00","33.110,00",ADIN,2016-05-31
01.06.2016,"300,00","300,00","300,00","300,00","-0,33",350,"105.000,00","105.000,00",ADIN,2016-06-01
03.06.2016,"300,00","300,00","300,00","300,00","0,00",100,"30.000,00","30.000,00",ADIN,2016-06-03
23.06.2016,"300,00","300,00","280,00","297,78","-0,74",180,"53.600,00","53.600,00",ADIN,2016-06-23
05.08.2016,"310,00","310,00","306,00","306,80","3,03",500,"153.400,00","153.400,00",ADIN,2016-08-05
08.08.2016,"310,00","310,00","310,00","310,00","1,04",80,"24.800,00","24.800,00",ADIN,2016-08-08
10.08.2016,"329,00","329,00","329,00","329,00","6,13",100,"32.900,00","32.900,00",ADIN,2016-08-10
15.08.2016,"330,00","330,00","329,00","329,49","0,15",226,"74.464,00","74.464,00",ADIN,2016-08-15
23.08.2016,"320,00","320,00","320,00","320,00","-2,88",20,"6.400,00","6.400,00",ADIN,2016-08-23
25.08.2016,"350,00","350,00","350,00","350,00","9,38",35,"12.250,00","12.250,00",ADIN,2016-08-25
01.09.2016,"385,00","385,00","385,00","385,00","10,00",20,"7.700,00","7.700,00",ADIN,2016-09-01
06.09.2016,"385,00","385,00","385,00","385,00","0,00",25,"9.625,00","9.625,00",ADIN,2016-09-06
05.10.2016,"385,00","385,00","385,00","385,00","0,00","1,258","484.330,00","484.330,00",ADIN,2016-10-05
06.10.2016,"400,00","400,00","400,00","400,00","3,90",196,"78.400,00","78.400,00",ADIN,2016-10-06
19.10.2016,"412,00","412,00","412,00","412,00","3,00",356,"146.672,00","146.672,00",ADIN,2016-10-19
21.10.2016,"453,00","453,00","453,00","453,00","9,95","1,500","679.500,00","679.500,00",ADIN,2016-10-21
26.10.2016,"466,00","466,00","466,00","466,00","2,87",5,"2.330,00","2.330,00",ADIN,2016-10-26
28.10.2016,"466,00",/,/,"466,00","0,00",0,"0,00","0,00",ADIN,2016-10-28
31.10.2016,"481,00","481,00","481,00","481,00","3,22",160,"76.960,00","76.960,00",ADIN,2016-10-31
01.11.2016,"495,00","495,00","495,00","495,00","2,91",199,"98.505,00","98.505,00",ADIN,2016-11-01
02.11.2016,"500,00","500,00","500,00","500,00","1,01",200,"100.000,00","100.000,00",ADIN,2016-11-02
09.11.2016,"500,00","500,00","500,00","500,00","0,00",200,"100.000,00","100.000,00",ADIN,2016-11-09
14.11.2016,"550,00","550,00","550,00","550,00","10,00",100,"55.000,00","55.000,00",ADIN,2016-11-14
15.11.2016,"550,00","550,00","550,00","550,00","0,00",90,"49.500,00","49.500,00",ADIN,2016-11-15
18.11.2016,"600,00","600,00","600,00","600,00","9,09",100,"60.000,00","60.000,00",ADIN,2016-11-18
14.12.2016,"550,00","550,00","550,00","550,00","-8,33",40,"22.000,00","7.986.550,00",ADIN,2016-12-14
15.12.2016,"550,00","550,00","550,00","550,00","0,00",672,"369.600,00","369.600,00",ADIN,2016-12-15
21.12.2016,"605,00","605,00","605,00","605,00","10,00","8,428","5.098.940,00","5.098.940,00",ADIN,2016-12-21
26.12.2016,"605,00","605,00","605,00","605,00","0,00","1,599","967.395,00","967.395,00",ADIN,2016-12-26
29.12.2016,"665,00","665,00","665,00","665,00","9,92",50,"33.250,00","33.250,00",ADIN,2016-12-29
03.01.2017,"731,00","731,00","731,00","731,00","9,92",40,"29.240,00","29.240,00",ADIN,2017-01-03
15.02.2017,"731,00","731,00","731,00","731,00","0,00",40,"29.240,00","29.240,00",ADIN,2017-02-15
16.02.2017,"750,00","750,00","750,00","750,00","2,60",60,"45.000,00","45.000,00",ADIN,2017-02-16
17.02.2017,"728,00","728,00","728,00","728,00","-2,93",30,"21.840,00","21.840,00",ADIN,2017-02-17
24.02.2017,"707,00","707,00","707,00","707,00","-2,88",20,"14.140,00","14.140,00",ADIN,2017-02-24
28.02.2017,"707,00","707,00","707,00","707,00","0,00",30,"21.210,00","21.210,00",ADIN,2017-02-28
01.03.2017,"686,00","686,00","686,00","686,00","-2,97",490,"336.140,00","336.140,00",ADIN,2017-03-01
06.03.2017,"730,00","730,00","630,00","692,50","0,95",40,"27.700,00","27.700,00",ADIN,2017-03-06
07.03.2017,"730,00","730,00","730,00","730,00","5,42",155,"113.150,00","113.150,00",ADIN,2017-03-07
13.03.2017,"657,00","657,00","657,00","657,00","-10,00",15,"9.855,00","9.855,00",ADIN,2017-03-13
23.03.2017,"639,00","639,00","639,00","639,00","-2,74",5,"3.195,00","3.195,00",ADIN,2017-03-23
27.03.2017,"700,00","700,00","700,00","700,00","9,55",5,"3.500,00","3.500,00",ADIN,2017-03-27
29.03.2017,"639,00","639,00","639,00","639,00","-8,71",127,"81.153,00","81.153,00",ADIN,2017-03-29
04.04.2017,"640,00","640,00","640,00","640,00","0,16","1,000","640.000,00","640.000,00",ADIN,2017-04-04
07.04.2017,"601,00","601,00","601,00","601,00","-6,09",10,"6.010,00","6.010,00",ADIN,2017-04-07
19.04.2017,"640,00","640,00","640,00","640,00","6,49",666,"426.240,00","426.240,00",ADIN,2017-04-19
25.04.2017,"680,00","680,00","680,00","680,00","6,25","18,308","12.449.440,00","12.449.440,00",ADIN,2017-04-25
27.04.2017,"680,00","680,00","680,00","680,00","0,00","1,288","875.840,00","875.840,00",ADIN,2017-04-27
07.09.2017,"659,00","659,00","659,00","659,00","-3,09",100,"65.900,00","65.900,00",ADIN,2017-09-07
27.10.2017,"550,00","550,00","550,00","550,00","-16,54",500,"275.000,00","275.000,00",ADIN,2017-10-27
30.10.2017,"550,00",/,/,"550,00","0,00",0,"0,00","0,00",ADIN,2017-10-30
02.11.2017,"550,00","550,00","550,00","550,00","0,00",30,"16.500,00","16.500,00",ADIN,2017-11-02
07.11.2017,"566,00","566,00","566,00","566,00","2,91",600,"339.600,00","339.600,00",ADIN,2017-11-07
16.11.2017,"550,00","550,00","550,00","550,00","-2,83",10,"5.500,00","5.500,00",ADIN,2017-11-16
20.11.2017,"550,00","550,00","550,00","550,00","0,00",350,"192.500,00","192.500,00",ADIN,2017-11-20
21.11.2017,"540,00","540,00","540,00","540,00","-1,82",120,"64.800,00","64.800,00",ADIN,2017-11-21
24.11.2017,"534,00","534,00","534,00","534,00","-1,11",200,"106.800,00","106.800,00",ADIN,2017-11-24
04.01.2018,"518,00","518,00","518,00","518,00","-3,00",350,"181.300,00","181.300,00",ADIN,2018-01-04
29.01.2018,"490,00","490,00","490,00","490,00","-5,41",110,"53.900,00","53.900,00",ADIN,2018-01-29
14.02.2018,"490,00","490,00","490,00","490,00","0,00",200,"98.000,00","98.000,00",ADIN,2018-02-14
07.03.2018,"490,00","490,00","490,00","490,00","0,00",50,"24.500,00","24.500,00",ADIN,2018-03-07
25.07.2018,"558,00","558,00","558,00","558,00","13,88",105,"58.590,00","58.590,00",ADIN,2018-07-25
16.08.2018,"558,00","558,00","558,00","558,00","0,00",320,"178.560,00","178.560,00",ADIN,2018-08-16
23.08.2018,"574,00","574,00","574,00","574,00","2,87",500,"287.000,00","287.000,00",ADIN,2018-08-23
17.09.2018,"557,00","557,00","557,00","557,00","-2,96",360,"200.520,00","200.520,00",ADIN,2018-09-17
20.09.2018,"560,00","560,00","560,00","560,00","0,54",500,"280.000,00","280.000,00",ADIN,2018-09-20
24.09.2018,"560,00","560,00","560,00","560,00","0,00",15,"8.400,00","8.400,00",ADIN,2018-09-24
30.10.2018,"560,00",/,/,"560,00","0,00",0,"0,00","0,00",ADIN,2018-10-30
01.11.2018,"618,00","618,00","618,00","618,00","10,36",360,"222.480,00","222.480,00",ADIN,2018-11-01
28.11.2018,"700,00","700,00","700,00","700,00","13,27",270,"189.000,00","189.000,00",ADIN,2018-11-28
29.11.2018,"700,00","700,00","700,00","700,00","0,00",80,"56.000,00","56.000,00",ADIN,2018-11-29
18.12.2018,"660,00","660,00","660,00","660,00","-5,71",400,"264.000,00","264.000,00",ADIN,2018-12-18
26.12.2018,"660,00","660,00","660,00","660,00","0,00",50,"33.000,00","33.000,00",ADIN,2018-12-26
14.02.2019,"660,00","660,00","660,00","660,00","0,00","1,000","660.000,00","660.000,00",ADIN,2019-02-14
04.03.2019,"691,00","691,00","691,00","691,00","4,70",380,"262.580,00","262.580,00",ADIN,2019-03-04
22.03.2019,"691,00","691,00","691,00","691,00","0,00",100,"69.100,00","69.100,00",ADIN,2019-03-22
17.04.2019,"648,00","648,00","648,00","648,00","-6,22",150,"97.200,00","97.200,00",ADIN,2019-04-17
19.04.2019,"648,00","648,00","648,00","648,00","0,00",20,"12.960,00","12.960,00",ADIN,2019-04-19
29.05.2019,"700,00","700,00","700,00","700,00","8,02",885,"619.500,00","619.500,00",ADIN,2019-05-29
21.06.2019,"679,00","679,00","679,00","679,00","-3,00",400,"271.600,00","271.600,00",ADIN,2019-06-21
08.08.2019,"620,00","620,00","620,00","620,00","-8,69","1,504","932.480,00","932.480,00",ADIN,2019-08-08
14.08.2019,"620,00","620,00","620,00","620,00","0,00",100,"62.000,00","62.000,00",ADIN,2019-08-14
27.08.2019,"660,00","660,00","660,00","660,00","6,45","2,940","1.940.400,00","1.940.400,00",ADIN,2019-08-27
03.09.2019,"679,00","679,00","679,00","679,00","2,88",115,"78.085,00","78.085,00",ADIN,2019-09-03
19.09.2019,"660,00","660,00","660,00","660,00","-2,80",300,"198.000,00","198.000,00",ADIN,2019-09-19
30.10.2019,"660,00",/,/,"660,00","0,00",0,"0,00","0,00",ADIN,2019-10-30
29.06.2020,"600,00","600,00","600,00","600,00","-9,09",300,"180.000,00","180.000,00",ADIN,2020-06-29
30.06.2020,"618,00","618,00","618,00","618,00","3,00","1,000","618.000,00","618.000,00",ADIN,2020-06-30
02.07.2020,"618,00","618,00","618,00","618,00","0,00",150,"92.700,00","92.700,00",ADIN,2020-07-02
06.07.2020,"618,00","618,00","618,00","618,00","0,00",100,"61.800,00","61.800,00",ADIN,2020-07-06
30.07.2020,"618,00","618,00","618,00","618,00","0,00",200,"123.600,00","123.600,00",ADIN,2020-07-30
05.08.2020,"618,00","618,00","618,00","618,00","0,00","2,400","1.483.200,00","1.483.200,00",ADIN,2020-08-05
29.10.2020,"618,00",/,/,"618,00","0,00",0,"0,00","0,00",ADIN,2020-10-29
12.11.2020,"666,00","666,00","666,00","666,00","7,77",15,"9.990,00","9.990,00",ADIN,2020-11-12
13.11.2020,"700,00","700,00","700,00","700,00","5,11",185,"129.500,00","129.500,00",ADIN,2020-11-13
16.11.2020,"700,00","700,00","700,00","700,00","0,00",300,"210.000,00","210.000,00",ADIN,2020-11-16
18.11.2020,"700,00","700,00","700,00","700,00","0,00",340,"238.000,00","238.000,00",ADIN,2020-11-18
23.11.2020,"699,00","699,00","699,00","699,00","-0,14",200,"139.800,00","139.800,00",ADIN,2020-11-23
24.11.2020,"700,00","700,00","700,00","700,00","0,14",360,"252.000,00","252.000,00",ADIN,2020-11-24
26.11.2020,"700,00","700,00","700,00","700,00","0,00",70,"49.000,00","49.000,00",ADIN,2020-11-26
14.12.2020,"679,00","679,00","679,00","679,00","-3,00",25,"16.975,00","16.975,00",ADIN,2020-12-14
05.01.2021,"679,00","679,00","679,00","679,00","0,00",22,"14.938,00","14.938,00",ADIN,2021-01-05
18.01.2021,"690,00","690,00","690,00","690,00","1,62",40,"27.600,00","27.600,00",ADIN,2021-01-18
20.01.2021,"690,00","690,00","690,00","690,00","0,00",129,"89.010,00","89.010,00",ADIN,2021-01-20
21.01.2021,"690,00","690,00","690,00","690,00","0,00",129,"89.010,00","89.010,00",ADIN,2021-01-21
16.02.2021,"701,00","701,00","701,00","701,00","1,59",50,"35.050,00","35.050,00",ADIN,2021-02-16
23.02.2021,"731,00","731,00","731,00","731,00","4,28",168,"122.808,00","122.808,00",ADIN,2021-02-23
01.03.2021,"750,00","750,00","750,00","750,00","2,60",170,"127.500,00","127.500,00",ADIN,2021-03-01
12.03.2021,"750,00","750,00","750,00","750,00","0,00",50,"37.500,00","37.500,00",ADIN,2021-03-12
25.03.2021,"750,00","750,00","750,00","750,00","0,00",450,"337.500,00","337.500,00",ADIN,2021-03-25
23.04.2021,"750,00","750,00","750,00","750,00","0,00",50,"37.500,00","37.500,00",ADIN,2021-04-23
28.04.2021,"750,00","750,00","750,00","750,00","0,00",120,"90.000,00","90.000,00",ADIN,2021-04-28
05.05.2021,"750,00","750,00","750,00","750,00","0,00",50,"37.500,00","37.500,00",ADIN,2021-05-05
14.05.2021,"633,00","633,00","633,00","633,00","-15,60",100,"63.300,00","63.300,00",ADIN,2021-05-14
30.06.2021,"661,00","661,00","661,00","661,00","4,42",50,"33.050,00","33.050,00",ADIN,2021-06-30
27.07.2021,"652,00","652,00","652,00","652,00","-1,36",50,"32.600,00","32.600,00",ADIN,2021-07-27
21.09.2021,"681,00","681,00","681,00","681,00","4,45",50,"34.050,00","34.050,00",ADIN,2021-09-21
27.09.2021,"700,00","700,00","700,00","700,00","2,79",61,"42.700,00","42.700,00",ADIN,2021-09-27
22.10.2021,"700,00","700,00","700,00","700,00","0,00",30,"21.000,00","21.000,00",ADIN,2021-10-22
27.10.2021,"700,00","700,00","700,00","700,00","0,00",61,"42.700,00","42.700,00",ADIN,2021-10-27
29.10.2021,"700,00",/,/,"700,00","0,00",0,"0,00","0,00",ADIN,2021-10-29
17.11.2021,"700,00","700,00","700,00","700,00","0,00",50,"35.000,00","35.000,00",ADIN,2021-11-17
13.01.2022,"704,00","704,00","704,00","704,00","0,57",25,"17.600,00","17.600,00",ADIN,2022-01-13
17.01.2022,"711,00","711,00","711,00","711,00","0,99",30,"21.330,00","21.330,00",ADIN,2022-01-17
21.02.2022,"732,00","732,00","732,00","732,00","2,95",30,"21.960,00","21.960,00",ADIN,2022-02-21
24.02.2022,"750,00","750,00","750,00","750,00","2,46",120,"90.000,00","90.000,00",ADIN,2022-02-24
07.03.2022,"750,00","750,00","750,00","750,00","0,00",100,"75.000,00","75.000,00",ADIN,2022-03-07
16.03.2022,"751,00","751,00","751,00","751,00","0,13","1,100","826.100,00","826.100,00",ADIN,2022-03-16
18.03.2022,"760,00","760,00","760,00","760,00","1,20",550,"418.000,00","418.000,00",ADIN,2022-03-18
12.05.2022,"782,00","782,00","782,00","782,00","2,89",10,"7.820,00","7.820,00",ADIN,2022-05-12
31.05.2022,"805,00","805,00","805,00","805,00","2,94",50,"40.250,00","40.250,00",ADIN,2022-05-31
22.07.2022,"815,00","815,00","815,00","815,00","1,24",10,"8.150,00","8.150,00",ADIN,2022-07-22
28.10.2022,"815,00",/,/,"815,00","0,00",0,"0,00","0,00",ADIN,2022-10-28
23.11.2022,"815,00","815,00","815,00","815,00","0,00",200,"163.000,00","163.000,00",ADIN,2022-11-23
16.12.2022,"816,00","816,00","816,00","816,00","0,12",400,"326.400,00","326.400,00",ADIN,2022-12-16
23.12.2022,"840,00","840,00","840,00","840,00","2,94",120,"100.800,00","100.800,00",ADIN,2022-12-23
20.01.2023,"840,00","840,00","840,00","840,00","0,00",95,"79.800,00","79.800,00",ADIN,2023-01-20
14.02.2023,"722,00","722,00","722,00","722,00","-14,05",505,"364.610,00","364.610,00",ADIN,2023-02-14
06.07.2023,"850,00","850,00","850,00","850,00","17,73",100,"85.000,00","85.000,00",ADIN,2023-07-06
11.07.2023,"865,00","865,00","865,00","865,00","1,76",70,"60.550,00","60.550,00",ADIN,2023-07-11
05.10.2023,"1.000,00","1.000,00","1.000,00","1.000,00","15,61",100,"100.000,00","100.000,00",ADIN,2023-10-05
27.10.2023,"1.000,00",/,/,"1.000,00","0,00",0,"0,00","0,00",ADIN,2023-10-27
09.11.2023,"1.000,00","1.000,00","1.000,00","1.000,00","0,00",200,"200.000,00","200.000,00",ADIN,2023-11-09
13.11.2023,"1.000,00","1.000,00","1.000,00","1.000,00","0,00",260,"260.000,00","260.000,00",ADIN,2023-11-13
29.11.2023,"1.000,00","1.000,00","1.000,00","1.000,00","0,00",600,"600.000,00","600.000,00",ADIN,2023-11-29
19.12.2023,"1.000,00","1.000,00","1.000,00","1.000,00","0,00",100,"100.000,00","100.000,00",ADIN,2023-12-19
31.01.2024,"1.200,00","1.200,00","1.200,00","1.200,00","20,00",295,"354.000,00","354.000,00",ADIN,2024-01-31
05.02.2024,"1.200,00","1.200,00","1.200,00","1.200,00","0,00",153,"183.600,00","183.600,00",ADIN,2024-02-05
14.05.2024,"1.697,00","1.697,00","1.697,00","1.697,00","41,42",50,"84.850,00","84.850,00",ADIN,2024-05-14
17.05.2024,"1.688,00","1.688,00","1.688,00","1.688,00","-0,53",76,"128.288,00","128.288,00",ADIN,2024-05-17
29.05.2024,"1.690,00","1.690,00","1.690,00","1.690,00","0,12",50,"84.500,00","84.500,00",ADIN,2024-05-29
27.06.2024,"1.600,00","1.600,00","1.600,00","1.600,00","-5,33",200,"320.000,00","320.000,00",ADIN,2024-06-27
10.07.2024,"1.500,00","1.500,00","1.500,00","1.500,00","-6,25",600,"900.000,00","900.000,00",ADIN,2024-07-10
12.07.2024,"1.500,00","1.500,00","1.500,00","1.500,00","0,00",368,"552.000,00","552.000,00",ADIN,2024-07-12
29.07.2024,"1.500,00","1.500,00","1.500,00","1.500,00","0,00",600,"900.000,00","900.000,00",ADIN,2024-07-29
30.07.2024,"1.500,00","1.500,00","1.500,00","1.500,00","0,00",240,"360.000,00","360.000,00",ADIN,2024-07-30
07.08.2024,"1.500,00","1.500,00","1.500,00","1.500,00","0,00",200,"300.000,00","300.000,00",ADIN,2024-08-07
13.08.2024,"1.505,00","1.505,00","1.505,00","1.505,00","0,33",100,"150.500,00","150.500,00",ADIN,2024-08-13
14.08.2024,"1.649,00","1.649,00","1.649,00","1.649,00","9,57",15,"24.735,00","24.735,00",ADIN,2024-08-14
23.08.2024,"1.610,00","1.610,00","1.610,00","1.610,00","-2,37",83,"133.630,00","133.630,00",ADIN,2024-08-23
26.08.2024,"1.600,00","1.600,00","1.600,00","1.600,00","-0,62",150,"240.000,00","240.000,00",ADIN,2024-08-26
13.09.2024,"1.646,00","1.646,00","1.646,00","1.646,00","2,88",120,"197.520,00","197.520,00",ADIN,2024-09-13
17.09.2024,"1.646,00","1.646,00","1.646,00","1.646,00","0,00",265,"436.190,00","436.190,00",ADIN,2024-09-17
18.09.2024,"1.646,00","1.646,00","1.646,00","1.646,00","0,00",10,"16.460,00","16.460,00",ADIN,2024-09-18
19.09.2024,"1.700,00","1.700,00","1.700,00","1.700,00","3,28",200,"340.000,00","340.000,00",ADIN,2024-09-19
20.09.2024,"1.770,00","1.770,00","1.770,00","1.770,00","4,12",135,"238.950,00","238.950,00",ADIN,2024-09-20
23.09.2024,"1.800,00","1.800,00","1.800,00","1.800,00","1,69",94,"169.200,00","169.200,00",ADIN,2024-09-23
24.09.2024,"1.800,00","1.800,00","1.800,00","1.800,00","0,00",16,"28.800,00","28.800,00",ADIN,2024-09-24
02.10.2024,"1.800,00","1.800,00","1.800,00","1.800,00","0,00",100,"180.000,00","180.000,00",ADIN,2024-10-02
09.10.2024,"1.750,00","1.750,00","1.750,00","1.750,00","-2,78",16,"28.000,00","28.000,00",ADIN,2024-10-09
10.10.2024,"1.700,00","1.700,00","1.700,00","1.700,00","-2,86",200,"340.000,00","340.000,00",ADIN,2024-10-10
18.10.2024,"1.700,00","1.700,00","1.700,00","1.700,00","0,00",2,"3.400,00","3.400,00",ADIN,2024-10-18
21.10.2024,"1.650,00","1.650,00","1.650,00","1.650,00","-2,94",208,"343.200,00","343.200,00",ADIN,2024-10-21
28.10.2024,"1.650,00",/,/,"1.650,00","0,00",0,"0,00","0,00",ADIN,2024-10-28
08.11.2024,"1.650,00",/,/,"1.650,00","0,00",0,"0,00","0,00",ADIN,2024-11-08
03.11.2014,"4.900,00","4.900,00","4.900,00","4.900,00","0,00",62,"303.800,00","303.800,00",ALK,2014-11-03
04.11.2014,"4.800,00","4.900,00","4.800,00","4.859,45","-0,83",136,"660.885,00","660.885,00",ALK,2014-11-04
05.11.2014,"4.800,00","4.800,00","4.800,00","4.800,00","-1,22",104,"499.200,00","499.200,00",ALK,2014-11-05
06.11.2014,"4.800,00","4.800,00","4.800,00","4.800,00","0,00",161,"772.800,00","772.800,00",ALK,2014-11-06
07.11.2014,"4.850,00","4.900,00","4.850,00","4.857,92","1,21",130,"631.530,00","631.530,00",ALK,2014-11-07
10.11.2014,"4.850,00","4.861,00","4.850,00","4.853,88","-0,08",123,"597.027,00","597.027,00",ALK,2014-11-10
11.11.2014,"4.850,00","4.852,00","4.800,00","4.836,46","-0,36",242,"1.170.424,00","1.170.424,00",ALK,2014-11-11
12.11.2014,"4.900,00","4.900,00","4.850,00","4.887,66","1,06",314,"1.534.725,00","1.534.725,00",ALK,2014-11-12
13.11.2014,"4.860,00","4.860,00","4.850,00","4.856,25","-0,64",8,"38.850,00","38.850,00",ALK,2014-11-13
14.11.2014,"4.949,00","4.949,00","4.860,00","4.908,29","1,07",35,"171.790,00","171.790,00",ALK,2014-11-14
17.11.2014,"4.900,00","4.900,00","4.861,00","4.892,84","-0,31",143,"699.676,00","699.676,00",ALK,2014-11-17
18.11.2014,"5.000,00","5.000,00","4.862,00","4.991,55","2,02","1,388","6.928.265,00","6.928.265,00",ALK,2014-11-18
19.11.2014,"5.002,00","5.002,00","5.000,00","5.000,07","0,17",305,"1.525.020,00","1.525.020,00",ALK,2014-11-19
20.11.2014,"5.000,00","5.000,00","5.000,00","5.000,00","0,00",132,"660.000,00","660.000,00",ALK,2014-11-20
21.11.2014,"5.000,00","5.030,00","5.000,00","5.025,31","0,51","1,586","7.970.141,00","7.970.141,00",ALK,2014-11-21
24.11.2014,"4.910,00","4.999,00","4.910,00","4.984,17","-0,82",12,"59.810,00","59.810,00",ALK,2014-11-24
25.11.2014,"4.950,00","4.962,00","4.950,00","4.950,24","-0,68",101,"499.974,00","499.974,00",ALK,2014-11-25
26.11.2014,"4.950,00","4.951,00","4.950,00","4.950,88","0,01",17,"84.165,00","84.165,00",ALK,2014-11-26
27.11.2014,"5.000,00","5.000,00","4.950,00","4.989,15","0,77",259,"1.292.190,00","1.292.190,00",ALK,2014-11-27
28.11.2014,"5.138,00","5.138,00","5.000,00","5.134,23","2,91","1,311","6.730.976,00","6.730.976,00",ALK,2014-11-28
01.12.2014,"5.140,00","5.210,00","5.138,00","5.200,80","1,30",163,"847.730,00","847.730,00",ALK,2014-12-01
02.12.2014,"5.050,00","5.200,00","5.050,00","5.157,34","-0,84",148,"763.286,00","763.286,00",ALK,2014-12-02
04.12.2014,"5.150,00","5.150,00","5.050,00","5.097,37","-1,16",19,"96.850,00","96.850,00",ALK,2014-12-04
05.12.2014,"5.051,00","5.051,00","5.051,00","5.051,00","-0,91",55,"277.805,00","277.805,00",ALK,2014-12-05
09.12.2014,"5.001,00","5.001,00","5.001,00","5.001,00","-0,99",10,"50.010,00","50.010,00",ALK,2014-12-09
10.12.2014,"5.000,00","5.001,00","5.000,00","5.000,24","-0,02",393,"1.965.093,00","1.965.093,00",ALK,2014-12-10
11.12.2014,"5.000,00","5.000,00","5.000,00","5.000,00","0,00",48,"240.000,00","240.000,00",ALK,2014-12-11
12.12.2014,"5.050,00","5.050,00","5.000,00","5.048,67","0,97",375,"1.893.250,00","1.893.250,00",ALK,2014-12-12
15.12.2014,"5.000,00","5.000,00","5.000,00","5.000,00","-0,96",103,"515.000,00","515.000,00",ALK,2014-12-15
16.12.2014,"5.002,00","5.002,00","5.001,00","5.001,74","0,03",38,"190.066,00","190.066,00",ALK,2014-12-16
17.12.2014,"5.005,00","5.030,00","5.002,00","5.017,70","0,32",200,"1.003.540,00","1.003.540,00",ALK,2014-12-17
18.12.2014,"5.005,00","5.030,00","5.005,00","5.026,74","0,18",230,"1.156.150,00","1.156.150,00",ALK,2014-12-18
19.12.2014,"5.005,00","5.005,00","5.005,00","5.005,00","-0,43",314,"1.571.570,00","1.571.570,00",ALK,2014-12-19
22.12.2014,"5.000,00","5.030,00","5.000,00","5.022,78","0,36",45,"226.025,00","226.025,00",ALK,2014-12-22
23.12.2014,"5.001,00","5.030,00","5.000,00","5.024,83","0,04",544,"2.733.505,00","2.733.505,00",ALK,2014-12-23
24.12.2014,"5.000,00","5.000,00","5.000,00","5.000,00","-0,49",514,"2.570.000,00","2.570.000,00",ALK,2014-12-24
25.12.2014,"5.030,00","5.030,00","5.020,00","5.029,05","0,58",644,"3.238.705,00","3.238.705,00",ALK,2014-12-25
26.12.2014,"5.050,00","5.050,00","5.050,00","5.050,00","0,42",6,"30.300,00","30.300,00",ALK,2014-12-26
29.12.2014,"5.050,00","5.050,00","5.049,00","5.049,86","0,00",820,"4.140.886,00","4.140.886,00",ALK,2014-12-29
30.12.2014,"5.100,00","5.100,00","5.070,00","5.087,79","0,75",68,"345.970,00","345.970,00",ALK,2014-12-30
02.01.2015,"5.100,00","5.100,00","5.100,00","5.100,00","0,24",40,"204.000,00","204.000,00",ALK,2015-01-02
05.01.2015,"5.050,00","5.050,00","5.050,00","5.050,00","-0,98",14,"70.700,00","70.700,00",ALK,2015-01-05
08.01.2015,"5.050,00","5.100,00","5.050,00","5.084,93","0,69",229,"1.164.450,00","1.164.450,00",ALK,2015-01-08
09.01.2015,"5.040,00","5.050,00","5.005,00","5.033,55","-1,01",307,"1.545.300,00","1.545.300,00",ALK,2015-01-09
12.01.2015,"5.100,00","5.100,00","5.050,00","5.082,47","0,97",77,"391.350,00","391.350,00",ALK,2015-01-12
13.01.2015,"5.050,00","5.100,00","5.035,00","5.068,25","-0,28",493,"2.498.645,00","2.498.645,00",ALK,2015-01-13
14.01.2015,"5.050,00","5.100,00","5.050,00","5.095,88","0,55",167,"851.012,00","851.012,00",ALK,2015-01-14
15.01.2015,"5.099,00","5.099,00","5.090,00","5.093,46","-0,05",13,"66.215,00","66.215,00",ALK,2015-01-15
16.01.2015,"5.050,00","5.099,00","5.032,00","5.053,18","-0,79",253,"1.278.454,00","1.278.454,00",ALK,2015-01-16
20.01.2015,"5.051,00","5.051,00","5.050,00","5.050,15","-0,06",66,"333.310,00","333.310,00",ALK,2015-01-20
21.01.2015,"5.099,00","5.099,00","5.051,00","5.074,05","0,47","1,043","5.292.229,00","5.292.229,00",ALK,2015-01-21
22.01.2015,"5.070,00","5.097,00","5.050,00","5.057,67","-0,32",114,"576.574,00","576.574,00",ALK,2015-01-22
23.01.2015,"5.099,00","5.099,00","5.070,00","5.076,94","0,38",287,"1.457.083,00","1.457.083,00",ALK,2015-01-23
26.01.2015,"5.100,00","5.100,00","5.100,00","5.100,00","0,45",191,"974.100,00","974.100,00",ALK,2015-01-26
27.01.2015,"5.080,00","5.080,00","5.080,00","5.080,00","-0,39",8,"40.640,00","40.640,00",ALK,2015-01-27
28.01.2015,"5.120,00","5.149,00","5.100,00","5.105,93","0,51",123,"628.030,00","628.030,00",ALK,2015-01-28
29.01.2015,"5.150,00","5.150,00","5.130,00","5.144,61","0,76",239,"1.229.561,00","1.229.561,00",ALK,2015-01-29
30.01.2015,"5.150,00","5.150,00","5.140,00","5.146,95","0,05",101,"519.842,00","519.842,00",ALK,2015-01-30
02.02.2015,"5.106,00","5.150,00","5.101,00","5.141,64","-0,10",218,"1.120.877,00","1.120.877,00",ALK,2015-02-02
03.02.2015,"5.102,00","5.105,00","5.101,00","5.101,31","-0,78",183,"933.540,00","933.540,00",ALK,2015-02-03
04.02.2015,"5.148,00","5.148,00","5.102,00","5.126,21","0,49",19,"97.398,00","97.398,00",ALK,2015-02-04
05.02.2015,"5.102,00","5.120,00","5.102,00","5.106,96","-0,38",68,"347.273,00","347.273,00",ALK,2015-02-05
06.02.2015,"5.148,00","5.148,00","5.102,00","5.143,82","0,72",22,"113.164,00","113.164,00",ALK,2015-02-06
09.02.2015,"5.150,00","5.150,00","5.120,00","5.127,63","-0,31",126,"646.082,00","646.082,00",ALK,2015-02-09
10.02.2015,"5.150,00","5.150,00","5.121,00","5.148,01","0,40",73,"375.805,00","375.805,00",ALK,2015-02-10
11.02.2015,"5.150,00","5.151,00","5.130,00","5.149,66","0,03",222,"1.143.224,00","1.143.224,00",ALK,2015-02-11
12.02.2015,"5.220,00","5.220,00","5.150,00","5.208,61","1,14",208,"1.083.390,00","1.083.390,00",ALK,2015-02-12
13.02.2015,"5.300,00","5.300,00","5.249,00","5.260,00","0,99",349,"1.835.740,00","1.835.740,00",ALK,2015-02-13
16.02.2015,"5.300,00","5.300,00","5.252,00","5.296,80","0,70",300,"1.589.040,00","1.589.040,00",ALK,2015-02-16
17.02.2015,"5.300,00","5.300,00","5.253,00","5.294,01","-0,05",386,"2.043.487,00","2.043.487,00",ALK,2015-02-17
18.02.2015,"5.280,00","5.300,00","5.253,00","5.280,21","-0,26",117,"617.784,00","617.784,00",ALK,2015-02-18
19.02.2015,"5.300,00","5.300,00","5.280,00","5.299,58","0,37",570,"3.020.760,00","3.020.760,00",ALK,2015-02-19
20.02.2015,"5.500,00","5.500,00","5.316,00","5.478,58","3,38","1,288","7.056.410,00","7.056.410,00",ALK,2015-02-20
23.02.2015,"5.700,00","5.700,00","5.700,00","5.700,00","4,04",2,"11.400,00","11.400,00",ALK,2015-02-23
24.02.2015,"5.500,00","5.700,00","5.499,00","5.501,88","-3,48",178,"979.335,00","979.335,00",ALK,2015-02-24
25.02.2015,"5.460,00","5.500,00","5.460,00","5.466,67","-0,64",300,"1.640.000,00","1.640.000,00",ALK,2015-02-25
26.02.2015,"5.460,00","5.460,00","5.410,00","5.457,62","-0,17",210,"1.146.100,00","1.146.100,00",ALK,2015-02-26
27.02.2015,"5.500,00","5.500,00","5.499,00","5.499,96","0,78","1,230","6.764.950,00","6.764.950,00",ALK,2015-02-27
02.03.2015,"5.410,00","5.500,00","5.410,00","5.499,69","0,00",289,"1.589.409,00","1.589.409,00",ALK,2015-03-02
04.03.2015,"5.399,00","5.415,00","5.399,00","5.400,67","-1,80",759,"4.099.105,00","4.099.105,00",ALK,2015-03-04
05.03.2015,"5.350,00","5.400,00","5.350,00","5.378,41","-0,41",44,"236.650,00","236.650,00",ALK,2015-03-05
06.03.2015,"5.375,00","5.390,00","5.370,00","5.379,63","0,02",462,"2.485.391,00","2.485.391,00",ALK,2015-03-06
09.03.2015,"5.375,00","5.375,00","5.360,00","5.371,82","-0,15",137,"735.940,00","735.940,00",ALK,2015-03-09
10.03.2015,"5.360,00","5.360,00","5.359,00","5.359,94","-0,22",385,"2.063.575,00","2.063.575,00",ALK,2015-03-10
11.03.2015,"5.360,00","5.360,00","5.350,00","5.359,73","0,00",74,"396.620,00","396.620,00",ALK,2015-03-11
12.03.2015,"5.360,00","5.360,00","5.350,00","5.359,35","-0,01",216,"1.157.620,00","1.157.620,00",ALK,2015-03-12
13.03.2015,"5.300,00","5.360,00","5.300,00","5.327,22","-0,60",316,"1.683.400,00","1.683.400,00",ALK,2015-03-13
16.03.2015,"5.250,00","5.300,00","5.250,00","5.275,42","-0,97",120,"633.050,00","633.050,00",ALK,2015-03-16
17.03.2015,"5.200,00","5.200,00","5.200,00","5.200,00","-1,43",306,"1.591.200,00","1.591.200,00",ALK,2015-03-17
18.03.2015,"5.150,00","5.199,00","5.100,00","5.148,90","-0,98","5,135","26.439.600,00","26.439.600,00",ALK,2015-03-18
19.03.2015,"5.100,00","5.100,00","5.100,00","5.100,00","-0,95",595,"3.034.500,00","3.034.500,00",ALK,2015-03-19
20.03.2015,"5.100,00","5.100,00","5.080,00","5.099,87","0,00","1,495","7.624.310,00","7.624.310,00",ALK,2015-03-20
23.03.2015,"5.100,00","5.100,00","5.098,00","5.099,91","0,00",70,"356.994,00","356.994,00",ALK,2015-03-23
24.03.2015,"5.000,00","5.090,00","5.000,00","5.005,51","-1,85",910,"4.555.015,00","4.555.015,00",ALK,2015-03-24
25.03.2015,"5.050,00","5.050,00","5.012,00","5.045,66","0,80",180,"908.218,00","908.218,00",ALK,2015-03-25
26.03.2015,"5.100,00","5.101,00","5.051,00","5.097,69","1,03","2,485","12.667.756,00","12.667.756,00",ALK,2015-03-26
27.03.2015,"5.051,00","5.053,00","5.051,00","5.051,90","-0,90",20,"101.038,00","101.038,00",ALK,2015-03-27
30.03.2015,"5.100,00","5.100,00","5.100,00","5.100,00","0,95",35,"178.500,00","178.500,00",ALK,2015-03-30
31.03.2015,"5.056,00","5.101,00","5.051,00","5.082,80","-0,34",448,"2.277.095,00","2.277.095,00",ALK,2015-03-31
01.04.2015,"5.065,00","5.066,00","5.065,00","5.065,35","-0,34",31,"157.026,00","157.026,00",ALK,2015-04-01
02.04.2015,"5.100,00","5.100,00","5.075,00","5.088,16","0,45",19,"96.675,00","96.675,00",ALK,2015-04-02
03.04.2015,"5.100,00","5.100,00","5.100,00","5.100,00","0,23",263,"1.341.300,00","1.341.300,00",ALK,2015-04-03
06.04.2015,"5.150,00","5.150,00","5.100,00","5.140,00","0,78",55,"282.700,00","282.700,00",ALK,2015-04-06
07.04.2015,"5.150,00","5.150,00","5.100,00","5.113,33","-0,52",694,"3.548.650,00","3.548.650,00",ALK,2015-04-07
08.04.2015,"5.150,00","5.150,00","5.110,00","5.148,88","0,70",143,"736.290,00","736.290,00",ALK,2015-04-08
14.04.2015,"5.150,00","5.150,00","5.130,00","5.133,93","-0,29",56,"287.500,00","287.500,00",ALK,2015-04-14
15.04.2015,"5.100,00","5.151,00","5.100,00","5.140,13","0,12",669,"3.438.745,00","3.438.745,00",ALK,2015-04-15
16.04.2015,"5.200,00","5.200,00","5.150,00","5.188,77","0,95",414,"2.148.150,00","2.148.150,00",ALK,2015-04-16
17.04.2015,"5.156,00","5.200,00","5.156,00","5.192,35","0,07",23,"119.424,00","119.424,00",ALK,2015-04-17
20.04.2015,"5.200,00","5.200,00","5.199,00","5.199,95","0,15",62,"322.397,00","322.397,00",ALK,2015-04-20
21.04.2015,"5.100,00","5.190,00","5.100,00","5.182,31","-0,34",232,"1.202.296,00","1.202.296,00",ALK,2015-04-21
22.04.2015,"4.950,00","5.057,00","4.950,00","4.983,37","-3,84",43,"214.285,00","214.285,00",ALK,2015-04-22
23.04.2015,"4.850,00","4.851,00","4.850,00","4.850,22","-2,67",186,"902.140,00","902.140,00",ALK,2015-04-23
24.04.2015,"4.851,00","4.851,00","4.851,00","4.851,00","0,02",4,"19.404,00","19.404,00",ALK,2015-04-24
27.04.2015,"4.870,00","4.900,00","4.870,00","4.898,33","0,98",18,"88.170,00","88.170,00",ALK,2015-04-27
28.04.2015,"4.950,00","4.950,00","4.950,00","4.950,00","1,05",50,"247.500,00","247.500,00",ALK,2015-04-28
29.04.2015,"4.950,00","4.950,00","4.950,00","4.950,00","0,00",82,"405.900,00","405.900,00",ALK,2015-04-29
30.04.2015,"4.950,00","4.950,00","4.950,00","4.950,00","0,00",76,"376.200,00","376.200,00",ALK,2015-04-30
04.05.2015,"4.950,00","4.950,00","4.950,00","4.950,00","0,00",1,"4.950,00","4.950,00",ALK,2015-05-04
05.05.2015,"5.000,00","5.000,00","4.950,00","4.996,14","0,93",72,"359.722,00","359.722,00",ALK,2015-05-05
06.05.2015,"5.000,00","5.000,00","5.000,00","5.000,00","0,08",86,"430.000,00","430.000,00",ALK,2015-05-06
07.05.2015,"4.901,00","4.950,00","4.901,00","4.931,62","-1,37",128,"631.248,00","631.248,00",ALK,2015-05-07
08.05.2015,"4.902,00","4.902,00","4.902,00","4.902,00","-0,60",27,"132.354,00","132.354,00",ALK,2015-05-08
11.05.2015,"4.851,00","4.906,00","4.851,00","4.891,78","-0,21",144,"704.416,00","704.416,00",ALK,2015-05-11
12.05.2015,"4.850,00","4.900,00","4.850,00","4.876,93","-0,30",457,"2.228.755,00","2.228.755,00",ALK,2015-05-12
13.05.2015,"4.900,00","4.900,00","4.890,00","4.899,63","0,47",54,"264.580,00","264.580,00",ALK,2015-05-13
14.05.2015,"4.850,00","4.850,00","4.850,00","4.850,00","-1,01",1,"4.850,00","4.850,00",ALK,2015-05-14
15.05.2015,"4.999,00","4.999,00","4.880,00","4.918,88","1,42",120,"590.265,00","590.265,00",ALK,2015-05-15
18.05.2015,"4.950,00","5.000,00","4.950,00","4.970,36","1,05",84,"417.510,00","417.510,00",ALK,2015-05-18
19.05.2015,"4.850,00","4.900,00","4.850,00","4.871,17","-2,00",531,"2.586.592,00","2.586.592,00",ALK,2015-05-19
20.05.2015,"4.850,00","4.850,00","4.849,00","4.849,99","-0,43",524,"2.541.395,00","2.541.395,00",ALK,2015-05-20
21.05.2015,"4.875,00","4.900,00","4.854,00","4.886,09","0,74",161,"786.660,00","786.660,00",ALK,2015-05-21
22.05.2015,"4.949,00","4.949,00","4.851,00","4.892,94","0,14",97,"474.615,00","474.615,00",ALK,2015-05-22
26.05.2015,"4.889,00","4.900,00","4.851,00","4.858,06","-0,71",54,"262.335,00","262.335,00",ALK,2015-05-26
27.05.2015,"4.861,00","4.900,00","4.861,00","4.883,19","0,52",135,"659.230,00","659.230,00",ALK,2015-05-27
28.05.2015,"4.899,00","4.899,00","4.861,00","4.877,96","-0,11",23,"112.193,00","112.193,00",ALK,2015-05-28
01.06.2015,"4.850,00","4.880,00","4.850,00","4.860,28","-0,36",438,"2.128.803,00","2.128.803,00",ALK,2015-06-01
02.06.2015,"4.850,00","4.850,00","4.849,00","4.849,99","-0,21",170,"824.498,00","824.498,00",ALK,2015-06-02
03.06.2015,"4.900,00","4.930,00","4.870,00","4.893,24","0,89",679,"3.322.510,00","3.322.510,00",ALK,2015-06-03
04.06.2015,"4.901,00","4.901,00","4.900,00","4.900,04","0,14",275,"1.347.510,00","1.347.510,00",ALK,2015-06-04
05.06.2015,"4.939,00","4.940,00","4.900,00","4.929,31","0,60",366,"1.804.128,00","1.804.128,00",ALK,2015-06-05
08.06.2015,"4.937,00","4.938,00","4.903,00","4.927,10","-0,04",245,"1.207.140,00","1.207.140,00",ALK,2015-06-08
09.06.2015,"4.908,00","4.940,00","4.908,00","4.931,49","0,09",293,"1.444.926,00","1.444.926,00",ALK,2015-06-09
10.06.2015,"4.939,00","4.939,00","4.910,00","4.922,17","-0,19",12,"59.066,00","59.066,00",ALK,2015-06-10
11.06.2015,"4.908,00","4.908,00","4.908,00","4.908,00","-0,29",17,"83.436,00","83.436,00",ALK,2015-06-11
12.06.2015,"4.939,00","4.940,00","4.900,00","4.922,31","0,29",299,"1.471.772,00","1.471.772,00",ALK,2015-06-12
15.06.2015,"4.901,00","4.930,00","4.900,00","4.901,82","-0,42",40,"196.073,00","196.073,00",ALK,2015-06-15
16.06.2015,"4.900,00","4.900,00","4.900,00","4.900,00","-0,04",43,"210.700,00","210.700,00",ALK,2015-06-16
17.06.2015,"4.850,00","4.852,00","4.850,00","4.850,50","-1,01",80,"388.040,00","388.040,00",ALK,2015-06-17
18.06.2015,"4.811,00","4.820,00","4.811,00","4.816,23","-0,71",43,"207.098,00","207.098,00",ALK,2015-06-18
19.06.2015,"4.800,00","4.830,00","4.800,00","4.806,55","-0,20",143,"687.336,00","687.336,00",ALK,2015-06-19
22.06.2015,"4.710,00","4.798,00","4.710,00","4.778,57","-0,58",14,"66.900,00","66.900,00",ALK,2015-06-22
23.06.2015,"4.770,00","4.790,00","4.730,00","4.775,09","-0,07",489,"2.335.020,00","2.335.020,00",ALK,2015-06-23
24.06.2015,"4.770,00","4.771,00","4.770,00","4.770,01","-0,11",415,"1.979.554,00","1.979.554,00",ALK,2015-06-24
25.06.2015,"4.800,00","4.800,00","4.770,00","4.798,51","0,60",683,"3.277.380,00","3.277.380,00",ALK,2015-06-25
26.06.2015,"4.800,00","4.800,00","4.771,00","4.786,82","-0,24",140,"670.155,00","670.155,00",ALK,2015-06-26
29.06.2015,"4.770,00","4.800,00","4.750,00","4.779,92","-0,14",130,"621.390,00","621.390,00",ALK,2015-06-29
30.06.2015,"4.780,00","4.800,00","4.750,00","4.794,09","0,30",195,"934.847,00","934.847,00",ALK,2015-06-30
01.07.2015,"4.760,00","4.780,00","4.750,00","4.761,01","-0,69",981,"4.670.555,00","4.670.555,00",ALK,2015-07-01
02.07.2015,"4.715,00","4.760,00","4.715,00","4.759,61","-0,03",116,"552.115,00","552.115,00",ALK,2015-07-02
03.07.2015,"4.702,00","4.703,00","4.702,00","4.702,93","-1,19",55,"258.661,00","258.661,00",ALK,2015-07-03
06.07.2015,"4.700,00","4.759,00","4.700,00","4.706,10","0,07",123,"578.850,00","578.850,00",ALK,2015-07-06
07.07.2015,"4.700,00","4.701,00","4.700,00","4.700,03","-0,13","1,324","6.222.835,00","6.222.835,00",ALK,2015-07-07
08.07.2015,"4.759,00","4.759,00","4.702,00","4.721,85","0,46",280,"1.322.119,00","1.322.119,00",ALK,2015-07-08
09.07.2015,"4.750,00","4.780,00","4.730,00","4.746,36","0,52",184,"873.330,00","873.330,00",ALK,2015-07-09
10.07.2015,"4.779,00","4.779,00","4.750,00","4.765,03","0,39",91,"433.618,00","433.618,00",ALK,2015-07-10
13.07.2015,"4.779,00","4.779,00","4.724,00","4.735,94","-0,61",214,"1.013.491,00","1.013.491,00",ALK,2015-07-13
14.07.2015,"4.760,00","4.780,00","4.740,00","4.758,41","0,47",94,"447.291,00","447.291,00",ALK,2015-07-14
15.07.2015,"4.800,00","4.800,00","4.771,00","4.798,90","0,85",234,"1.122.943,00","1.122.943,00",ALK,2015-07-15
16.07.2015,"4.810,00","4.845,00","4.810,00","4.822,27","0,49",77,"371.315,00","371.315,00",ALK,2015-07-16
20.07.2015,"4.850,00","4.850,00","4.800,00","4.848,52","0,54",208,"1.008.493,00","1.008.493,00",ALK,2015-07-20
21.07.2015,"4.898,00","4.898,00","4.818,00","4.825,81","-0,47",149,"719.046,00","719.046,00",ALK,2015-07-21
22.07.2015,"4.821,00","4.821,00","4.820,00","4.820,75","-0,10",60,"289.245,00","289.245,00",ALK,2015-07-22
23.07.2015,"4.850,00","4.890,00","4.821,00","4.843,94","0,48",50,"242.197,00","242.197,00",ALK,2015-07-23
24.07.2015,"4.820,00","4.820,00","4.820,00","4.820,00","-0,49",20,"96.400,00","96.400,00",ALK,2015-07-24
27.07.2015,"4.820,00","4.820,00","4.801,00","4.804,28","-0,33",29,"139.324,00","139.324,00",ALK,2015-07-27
28.07.2015,"4.890,00","4.890,00","4.815,00","4.849,30","0,94",279,"1.352.955,00","1.352.955,00",ALK,2015-07-28
29.07.2015,"4.850,00","4.850,00","4.850,00","4.850,00","0,01",48,"232.800,00","232.800,00",ALK,2015-07-29
30.07.2015,"4.851,00","4.899,00","4.851,00","4.877,31","0,56",134,"653.560,00","653.560,00",ALK,2015-07-30
04.08.2015,"4.860,00","4.860,00","4.855,00","4.856,19","-0,43",63,"305.940,00","305.940,00",ALK,2015-08-04
05.08.2015,"4.880,00","4.900,00","4.872,00","4.879,32","0,48",96,"468.415,00","468.415,00",ALK,2015-08-05
06.08.2015,"4.900,00","4.900,00","4.866,00","4.874,08","-0,11",105,"511.778,00","511.778,00",ALK,2015-08-06
07.08.2015,"4.900,00","4.900,00","4.860,00","4.890,93","0,35",644,"3.149.760,00","3.149.760,00",ALK,2015-08-07
10.08.2015,"4.855,00","4.890,00","4.855,00","4.863,75","-0,56",8,"38.910,00","38.910,00",ALK,2015-08-10
11.08.2015,"4.860,00","4.860,00","4.860,00","4.860,00","-0,08",3,"14.580,00","14.580,00",ALK,2015-08-11
12.08.2015,"4.880,00","4.881,00","4.880,00","4.880,53","0,42",113,"551.500,00","551.500,00",ALK,2015-08-12
13.08.2015,"4.880,00","4.890,00","4.863,00","4.883,62","0,06",140,"683.707,00","683.707,00",ALK,2015-08-13
14.08.2015,"4.880,00","4.889,00","4.880,00","4.884,14","0,01",37,"180.713,00","180.713,00",ALK,2015-08-14
17.08.2015,"4.885,00","4.886,00","4.880,00","4.880,84","-0,07",289,"1.410.564,00","1.410.564,00",ALK,2015-08-17
18.08.2015,"4.901,00","4.940,00","4.887,00","4.899,85","0,39",61,"298.891,00","298.891,00",ALK,2015-08-18
19.08.2015,"4.901,00","4.950,00","4.901,00","4.940,31","0,83",270,"1.333.883,00","1.333.883,00",ALK,2015-08-19
20.08.2015,"4.952,00","4.952,00","4.949,00","4.949,68","0,19",75,"371.226,00","371.226,00",ALK,2015-08-20
21.08.2015,"4.962,00","4.970,00","4.960,00","4.965,64","0,32",153,"759.743,00","759.743,00",ALK,2015-08-21
24.08.2015,"4.950,00","4.981,00","4.950,00","4.968,75","0,06",711,"3.532.782,00","3.532.782,00",ALK,2015-08-24
25.08.2015,"4.900,00","4.950,00","4.900,00","4.915,27","-1,08",820,"4.030.520,00","4.030.520,00",ALK,2015-08-25
26.08.2015,"4.890,00","4.900,00","4.886,00","4.899,48","-0,32","1,086","5.320.832,00","5.320.832,00",ALK,2015-08-26
27.08.2015,"4.900,00","4.900,00","4.900,00","4.900,00","0,01","1,230","6.027.000,00","6.027.000,00",ALK,2015-08-27
31.08.2015,"4.890,00","4.900,00","4.890,00","4.899,35","-0,01",417,"2.043.030,00","2.043.030,00",ALK,2015-08-31
01.09.2015,"4.899,00","4.900,00","4.899,00","4.899,97","0,01","1,218","5.968.160,00","5.968.160,00",ALK,2015-09-01
02.09.2015,"4.860,00","4.900,00","4.860,00","4.889,71","-0,21",138,"674.780,00","674.780,00",ALK,2015-09-02
03.09.2015,"4.900,00","4.900,00","4.850,00","4.870,71","-0,39",287,"1.397.894,00","1.397.894,00",ALK,2015-09-03
04.09.2015,"4.900,00","4.900,00","4.900,00","4.900,00","0,60",133,"651.700,00","651.700,00",ALK,2015-09-04
07.09.2015,"4.900,00","4.901,00","4.900,00","4.900,57","0,01",175,"857.600,00","857.600,00",ALK,2015-09-07
09.09.2015,"4.900,00","4.900,00","4.900,00","4.900,00","-0,01",132,"646.800,00","646.800,00",ALK,2015-09-09
10.09.2015,"4.902,00","4.902,00","4.900,00","4.900,70","0,01",92,"450.864,00","450.864,00",ALK,2015-09-10
11.09.2015,"4.912,00","4.912,00","4.902,00","4.904,13","0,07",191,"936.688,00","936.688,00",ALK,2015-09-11
14.09.2015,"4.949,00","4.950,00","4.920,00","4.945,73","0,85",449,"2.220.632,00","2.220.632,00",ALK,2015-09-14
15.09.2015,"4.920,00","4.921,00","4.910,00","4.914,76","-0,63",170,"835.509,00","835.509,00",ALK,2015-09-15
16.09.2015,"4.920,00","4.920,00","4.920,00","4.920,00","0,11",74,"364.080,00","364.080,00",ALK,2015-09-16
17.09.2015,"4.950,00","4.950,00","4.930,00","4.944,22","0,49",77,"380.705,00","380.705,00",ALK,2015-09-17
18.09.2015,"4.940,00","4.950,00","4.931,00","4.945,71","0,03",115,"568.757,00","568.757,00",ALK,2015-09-18
21.09.2015,"4.940,00","4.951,00","4.940,00","4.947,40","0,03",124,"613.477,00","613.477,00",ALK,2015-09-21
22.09.2015,"4.980,00","4.980,00","4.950,00","4.958,23","0,22",95,"471.032,00","471.032,00",ALK,2015-09-22
23.09.2015,"4.960,00","4.960,00","4.952,00","4.959,33","0,02",60,"297.560,00","297.560,00",ALK,2015-09-23
24.09.2015,"4.976,00","4.998,00","4.975,00","4.982,30","0,46",210,"1.046.282,00","1.046.282,00",ALK,2015-09-24
25.09.2015,"4.977,00","4.977,00","4.977,00","4.977,00","-0,11",4,"19.908,00","19.908,00",ALK,2015-09-25
28.09.2015,"4.995,00","4.995,00","4.986,00","4.994,81","0,36",513,"2.562.340,00","2.562.340,00",ALK,2015-09-28
29.09.2015,"4.970,00","4.990,00","4.970,00","4.977,19","-0,35",242,"1.204.479,00","1.204.479,00",ALK,2015-09-29
30.09.2015,"4.970,00","4.970,00","4.970,00","4.970,00","-0,14",10,"49.700,00","49.700,00",ALK,2015-09-30
01.10.2015,"4.985,00","4.995,00","4.984,00","4.990,11","0,40",231,"1.152.715,00","1.152.715,00",ALK,2015-10-01
02.10.2015,"5.000,00","5.000,00","4.990,00","4.998,02","0,16",710,"3.548.596,00","3.548.596,00",ALK,2015-10-02
05.10.2015,"5.000,00","5.000,00","4.940,00","4.999,38","0,03",589,"2.944.637,00","2.944.637,00",ALK,2015-10-05
06.10.2015,"5.030,00","5.030,00","5.030,00","5.030,00","0,61",49,"246.470,00","246.470,00",ALK,2015-10-06
07.10.2015,"5.010,00","5.030,00","5.005,00","5.005,50","-0,49","1,000","5.005.500,00","5.005.500,00",ALK,2015-10-07
08.10.2015,"5.090,00","5.090,00","5.040,00","5.072,81","1,34",224,"1.136.310,00","1.136.310,00",ALK,2015-10-08
09.10.2015,"5.051,00","5.100,00","5.050,00","5.058,71","-0,28",217,"1.097.739,00","1.097.739,00",ALK,2015-10-09
13.10.2015,"5.052,00","5.052,00","5.050,00","5.050,67","-0,16",111,"560.624,00","560.624,00",ALK,2015-10-13
14.10.2015,"5.052,00","5.053,00","5.050,00","5.051,10","0,01",105,"530.366,00","530.366,00",ALK,2015-10-14
15.10.2015,"5.052,00","5.053,00","5.052,00","5.052,04","0,02",233,"1.177.126,00","1.177.126,00",ALK,2015-10-15
16.10.2015,"5.052,00","5.052,00","5.052,00","5.052,00","0,00",32,"161.664,00","161.664,00",ALK,2015-10-16
19.10.2015,"5.054,00","5.055,00","5.052,00","5.054,29","0,05",87,"439.723,00","439.723,00",ALK,2015-10-19
20.10.2015,"5.055,00","5.055,00","5.054,00","5.054,68","0,01",238,"1.203.015,00","1.203.015,00",ALK,2015-10-20
21.10.2015,"5.053,00","5.053,00","5.050,00","5.050,61","-0,08",155,"782.845,00","782.845,00",ALK,2015-10-21
22.10.2015,"5.056,00","5.070,00","5.054,00","5.061,57","0,22",265,"1.341.316,00","1.341.316,00",ALK,2015-10-22
26.10.2015,"5.058,00","5.058,00","5.055,00","5.056,88","-0,09",8,"40.455,00","40.455,00",ALK,2015-10-26
27.10.2015,"5.051,00","5.058,00","5.050,00","5.051,16","-0,11",253,"1.277.944,00","1.277.944,00",ALK,2015-10-27
28.10.2015,"5.100,00","5.100,00","5.053,00","5.095,95","0,89",464,"2.364.520,00","2.364.520,00",ALK,2015-10-28
29.10.2015,"5.100,00","5.101,00","5.057,00","5.099,21","0,06",113,"576.211,00","576.211,00",ALK,2015-10-29
30.10.2015,"5.102,00","5.150,00","5.102,00","5.118,00","0,37",30,"153.540,00","153.540,00",ALK,2015-10-30
02.11.2015,"5.150,00","5.150,00","5.100,00","5.133,08","0,29",229,"1.175.476,00","1.175.476,00",ALK,2015-11-02
03.11.2015,"5.156,00","5.200,00","5.151,00","5.179,18","0,90",110,"569.710,00","569.710,00",ALK,2015-11-03
04.11.2015,"5.208,00","5.208,00","5.203,00","5.204,53","0,49",262,"1.363.586,00","1.363.586,00",ALK,2015-11-04
05.11.2015,"5.300,00","5.300,00","5.249,00","5.280,28","1,46",300,"1.584.085,00","1.584.085,00",ALK,2015-11-05
06.11.2015,"5.350,00","5.350,00","5.300,00","5.319,11","0,74",554,"2.946.785,00","2.946.785,00",ALK,2015-11-06
09.11.2015,"5.302,00","5.335,00","5.302,00","5.306,70","-0,23",196,"1.040.114,00","1.040.114,00",ALK,2015-11-09
10.11.2015,"5.290,00","5.302,00","5.200,00","5.297,91","-0,17",721,"3.819.790,00","3.819.790,00",ALK,2015-11-10
11.11.2015,"5.300,00","5.300,00","5.300,00","5.300,00","0,04",150,"795.000,00","795.000,00",ALK,2015-11-11
12.11.2015,"5.300,00","5.300,00","5.300,00","5.300,00","0,00",34,"180.200,00","180.200,00",ALK,2015-11-12
13.11.2015,"5.250,00","5.250,00","5.250,00","5.250,00","-0,94",15,"78.750,00","78.750,00",ALK,2015-11-13
16.11.2015,"5.250,00","5.250,00","5.250,00","5.250,00","0,00",6,"31.500,00","31.500,00",ALK,2015-11-16
17.11.2015,"5.250,00","5.250,00","5.250,00","5.250,00","0,00",52,"273.000,00","273.000,00",ALK,2015-11-17
18.11.2015,"5.250,00","5.250,00","5.250,00","5.250,00","0,00",312,"1.638.000,00","1.638.000,00",ALK,2015-11-18
19.11.2015,"5.256,00","5.300,00","5.255,00","5.270,07","0,38",341,"1.797.095,00","1.797.095,00",ALK,2015-11-19
20.11.2015,"5.350,00","5.350,00","5.349,00","5.349,45","1,51",55,"294.220,00","294.220,00",ALK,2015-11-20
23.11.2015,"5.350,00","5.350,00","5.300,00","5.346,34","-0,06",112,"598.790,00","598.790,00",ALK,2015-11-23
24.11.2015,"5.499,00","5.500,00","5.360,00","5.446,35","1,87",202,"1.100.162,00","1.100.162,00",ALK,2015-11-24
25.11.2015,"5.420,00","5.450,00","5.402,00","5.433,08","-0,24",711,"3.862.920,00","3.862.920,00",ALK,2015-11-25
26.11.2015,"5.404,00","5.404,00","5.403,00","5.403,08","-0,55",65,"351.200,00","351.200,00",ALK,2015-11-26
27.11.2015,"5.402,00","5.406,00","5.402,00","5.404,10","0,02",155,"837.635,00","837.635,00",ALK,2015-11-27
30.11.2015,"5.402,00","5.403,00","5.402,00","5.402,80","-0,02",51,"275.543,00","275.543,00",ALK,2015-11-30
01.12.2015,"5.403,00","5.403,00","5.403,00","5.403,00","0,00",10,"54.030,00","54.030,00",ALK,2015-12-01
03.12.2015,"5.403,00","5.403,00","5.402,00","5.402,62","-0,01",16,"86.442,00","86.442,00",ALK,2015-12-03
04.12.2015,"5.407,00","5.408,00","5.406,00","5.407,05","0,08",86,"465.006,00","465.006,00",ALK,2015-12-04
07.12.2015,"5.400,00","5.449,00","5.400,00","5.400,86","-0,11",145,"783.125,00","783.125,00",ALK,2015-12-07
09.12.2015,"5.400,00","5.400,00","5.400,00","5.400,00","-0,02",84,"453.600,00","453.600,00",ALK,2015-12-09
10.12.2015,"5.400,00","5.400,00","5.400,00","5.400,00","0,00",136,"734.400,00","734.400,00",ALK,2015-12-10
11.12.2015,"5.450,00","5.450,00","5.401,00","5.422,45","0,42",138,"748.298,00","748.298,00",ALK,2015-12-11
14.12.2015,"5.417,00","5.421,00","5.416,00","5.418,83","-0,07",72,"390.156,00","390.156,00",ALK,2015-12-14
15.12.2015,"5.420,00","5.421,00","5.420,00","5.420,91","0,04",236,"1.279.334,00","1.279.334,00",ALK,2015-12-15
16.12.2015,"5.420,00","5.421,00","5.420,00","5.420,37","-0,01",108,"585.400,00","585.400,00",ALK,2015-12-16
17.12.2015,"5.420,00","5.420,00","5.420,00","5.420,00","-0,01",137,"742.540,00","742.540,00",ALK,2015-12-17
18.12.2015,"5.420,00","5.420,00","5.420,00","5.420,00","0,00",64,"346.880,00","346.880,00",ALK,2015-12-18
21.12.2015,"5.403,00","5.403,00","5.401,00","5.402,54","-0,32",13,"70.233,00","70.233,00",ALK,2015-12-21
22.12.2015,"5.416,00","5.416,00","5.404,00","5.409,99","0,14",161,"871.008,00","871.008,00",ALK,2015-12-22
23.12.2015,"5.450,00","5.450,00","5.430,00","5.439,52","0,55",21,"114.230,00","114.230,00",ALK,2015-12-23
24.12.2015,"5.485,00","5.485,00","5.450,00","5.452,88","0,25",78,"425.325,00","425.325,00",ALK,2015-12-24
25.12.2015,"5.426,00","5.485,00","5.426,00","5.482,64","0,55",55,"301.545,00","301.545,00",ALK,2015-12-25
28.12.2015,"5.400,00","5.435,00","5.400,00","5.428,92","-0,98",130,"705.760,00","705.760,00",ALK,2015-12-28
29.12.2015,"5.432,00","5.435,00","5.405,00","5.423,90","-0,09",92,"498.999,00","498.999,00",ALK,2015-12-29
30.12.2015,"5.442,00","5.480,00","5.432,00","5.444,71","0,38",210,"1.143.390,00","1.143.390,00",ALK,2015-12-30
04.01.2016,"5.412,00","5.430,00","5.412,00","5.414,21","-0,56",38,"205.740,00","205.740,00",ALK,2016-01-04
05.01.2016,"5.411,00","5.415,00","5.410,00","5.411,82","-0,04",119,"644.006,00","644.006,00",ALK,2016-01-05
08.01.2016,"5.429,00","5.429,00","5.410,00","5.424,15","0,23",135,"732.260,00","732.260,00",ALK,2016-01-08
11.01.2016,"5.411,00","5.411,00","5.411,00","5.411,00","-0,24",22,"119.042,00","119.042,00",ALK,2016-01-11
12.01.2016,"5.400,00","5.400,00","5.400,00","5.400,00","-0,20",228,"1.231.200,00","1.231.200,00",ALK,2016-01-12
13.01.2016,"5.401,00","5.401,00","5.400,00","5.400,58","0,01",115,"621.067,00","621.067,00",ALK,2016-01-13
14.01.2016,"5.400,00","5.401,00","5.400,00","5.400,38","0,00",189,"1.020.671,00","1.020.671,00",ALK,2016-01-14
15.01.2016,"5.401,00","5.402,00","5.401,00","5.401,13","0,01",156,"842.576,00","842.576,00",ALK,2016-01-15
18.01.2016,"5.350,00","5.402,00","5.350,00","5.390,12","-0,20",153,"824.689,00","824.689,00",ALK,2016-01-18
20.01.2016,"5.350,00","5.400,00","5.350,00","5.368,64","-0,40",132,"708.660,00","708.660,00",ALK,2016-01-20
21.01.2016,"5.351,00","5.390,00","5.350,00","5.355,53","-0,24",207,"1.108.594,00","1.108.594,00",ALK,2016-01-21
22.01.2016,"5.397,00","5.399,00","5.351,00","5.384,24","0,54",71,"382.281,00","382.281,00",ALK,2016-01-22
25.01.2016,"5.350,00","5.352,00","5.350,00","5.350,72","-0,62",79,"422.707,00","422.707,00",ALK,2016-01-25
26.01.2016,"5.350,00","5.350,00","5.350,00","5.350,00","-0,01",25,"133.750,00","133.750,00",ALK,2016-01-26
27.01.2016,"5.400,00","5.400,00","5.352,00","5.398,37","0,90",478,"2.580.423,00","2.580.423,00",ALK,2016-01-27
28.01.2016,"5.400,00","5.400,00","5.400,00","5.400,00","0,03",100,"540.000,00","540.000,00",ALK,2016-01-28
29.01.2016,"5.300,00","5.400,00","5.300,00","5.333,80","-1,23",71,"378.700,00","378.700,00",ALK,2016-01-29
01.02.2016,"5.250,00","5.301,00","5.250,00","5.277,19","-1,06",124,"654.371,00","654.371,00",ALK,2016-02-01
02.02.2016,"5.250,00","5.250,00","5.201,00","5.220,75","-1,07",67,"349.790,00","349.790,00",ALK,2016-02-02
03.02.2016,"5.300,00","5.300,00","5.251,00","5.267,90","0,90",290,"1.527.690,00","1.527.690,00",ALK,2016-02-03
04.02.2016,"5.370,00","5.370,00","5.370,00","5.370,00","1,94",38,"204.060,00","204.060,00",ALK,2016-02-04
05.02.2016,"5.300,00","5.301,00","5.300,00","5.300,44","-1,30",91,"482.340,00","482.340,00",ALK,2016-02-05
08.02.2016,"5.300,00","5.301,00","5.300,00","5.300,14","-0,01",143,"757.920,00","757.920,00",ALK,2016-02-08
09.02.2016,"5.300,00","5.375,00","5.300,00","5.311,54","0,22",13,"69.050,00","69.050,00",ALK,2016-02-09
10.02.2016,"5.374,00","5.374,00","5.300,00","5.318,87","0,14",222,"1.180.790,00","1.180.790,00",ALK,2016-02-10
11.02.2016,"5.253,00","5.399,00","5.253,00","5.372,28","1,00",131,"703.769,00","703.769,00",ALK,2016-02-11
12.02.2016,"5.300,00","5.300,00","5.300,00","5.300,00","-1,35",50,"265.000,00","265.000,00",ALK,2016-02-12
15.02.2016,"5.300,00","5.301,00","5.300,00","5.300,40","0,01",350,"1.855.140,00","1.855.140,00",ALK,2016-02-15
16.02.2016,"5.220,00","5.300,00","5.215,00","5.272,07","-0,53",70,"369.045,00","369.045,00",ALK,2016-02-16
17.02.2016,"5.300,00","5.300,00","5.231,00","5.289,57","0,33",165,"872.779,00","872.779,00",ALK,2016-02-17
18.02.2016,"5.300,00","5.397,00","5.300,00","5.305,71","0,31",34,"180.394,00","180.394,00",ALK,2016-02-18
22.02.2016,"5.300,00","5.349,00","5.300,00","5.311,53","0,11",85,"451.480,00","451.480,00",ALK,2016-02-22
23.02.2016,"5.300,00","5.301,00","5.300,00","5.300,36","-0,21",55,"291.520,00","291.520,00",ALK,2016-02-23
24.02.2016,"5.300,00","5.300,00","5.300,00","5.300,00","-0,01",61,"323.300,00","323.300,00",ALK,2016-02-24
25.02.2016,"5.375,00","5.375,00","5.349,00","5.365,74","1,24",87,"466.819,00","466.819,00",ALK,2016-02-25
26.02.2016,"5.350,00","5.351,00","5.350,00","5.350,30","-0,29",333,"1.781.650,00","1.781.650,00",ALK,2016-02-26
29.02.2016,"5.390,00","5.397,00","5.302,00","5.389,62","0,73",261,"1.406.692,00","1.406.692,00",ALK,2016-02-29
01.03.2016,"5.350,00","5.350,00","5.350,00","5.350,00","-0,74",18,"96.300,00","96.300,00",ALK,2016-03-01
02.03.2016,"5.350,00","5.351,00","5.349,00","5.349,93","0,00",108,"577.792,00","577.792,00",ALK,2016-03-02
03.03.2016,"5.330,00","5.331,00","5.330,00","5.330,05","-0,37",57,"303.813,00","303.813,00",ALK,2016-03-03
04.03.2016,"5.330,00","5.348,00","5.301,00","5.313,46","-0,31",110,"584.481,00","584.481,00",ALK,2016-03-04
07.03.2016,"5.330,00","5.330,00","5.300,00","5.321,08","0,14",167,"888.620,00","888.620,00",ALK,2016-03-07
08.03.2016,"5.340,00","5.340,00","5.306,00","5.312,41","-0,16",106,"563.115,00","563.115,00",ALK,2016-03-08
09.03.2016,"5.344,00","5.350,00","5.311,00","5.343,01","0,58",345,"1.843.340,00","1.843.340,00",ALK,2016-03-09
10.03.2016,"5.350,00","5.350,00","5.300,00","5.346,02","0,06",756,"4.041.589,00","4.041.589,00",ALK,2016-03-10
11.03.2016,"5.300,00","5.350,00","5.300,00","5.330,05","-0,30",101,"538.335,00","538.335,00",ALK,2016-03-11
14.03.2016,"5.300,00","5.301,00","5.300,00","5.300,88","-0,55",113,"599.000,00","599.000,00",ALK,2016-03-14
15.03.2016,"5.300,00","5.301,00","5.300,00","5.300,17","-0,01",168,"890.429,00","890.429,00",ALK,2016-03-15
16.03.2016,"5.301,00","5.301,00","5.301,00","5.301,00","0,02",5,"26.505,00","26.505,00",ALK,2016-03-16
17.03.2016,"5.350,00","5.350,00","5.348,00","5.348,98","0,91",228,"1.219.568,00","1.219.568,00",ALK,2016-03-17
18.03.2016,"5.305,00","5.349,00","5.305,00","5.318,12","-0,58",57,"303.133,00","303.133,00",ALK,2016-03-18
21.03.2016,"5.330,00","5.331,00","5.301,00","5.327,17","0,17",406,"2.162.829,00","2.162.829,00",ALK,2016-03-21
22.03.2016,"5.301,00","5.320,00","5.301,00","5.318,26","-0,17",700,"3.722.785,00","3.722.785,00",ALK,2016-03-22
23.03.2016,"5.301,00","5.301,00","5.301,00","5.301,00","-0,32",90,"477.090,00","477.090,00",ALK,2016-03-23
24.03.2016,"5.320,00","5.320,00","5.310,00","5.316,43","0,29",28,"148.860,00","148.860,00",ALK,2016-03-24
25.03.2016,"5.300,00","5.310,00","5.300,00","5.303,27","-0,25",100,"530.327,00","530.327,00",ALK,2016-03-25
28.03.2016,"5.299,00","5.299,00","5.299,00","5.299,00","-0,08",16,"84.784,00","84.784,00",ALK,2016-03-28
29.03.2016,"5.220,00","5.222,00","5.220,00","5.220,39","-1,48",89,"464.615,00","464.615,00",ALK,2016-03-29
31.03.2016,"5.200,00","5.200,00","5.200,00","5.200,00","-0,39",40,"208.000,00","208.000,00",ALK,2016-03-31
01.04.2016,"5.200,00","5.201,00","5.200,00","5.200,30","0,01",50,"260.015,00","260.015,00",ALK,2016-04-01
04.04.2016,"5.299,00","5.299,00","5.201,00","5.213,27","0,25",62,"323.223,00","323.223,00",ALK,2016-04-04
05.04.2016,"5.299,00","5.300,00","5.297,00","5.299,12","1,65",433,"2.294.517,00","2.294.517,00",ALK,2016-04-05
06.04.2016,"5.300,00","5.320,00","5.300,00","5.304,29","0,10","1,886","10.003.900,00","10.003.900,00",ALK,2016-04-06
07.04.2016,"5.220,00","5.300,00","5.220,00","5.299,20","-0,10",301,"1.595.060,00","1.595.060,00",ALK,2016-04-07
08.04.2016,"5.300,00","5.300,00","5.300,00","5.300,00","0,02",276,"1.462.800,00","1.462.800,00",ALK,2016-04-08
11.04.2016,"5.300,00","5.300,00","5.298,00","5.299,35","-0,01",115,"609.425,00","609.425,00",ALK,2016-04-11
12.04.2016,"5.300,00","5.300,00","5.300,00","5.300,00","0,01","1,791","9.492.300,00","9.492.300,00",ALK,2016-04-12
13.04.2016,"5.300,00","5.300,00","5.298,00","5.299,72","-0,01",108,"572.370,00","572.370,00",ALK,2016-04-13
14.04.2016,"5.300,00","5.300,00","5.300,00","5.300,00","0,01",686,"3.635.800,00","3.635.800,00",ALK,2016-04-14
15.04.2016,"5.300,00","5.300,00","5.300,00","5.300,00","0,00",83,"439.900,00","439.900,00",ALK,2016-04-15
18.04.2016,"5.310,00","5.350,00","5.301,00","5.332,26","0,61","1,380","7.358.513,00","7.358.513,00",ALK,2016-04-18
19.04.2016,"5.300,00","5.301,00","5.251,00","5.299,74","-0,61",265,"1.404.432,00","1.404.432,00",ALK,2016-04-19
20.04.2016,"5.199,00","5.199,00","5.199,00","5.199,00","-1,90",15,"77.985,00","77.985,00",ALK,2016-04-20
21.04.2016,"4.950,00","5.045,00","4.950,00","4.999,88","-3,83",41,"204.995,00","204.995,00",ALK,2016-04-21
22.04.2016,"5.000,00","5.000,00","5.000,00","5.000,00","0,00",309,"1.545.000,00","1.545.000,00",ALK,2016-04-22
25.04.2016,"5.000,00","5.000,00","4.999,00","4.999,71","-0,01",340,"1.699.900,00","1.699.900,00",ALK,2016-04-25
26.04.2016,"5.000,00","5.000,00","5.000,00","5.000,00","0,01",38,"190.000,00","190.000,00",ALK,2016-04-26
27.04.2016,"5.000,00","5.000,00","5.000,00","5.000,00","0,00",50,"250.000,00","250.000,00",ALK,2016-04-27
28.04.2016,"5.001,00","5.001,00","5.001,00","5.001,00","0,02",45,"225.045,00","225.045,00",ALK,2016-04-28
03.05.2016,"5.003,00","5.005,00","5.001,00","5.002,52","0,03",132,"660.332,00","660.332,00",ALK,2016-05-03
04.05.2016,"5.002,00","5.010,00","5.002,00","5.004,57","0,04",115,"575.526,00","575.526,00",ALK,2016-05-04
05.05.2016,"5.000,00","5.010,00","5.000,00","5.004,22","-0,01",463,"2.316.954,00","2.316.954,00",ALK,2016-05-05
06.05.2016,"5.000,00","5.000,00","5.000,00","5.000,00","-0,08",44,"220.000,00","220.000,00",ALK,2016-05-06
09.05.2016,"5.002,00","5.002,00","5.001,00","5.001,71","0,03",34,"170.058,00","170.058,00",ALK,2016-05-09
10.05.2016,"5.000,00","5.001,00","5.000,00","5.000,80","-0,02",364,"1.820.290,00","1.820.290,00",ALK,2016-05-10
11.05.2016,"5.000,00","5.050,00","5.000,00","5.004,18","0,07",282,"1.411.180,00","1.411.180,00",ALK,2016-05-11
12.05.2016,"4.900,00","4.950,00","4.900,00","4.911,44","-1,85",90,"442.030,00","442.030,00",ALK,2016-05-12
13.05.2016,"4.900,00","4.900,00","4.900,00","4.900,00","-0,23",60,"294.000,00","294.000,00",ALK,2016-05-13
16.05.2016,"4.902,00","4.902,00","4.902,00","4.902,00","0,04",1,"4.902,00","4.902,00",ALK,2016-05-16
17.05.2016,"5.050,00","5.050,00","4.999,00","5.005,87","2,12",571,"2.858.350,00","2.858.350,00",ALK,2016-05-17
18.05.2016,"5.000,00","5.050,00","5.000,00","5.046,23","0,81",75,"378.467,00","378.467,00",ALK,2016-05-18
19.05.2016,"5.000,00","5.000,00","5.000,00","5.000,00","-0,92",20,"100.000,00","100.000,00",ALK,2016-05-19
20.05.2016,"5.000,00","5.049,00","5.000,00","5.035,00","0,70",14,"70.490,00","70.490,00",ALK,2016-05-20
23.05.2016,"5.050,00","5.050,00","5.050,00","5.050,00","0,30",144,"727.200,00","727.200,00",ALK,2016-05-23
25.05.2016,"5.050,00","5.050,00","5.050,00","5.050,00","0,00",144,"727.200,00","727.200,00",ALK,2016-05-25
26.05.2016,"5.040,00","5.040,00","5.040,00","5.040,00","-0,20",134,"675.360,00","675.360,00",ALK,2016-05-26
27.05.2016,"5.000,00","5.000,00","5.000,00","5.000,00","-0,79",121,"605.000,00","605.000,00",ALK,2016-05-27
30.05.2016,"5.000,00","5.000,00","5.000,00","5.000,00","0,00",30,"150.000,00","150.000,00",ALK,2016-05-30
01.06.2016,"4.951,00","4.952,00","4.951,00","4.951,20","-0,98",156,"772.387,00","772.387,00",ALK,2016-06-01
02.06.2016,"4.916,00","4.949,00","4.916,00","4.927,00","-0,49",15,"73.905,00","73.905,00",ALK,2016-06-02
03.06.2016,"4.944,00","4.944,00","4.915,00","4.919,03","-0,16",145,"713.260,00","713.260,00",ALK,2016-06-03
06.06.2016,"4.950,00","4.951,00","4.945,00","4.948,87","0,61",75,"371.165,00","371.165,00",ALK,2016-06-06
07.06.2016,"4.950,00","4.950,00","4.950,00","4.950,00","0,02",60,"297.000,00","297.000,00",ALK,2016-06-07
08.06.2016,"4.998,00","4.998,00","4.960,00","4.962,81","0,26",162,"803.976,00","803.976,00",ALK,2016-06-08
09.06.2016,"4.961,00","4.961,00","4.960,00","4.960,07","-0,06",151,"748.971,00","748.971,00",ALK,2016-06-09
10.06.2016,"4.998,00","4.998,00","4.960,00","4.965,95","0,12",123,"610.812,00","610.812,00",ALK,2016-06-10
13.06.2016,"4.990,00","4.990,00","4.990,00","4.990,00","0,48",35,"174.650,00","174.650,00",ALK,2016-06-13
14.06.2016,"4.990,00","4.990,00","4.990,00","4.990,00","0,00",10,"49.900,00","49.900,00",ALK,2016-06-14
15.06.2016,"4.984,00","4.984,00","4.962,00","4.975,87","-0,28",63,"313.480,00","313.480,00",ALK,2016-06-15
16.06.2016,"4.960,00","4.960,00","4.960,00","4.960,00","-0,32",101,"500.960,00","500.960,00",ALK,2016-06-16
20.06.2016,"4.999,00","4.999,00","4.960,00","4.979,87","0,40",98,"488.027,00","488.027,00",ALK,2016-06-20
21.06.2016,"5.000,00","5.000,00","4.997,00","4.999,71","0,40",557,"2.784.836,00","2.784.836,00",ALK,2016-06-21
22.06.2016,"5.006,00","5.006,00","5.000,00","5.000,50","0,02",298,"1.490.150,00","1.490.150,00",ALK,2016-06-22
23.06.2016,"5.002,00","5.002,00","5.002,00","5.002,00","0,03",3,"15.006,00","15.006,00",ALK,2016-06-23
24.06.2016,"5.008,00","5.008,00","5.007,00","5.007,30","0,11",285,"1.427.080,00","1.427.080,00",ALK,2016-06-24
27.06.2016,"5.012,00","5.012,00","5.011,00","5.011,97","0,09",192,"962.299,00","962.299,00",ALK,2016-06-27
28.06.2016,"5.011,00","5.011,00","5.011,00","5.011,00","-0,02",317,"1.588.487,00","1.588.487,00",ALK,2016-06-28
29.06.2016,"5.011,00","5.011,00","5.011,00","5.011,00","0,00",211,"1.057.321,00","1.057.321,00",ALK,2016-06-29
30.06.2016,"5.014,00","5.015,00","5.014,00","5.014,15","0,06",290,"1.454.103,00","1.454.103,00",ALK,2016-06-30
01.07.2016,"5.049,00","5.049,00","5.014,00","5.020,43","0,13",49,"246.001,00","246.001,00",ALK,2016-07-01
04.07.2016,"5.020,00","5.020,00","5.000,00","5.012,96","-0,15",272,"1.363.525,00","1.363.525,00",ALK,2016-07-04
06.07.2016,"5.040,00","5.050,00","5.040,00","5.040,77","0,55",260,"1.310.600,00","1.310.600,00",ALK,2016-07-06
08.07.2016,"5.021,00","5.021,00","5.021,00","5.021,00","-0,39",15,"75.315,00","75.315,00",ALK,2016-07-08
11.07.2016,"5.021,00","5.021,00","5.021,00","5.021,00","0,00",3,"15.063,00","15.063,00",ALK,2016-07-11
12.07.2016,"5.041,00","5.041,00","5.028,00","5.035,78","0,29",426,"2.145.242,00","2.145.242,00",ALK,2016-07-12
13.07.2016,"5.040,00","5.040,00","5.020,00","5.033,52","-0,04",184,"926.168,00","926.168,00",ALK,2016-07-13
14.07.2016,"5.041,00","5.041,00","5.041,00","5.041,00","0,15",25,"126.025,00","126.025,00",ALK,2016-07-14
15.07.2016,"5.041,00","5.043,00","5.041,00","5.042,44","0,03",80,"403.395,00","403.395,00",ALK,2016-07-15
18.07.2016,"5.040,00","5.040,00","5.033,00","5.039,86","-0,05",255,"1.285.165,00","1.285.165,00",ALK,2016-07-18
19.07.2016,"5.040,00","5.040,00","5.040,00","5.040,00","0,00",332,"1.673.280,00","1.673.280,00",ALK,2016-07-19
20.07.2016,"5.051,00","5.051,00","5.051,00","5.051,00","0,22",238,"1.202.138,00","1.202.138,00",ALK,2016-07-20
21.07.2016,"5.100,00","5.100,00","5.051,00","5.099,13","0,95",357,"1.820.390,00","1.820.390,00",ALK,2016-07-21
22.07.2016,"5.100,00","5.100,00","5.100,00","5.100,00","0,02",165,"841.500,00","841.500,00",ALK,2016-07-22
25.07.2016,"5.100,00","5.100,00","5.051,00","5.097,60","-0,05",503,"2.564.095,00","2.564.095,00",ALK,2016-07-25
26.07.2016,"5.100,00","5.100,00","5.054,00","5.096,07","-0,03",82,"417.878,00","417.878,00",ALK,2016-07-26
27.07.2016,"5.100,00","5.100,00","5.080,00","5.080,65","-0,30",62,"315.000,00","315.000,00",ALK,2016-07-27
28.07.2016,"5.100,00","5.100,00","5.100,00","5.100,00","0,38",138,"703.800,00","703.800,00",ALK,2016-07-28
29.07.2016,"5.120,00","5.150,00","5.120,00","5.136,10","0,71",136,"698.510,00","698.510,00",ALK,2016-07-29
01.08.2016,"5.200,00","5.200,00","5.121,00","5.166,45","0,59",132,"681.972,00","681.972,00",ALK,2016-08-01
03.08.2016,"5.200,00","5.201,00","5.180,00","5.198,35","0,62",112,"582.215,00","582.215,00",ALK,2016-08-03
04.08.2016,"5.250,00","5.250,00","5.250,00","5.250,00","0,99",269,"1.412.250,00","1.412.250,00",ALK,2016-08-04
05.08.2016,"5.300,00","5.300,00","5.250,00","5.278,69","0,55",183,"966.000,00","966.000,00",ALK,2016-08-05
08.08.2016,"5.220,00","5.430,00","5.220,00","5.278,33","-0,01",18,"95.010,00","95.010,00",ALK,2016-08-08
09.08.2016,"5.300,00","5.300,00","5.300,00","5.300,00","0,41",562,"2.978.600,00","2.978.600,00",ALK,2016-08-09
10.08.2016,"5.202,00","5.202,00","5.202,00","5.202,00","-1,85",6,"31.212,00","31.212,00",ALK,2016-08-10
11.08.2016,"5.202,00","5.202,00","5.202,00","5.202,00","0,00",14,"72.828,00","72.828,00",ALK,2016-08-11
12.08.2016,"5.204,00","5.211,00","5.201,00","5.205,36","0,06",164,"853.679,00","853.679,00",ALK,2016-08-12
15.08.2016,"5.205,00","5.205,00","5.204,00","5.204,91","-0,01",123,"640.204,00","640.204,00",ALK,2016-08-15
16.08.2016,"5.250,00","5.254,00","5.250,00","5.253,96","0,94",106,"556.920,00","556.920,00",ALK,2016-08-16
17.08.2016,"5.303,00","5.303,00","5.303,00","5.303,00","0,93",290,"1.537.870,00","1.537.870,00",ALK,2016-08-17
18.08.2016,"5.306,00","5.350,00","5.305,00","5.327,91","0,47",314,"1.672.965,00","1.672.965,00",ALK,2016-08-18
19.08.2016,"5.350,00","5.350,00","5.305,00","5.340,29","0,23",209,"1.116.121,00","1.116.121,00",ALK,2016-08-19
22.08.2016,"5.352,00","5.352,00","5.351,00","5.351,04","0,20",151,"808.007,00","808.007,00",ALK,2016-08-22
23.08.2016,"5.350,00","5.361,00","5.350,00","5.354,67","0,07",205,"1.097.708,00","1.097.708,00",ALK,2016-08-23
24.08.2016,"5.400,00","5.400,00","5.360,00","5.384,87","0,56",76,"409.250,00","409.250,00",ALK,2016-08-24
25.08.2016,"5.355,00","5.355,00","5.355,00","5.355,00","-0,55",3,"16.065,00","16.065,00",ALK,2016-08-25
26.08.2016,"5.356,00","5.357,00","5.356,00","5.356,30","0,02",100,"535.630,00","535.630,00",ALK,2016-08-26
29.08.2016,"5.351,00","5.357,00","5.350,00","5.351,14","-0,10",198,"1.059.525,00","1.059.525,00",ALK,2016-08-29
30.08.2016,"5.398,00","5.398,00","5.360,00","5.381,95","0,58",150,"807.292,00","807.292,00",ALK,2016-08-30
31.08.2016,"5.350,00","5.360,00","5.350,00","5.352,84","-0,54",90,"481.756,00","481.756,00",ALK,2016-08-31
01.09.2016,"5.396,00","5.397,00","5.360,00","5.391,24","0,72",42,"226.432,00","226.432,00",ALK,2016-09-01
02.09.2016,"5.396,00","5.396,00","5.350,00","5.352,82","-0,71",170,"909.980,00","909.980,00",ALK,2016-09-02
05.09.2016,"5.305,00","5.350,00","5.305,00","5.328,61","-0,45",274,"1.460.039,00","1.460.039,00",ALK,2016-09-05
06.09.2016,"5.325,00","5.325,00","5.305,00","5.314,34","-0,27",300,"1.594.302,00","1.594.302,00",ALK,2016-09-06
07.09.2016,"5.311,00","5.345,00","5.311,00","5.337,15","0,43",13,"69.383,00","69.383,00",ALK,2016-09-07
09.09.2016,"5.350,00","5.350,00","5.350,00","5.350,00","0,24",8,"42.800,00","42.800,00",ALK,2016-09-09
12.09.2016,"5.350,00","5.351,00","5.350,00","5.350,45","0,01",123,"658.105,00","658.105,00",ALK,2016-09-12
13.09.2016,"5.350,00","5.350,00","5.350,00","5.350,00","-0,01",55,"294.250,00","294.250,00",ALK,2016-09-13
14.09.2016,"5.350,00","5.351,00","5.350,00","5.350,49","0,01",113,"604.605,00","604.605,00",ALK,2016-09-14
15.09.2016,"5.350,00","5.350,00","5.350,00","5.350,00","-0,01",60,"321.000,00","321.000,00",ALK,2016-09-15
16.09.2016,"5.351,00","5.352,00","5.351,00","5.351,56","0,03",45,"240.820,00","240.820,00",ALK,2016-09-16
19.09.2016,"5.352,00","5.352,00","5.351,00","5.351,50","0,00",90,"481.635,00","481.635,00",ALK,2016-09-19
20.09.2016,"5.353,00","5.353,00","5.351,00","5.351,29","0,00",85,"454.860,00","454.860,00",ALK,2016-09-20
21.09.2016,"5.371,00","5.391,00","5.352,00","5.386,95","0,67",291,"1.567.602,00","1.567.602,00",ALK,2016-09-21
22.09.2016,"5.399,00","5.399,00","5.354,00","5.364,78","-0,41",106,"568.667,00","568.667,00",ALK,2016-09-22
23.09.2016,"5.399,00","5.399,00","5.370,00","5.385,56","0,39",78,"420.074,00","420.074,00",ALK,2016-09-23
26.09.2016,"5.361,00","5.361,00","5.360,00","5.360,43","-0,47",42,"225.138,00","225.138,00",ALK,2016-09-26
27.09.2016,"5.371,00","5.380,00","5.361,00","5.372,66","0,23",105,"564.129,00","564.129,00",ALK,2016-09-27
28.09.2016,"5.400,00","5.400,00","5.372,00","5.398,46","0,48",178,"960.925,00","960.925,00",ALK,2016-09-28
29.09.2016,"5.400,00","5.420,00","5.385,00","5.399,21","0,01",126,"680.300,00","680.300,00",ALK,2016-09-29
30.09.2016,"5.450,00","5.450,00","5.410,00","5.445,04","0,85","1,454","7.917.086,00","7.917.086,00",ALK,2016-09-30
03.10.2016,"5.430,00","5.450,00","5.417,00","5.444,79","0,00",351,"1.911.121,00","1.911.121,00",ALK,2016-10-03
04.10.2016,"5.450,00","5.450,00","5.407,00","5.435,10","-0,18",50,"271.755,00","271.755,00",ALK,2016-10-04
05.10.2016,"5.490,00","5.490,00","5.450,00","5.462,63","0,51",38,"207.580,00","207.580,00",ALK,2016-10-05
06.10.2016,"5.450,00","5.450,00","5.450,00","5.450,00","-0,23",30,"163.500,00","163.500,00",ALK,2016-10-06
07.10.2016,"5.450,00","5.450,00","5.450,00","5.450,00","0,00",181,"986.450,00","986.450,00",ALK,2016-10-07
10.10.2016,"5.460,00","5.489,00","5.457,00","5.461,34","0,21",99,"540.673,00","540.673,00",ALK,2016-10-10
12.10.2016,"5.489,00","5.489,00","5.460,00","5.466,24","0,09",169,"923.795,00","923.795,00",ALK,2016-10-12
13.10.2016,"5.470,00","5.490,00","5.470,00","5.478,86","0,23",185,"1.013.590,00","1.013.590,00",ALK,2016-10-13
14.10.2016,"5.411,00","5.450,00","5.411,00","5.437,00","-0,76",30,"163.110,00","163.110,00",ALK,2016-10-14
17.10.2016,"5.460,00","5.460,00","5.411,00","5.451,87","0,27",113,"616.061,00","616.061,00",ALK,2016-10-17
18.10.2016,"5.430,00","5.431,00","5.430,00","5.430,05","-0,40",402,"2.182.880,00","2.182.880,00",ALK,2016-10-18
19.10.2016,"5.450,00","5.450,00","5.430,00","5.441,18","0,20",34,"185.000,00","185.000,00",ALK,2016-10-19
20.10.2016,"5.450,00","5.450,00","5.431,00","5.444,72","0,07",177,"963.716,00","963.716,00",ALK,2016-10-20
21.10.2016,"5.450,00","5.489,00","5.430,00","5.482,09","0,69",130,"712.672,00","712.672,00",ALK,2016-10-21
25.10.2016,"5.430,00","5.450,00","5.430,00","5.444,08","-0,69",169,"920.050,00","920.050,00",ALK,2016-10-25
26.10.2016,"5.430,00","5.430,00","5.430,00","5.430,00","-0,26",105,"570.150,00","570.150,00",ALK,2016-10-26
27.10.2016,"5.400,00","5.430,00","5.400,00","5.424,00","-0,11",60,"325.440,00","325.440,00",ALK,2016-10-27
28.10.2016,"5.450,00","5.450,00","5.401,00","5.406,82","-0,32",303,"1.638.266,00","1.638.266,00",ALK,2016-10-28
31.10.2016,"5.400,00","5.400,00","5.400,00","5.400,00","-0,13",412,"2.224.800,00","2.224.800,00",ALK,2016-10-31
01.11.2016,"5.353,00","5.380,00","5.352,00","5.354,46","-0,84",437,"2.339.901,00","2.339.901,00",ALK,2016-11-01
02.11.2016,"5.400,00","5.400,00","5.400,00","5.400,00","0,85",30,"162.000,00","162.000,00",ALK,2016-11-02
03.11.2016,"5.450,00","5.450,00","5.400,00","5.421,13","0,39",142,"769.800,00","769.800,00",ALK,2016-11-03
04.11.2016,"5.488,00","5.488,00","5.401,00","5.454,13","0,61",90,"490.872,00","490.872,00",ALK,2016-11-04
07.11.2016,"5.486,00","5.486,00","5.451,00","5.484,85","0,56",152,"833.697,00","833.697,00",ALK,2016-11-07
08.11.2016,"5.479,00","5.487,00","5.460,00","5.465,63","-0,35",113,"617.616,00","617.616,00",ALK,2016-11-08
09.11.2016,"5.450,00","5.451,00","5.450,00","5.450,32","-0,28",47,"256.165,00","256.165,00",ALK,2016-11-09
10.11.2016,"5.478,00","5.478,00","5.450,00","5.459,66","0,17",29,"158.330,00","158.330,00",ALK,2016-11-10
11.11.2016,"5.450,00","5.450,00","5.450,00","5.450,00","-0,18",40,"218.000,00","218.000,00",ALK,2016-11-11
14.11.2016,"5.461,00","5.480,00","5.410,00","5.462,84","0,24",237,"1.294.694,00","1.294.694,00",ALK,2016-11-14
15.11.2016,"5.450,00","5.490,00","5.410,00","5.472,47","0,18",723,"3.956.594,00","3.956.594,00",ALK,2016-11-15
16.11.2016,"5.450,00","5.453,00","5.450,00","5.450,68","-0,40",323,"1.760.570,00","1.760.570,00",ALK,2016-11-16
17.11.2016,"5.471,00","5.473,00","5.470,00","5.470,98","0,37",223,"1.220.029,00","1.220.029,00",ALK,2016-11-17
18.11.2016,"5.499,00","5.499,00","5.470,00","5.487,37","0,30",500,"2.743.685,00","2.743.685,00",ALK,2016-11-18
21.11.2016,"5.490,00","5.490,00","5.450,00","5.480,96","-0,12",104,"570.020,00","570.020,00",ALK,2016-11-21
22.11.2016,"5.462,00","5.463,00","5.462,00","5.462,67","-0,33",75,"409.700,00","409.700,00",ALK,2016-11-22
23.11.2016,"5.400,00","5.460,00","5.400,00","5.447,92","-0,27",472,"2.571.420,00","2.571.420,00",ALK,2016-11-23
25.11.2016,"5.290,00","5.290,00","5.290,00","5.290,00","-2,90",1,"5.290,00","5.290,00",ALK,2016-11-25
28.11.2016,"5.400,00","5.448,00","5.201,00","5.422,95","2,51",66,"357.915,00","357.915,00",ALK,2016-11-28
29.11.2016,"5.400,00","5.400,00","5.400,00","5.400,00","-0,42",23,"124.200,00","124.200,00",ALK,2016-11-29
01.12.2016,"5.400,00","5.400,00","5.400,00","5.400,00","0,00",143,"772.200,00","772.200,00",ALK,2016-12-01
02.12.2016,"5.400,00","5.400,00","5.390,00","5.399,44","-0,01",205,"1.106.885,00","1.106.885,00",ALK,2016-12-02
05.12.2016,"5.440,00","5.440,00","5.400,00","5.428,33","0,54",150,"814.250,00","814.250,00",ALK,2016-12-05
06.12.2016,"5.400,00","5.410,00","5.400,00","5.404,81","-0,43",208,"1.124.200,00","1.124.200,00",ALK,2016-12-06
07.12.2016,"5.401,00","5.401,00","5.400,00","5.400,41","-0,08",107,"577.844,00","577.844,00",ALK,2016-12-07
09.12.2016,"5.435,00","5.435,00","5.410,00","5.415,36","0,28",140,"758.150,00","758.150,00",ALK,2016-12-09
12.12.2016,"5.352,00","5.410,00","5.352,00","5.399,19","-0,30",154,"831.476,00","831.476,00",ALK,2016-12-12
13.12.2016,"5.350,00","5.360,00","5.350,00","5.353,30","-0,85",100,"535.330,00","535.330,00",ALK,2016-12-13
14.12.2016,"5.400,00","5.400,00","5.350,00","5.395,18","0,78",166,"895.600,00","895.600,00",ALK,2016-12-14
15.12.2016,"5.349,00","5.349,00","5.349,00","5.349,00","-0,86",63,"336.987,00","336.987,00",ALK,2016-12-15
16.12.2016,"5.350,00","5.350,00","5.350,00","5.350,00","0,02",120,"642.000,00","642.000,00",ALK,2016-12-16
19.12.2016,"5.330,00","5.350,00","5.330,00","5.338,54","-0,21",192,"1.025.000,00","1.025.000,00",ALK,2016-12-19
20.12.2016,"5.350,00","5.350,00","5.330,00","5.348,96","0,20",249,"1.331.890,00","1.331.890,00",ALK,2016-12-20
21.12.2016,"5.331,00","5.350,00","5.330,00","5.348,25","-0,01",332,"1.775.620,00","1.775.620,00",ALK,2016-12-21
22.12.2016,"5.300,00","5.300,00","5.300,00","5.300,00","-0,90",24,"127.200,00","127.200,00",ALK,2016-12-22
23.12.2016,"5.300,00","5.340,00","5.300,00","5.325,83","0,49",187,"995.930,00","995.930,00",ALK,2016-12-23
26.12.2016,"5.330,00","5.330,00","5.300,00","5.304,29","-0,40",35,"185.650,00","185.650,00",ALK,2016-12-26
27.12.2016,"5.350,00","5.350,00","5.350,00","5.350,00","0,86",115,"615.250,00","615.250,00",ALK,2016-12-27
28.12.2016,"5.350,00","5.389,00","5.350,00","5.387,14","0,69",105,"565.650,00","565.650,00",ALK,2016-12-28
03.01.2017,"5.400,00","5.400,00","5.400,00","5.400,00","0,24",33,"178.200,00","178.200,00",ALK,2017-01-03
04.01.2017,"5.400,00","5.400,00","5.400,00","5.400,00","0,00",57,"307.800,00","307.800,00",ALK,2017-01-04
05.01.2017,"5.400,00","5.400,00","5.400,00","5.400,00","0,00",23,"124.200,00","124.200,00",ALK,2017-01-05
09.01.2017,"5.400,00","5.430,00","5.400,00","5.408,82","0,16",17,"91.950,00","91.950,00",ALK,2017-01-09
10.01.2017,"5.400,00","5.430,00","5.400,00","5.419,85","0,20",155,"840.076,00","840.076,00",ALK,2017-01-10
11.01.2017,"5.358,00","5.403,00","5.358,00","5.398,01","-0,40",180,"971.642,00","971.642,00",ALK,2017-01-11
12.01.2017,"5.400,00","5.400,00","5.400,00","5.400,00","0,04",322,"1.738.800,00","1.738.800,00",ALK,2017-01-12
13.01.2017,"5.400,00","5.405,00","5.400,00","5.402,93","0,05",140,"756.410,00","756.410,00",ALK,2017-01-13
16.01.2017,"5.400,00","5.400,00","5.400,00","5.400,00","-0,05",130,"702.000,00","702.000,00",ALK,2017-01-16
17.01.2017,"5.400,00","5.400,00","5.400,00","5.400,00","0,00",680,"3.672.000,00","3.672.000,00",ALK,2017-01-17
18.01.2017,"5.400,00","5.401,00","5.351,00","5.395,26","-0,09",431,"2.325.356,00","2.325.356,00",ALK,2017-01-18
20.01.2017,"5.352,00","5.400,00","5.352,00","5.399,58","0,08",230,"1.241.904,00","1.241.904,00",ALK,2017-01-20
23.01.2017,"5.354,00","5.355,00","5.354,00","5.354,82","-0,83",73,"390.902,00","390.902,00",ALK,2017-01-23
24.01.2017,"5.400,00","5.400,00","5.373,00","5.398,77","0,82",308,"1.662.822,00","1.662.822,00",ALK,2017-01-24
25.01.2017,"5.420,00","5.420,00","5.402,00","5.417,43","0,35",70,"379.220,00","379.220,00",ALK,2017-01-25
26.01.2017,"5.406,00","5.450,00","5.403,00","5.425,21","0,14",71,"385.190,00","385.190,00",ALK,2017-01-26
27.01.2017,"5.450,00","5.451,00","5.416,00","5.449,20","0,44",578,"3.149.636,00","3.149.636,00",ALK,2017-01-27
30.01.2017,"5.450,00","5.450,00","5.431,00","5.449,70","0,01",127,"692.112,00","692.112,00",ALK,2017-01-30
31.01.2017,"5.499,00","5.499,00","5.431,00","5.440,76","-0,16",94,"511.431,00","511.431,00",ALK,2017-01-31
01.02.2017,"5.500,00","5.500,00","5.461,00","5.484,97","0,81",232,"1.272.513,00","1.272.513,00",ALK,2017-02-01
02.02.2017,"5.483,00","5.483,00","5.483,00","5.483,00","-0,04",2,"10.966,00","10.966,00",ALK,2017-02-02
03.02.2017,"5.500,00","5.500,00","5.452,00","5.486,36","0,06",320,"1.755.636,00","1.755.636,00",ALK,2017-02-03
06.02.2017,"5.500,00","5.500,00","5.500,00","5.500,00","0,25",273,"1.501.500,00","1.501.500,00",ALK,2017-02-06
07.02.2017,"5.500,00","5.501,00","5.500,00","5.500,54","0,01",46,"253.025,00","253.025,00",ALK,2017-02-07
08.02.2017,"5.600,00","5.600,00","5.590,00","5.598,04","1,77",277,"1.550.656,00","1.550.656,00",ALK,2017-02-08
09.02.2017,"5.516,00","5.516,00","5.505,00","5.514,31","-1,50",70,"386.002,00","386.002,00",ALK,2017-02-09
10.02.2017,"5.596,00","5.597,00","5.523,00","5.585,47","1,29",32,"178.735,00","178.735,00",ALK,2017-02-10
13.02.2017,"5.527,00","5.527,00","5.527,00","5.527,00","-1,05",5,"27.635,00","27.635,00",ALK,2017-02-13
14.02.2017,"5.550,00","5.551,00","5.525,00","5.540,66","0,25",170,"941.912,00","941.912,00",ALK,2017-02-14
15.02.2017,"5.559,00","5.595,00","5.556,00","5.558,89","0,33",149,"828.275,00","828.275,00",ALK,2017-02-15
16.02.2017,"5.550,00","5.550,00","5.550,00","5.550,00","-0,16",139,"771.450,00","771.450,00",ALK,2017-02-16
17.02.2017,"5.501,00","5.550,00","5.501,00","5.536,88","-0,24",56,"310.065,00","310.065,00",ALK,2017-02-17
20.02.2017,"5.500,00","5.501,00","5.500,00","5.500,42","-0,66",36,"198.015,00","198.015,00",ALK,2017-02-20
21.02.2017,"5.511,00","5.511,00","5.502,00","5.507,30","0,13",20,"110.146,00","110.146,00",ALK,2017-02-21
22.02.2017,"5.595,00","5.596,00","5.511,00","5.548,71","0,75",309,"1.714.550,00","1.714.550,00",ALK,2017-02-22
23.02.2017,"5.550,00","5.580,00","5.550,00","5.551,33","0,05",326,"1.809.733,00","1.809.733,00",ALK,2017-02-23
24.02.2017,"5.502,00","5.550,00","5.502,00","5.538,92","-0,22",13,"72.006,00","72.006,00",ALK,2017-02-24
27.02.2017,"5.501,00","5.502,00","5.501,00","5.501,52","-0,68",33,"181.550,00","181.550,00",ALK,2017-02-27
28.02.2017,"5.596,00","5.596,00","5.501,00","5.580,84","1,44",93,"519.018,00","519.018,00",ALK,2017-02-28
01.03.2017,"5.601,00","5.620,00","5.596,00","5.601,35","0,37",658,"3.685.686,00","3.685.686,00",ALK,2017-03-01
02.03.2017,"5.620,00","5.620,00","5.601,00","5.614,91","0,24",341,"1.914.685,00","1.914.685,00",ALK,2017-03-02
03.03.2017,"5.651,00","5.680,00","5.600,00","5.650,44","0,63",304,"1.717.735,00","1.717.735,00",ALK,2017-03-03
06.03.2017,"5.630,00","5.651,00","5.600,00","5.631,11","-0,34",89,"501.169,00","501.169,00",ALK,2017-03-06
07.03.2017,"5.600,00","5.650,00","5.600,00","5.645,10","0,25",51,"287.900,00","287.900,00",ALK,2017-03-07
08.03.2017,"5.650,00","5.650,00","5.649,00","5.649,33","0,07",135,"762.660,00","762.660,00",ALK,2017-03-08
09.03.2017,"5.600,00","5.655,00","5.600,00","5.646,82","-0,04",209,"1.180.185,00","1.180.185,00",ALK,2017-03-09
10.03.2017,"5.600,00","5.650,00","5.600,00","5.620,71","-0,46",129,"725.071,00","725.071,00",ALK,2017-03-10
13.03.2017,"5.650,00","5.650,00","5.611,00","5.646,89","0,47",251,"1.417.370,00","1.417.370,00",ALK,2017-03-13
14.03.2017,"5.600,00","5.611,00","5.600,00","5.602,52","-0,79",50,"280.126,00","280.126,00",ALK,2017-03-14
15.03.2017,"5.655,00","5.655,00","5.649,00","5.651,72","0,88",226,"1.277.288,00","1.277.288,00",ALK,2017-03-15
16.03.2017,"5.657,00","5.699,00","5.657,00","5.680,74","0,51",270,"1.533.799,00","1.533.799,00",ALK,2017-03-16
17.03.2017,"5.690,00","5.699,00","5.660,00","5.689,20","0,15",64,"364.109,00","364.109,00",ALK,2017-03-17
20.03.2017,"5.690,00","5.690,00","5.656,00","5.689,38","0,00",165,"938.748,00","938.748,00",ALK,2017-03-20
21.03.2017,"5.701,00","5.701,00","5.657,00","5.697,14","0,14",700,"3.987.999,00","3.987.999,00",ALK,2017-03-21
22.03.2017,"5.656,00","5.700,00","5.656,00","5.688,20","-0,16",41,"233.216,00","233.216,00",ALK,2017-03-22
23.03.2017,"5.700,00","5.700,00","5.700,00","5.700,00","0,21","2,110","12.027.000,00","12.027.000,00",ALK,2017-03-23
27.03.2017,"5.700,00","5.700,00","5.700,00","5.700,00","0,00",273,"1.556.100,00","1.556.100,00",ALK,2017-03-27
28.03.2017,"5.702,00","5.702,00","5.700,00","5.700,04","0,00",140,"798.005,00","798.005,00",ALK,2017-03-28
29.03.2017,"5.710,00","5.710,00","5.703,00","5.704,29","0,07",189,"1.078.111,00","1.078.111,00",ALK,2017-03-29
30.03.2017,"5.705,00","5.705,00","5.705,00","5.705,00","0,01",300,"1.711.500,00","1.711.500,00",ALK,2017-03-30
31.03.2017,"5.715,00","5.716,00","5.711,00","5.713,42","0,15",287,"1.639.752,00","1.639.752,00",ALK,2017-03-31
03.04.2017,"5.750,00","5.750,00","5.750,00","5.750,00","0,64","1,642","9.441.500,00","9.441.500,00",ALK,2017-04-03
04.04.2017,"5.760,00","5.764,00","5.707,00","5.757,80","0,14",265,"1.525.817,00","1.525.817,00",ALK,2017-04-04
05.04.2017,"5.771,00","5.800,00","5.771,00","5.772,32","0,25",22,"126.991,00","2.430.991,00",ALK,2017-04-05
06.04.2017,"5.850,00","5.850,00","5.800,00","5.835,93","1,10",334,"1.949.200,00","1.949.200,00",ALK,2017-04-06
07.04.2017,"5.900,00","5.901,00","5.825,00","5.899,04","1,08",541,"3.191.381,00","3.191.381,00",ALK,2017-04-07
10.04.2017,"5.900,00","5.900,00","5.826,00","5.899,47","0,01",491,"2.896.642,00","2.896.642,00",ALK,2017-04-10
11.04.2017,"5.800,00","5.850,00","5.800,00","5.817,74","-1,39",310,"1.803.500,00","1.803.500,00",ALK,2017-04-11
13.04.2017,"5.790,00","5.790,00","5.790,00","5.790,00","-0,48",10,"57.900,00","57.900,00",ALK,2017-04-13
18.04.2017,"5.760,00","5.799,00","5.703,00","5.753,42","-0,63",952,"5.477.252,00","5.477.252,00",ALK,2017-04-18
19.04.2017,"5.550,00","5.550,00","5.550,00","5.550,00","-3,54",10,"55.500,00","55.500,00",ALK,2017-04-19
20.04.2017,"5.501,00","5.550,00","5.501,00","5.536,00","-0,25",133,"736.288,00","736.288,00",ALK,2017-04-20
21.04.2017,"5.500,00","5.550,00","5.500,00","5.518,14","-0,32",155,"855.312,00","855.312,00",ALK,2017-04-21
24.04.2017,"5.549,00","5.550,00","5.500,00","5.540,40","0,40",105,"581.742,00","581.742,00",ALK,2017-04-24
25.04.2017,"5.500,00","5.500,00","5.499,00","5.499,99","-0,73",349,"1.919.498,00","1.919.498,00",ALK,2017-04-25
26.04.2017,"5.501,00","5.502,00","5.500,00","5.500,64","0,01",263,"1.446.668,00","1.446.668,00",ALK,2017-04-26
27.04.2017,"5.500,00","5.549,00","5.500,00","5.518,39","0,32",103,"568.394,00","568.394,00",ALK,2017-04-27
02.05.2017,"5.549,00","5.549,00","5.500,00","5.546,77","0,51",103,"571.317,00","571.317,00",ALK,2017-05-02
03.05.2017,"5.520,00","5.521,00","5.510,00","5.515,13","-0,57",515,"2.840.290,00","2.840.290,00",ALK,2017-05-03
04.05.2017,"5.515,00","5.515,00","5.515,00","5.515,00","0,00",480,"2.647.200,00","2.647.200,00",ALK,2017-05-04
05.05.2017,"5.550,00","5.550,00","5.549,00","5.549,31","0,62",150,"832.396,00","832.396,00",ALK,2017-05-05
08.05.2017,"5.550,00","5.550,00","5.550,00","5.550,00","0,01",97,"538.350,00","538.350,00",ALK,2017-05-08
09.05.2017,"5.515,00","5.516,00","5.515,00","5.515,35","-0,62",48,"264.737,00","264.737,00",ALK,2017-05-09
10.05.2017,"5.550,00","5.550,00","5.550,00","5.550,00","0,63",20,"111.000,00","111.000,00",ALK,2017-05-10
11.05.2017,"5.550,00","5.550,00","5.550,00","5.550,00","0,00",416,"2.308.800,00","2.308.800,00",ALK,2017-05-11
12.05.2017,"5.555,00","5.555,00","5.555,00","5.555,00","0,09",12,"66.660,00","66.660,00",ALK,2017-05-12
15.05.2017,"5.600,00","5.600,00","5.600,00","5.600,00","0,81",100,"560.000,00","560.000,00",ALK,2017-05-15
16.05.2017,"5.600,00","5.600,00","5.560,00","5.593,33","-0,12",30,"167.800,00","167.800,00",ALK,2017-05-16
17.05.2017,"5.600,00","5.600,00","5.561,00","5.573,30","-0,36",646,"3.600.353,00","3.600.353,00",ALK,2017-05-17
18.05.2017,"5.601,00","5.601,00","5.601,00","5.601,00","0,50",149,"834.549,00","834.549,00",ALK,2017-05-18
19.05.2017,"5.850,00","5.850,00","5.750,00","5.797,53","3,51","1,240","7.188.935,00","7.188.935,00",ALK,2017-05-19
22.05.2017,"5.860,00","5.860,00","5.837,00","5.858,72","1,06",773,"4.528.787,00","4.528.787,00",ALK,2017-05-22
23.05.2017,"5.800,00","5.800,00","5.799,00","5.799,18","-1,02",67,"388.545,00","388.545,00",ALK,2017-05-23
25.05.2017,"5.700,00","5.700,00","5.699,00","5.699,89","-1,71",90,"512.990,00","512.990,00",ALK,2017-05-25
26.05.2017,"5.699,00","5.700,00","5.699,00","5.699,50","-0,01",20,"113.990,00","113.990,00",ALK,2017-05-26
29.05.2017,"5.700,00","5.700,00","5.651,00","5.657,61","-0,73",168,"950.479,00","950.479,00",ALK,2017-05-29
30.05.2017,"5.670,00","5.670,00","5.651,00","5.653,98","-0,06",166,"938.560,00","938.560,00",ALK,2017-05-30
31.05.2017,"5.700,00","5.750,00","5.700,00","5.713,64","1,06",55,"314.250,00","314.250,00",ALK,2017-05-31
01.06.2017,"5.750,00","5.750,00","5.701,00","5.742,79","0,51",335,"1.923.835,00","1.923.835,00",ALK,2017-06-01
05.06.2017,"5.710,00","5.711,00","5.710,00","5.710,21","-0,57",114,"650.964,00","650.964,00",ALK,2017-06-05
06.06.2017,"5.750,00","5.750,00","5.711,00","5.747,00","0,64",172,"988.484,00","988.484,00",ALK,2017-06-06
07.06.2017,"5.750,00","5.750,00","5.750,00","5.750,00","0,05",158,"908.500,00","908.500,00",ALK,2017-06-07
08.06.2017,"5.750,00","5.770,00","5.750,00","5.766,80","0,29",250,"1.441.700,00","1.441.700,00",ALK,2017-06-08
09.06.2017,"5.746,00","5.746,00","5.746,00","5.746,00","-0,36",20,"114.920,00","114.920,00",ALK,2017-06-09
12.06.2017,"5.800,00","5.800,00","5.750,00","5.796,99","0,89",441,"2.556.472,00","2.556.472,00",ALK,2017-06-12
13.06.2017,"5.800,00","5.800,00","5.799,00","5.799,99","0,05",503,"2.917.397,00","2.917.397,00",ALK,2017-06-13
14.06.2017,"5.800,00","5.800,00","5.800,00","5.800,00","0,00",186,"1.078.800,00","1.078.800,00",ALK,2017-06-14
15.06.2017,"5.800,00","5.800,00","5.799,00","5.799,99","0,00",577,"3.346.594,00","3.346.594,00",ALK,2017-06-15
16.06.2017,"5.750,00","5.750,00","5.750,00","5.750,00","-0,86",16,"92.000,00","92.000,00",ALK,2017-06-16
19.06.2017,"5.750,00","5.800,00","5.750,00","5.775,07","0,44",367,"2.119.450,00","2.119.450,00",ALK,2017-06-19
20.06.2017,"5.750,00","5.750,00","5.750,00","5.750,00","-0,43",25,"143.750,00","143.750,00",ALK,2017-06-20
21.06.2017,"5.800,00","5.800,00","5.751,00","5.786,76","0,64",349,"2.019.579,00","2.019.579,00",ALK,2017-06-21
22.06.2017,"5.840,00","5.840,00","5.800,00","5.801,04","0,25","1,952","11.323.630,00","11.323.630,00",ALK,2017-06-22
23.06.2017,"5.800,00","5.850,00","5.800,00","5.840,86","0,69",525,"3.066.451,00","3.066.451,00",ALK,2017-06-23
27.06.2017,"5.850,00","5.850,00","5.800,00","5.806,04","-0,60",182,"1.056.700,00","1.056.700,00",ALK,2017-06-27
28.06.2017,"5.800,00","5.800,00","5.800,00","5.800,00","-0,10",4,"23.200,00","23.200,00",ALK,2017-06-28
29.06.2017,"5.805,00","5.810,00","5.805,00","5.808,33","0,14",15,"87.125,00","87.125,00",ALK,2017-06-29
30.06.2017,"5.805,00","5.805,00","5.805,00","5.805,00","-0,06",13,"75.465,00","75.465,00",ALK,2017-06-30
03.07.2017,"5.806,00","5.806,00","5.805,00","5.805,77","0,01",133,"772.168,00","772.168,00",ALK,2017-07-03
04.07.2017,"5.800,00","5.806,00","5.800,00","5.802,41","-0,06",777,"4.508.470,00","4.508.470,00",ALK,2017-07-04
05.07.2017,"5.800,00","5.800,00","5.800,00","5.800,00","-0,04",27,"156.600,00","156.600,00",ALK,2017-07-05
06.07.2017,"5.821,00","5.821,00","5.820,00","5.820,11","0,35",203,"1.181.483,00","1.181.483,00",ALK,2017-07-06
07.07.2017,"5.851,00","5.851,00","5.851,00","5.851,00","0,53",5,"29.255,00","29.255,00",ALK,2017-07-07
10.07.2017,"5.900,00","5.900,00","5.853,00","5.894,61","0,75",183,"1.078.713,00","1.078.713,00",ALK,2017-07-10
11.07.2017,"6.000,00","6.000,00","5.915,00","5.995,96","1,72",188,"1.127.240,00","1.127.240,00",ALK,2017-07-11
12.07.2017,"6.100,00","6.100,00","6.000,00","6.077,06","1,35",52,"316.007,00","316.007,00",ALK,2017-07-12
13.07.2017,"6.200,00","6.200,00","6.101,00","6.181,08","1,71",638,"3.943.526,00","3.943.526,00",ALK,2017-07-13
14.07.2017,"6.200,00","6.211,00","6.200,00","6.205,39","0,39",532,"3.301.267,00","3.301.267,00",ALK,2017-07-14
17.07.2017,"6.250,00","6.250,00","6.250,00","6.250,00","0,72",122,"762.500,00","762.500,00",ALK,2017-07-17
18.07.2017,"6.251,00","6.300,00","6.250,00","6.258,34","0,13",126,"788.551,00","788.551,00",ALK,2017-07-18
19.07.2017,"6.390,00","6.390,00","6.275,00","6.327,94","1,11",529,"3.347.479,00","3.347.479,00",ALK,2017-07-19
20.07.2017,"6.608,00","6.608,00","6.350,00","6.392,48","1,02",244,"1.559.765,00","1.559.765,00",ALK,2017-07-20
21.07.2017,"6.800,00","6.850,00","6.650,00","6.736,57","5,38",624,"4.203.621,00","4.203.621,00",ALK,2017-07-21
24.07.2017,"6.901,00","6.910,00","6.899,00","6.900,96","2,44",929,"6.410.990,00","6.410.990,00",ALK,2017-07-24
25.07.2017,"6.900,00","6.950,00","6.850,00","6.911,65","0,15",806,"5.570.790,00","5.570.790,00",ALK,2017-07-25
26.07.2017,"6.800,00","6.800,00","6.800,00","6.800,00","-1,62",100,"680.000,00","680.000,00",ALK,2017-07-26
27.07.2017,"6.600,00","6.601,00","6.596,00","6.599,80","-2,94",299,"1.973.340,00","1.973.340,00",ALK,2017-07-27
28.07.2017,"6.415,00","6.450,00","6.400,00","6.403,39","-2,98",685,"4.386.320,00","4.386.320,00",ALK,2017-07-28
31.07.2017,"6.400,00","6.500,00","6.400,00","6.412,02","0,13",84,"538.610,00","538.610,00",ALK,2017-07-31
01.08.2017,"6.430,00","6.500,00","6.413,00","6.478,49","1,04",81,"524.758,00","524.758,00",ALK,2017-08-01
03.08.2017,"6.465,00","6.465,00","6.452,00","6.459,14","-0,30",70,"452.140,00","452.140,00",ALK,2017-08-03
04.08.2017,"6.600,00","6.600,00","6.466,00","6.540,77","1,26",222,"1.452.051,00","1.452.051,00",ALK,2017-08-04
07.08.2017,"6.700,00","6.700,00","6.500,00","6.665,31","1,90",29,"193.294,00","193.294,00",ALK,2017-08-07
08.08.2017,"6.601,00","6.602,00","6.600,00","6.601,48","-0,96",250,"1.650.370,00","1.650.370,00",ALK,2017-08-08
09.08.2017,"6.650,00","6.650,00","6.650,00","6.650,00","0,73",25,"166.250,00","1.506.250,00",ALK,2017-08-09
10.08.2017,"6.700,00","6.700,00","6.670,00","6.697,27","0,71",55,"368.350,00","368.350,00",ALK,2017-08-10
11.08.2017,"6.715,00","6.715,00","6.700,00","6.700,95","0,05",63,"422.160,00","422.160,00",ALK,2017-08-11
14.08.2017,"6.800,00","6.800,00","6.751,00","6.787,23","1,29",230,"1.561.062,00","1.561.062,00",ALK,2017-08-14
15.08.2017,"6.810,00","6.810,00","6.800,00","6.805,01","0,26",669,"4.552.555,00","4.552.555,00",ALK,2017-08-15
16.08.2017,"6.800,00","6.800,00","6.760,00","6.797,60","-0,11",250,"1.699.400,00","1.699.400,00",ALK,2017-08-16
17.08.2017,"6.800,00","6.800,00","6.760,00","6.795,90","-0,03",39,"265.040,00","265.040,00",ALK,2017-08-17
18.08.2017,"6.899,00","6.899,00","6.800,00","6.805,85","0,15",186,"1.265.889,00","1.265.889,00",ALK,2017-08-18
21.08.2017,"6.810,00","6.810,00","6.810,00","6.810,00","0,06",36,"245.160,00","245.160,00",ALK,2017-08-21
22.08.2017,"6.810,00","6.850,00","6.810,00","6.813,57","0,05",224,"1.526.240,00","1.526.240,00",ALK,2017-08-22
23.08.2017,"6.840,00","6.840,00","6.810,00","6.817,30","0,05",300,"2.045.190,00","2.045.190,00",ALK,2017-08-23
24.08.2017,"6.810,00","6.810,00","6.810,00","6.810,00","-0,11",70,"476.700,00","476.700,00",ALK,2017-08-24
25.08.2017,"6.797,00","6.840,00","6.797,00","6.801,63","-0,12",116,"788.989,00","788.989,00",ALK,2017-08-25
29.08.2017,"6.800,00","6.800,00","6.750,00","6.782,17","-0,29",90,"610.395,00","610.395,00",ALK,2017-08-29
30.08.2017,"6.800,00","6.800,00","6.800,00","6.800,00","0,26",584,"3.971.200,00","3.971.200,00",ALK,2017-08-30
31.08.2017,"6.840,00","6.840,00","6.840,00","6.840,00","0,59",5,"34.200,00","34.200,00",ALK,2017-08-31
01.09.2017,"6.840,00","6.840,00","6.840,00","6.840,00","0,00",5,"34.200,00","34.200,00",ALK,2017-09-01
04.09.2017,"6.900,00","6.900,00","6.790,00","6.849,62","0,14",965,"6.609.887,00","6.609.887,00",ALK,2017-09-04
05.09.2017,"6.850,00","6.850,00","6.850,00","6.850,00","0,01",65,"445.250,00","445.250,00",ALK,2017-09-05
06.09.2017,"7.000,00","7.000,00","6.850,00","6.992,88","2,09",474,"3.314.627,00","3.314.627,00",ALK,2017-09-06
07.09.2017,"7.011,00","7.011,00","6.900,00","7.007,77","0,21",354,"2.480.750,00","2.480.750,00",ALK,2017-09-07
11.09.2017,"7.100,00","7.100,00","7.004,00","7.059,05","0,73",566,"3.995.422,00","3.995.422,00",ALK,2017-09-11
12.09.2017,"7.100,00","7.102,00","7.050,00","7.092,27","0,47","1,005","7.127.727,00","7.127.727,00",ALK,2017-09-12
13.09.2017,"7.101,00","7.120,00","7.100,00","7.101,01","0,12",505,"3.586.010,00","3.586.010,00",ALK,2017-09-13
14.09.2017,"7.110,00","7.111,00","7.101,00","7.110,72","0,14",283,"2.012.334,00","2.012.334,00",ALK,2017-09-14
15.09.2017,"7.103,00","7.105,00","7.101,00","7.102,16","-0,12",93,"660.501,00","660.501,00",ALK,2017-09-15
18.09.2017,"7.110,00","7.150,00","7.102,00","7.144,86","0,60",253,"1.807.649,00","1.807.649,00",ALK,2017-09-18
19.09.2017,"7.150,00","7.150,00","7.140,00","7.149,36","0,06",157,"1.122.450,00","1.122.450,00",ALK,2017-09-19
20.09.2017,"7.163,00","7.163,00","7.151,00","7.152,50","0,04",240,"1.716.600,00","1.716.600,00",ALK,2017-09-20
21.09.2017,"7.300,00","7.300,00","7.300,00","7.300,00","2,06",297,"2.168.100,00","2.168.100,00",ALK,2017-09-21
22.09.2017,"7.300,00","7.300,00","7.250,00","7.297,60","-0,03",229,"1.671.150,00","1.671.150,00",ALK,2017-09-22
25.09.2017,"7.300,00","7.303,00","7.300,00","7.300,54","0,04",532,"3.883.888,00","3.883.888,00",ALK,2017-09-25
26.09.2017,"7.400,00","7.400,00","7.303,00","7.367,59","0,92",517,"3.809.044,00","3.809.044,00",ALK,2017-09-26
27.09.2017,"7.500,00","7.519,00","7.410,00","7.495,85","1,74",579,"4.340.099,00","4.340.099,00",ALK,2017-09-27
28.09.2017,"7.600,00","7.601,00","7.600,00","7.600,42","1,40",239,"1.816.500,00","1.816.500,00",ALK,2017-09-28
29.09.2017,"7.500,00","7.550,00","7.500,00","7.537,89","-0,82",303,"2.283.981,00","2.283.981,00",ALK,2017-09-29
02.10.2017,"7.420,00","7.600,00","7.420,00","7.505,24","-0,43",345,"2.589.308,00","2.589.308,00",ALK,2017-10-02
03.10.2017,"7.285,00","7.400,00","7.285,00","7.340,18","-2,20",450,"3.303.079,00","3.303.079,00",ALK,2017-10-03
04.10.2017,"7.175,00","7.250,00","7.175,00","7.205,25","-1,84",407,"2.932.535,00","2.932.535,00",ALK,2017-10-04
05.10.2017,"7.200,00","7.200,00","7.149,00","7.153,49","-0,72","1,010","7.225.027,00","7.225.027,00",ALK,2017-10-05
06.10.2017,"7.257,00","7.300,00","7.151,00","7.256,59","1,44",339,"2.459.985,00","2.459.985,00",ALK,2017-10-06
09.10.2017,"7.300,00","7.300,00","7.260,00","7.261,29","0,06",155,"1.125.500,00","1.125.500,00",ALK,2017-10-09
10.10.2017,"7.450,00","7.500,00","7.301,00","7.458,01","2,71",229,"1.707.885,00","1.707.885,00",ALK,2017-10-10
12.10.2017,"7.450,00","7.450,00","7.450,00","7.450,00","-0,11",66,"491.700,00","491.700,00",ALK,2017-10-12
13.10.2017,"7.456,00","7.500,00","7.450,00","7.477,34","0,37",178,"1.330.966,00","1.330.966,00",ALK,2017-10-13
16.10.2017,"7.550,00","7.550,00","7.500,00","7.521,83","0,59",126,"947.750,00","947.750,00",ALK,2017-10-16
17.10.2017,"7.600,00","7.600,00","7.571,00","7.582,40","0,81",445,"3.374.170,00","3.374.170,00",ALK,2017-10-17
18.10.2017,"7.600,00","7.615,00","7.600,00","7.600,72","0,24",313,"2.379.025,00","2.379.025,00",ALK,2017-10-18
19.10.2017,"7.600,00","7.600,00","7.502,00","7.549,07","-0,68",180,"1.358.833,00","1.358.833,00",ALK,2017-10-19
20.10.2017,"7.600,00","7.600,00","7.550,00","7.595,80","0,62",268,"2.035.674,00","2.035.674,00",ALK,2017-10-20
24.10.2017,"7.550,00","7.550,00","7.550,00","7.550,00","-0,60",57,"430.350,00","430.350,00",ALK,2017-10-24
25.10.2017,"7.325,00","7.325,00","7.325,00","7.325,00","-2,98",2,"14.650,00","14.650,00",ALK,2017-10-25
26.10.2017,"7.400,00","7.450,00","7.324,00","7.362,82","0,52",39,"287.150,00","287.150,00",ALK,2017-10-26
27.10.2017,"7.499,00","7.499,00","7.499,00","7.499,00","1,85",50,"374.950,00","374.950,00",ALK,2017-10-27
30.10.2017,"7.401,00","7.499,00","7.400,00","7.460,60","-0,51",85,"634.151,00","634.151,00",ALK,2017-10-30
31.10.2017,"7.480,00","7.499,00","7.402,00","7.481,79","0,28",248,"1.855.483,00","1.855.483,00",ALK,2017-10-31
01.11.2017,"7.450,00","7.450,00","7.403,00","7.431,20","-0,68",15,"111.468,00","111.468,00",ALK,2017-11-01
02.11.2017,"7.500,00","7.500,00","7.498,00","7.499,43","0,92",401,"3.007.272,00","3.007.272,00",ALK,2017-11-02
03.11.2017,"7.500,00","7.500,00","7.500,00","7.500,00","0,01",117,"877.500,00","877.500,00",ALK,2017-11-03
06.11.2017,"7.450,00","7.450,00","7.402,00","7.441,27","-0,78",11,"81.854,00","81.854,00",ALK,2017-11-06
07.11.2017,"7.402,00","7.450,00","7.402,00","7.441,95","0,01",37,"275.352,00","275.352,00",ALK,2017-11-07
08.11.2017,"7.430,00","7.450,00","7.430,00","7.441,41","-0,01",92,"684.610,00","684.610,00",ALK,2017-11-08
09.11.2017,"7.402,00","7.430,00","7.402,00","7.418,16","-0,31",25,"185.454,00","185.454,00",ALK,2017-11-09
10.11.2017,"7.402,00","7.430,00","7.402,00","7.421,91","0,05",90,"667.972,00","667.972,00",ALK,2017-11-10
13.11.2017,"7.450,00","7.450,00","7.410,00","7.420,54","-0,02",127,"942.408,00","942.408,00",ALK,2017-11-13
14.11.2017,"7.404,00","7.404,00","7.402,00","7.402,71","-0,24",42,"310.914,00","310.914,00",ALK,2017-11-14
15.11.2017,"7.400,00","7.450,00","7.400,00","7.438,41","0,48",82,"609.950,00","609.950,00",ALK,2017-11-15
16.11.2017,"7.401,00","7.401,00","7.401,00","7.401,00","-0,50",10,"74.010,00","74.010,00",ALK,2017-11-16
17.11.2017,"7.410,00","7.410,00","7.400,00","7.409,18","0,11",159,"1.178.060,00","1.178.060,00",ALK,2017-11-17
20.11.2017,"7.350,00","7.400,00","7.350,00","7.387,50","-0,29",44,"325.050,00","325.050,00",ALK,2017-11-20
21.11.2017,"7.350,00","7.350,00","7.350,00","7.350,00","-0,51",7,"51.450,00","51.450,00",ALK,2017-11-21
22.11.2017,"7.250,00","7.280,00","7.200,00","7.231,17","-1,62",130,"940.052,00","940.052,00",ALK,2017-11-22
23.11.2017,"7.350,00","7.350,00","7.350,00","7.350,00","1,64",2,"14.700,00","14.700,00",ALK,2017-11-23
24.11.2017,"7.250,00","7.350,00","7.202,00","7.277,39","-0,99",46,"334.760,00","334.760,00",ALK,2017-11-24
27.11.2017,"7.250,00","7.250,00","7.250,00","7.250,00","-0,38",42,"304.500,00","304.500,00",ALK,2017-11-27
28.11.2017,"7.350,00","7.350,00","7.250,00","7.308,05","0,80",118,"862.350,00","862.350,00",ALK,2017-11-28
29.11.2017,"7.302,00","7.302,00","7.302,00","7.302,00","-0,08",115,"839.730,00","839.730,00",ALK,2017-11-29
30.11.2017,"7.300,00","7.350,00","7.300,00","7.307,37","0,07",93,"679.585,00","679.585,00",ALK,2017-11-30
01.12.2017,"7.351,00","7.352,00","7.350,00","7.350,32","0,59",40,"294.013,00","294.013,00",ALK,2017-12-01
04.12.2017,"7.351,00","7.400,00","7.351,00","7.352,44","0,03",263,"1.933.691,00","1.933.691,00",ALK,2017-12-04
05.12.2017,"7.351,00","7.370,00","7.351,00","7.356,75","0,06",85,"625.324,00","625.324,00",ALK,2017-12-05
06.12.2017,"7.300,00","7.351,00","7.300,00","7.322,16","-0,47",241,"1.764.640,00","1.764.640,00",ALK,2017-12-06
11.12.2017,"7.300,00","7.320,00","7.300,00","7.301,12","-0,29",89,"649.800,00","649.800,00",ALK,2017-12-11
12.12.2017,"7.301,00","7.350,00","7.300,00","7.302,00","0,01",151,"1.102.602,00","1.102.602,00",ALK,2017-12-12
13.12.2017,"7.350,00","7.350,00","7.301,00","7.308,06","0,08",313,"2.287.423,00","2.287.423,00",ALK,2017-12-13
14.12.2017,"7.302,00","7.350,00","7.301,00","7.304,74","-0,05",159,"1.161.454,00","1.161.454,00",ALK,2017-12-14
15.12.2017,"7.320,00","7.320,00","7.300,00","7.304,71","0,00",85,"620.900,00","620.900,00",ALK,2017-12-15
18.12.2017,"7.300,00","7.300,00","7.300,00","7.300,00","-0,06",117,"854.100,00","854.100,00",ALK,2017-12-18
19.12.2017,"7.300,00","7.300,00","7.300,00","7.300,00","0,00",43,"313.900,00","313.900,00",ALK,2017-12-19
20.12.2017,"7.300,00","7.301,00","7.300,00","7.300,04","0,00",50,"365.002,00","365.002,00",ALK,2017-12-20
21.12.2017,"7.300,00","7.300,00","7.300,00","7.300,00","0,00",44,"321.200,00","321.200,00",ALK,2017-12-21
22.12.2017,"7.320,00","7.320,00","7.302,00","7.304,65","0,06","1,078","7.874.415,00","7.874.415,00",ALK,2017-12-22
25.12.2017,"7.350,00","7.350,00","7.320,00","7.349,53","0,61",127,"933.390,00","933.390,00",ALK,2017-12-25
26.12.2017,"7.362,00","7.400,00","7.350,00","7.373,77","0,33",61,"449.800,00","449.800,00",ALK,2017-12-26
27.12.2017,"7.363,00","7.400,00","7.363,00","7.381,03","0,10",39,"287.860,00","287.860,00",ALK,2017-12-27
28.12.2017,"7.500,00","7.500,00","7.401,00","7.496,80","1,57",229,"1.716.767,00","1.716.767,00",ALK,2017-12-28
02.01.2018,"7.500,00","7.500,00","7.400,00","7.476,70","-0,27",30,"224.301,00","224.301,00",ALK,2018-01-02
03.01.2018,"7.500,00","7.500,00","7.401,00","7.496,19","0,26",52,"389.802,00","389.802,00",ALK,2018-01-03
04.01.2018,"7.500,00","7.500,00","7.450,00","7.491,64","-0,06",118,"884.013,00","884.013,00",ALK,2018-01-04
05.01.2018,"7.600,00","7.600,00","7.600,00","7.600,00","1,45",72,"547.200,00","547.200,00",ALK,2018-01-05
09.01.2018,"7.500,00","7.650,00","7.500,00","7.608,55","0,11",179,"1.361.930,00","1.361.930,00",ALK,2018-01-09
10.01.2018,"7.600,00","7.651,00","7.600,00","7.645,09","0,48","1,040","7.950.893,00","7.950.893,00",ALK,2018-01-10
11.01.2018,"7.650,00","7.650,00","7.600,00","7.617,96","-0,35",307,"2.338.714,00","2.338.714,00",ALK,2018-01-11
12.01.2018,"7.605,00","7.650,00","7.605,00","7.646,97","0,38",178,"1.361.160,00","1.361.160,00",ALK,2018-01-12
15.01.2018,"7.605,00","7.650,00","7.605,00","7.649,31","0,03",65,"497.205,00","497.205,00",ALK,2018-01-15
16.01.2018,"7.690,00","7.690,00","7.605,00","7.666,52","0,22",141,"1.080.980,00","1.080.980,00",ALK,2018-01-16
17.01.2018,"7.750,00","7.750,00","7.610,00","7.648,33","-0,24",300,"2.294.500,00","2.294.500,00",ALK,2018-01-17
18.01.2018,"7.650,00","7.650,00","7.650,00","7.650,00","0,02",2,"15.300,00","15.300,00",ALK,2018-01-18
22.01.2018,"7.700,00","7.700,00","7.640,00","7.698,52","0,63",976,"7.513.760,00","7.513.760,00",ALK,2018-01-22
23.01.2018,"7.750,00","7.750,00","7.700,00","7.707,16","0,11",412,"3.175.350,00","3.175.350,00",ALK,2018-01-23
24.01.2018,"7.900,00","7.900,00","7.750,00","7.803,39","1,25",192,"1.498.250,00","1.498.250,00",ALK,2018-01-24
25.01.2018,"8.000,00","8.000,00","7.901,00","7.981,87","2,29",486,"3.879.188,00","3.879.188,00",ALK,2018-01-25
26.01.2018,"8.200,00","8.200,00","8.050,00","8.081,58","1,25",38,"307.100,00","307.100,00",ALK,2018-01-26
29.01.2018,"8.200,00","8.200,00","8.101,00","8.197,92","1,44",143,"1.172.303,00","1.172.303,00",ALK,2018-01-29
30.01.2018,"8.290,00","8.290,00","8.280,00","8.289,42","1,12",243,"2.014.328,00","2.014.328,00",ALK,2018-01-30
31.01.2018,"8.290,00","8.299,00","8.290,00","8.293,30","0,05",79,"655.171,00","655.171,00",ALK,2018-01-31
01.02.2018,"8.320,00","8.365,00","8.301,00","8.333,47","0,48",239,"1.991.700,00","1.991.700,00",ALK,2018-02-01
02.02.2018,"8.310,00","8.311,00","8.310,00","8.310,16","-0,28",107,"889.187,00","889.187,00",ALK,2018-02-02
05.02.2018,"8.310,00","8.400,00","8.310,00","8.388,70","0,95",115,"964.700,00","964.700,00",ALK,2018-02-05
06.02.2018,"8.200,00","8.280,00","8.200,00","8.208,91","-2,14",171,"1.403.724,00","1.403.724,00",ALK,2018-02-06
07.02.2018,"8.000,00","8.100,00","8.000,00","8.006,02","-2,47",764,"6.116.596,00","7.724.596,00",ALK,2018-02-07
08.02.2018,"8.003,00","8.003,00","8.000,00","8.000,78","-0,07",327,"2.616.255,00","2.616.255,00",ALK,2018-02-08
09.02.2018,"8.001,00","8.007,00","8.000,00","8.002,16","0,02",292,"2.336.631,00","2.336.631,00",ALK,2018-02-09
12.02.2018,"8.000,00","8.001,00","8.000,00","8.000,28","-0,02",180,"1.440.050,00","1.440.050,00",ALK,2018-02-12
13.02.2018,"8.100,00","8.100,00","8.090,00","8.099,25","1,24",265,"2.146.300,00","2.146.300,00",ALK,2018-02-13
14.02.2018,"8.003,00","8.004,00","8.000,00","8.001,63","-1,21",753,"6.025.227,00","6.025.227,00",ALK,2018-02-14
15.02.2018,"7.999,00","8.002,00","7.999,00","8.001,20","-0,01",140,"1.120.168,00","1.120.168,00",ALK,2018-02-15
16.02.2018,"7.999,00","7.999,00","7.998,00","7.998,40","-0,03",50,"399.920,00","399.920,00",ALK,2018-02-16
19.02.2018,"7.900,00","7.998,00","7.900,00","7.932,13","-0,83",61,"483.860,00","483.860,00",ALK,2018-02-19
20.02.2018,"7.800,00","7.900,00","7.800,00","7.801,99","-1,64",233,"1.817.864,00","1.817.864,00",ALK,2018-02-20
21.02.2018,"7.750,00","7.750,00","7.750,00","7.750,00","-0,67",4,"31.000,00","31.000,00",ALK,2018-02-21
22.02.2018,"7.900,00","7.900,00","7.800,00","7.888,38","1,79",37,"291.870,00","291.870,00",ALK,2018-02-22
23.02.2018,"7.900,00","8.000,00","7.900,00","7.926,24","0,48",204,"1.616.953,00","1.616.953,00",ALK,2018-02-23
26.02.2018,"7.999,00","7.999,00","7.999,00","7.999,00","0,92",6,"47.994,00","47.994,00",ALK,2018-02-26
27.02.2018,"8.100,00","8.100,00","7.999,00","8.027,84","0,36",102,"818.840,00","818.840,00",ALK,2018-02-27
28.02.2018,"8.200,00","8.200,00","8.000,00","8.107,41","0,99",135,"1.094.500,00","1.094.500,00",ALK,2018-02-28
01.03.2018,"8.300,00","8.300,00","8.250,00","8.284,30","2,18",86,"712.450,00","712.450,00",ALK,2018-03-01
02.03.2018,"8.102,00","8.302,00","8.102,00","8.292,20","0,10",233,"1.932.082,00","1.932.082,00",ALK,2018-03-02
05.03.2018,"8.100,00","8.200,00","8.100,00","8.109,09","-2,21",11,"89.200,00","89.200,00",ALK,2018-03-05
06.03.2018,"7.960,00","8.098,00","7.960,00","8.001,10","-1,33",142,"1.136.156,00","1.136.156,00",ALK,2018-03-06
07.03.2018,"8.000,00","8.002,00","8.000,00","8.000,95","0,00",99,"792.094,00","792.094,00",ALK,2018-03-07
08.03.2018,"8.000,00","8.100,00","8.000,00","8.085,80","1,06",88,"711.550,00","711.550,00",ALK,2018-03-08
09.03.2018,"8.000,00","8.000,00","8.000,00","8.000,00","-1,06",92,"736.000,00","736.000,00",ALK,2018-03-09
12.03.2018,"8.000,00","8.000,00","8.000,00","8.000,00","0,00",6,"48.000,00","48.000,00",ALK,2018-03-12
14.03.2018,"8.100,00","8.100,00","8.099,00","8.099,61","1,25",77,"623.670,00","623.670,00",ALK,2018-03-14
16.03.2018,"8.000,00","8.001,00","8.000,00","8.000,06","-1,23",120,"960.007,00","960.007,00",ALK,2018-03-16
20.03.2018,"8.000,00","8.049,00","8.000,00","8.027,31","0,34",121,"971.305,00","971.305,00",ALK,2018-03-20
21.03.2018,"7.910,00","7.910,00","7.910,00","7.910,00","-1,46",1,"7.910,00","7.910,00",ALK,2018-03-21
22.03.2018,"8.000,00","8.000,00","7.950,00","7.990,41","1,02",148,"1.182.580,00","1.182.580,00",ALK,2018-03-22
23.03.2018,"7.950,00","7.950,00","7.920,00","7.945,65","-0,56",131,"1.040.880,00","1.040.880,00",ALK,2018-03-23
26.03.2018,"7.999,00","7.999,00","7.950,00","7.967,21","0,27",240,"1.912.130,00","1.912.130,00",ALK,2018-03-26
27.03.2018,"7.968,00","7.970,00","7.912,00","7.945,49","-0,27",91,"723.040,00","723.040,00",ALK,2018-03-27
28.03.2018,"7.999,00","7.999,00","7.967,00","7.974,41","0,36",210,"1.674.627,00","1.674.627,00",ALK,2018-03-28
29.03.2018,"7.960,00","7.960,00","7.940,00","7.949,47","-0,31",95,"755.200,00","755.200,00",ALK,2018-03-29
30.03.2018,"7.910,00","7.999,00","7.910,00","7.943,62","-0,07",73,"579.884,00","579.884,00",ALK,2018-03-30
02.04.2018,"7.900,00","7.940,00","7.900,00","7.909,87","-0,42",151,"1.194.390,00","1.194.390,00",ALK,2018-04-02
03.04.2018,"7.940,00","7.949,00","7.921,00","7.932,49","0,29",185,"1.467.510,00","1.467.510,00",ALK,2018-04-03
04.04.2018,"7.998,00","7.999,00","7.920,00","7.967,17","0,44",679,"5.409.708,00","5.409.708,00",ALK,2018-04-04
05.04.2018,"8.050,00","8.050,00","8.001,00","8.024,08","0,71",215,"1.725.178,00","1.725.178,00",ALK,2018-04-05
10.04.2018,"8.050,00","8.050,00","8.050,00","8.050,00","0,32",103,"829.150,00","829.150,00",ALK,2018-04-10
11.04.2018,"8.000,00","8.050,00","8.000,00","8.012,35","-0,47",433,"3.469.349,00","3.469.349,00",ALK,2018-04-11
12.04.2018,"7.950,00","7.950,00","7.950,00","7.950,00","-0,78",148,"1.176.600,00","1.176.600,00",ALK,2018-04-12
13.04.2018,"7.999,00","7.999,00","7.998,00","7.998,62","0,61",126,"1.007.826,00","1.007.826,00",ALK,2018-04-13
16.04.2018,"7.950,00","7.998,00","7.950,00","7.966,51","-0,40",310,"2.469.617,00","2.469.617,00",ALK,2018-04-16
17.04.2018,"7.900,00","7.950,00","7.900,00","7.941,40","-0,32",378,"3.001.850,00","3.001.850,00",ALK,2018-04-17
18.04.2018,"7.704,00","7.800,00","7.704,00","7.730,93","-2,65",105,"811.748,00","811.748,00",ALK,2018-04-18
19.04.2018,"7.726,00","7.730,00","7.670,00","7.727,73","-0,04",153,"1.182.342,00","1.182.342,00",ALK,2018-04-19
20.04.2018,"7.711,00","7.711,00","7.711,00","7.711,00","-0,22",34,"262.174,00","262.174,00",ALK,2018-04-20
23.04.2018,"7.800,00","7.800,00","7.760,00","7.792,94","1,06",34,"264.960,00","264.960,00",ALK,2018-04-23
24.04.2018,"7.950,00","7.950,00","7.810,00","7.928,46","1,74",65,"515.350,00","515.350,00",ALK,2018-04-24
25.04.2018,"7.950,00","7.950,00","7.949,00","7.949,70","0,27",412,"3.275.275,00","3.275.275,00",ALK,2018-04-25
26.04.2018,"7.949,00","7.950,00","7.948,00","7.948,61","-0,01",76,"604.094,00","604.094,00",ALK,2018-04-26
27.04.2018,"7.946,00","7.947,00","7.946,00","7.946,88","-0,02",24,"190.725,00","190.725,00",ALK,2018-04-27
30.04.2018,"7.950,00","7.950,00","7.945,00","7.948,02","0,01",252,"2.002.900,00","2.002.900,00",ALK,2018-04-30
02.05.2018,"8.000,00","8.000,00","7.949,00","7.956,45","0,11",327,"2.601.759,00","2.601.759,00",ALK,2018-05-02
04.05.2018,"7.948,00","7.948,00","7.900,00","7.941,60","-0,19",15,"119.124,00","119.124,00",ALK,2018-05-04
07.05.2018,"7.855,00","7.899,00","7.855,00","7.856,84","-1,07",50,"392.842,00","392.842,00",ALK,2018-05-07
08.05.2018,"7.830,00","7.852,00","7.830,00","7.836,85","-0,25",241,"1.888.682,00","1.888.682,00",ALK,2018-05-08
09.05.2018,"7.830,00","7.830,00","7.830,00","7.830,00","-0,09",349,"2.732.670,00","2.732.670,00",ALK,2018-05-09
10.05.2018,"7.800,00","7.840,00","7.799,00","7.802,99","-0,34",308,"2.403.320,00","2.403.320,00",ALK,2018-05-10
11.05.2018,"7.850,00","7.850,00","7.790,00","7.807,12","0,05",310,"2.420.207,00","2.420.207,00",ALK,2018-05-11
14.05.2018,"7.996,00","7.996,00","7.802,00","7.938,02","1,68",890,"7.064.841,00","7.064.841,00",ALK,2018-05-14
15.05.2018,"8.050,00","8.050,00","7.971,00","7.997,85","0,75",350,"2.799.248,00","2.799.248,00",ALK,2018-05-15
16.05.2018,"8.005,00","8.005,00","8.001,00","8.004,29","0,08",68,"544.292,00","544.292,00",ALK,2018-05-16
17.05.2018,"8.000,00","8.101,00","8.000,00","8.074,99","0,88",469,"3.787.168,00","3.787.168,00",ALK,2018-05-17
18.05.2018,"8.100,00","8.100,00","8.000,00","8.098,79","0,29","3,162","25.608.380,00","25.608.380,00",ALK,2018-05-18
21.05.2018,"8.050,00","8.099,00","8.050,00","8.079,77","-0,23",159,"1.284.683,00","1.284.683,00",ALK,2018-05-21
22.05.2018,"7.900,00","8.000,00","7.900,00","7.923,39","-1,94",408,"3.232.745,00","3.232.745,00",ALK,2018-05-22
23.05.2018,"7.900,00","7.948,00","7.850,00","7.872,21","-0,65",154,"1.212.320,00","1.212.320,00",ALK,2018-05-23
28.05.2018,"7.900,00","7.900,00","7.900,00","7.900,00","0,35",130,"1.027.000,00","1.027.000,00",ALK,2018-05-28
29.05.2018,"7.902,00","7.903,00","7.900,00","7.901,97","0,02",73,"576.844,00","576.844,00",ALK,2018-05-29
30.05.2018,"7.950,00","7.951,00","7.950,00","7.950,05","0,61",396,"3.148.219,00","3.148.219,00",ALK,2018-05-30
31.05.2018,"8.000,00","8.000,00","7.951,00","7.998,87","0,61",968,"7.742.902,00","7.742.902,00",ALK,2018-05-31
01.06.2018,"8.100,00","8.101,00","8.002,00","8.097,85","1,24","6,577","53.259.547,00","53.259.547,00",ALK,2018-06-01
04.06.2018,"8.100,00","8.100,00","8.000,00","8.095,10","-0,03",718,"5.812.280,00","5.812.280,00",ALK,2018-06-04
05.06.2018,"8.100,00","8.100,00","8.099,00","8.100,00","0,06","7,909","64.062.870,00","64.062.870,00",ALK,2018-06-05
06.06.2018,"8.150,00","8.150,00","8.100,00","8.135,56","0,44",180,"1.464.400,00","1.464.400,00",ALK,2018-06-06
07.06.2018,"8.199,00","8.199,00","8.130,00","8.174,80","0,48",270,"2.207.195,00","2.207.195,00",ALK,2018-06-07
08.06.2018,"8.150,00","8.200,00","8.150,00","8.197,19","0,27",160,"1.311.550,00","1.311.550,00",ALK,2018-06-08
11.06.2018,"8.200,00","8.200,00","8.150,00","8.196,35","-0,01",371,"3.040.847,00","3.040.847,00",ALK,2018-06-11
12.06.2018,"8.200,00","8.200,00","8.152,00","8.194,05","-0,03",122,"999.674,00","999.674,00",ALK,2018-06-12
13.06.2018,"8.200,00","8.200,00","8.200,00","8.200,00","0,07",363,"2.976.600,00","2.976.600,00",ALK,2018-06-13
14.06.2018,"8.250,00","8.251,00","8.250,00","8.250,25","0,61",377,"3.110.346,00","3.110.346,00",ALK,2018-06-14
18.06.2018,"8.300,00","8.300,00","8.270,00","8.296,78","0,56",299,"2.480.738,00","2.480.738,00",ALK,2018-06-18
19.06.2018,"8.300,00","8.300,00","8.300,00","8.300,00","0,04",428,"3.552.400,00","3.552.400,00",ALK,2018-06-19
20.06.2018,"8.200,00","8.300,00","8.200,00","8.299,13","-0,01",230,"1.908.800,00","1.908.800,00",ALK,2018-06-20
21.06.2018,"8.300,00","8.301,00","8.300,00","8.300,03","0,01",374,"3.104.210,00","3.104.210,00",ALK,2018-06-21
22.06.2018,"8.400,00","8.400,00","8.300,00","8.331,04","0,37",260,"2.166.071,00","2.166.071,00",ALK,2018-06-22
25.06.2018,"8.399,00","8.399,00","8.301,00","8.323,24","-0,09",85,"707.475,00","707.475,00",ALK,2018-06-25
26.06.2018,"8.200,00","8.327,00","8.200,00","8.256,90","-0,80",461,"3.806.430,00","3.806.430,00",ALK,2018-06-26
27.06.2018,"8.150,00","8.200,00","8.150,00","8.182,39","-0,90",284,"2.323.800,00","2.323.800,00",ALK,2018-06-27
28.06.2018,"8.120,00","8.150,00","8.100,00","8.119,22","-0,77",332,"2.695.580,00","2.695.580,00",ALK,2018-06-28
29.06.2018,"8.200,00","8.200,00","8.120,00","8.197,46","0,96",315,"2.582.200,00","2.582.200,00",ALK,2018-06-29
02.07.2018,"8.200,00","8.200,00","8.200,00","8.200,00","0,03",432,"3.542.400,00","3.542.400,00",ALK,2018-07-02
03.07.2018,"8.200,00","8.200,00","8.200,00","8.200,00","0,00",447,"3.665.400,00","3.665.400,00",ALK,2018-07-03
04.07.2018,"8.199,00","8.200,00","8.151,00","8.198,21","-0,02",340,"2.787.390,00","2.787.390,00",ALK,2018-07-04
05.07.2018,"8.100,00","8.200,00","8.100,00","8.103,76","-1,15",291,"2.358.195,00","2.358.195,00",ALK,2018-07-05
06.07.2018,"8.149,00","8.149,00","8.100,00","8.131,42","0,34",238,"1.935.278,00","1.935.278,00",ALK,2018-07-06
09.07.2018,"8.200,00","8.200,00","8.118,00","8.180,06","0,60",127,"1.038.868,00","1.038.868,00",ALK,2018-07-09
10.07.2018,"8.200,00","8.200,00","8.200,00","8.200,00","0,24",456,"3.739.200,00","3.739.200,00",ALK,2018-07-10
11.07.2018,"8.200,00","8.200,00","8.200,00","8.200,00","0,00",160,"1.312.000,00","1.312.000,00",ALK,2018-07-11
12.07.2018,"8.200,00","8.200,00","8.180,00","8.187,87","-0,15",61,"499.460,00","499.460,00",ALK,2018-07-12
13.07.2018,"8.100,00","8.100,00","8.022,00","8.098,92","-1,09",504,"4.081.854,00","4.081.854,00",ALK,2018-07-13
16.07.2018,"8.033,00","8.100,00","8.021,00","8.084,47","-0,18",47,"379.970,00","379.970,00",ALK,2018-07-16
17.07.2018,"8.033,00","8.034,00","8.000,00","8.017,33","-0,83",153,"1.226.651,00","1.226.651,00",ALK,2018-07-17
18.07.2018,"8.050,00","8.050,00","8.000,00","8.022,86","0,07",70,"561.600,00","561.600,00",ALK,2018-07-18
19.07.2018,"8.011,00","8.030,00","8.011,00","8.012,39","-0,13",90,"721.115,00","721.115,00",ALK,2018-07-19
20.07.2018,"8.000,00","8.001,00","8.000,00","8.000,45","-0,15",55,"440.025,00","440.025,00",ALK,2018-07-20
23.07.2018,"8.059,00","8.059,00","8.005,00","8.025,60","0,31",160,"1.284.096,00","1.284.096,00",ALK,2018-07-23
24.07.2018,"8.031,00","8.059,00","8.000,00","8.032,76","0,09",131,"1.052.291,00","1.052.291,00",ALK,2018-07-24
25.07.2018,"8.099,00","8.099,00","8.040,00","8.064,68","0,40",78,"629.045,00","629.045,00",ALK,2018-07-25
26.07.2018,"8.045,00","8.080,00","8.045,00","8.059,28","-0,07",167,"1.345.900,00","1.345.900,00",ALK,2018-07-26
27.07.2018,"8.100,00","8.100,00","8.055,00","8.095,03","0,44",323,"2.614.695,00","2.614.695,00",ALK,2018-07-27
30.07.2018,"8.100,00","8.100,00","8.100,00","8.100,00","0,06",83,"672.300,00","672.300,00",ALK,2018-07-30
31.07.2018,"8.150,00","8.190,00","8.100,00","8.135,00","0,43",20,"162.700,00","162.700,00",ALK,2018-07-31
01.08.2018,"8.149,00","8.160,00","8.100,00","8.146,67","0,14",42,"342.160,00","342.160,00",ALK,2018-08-01
03.08.2018,"8.100,00","8.149,00","8.100,00","8.111,36","-0,43",56,"454.236,00","454.236,00",ALK,2018-08-03
06.08.2018,"8.010,00","8.098,00","8.010,00","8.096,36","-0,18",73,"591.034,00","591.034,00",ALK,2018-08-06
07.08.2018,"8.089,00","8.089,00","8.089,00","8.089,00","-0,09",2,"16.178,00","16.178,00",ALK,2018-08-07
08.08.2018,"8.100,00","8.100,00","8.000,00","8.091,73","0,03",390,"3.155.776,00","3.155.776,00",ALK,2018-08-08
09.08.2018,"8.050,00","8.050,00","8.050,00","8.050,00","-0,52",30,"241.500,00","241.500,00",ALK,2018-08-09
10.08.2018,"8.000,00","8.001,00","8.000,00","8.000,32","-0,62",190,"1.520.060,00","1.520.060,00",ALK,2018-08-10
13.08.2018,"8.000,00","8.000,00","8.000,00","8.000,00","0,00",104,"832.000,00","832.000,00",ALK,2018-08-13
14.08.2018,"8.000,00","8.050,00","8.000,00","8.022,39","0,28",67,"537.500,00","537.500,00",ALK,2018-08-14
15.08.2018,"8.049,00","8.049,00","8.049,00","8.049,00","0,33",40,"321.960,00","321.960,00",ALK,2018-08-15
16.08.2018,"8.000,00","8.000,00","8.000,00","8.000,00","-0,61",64,"512.000,00","512.000,00",ALK,2018-08-16
17.08.2018,"7.999,00","7.999,00","7.950,00","7.956,45","-0,54",31,"246.650,00","246.650,00",ALK,2018-08-17
21.08.2018,"7.900,00","7.950,00","7.900,00","7.906,78","-0,62",507,"4.008.735,00","4.008.735,00",ALK,2018-08-21
22.08.2018,"7.951,00","7.999,00","7.950,00","7.970,76","0,81",210,"1.673.860,00","1.673.860,00",ALK,2018-08-22
23.08.2018,"7.998,00","7.998,00","7.901,00","7.991,07","0,25",14,"111.875,00","111.875,00",ALK,2018-08-23
24.08.2018,"7.901,00","7.905,00","7.900,00","7.901,09","-1,13",793,"6.265.562,00","6.265.562,00",ALK,2018-08-24
27.08.2018,"7.950,00","7.950,00","7.901,00","7.926,67","0,32",84,"665.840,00","665.840,00",ALK,2018-08-27
29.08.2018,"7.900,00","7.920,00","7.900,00","7.905,47","-0,27",139,"1.098.860,00","1.098.860,00",ALK,2018-08-29
30.08.2018,"7.900,00","7.950,00","7.900,00","7.913,02","0,10",192,"1.519.300,00","1.519.300,00",ALK,2018-08-30
31.08.2018,"7.990,00","7.990,00","7.902,00","7.937,60","0,31",100,"793.760,00","793.760,00",ALK,2018-08-31
03.09.2018,"7.901,00","7.999,00","7.901,00","7.938,01","0,01",135,"1.071.632,00","1.071.632,00",ALK,2018-09-03
04.09.2018,"8.050,00","8.050,00","7.950,00","7.999,10","0,77",518,"4.143.534,00","4.143.534,00",ALK,2018-09-04
05.09.2018,"8.000,00","8.000,00","8.000,00","8.000,00","0,01",109,"872.000,00","872.000,00",ALK,2018-09-05
06.09.2018,"8.000,00","8.050,00","7.905,00","8.029,67","0,37",458,"3.677.591,00","3.677.591,00",ALK,2018-09-06
07.09.2018,"8.001,00","8.099,00","8.001,00","8.077,60","0,60",215,"1.736.683,00","1.736.683,00",ALK,2018-09-07
10.09.2018,"8.050,00","8.050,00","8.001,00","8.045,55","-0,40",11,"88.501,00","88.501,00",ALK,2018-09-10
11.09.2018,"8.000,00","8.000,00","8.000,00","8.000,00","-0,57",25,"200.000,00","200.000,00",ALK,2018-09-11
12.09.2018,"8.050,00","8.050,00","7.999,00","8.018,11","0,23",140,"1.122.535,00","1.122.535,00",ALK,2018-09-12
13.09.2018,"8.004,00","8.052,00","8.004,00","8.047,66","0,37",238,"1.915.342,00","1.915.342,00",ALK,2018-09-13
14.09.2018,"8.000,00","8.079,00","8.000,00","8.017,65","-0,37",85,"681.500,00","681.500,00",ALK,2018-09-14
17.09.2018,"8.000,00","8.000,00","8.000,00","8.000,00","-0,22",86,"688.000,00","688.000,00",ALK,2018-09-17
18.09.2018,"8.000,00","8.001,00","8.000,00","8.000,05","0,00",213,"1.704.010,00","1.704.010,00",ALK,2018-09-18
19.09.2018,"8.005,00","8.015,00","8.005,00","8.006,69","0,08",180,"1.441.204,00","1.441.204,00",ALK,2018-09-19
20.09.2018,"8.035,00","8.040,00","8.000,00","8.003,87","-0,04",106,"848.410,00","848.410,00",ALK,2018-09-20
21.09.2018,"8.001,00","8.001,00","8.001,00","8.001,00","-0,04",86,"688.086,00","688.086,00",ALK,2018-09-21
24.09.2018,"8.010,00","8.014,00","8.002,00","8.011,26","0,13",305,"2.443.433,00","2.443.433,00",ALK,2018-09-24
25.09.2018,"8.099,00","8.099,00","8.004,00","8.056,24","0,56",72,"580.049,00","580.049,00",ALK,2018-09-25
26.09.2018,"8.200,00","8.200,00","8.100,00","8.160,67","1,30",652,"5.320.760,00","5.320.760,00",ALK,2018-09-26
27.09.2018,"8.301,00","8.302,00","8.200,00","8.262,64","1,25",308,"2.544.892,00","2.544.892,00",ALK,2018-09-27
28.09.2018,"8.355,00","8.450,00","8.301,00","8.352,34","1,09",158,"1.319.669,00","1.319.669,00",ALK,2018-09-28
01.10.2018,"8.100,00","8.106,00","8.011,00","8.088,99","-3,15",627,"5.071.799,00","5.071.799,00",ALK,2018-10-01
02.10.2018,"8.105,00","8.200,00","8.101,00","8.109,63","0,26",70,"567.674,00","567.674,00",ALK,2018-10-02
03.10.2018,"8.050,00","8.105,00","8.050,00","8.094,73","-0,18",294,"2.379.851,00","2.379.851,00",ALK,2018-10-03
04.10.2018,"8.006,00","8.050,00","8.003,00","8.016,69","-0,96","1,014","8.128.921,00","8.128.921,00",ALK,2018-10-04
05.10.2018,"7.990,00","7.990,00","7.900,00","7.902,79","-1,42","1,099","8.685.171,00","8.685.171,00",ALK,2018-10-05
08.10.2018,"7.900,00","7.900,00","7.720,00","7.847,37","-0,70",513,"4.025.700,00","4.025.700,00",ALK,2018-10-08
09.10.2018,"8.100,00","8.100,00","7.950,00","7.959,69","1,43",129,"1.026.800,00","1.026.800,00",ALK,2018-10-09
10.10.2018,"8.011,00","8.011,00","8.000,00","8.005,86","0,58",527,"4.219.090,00","4.219.090,00",ALK,2018-10-10
12.10.2018,"8.001,00","8.001,00","8.000,00","8.000,02","-0,07",457,"3.656.011,00","3.656.011,00",ALK,2018-10-12
15.10.2018,"7.900,00","8.000,00","7.900,00","7.932,53","-0,84",79,"626.670,00","626.670,00",ALK,2018-10-15
16.10.2018,"8.000,00","8.000,00","7.900,00","7.973,63","0,52",201,"1.602.699,00","1.602.699,00",ALK,2018-10-16
17.10.2018,"8.005,00","8.005,00","8.000,00","8.000,71","0,34",136,"1.088.096,00","1.088.096,00",ALK,2018-10-17
18.10.2018,"8.055,00","8.079,00","8.050,00","8.050,94","0,63",928,"7.471.269,00","7.471.269,00",ALK,2018-10-18
19.10.2018,"8.200,00","8.200,00","8.052,00","8.129,21","0,97",185,"1.503.904,00","1.503.904,00",ALK,2018-10-19
22.10.2018,"8.599,00","8.629,00","8.351,00","8.526,54","4,89",872,"7.435.144,00","7.435.144,00",ALK,2018-10-22
24.10.2018,"8.400,00","8.403,00","8.353,00","8.400,78","-1,47",221,"1.856.573,00","1.856.573,00",ALK,2018-10-24
25.10.2018,"8.300,00","8.400,00","8.300,00","8.350,00","-0,60",374,"3.122.900,00","3.122.900,00",ALK,2018-10-25
26.10.2018,"8.250,00","8.250,00","8.220,00","8.235,00","-1,38",10,"82.350,00","82.350,00",ALK,2018-10-26
29.10.2018,"8.300,00","8.300,00","8.300,00","8.300,00","0,79",107,"888.100,00","888.100,00",ALK,2018-10-29
30.10.2018,"8.300,00","8.329,00","8.201,00","8.303,58","0,04",119,"988.126,00","988.126,00",ALK,2018-10-30
31.10.2018,"8.349,00","8.350,00","8.250,00","8.298,24","-0,06",255,"2.116.051,00","2.116.051,00",ALK,2018-10-31
01.11.2018,"8.350,00","8.350,00","8.301,00","8.306,63","0,10",198,"1.644.712,00","1.644.712,00",ALK,2018-11-01
02.11.2018,"8.325,00","8.350,00","8.300,00","8.319,79","0,16",145,"1.206.370,00","1.206.370,00",ALK,2018-11-02
05.11.2018,"8.300,00","8.300,00","8.298,00","8.299,65","-0,24",344,"2.855.078,00","2.855.078,00",ALK,2018-11-05
06.11.2018,"8.300,00","8.300,00","8.295,00","8.299,17","-0,01",519,"4.307.270,00","4.307.270,00",ALK,2018-11-06
07.11.2018,"8.300,00","8.300,00","8.250,00","8.288,60","-0,13",93,"770.840,00","770.840,00",ALK,2018-11-07
08.11.2018,"8.315,00","8.315,00","8.300,00","8.307,50","0,23",40,"332.300,00","332.300,00",ALK,2018-11-08
09.11.2018,"8.300,00","8.315,00","8.300,00","8.308,32","0,01",184,"1.528.730,00","1.528.730,00",ALK,2018-11-09
12.11.2018,"8.290,00","8.300,00","8.290,00","8.291,04","-0,21",106,"878.850,00","878.850,00",ALK,2018-11-12
13.11.2018,"8.300,00","8.300,00","8.289,00","8.297,18","0,07",262,"2.173.860,00","2.173.860,00",ALK,2018-11-13
14.11.2018,"8.290,00","8.290,00","8.200,00","8.236,00","-0,74",5,"41.180,00","41.180,00",ALK,2018-11-14
16.11.2018,"8.250,00","8.250,00","8.249,00","8.249,89","0,17",45,"371.245,00","371.245,00",ALK,2018-11-16
19.11.2018,"8.249,00","8.250,00","8.249,00","8.249,60","0,00",25,"206.240,00","206.240,00",ALK,2018-11-19
20.11.2018,"8.101,00","8.102,00","8.101,00","8.101,60","-1,79",25,"202.540,00","202.540,00",ALK,2018-11-20
21.11.2018,"8.240,00","8.240,00","8.101,00","8.231,94","1,61",106,"872.586,00","872.586,00",ALK,2018-11-21
22.11.2018,"8.101,00","8.102,00","8.100,00","8.101,46","-1,59",130,"1.053.190,00","1.053.190,00",ALK,2018-11-22
23.11.2018,"8.106,00","8.106,00","8.106,00","8.106,00","0,06",2,"16.212,00","16.212,00",ALK,2018-11-23
26.11.2018,"8.200,00","8.200,00","8.200,00","8.200,00","1,16",30,"246.000,00","246.000,00",ALK,2018-11-26
27.11.2018,"8.100,00","8.101,00","8.100,00","8.100,35","-1,22",107,"866.737,00","866.737,00",ALK,2018-11-27
28.11.2018,"8.100,00","8.101,00","8.100,00","8.100,12","0,00",60,"486.007,00","486.007,00",ALK,2018-11-28
29.11.2018,"8.100,00","8.100,00","8.100,00","8.100,00","0,00",35,"283.500,00","283.500,00",ALK,2018-11-29
30.11.2018,"8.240,00","8.240,00","8.103,00","8.144,55","0,55",82,"667.853,00","667.853,00",ALK,2018-11-30
03.12.2018,"8.117,00","8.150,00","8.117,00","8.129,87","-0,18",377,"3.064.960,00","3.064.960,00",ALK,2018-12-03
04.12.2018,"8.110,00","8.148,00","8.100,00","8.118,16","-0,14",25,"202.954,00","202.954,00",ALK,2018-12-04
05.12.2018,"8.110,00","8.110,00","8.110,00","8.110,00","-0,10",15,"121.650,00","121.650,00",ALK,2018-12-05
06.12.2018,"8.150,00","8.200,00","8.100,00","8.114,44","0,05",360,"2.921.200,00","2.921.200,00",ALK,2018-12-06
07.12.2018,"8.101,00","8.101,00","8.050,00","8.084,00","-0,38",40,"323.360,00","323.360,00",ALK,2018-12-07
10.12.2018,"8.150,00","8.150,00","8.101,00","8.149,06","0,80",261,"2.126.905,00","2.126.905,00",ALK,2018-12-10
11.12.2018,"8.300,00","8.300,00","8.161,00","8.271,79","1,51",811,"6.708.425,00","6.708.425,00",ALK,2018-12-11
12.12.2018,"8.270,00","8.300,00","8.270,00","8.298,81","0,33",368,"3.053.961,00","3.053.961,00",ALK,2018-12-12
13.12.2018,"8.250,00","8.300,00","8.222,00","8.293,68","-0,06",486,"4.030.728,00","4.030.728,00",ALK,2018-12-13
14.12.2018,"8.200,00","8.201,00","8.170,00","8.197,71","-1,16",77,"631.224,00","631.224,00",ALK,2018-12-14
17.12.2018,"8.250,00","8.250,00","8.200,00","8.219,33","0,26",388,"3.189.100,00","3.189.100,00",ALK,2018-12-17
18.12.2018,"8.200,00","8.200,00","8.200,00","8.200,00","-0,24",68,"557.600,00","557.600,00",ALK,2018-12-18
19.12.2018,"8.250,00","8.250,00","8.250,00","8.250,00","0,61",140,"1.155.000,00","1.155.000,00",ALK,2018-12-19
20.12.2018,"8.200,00","8.250,00","8.200,00","8.241,76","-0,10",182,"1.500.000,00","1.500.000,00",ALK,2018-12-20
21.12.2018,"8.200,00","8.200,00","8.170,00","8.180,00","-0,75",15,"122.700,00","122.700,00",ALK,2018-12-21
24.12.2018,"8.050,00","8.050,00","8.050,00","8.050,00","-1,59",18,"144.900,00","144.900,00",ALK,2018-12-24
25.12.2018,"8.150,00","8.150,00","8.053,00","8.096,73","0,58",77,"623.448,00","623.448,00",ALK,2018-12-25
26.12.2018,"8.150,00","8.150,00","8.140,00","8.146,64","0,62",149,"1.213.850,00","1.213.850,00",ALK,2018-12-26
27.12.2018,"8.160,00","8.160,00","8.150,00","8.150,33","0,05",305,"2.485.850,00","2.485.850,00",ALK,2018-12-27
28.12.2018,"8.200,00","8.298,00","8.200,00","8.200,64","0,62",304,"2.492.996,00","2.492.996,00",ALK,2018-12-28
02.01.2019,"8.200,00","8.200,00","8.200,00","8.200,00","-0,01",4,"32.800,00","32.800,00",ALK,2019-01-02
03.01.2019,"8.250,00","8.250,00","8.200,00","8.225,00","0,30",56,"460.600,00","460.600,00",ALK,2019-01-03
04.01.2019,"8.400,00","8.400,00","8.201,00","8.299,25","0,90",599,"4.971.251,00","4.971.251,00",ALK,2019-01-04
08.01.2019,"8.300,00","8.300,00","8.251,00","8.298,74","-0,01",309,"2.564.312,00","2.564.312,00",ALK,2019-01-08
09.01.2019,"8.351,00","8.351,00","8.300,00","8.349,43","0,61",168,"1.402.705,00","1.402.705,00",ALK,2019-01-09
10.01.2019,"8.300,00","8.400,00","8.300,00","8.336,21","-0,16",642,"5.351.850,00","5.351.850,00",ALK,2019-01-10
11.01.2019,"8.350,00","8.350,00","8.350,00","8.350,00","0,17",7,"58.450,00","58.450,00",ALK,2019-01-11
14.01.2019,"8.400,00","8.400,00","8.350,00","8.388,10","0,46",84,"704.600,00","704.600,00",ALK,2019-01-14
15.01.2019,"8.400,00","8.400,00","8.350,00","8.393,65","0,07",63,"528.800,00","528.800,00",ALK,2019-01-15
16.01.2019,"8.402,00","8.428,00","8.400,00","8.404,21","0,13",29,"243.722,00","243.722,00",ALK,2019-01-16
17.01.2019,"8.400,00","8.402,00","8.400,00","8.400,52","-0,04",91,"764.447,00","764.447,00",ALK,2019-01-17
18.01.2019,"8.300,00","8.310,00","8.300,00","8.300,96","-1,19",530,"4.399.510,00","4.399.510,00",ALK,2019-01-18
21.01.2019,"8.300,00","8.301,00","8.300,00","8.300,23","-0,01",137,"1.137.132,00","1.137.132,00",ALK,2019-01-21
22.01.2019,"8.350,00","8.350,00","8.301,00","8.318,84","0,22",43,"357.710,00","357.710,00",ALK,2019-01-22
23.01.2019,"8.300,00","8.350,00","8.300,00","8.302,84","-0,19","1,038","8.618.353,00","8.618.353,00",ALK,2019-01-23
24.01.2019,"8.301,00","8.301,00","8.301,00","8.301,00","-0,02",5,"41.505,00","41.505,00",ALK,2019-01-24
25.01.2019,"8.400,00","8.400,00","8.300,00","8.356,29","0,67",272,"2.272.910,00","2.272.910,00",ALK,2019-01-25
28.01.2019,"8.350,00","8.450,00","8.350,00","8.358,18","0,02","2,268","18.956.354,00","18.956.354,00",ALK,2019-01-28
29.01.2019,"8.350,00","8.350,00","8.349,00","8.349,99","-0,10",825,"6.888.742,00","6.888.742,00",ALK,2019-01-29
30.01.2019,"8.350,00","8.350,00","8.350,00","8.350,00","0,00",121,"1.010.350,00","1.010.350,00",ALK,2019-01-30
31.01.2019,"8.400,00","8.400,00","8.300,00","8.350,00","0,00",11,"91.850,00","91.850,00",ALK,2019-01-31
01.02.2019,"8.350,00","8.350,00","8.350,00","8.350,00","0,00",50,"417.500,00","417.500,00",ALK,2019-02-01
04.02.2019,"8.301,00","8.350,00","8.301,00","8.311,65","-0,46",23,"191.168,00","191.168,00",ALK,2019-02-04
05.02.2019,"8.301,00","8.302,00","8.300,00","8.300,66","-0,13",140,"1.162.092,00","1.162.092,00",ALK,2019-02-05
06.02.2019,"8.300,00","8.350,00","8.300,00","8.301,36","0,01",772,"6.408.653,00","6.408.653,00",ALK,2019-02-06
07.02.2019,"8.350,00","8.350,00","8.300,00","8.340,73","0,47",41,"341.970,00","341.970,00",ALK,2019-02-07
08.02.2019,"8.300,00","8.300,00","8.300,00","8.300,00","-0,49",647,"5.370.100,00","5.370.100,00",ALK,2019-02-08
11.02.2019,"8.300,00","8.310,00","8.300,00","8.306,00","0,07",20,"166.120,00","166.120,00",ALK,2019-02-11
12.02.2019,"8.300,00","8.310,00","8.300,00","8.301,42","-0,06",373,"3.096.430,00","3.096.430,00",ALK,2019-02-12
13.02.2019,"8.300,00","8.310,00","8.300,00","8.307,42","0,07",190,"1.578.410,00","1.578.410,00",ALK,2019-02-13
14.02.2019,"8.250,00","8.250,00","8.250,00","8.250,00","-0,69",10,"82.500,00","82.500,00",ALK,2019-02-14
15.02.2019,"8.290,00","8.299,00","8.250,00","8.270,19","0,24",281,"2.323.923,00","2.323.923,00",ALK,2019-02-15
18.02.2019,"8.399,00","8.399,00","8.251,00","8.332,70","0,76",33,"274.979,00","274.979,00",ALK,2019-02-18
19.02.2019,"8.400,00","8.400,00","8.300,00","8.399,04","0,80",315,"2.645.697,00","2.645.697,00",ALK,2019-02-19
20.02.2019,"8.500,00","8.500,00","8.400,00","8.440,21","0,49",249,"2.101.613,00","2.101.613,00",ALK,2019-02-20
21.02.2019,"8.499,00","8.501,00","8.499,00","8.499,89","0,71",119,"1.011.487,00","1.011.487,00",ALK,2019-02-21
22.02.2019,"8.450,00","8.500,00","8.450,00","8.484,15","-0,19",41,"347.850,00","347.850,00",ALK,2019-02-22
25.02.2019,"8.450,00","8.500,00","8.410,00","8.462,30","-0,26",176,"1.489.365,00","1.489.365,00",ALK,2019-02-25
26.02.2019,"8.300,00","8.400,00","8.300,00","8.325,19","-1,62",595,"4.953.490,00","4.953.490,00",ALK,2019-02-26
27.02.2019,"8.350,00","8.350,00","8.300,00","8.349,02","0,29",51,"425.800,00","425.800,00",ALK,2019-02-27
28.02.2019,"8.320,00","8.350,00","8.320,00","8.328,94","-0,24",104,"866.210,00","866.210,00",ALK,2019-02-28
01.03.2019,"8.300,00","8.300,00","8.299,00","8.300,00","-0,35",756,"6.274.798,00","6.274.798,00",ALK,2019-03-01
04.03.2019,"8.300,00","8.320,00","8.300,00","8.308,05","0,10",325,"2.700.115,00","2.700.115,00",ALK,2019-03-04
05.03.2019,"8.300,00","8.300,00","8.220,00","8.299,11","-0,11",450,"3.734.600,00","3.734.600,00",ALK,2019-03-05
06.03.2019,"8.350,00","8.350,00","8.300,00","8.323,81","0,30",42,"349.600,00","349.600,00",ALK,2019-03-06
07.03.2019,"8.300,00","8.313,00","8.300,00","8.303,52","-0,24","1,157","9.607.167,00","9.607.167,00",ALK,2019-03-07
08.03.2019,"8.350,00","8.350,00","8.300,00","8.312,15","0,10",135,"1.122.140,00","1.122.140,00",ALK,2019-03-08
11.03.2019,"8.300,00","8.350,00","8.299,00","8.301,70","-0,13","1,045","8.675.275,00","8.675.275,00",ALK,2019-03-11
12.03.2019,"8.300,00","8.300,00","8.300,00","8.300,00","-0,02",65,"539.500,00","58.289.500,00",ALK,2019-03-12
13.03.2019,"8.300,00","8.330,00","8.300,00","8.303,78","0,05",80,"664.302,00","46.039.302,00",ALK,2019-03-13
14.03.2019,"8.350,00","8.350,00","8.300,00","8.322,36","0,22",265,"2.205.425,00","45.732.425,00",ALK,2019-03-14
15.03.2019,"8.350,00","8.350,00","8.349,00","8.349,78","0,33",114,"951.875,00","951.875,00",ALK,2019-03-15
18.03.2019,"8.300,00","8.351,00","8.300,00","8.333,36","-0,20",129,"1.075.004,00","1.075.004,00",ALK,2019-03-18
19.03.2019,"8.400,00","8.400,00","8.300,00","8.374,75","0,50",40,"334.990,00","334.990,00",ALK,2019-03-19
20.03.2019,"8.400,00","8.400,00","8.400,00","8.400,00","0,30",105,"882.000,00","882.000,00",ALK,2019-03-20
21.03.2019,"8.400,00","8.400,00","8.400,00","8.400,00","0,00",51,"428.400,00","428.400,00",ALK,2019-03-21
22.03.2019,"8.450,00","8.450,00","8.401,00","8.430,59","0,36",126,"1.062.254,00","1.062.254,00",ALK,2019-03-22
25.03.2019,"8.450,00","8.450,00","8.401,00","8.443,97","0,16",403,"3.402.918,00","3.402.918,00",ALK,2019-03-25
26.03.2019,"8.450,00","8.451,00","8.450,00","8.450,37","0,08",364,"3.075.936,00","3.075.936,00",ALK,2019-03-26
27.03.2019,"8.450,00","8.450,00","8.450,00","8.450,00","0,00",19,"160.550,00","160.550,00",ALK,2019-03-27
28.03.2019,"8.500,00","8.500,00","8.500,00","8.500,00","0,59",112,"952.000,00","952.000,00",ALK,2019-03-28
29.03.2019,"8.500,00","8.500,00","8.500,00","8.500,00","0,00",120,"1.020.000,00","1.020.000,00",ALK,2019-03-29
01.04.2019,"8.500,00","8.500,00","8.499,00","8.500,00","0,00",242,"2.056.999,00","2.056.999,00",ALK,2019-04-01
02.04.2019,"8.450,00","8.500,00","8.450,00","8.484,85","-0,18",33,"280.000,00","280.000,00",ALK,2019-04-02
03.04.2019,"8.420,00","8.450,00","8.401,00","8.432,45","-0,62",186,"1.568.436,00","1.568.436,00",ALK,2019-04-03
04.04.2019,"8.500,00","8.500,00","8.499,00","8.499,58","0,80",132,"1.121.944,00","1.121.944,00",ALK,2019-04-04
05.04.2019,"8.500,00","8.500,00","8.450,00","8.498,11","-0,02",106,"900.800,00","900.800,00",ALK,2019-04-05
08.04.2019,"8.550,00","8.550,00","8.498,00","8.507,79","0,11",520,"4.424.053,00","8.674.053,00",ALK,2019-04-08
09.04.2019,"8.550,00","8.550,00","8.500,00","8.516,67","0,10",21,"178.850,00","178.850,00",ALK,2019-04-09
10.04.2019,"8.560,00","8.560,00","8.549,00","8.551,71","0,41",538,"4.600.821,00","4.600.821,00",ALK,2019-04-10
11.04.2019,"8.600,00","8.600,00","8.599,00","8.599,67","0,56",66,"567.578,00","567.578,00",ALK,2019-04-11
12.04.2019,"8.600,00","8.600,00","8.550,00","8.599,26","0,00","1,150","9.889.146,00","9.889.146,00",ALK,2019-04-12
15.04.2019,"8.599,00","8.600,00","8.599,00","8.599,98","0,01",324,"2.786.393,00","2.786.393,00",ALK,2019-04-15
16.04.2019,"8.550,00","8.550,00","8.550,00","8.550,00","-0,58",22,"188.100,00","188.100,00",ALK,2019-04-16
17.04.2019,"8.568,00","8.599,00","8.551,00","8.563,66","0,16",374,"3.202.809,00","3.202.809,00",ALK,2019-04-17
18.04.2019,"8.595,00","8.600,00","8.595,00","8.597,75","0,40",169,"1.453.020,00","1.453.020,00",ALK,2019-04-18
19.04.2019,"8.560,00","8.589,00","8.560,00","8.575,33","-0,26",102,"874.684,00","874.684,00",ALK,2019-04-19
22.04.2019,"8.501,00","8.550,00","8.501,00","8.548,10","-0,32","1,086","9.283.242,00","9.283.242,00",ALK,2019-04-22
23.04.2019,"8.550,00","8.550,00","8.500,00","8.549,56","0,02","1,054","9.011.239,00","9.011.239,00",ALK,2019-04-23
24.04.2019,"8.258,00","8.258,00","8.258,00","8.258,00","-3,41",27,"222.966,00","222.966,00",ALK,2019-04-24
25.04.2019,"8.320,00","8.320,00","8.300,00","8.310,00","0,63",60,"498.600,00","498.600,00",ALK,2019-04-25
30.04.2019,"8.300,00","8.301,00","8.300,00","8.300,25","-0,12",77,"639.119,00","639.119,00",ALK,2019-04-30
03.05.2019,"8.505,00","8.505,00","8.400,00","8.440,70","1,69",201,"1.696.580,00","1.696.580,00",ALK,2019-05-03
06.05.2019,"8.600,00","8.600,00","8.500,00","8.526,66","1,02",61,"520.126,00","520.126,00",ALK,2019-05-06
07.05.2019,"8.600,00","8.600,00","8.550,00","8.592,48","0,77",206,"1.770.050,00","1.770.050,00",ALK,2019-05-07
08.05.2019,"8.600,00","8.600,00","8.590,00","8.594,70","0,03",302,"2.595.600,00","2.595.600,00",ALK,2019-05-08
09.05.2019,"8.550,00","8.550,00","8.550,00","8.550,00","-0,52",20,"171.000,00","171.000,00",ALK,2019-05-09
10.05.2019,"8.600,00","8.600,00","8.550,00","8.598,75","0,57",372,"3.198.734,00","3.198.734,00",ALK,2019-05-10
13.05.2019,"8.600,00","8.600,00","8.550,00","8.580,66","-0,21",139,"1.192.712,00","1.192.712,00",ALK,2019-05-13
14.05.2019,"8.626,00","8.626,00","8.599,00","8.607,74","0,32",517,"4.450.203,00","4.450.203,00",ALK,2019-05-14
15.05.2019,"8.625,00","8.626,00","8.625,00","8.625,14","0,20",204,"1.759.529,00","1.759.529,00",ALK,2019-05-15
16.05.2019,"8.700,00","8.700,00","8.700,00","8.700,00","0,87",20,"174.000,00","174.000,00",ALK,2019-05-16
17.05.2019,"9.007,00","9.007,00","8.700,00","8.917,90","2,50",399,"3.558.243,00","3.558.243,00",ALK,2019-05-17
20.05.2019,"9.000,00","9.185,00","9.000,00","9.045,41","1,43",191,"1.727.674,00","1.727.674,00",ALK,2019-05-20
21.05.2019,"9.100,00","9.100,00","9.000,00","9.076,22","0,34",600,"5.445.733,00","5.445.733,00",ALK,2019-05-21
22.05.2019,"9.150,00","9.150,00","9.100,00","9.133,94","0,64",486,"4.439.095,00","4.439.095,00",ALK,2019-05-22
23.05.2019,"9.076,00","9.150,00","9.076,00","9.117,59","-0,18",441,"4.020.859,00","4.020.859,00",ALK,2019-05-23
27.05.2019,"9.100,00","9.100,00","9.076,00","9.095,38","-0,24",552,"5.020.652,00","5.020.652,00",ALK,2019-05-27
28.05.2019,"9.100,00","9.100,00","9.099,00","9.099,98","0,05",664,"6.042.385,00","6.042.385,00",ALK,2019-05-28
29.05.2019,"9.150,00","9.150,00","9.100,00","9.131,25","0,34",80,"730.500,00","730.500,00",ALK,2019-05-29
30.05.2019,"9.150,00","9.150,00","9.150,00","9.150,00","0,21",232,"2.122.800,00","2.122.800,00",ALK,2019-05-30
31.05.2019,"9.101,00","9.104,00","9.100,00","9.101,82","-0,53",485,"4.414.381,00","4.414.381,00",ALK,2019-05-31
03.06.2019,"9.065,00","9.100,00","9.065,00","9.079,79","-0,24",70,"635.585,00","635.585,00",ALK,2019-06-03
05.06.2019,"9.099,00","9.100,00","9.050,00","9.097,82","0,20",173,"1.573.923,00","1.573.923,00",ALK,2019-06-05
06.06.2019,"9.051,00","9.099,00","9.051,00","9.080,30","-0,19",185,"1.679.855,00","1.679.855,00",ALK,2019-06-06
07.06.2019,"9.088,00","9.088,00","9.051,00","9.051,42","-0,32",265,"2.398.626,00","2.398.626,00",ALK,2019-06-07
10.06.2019,"9.052,00","9.052,00","9.051,00","9.051,75","0,00",20,"181.035,00","181.035,00",ALK,2019-06-10
11.06.2019,"9.040,00","9.052,00","9.000,00","9.039,47","-0,14",734,"6.634.973,00","6.634.973,00",ALK,2019-06-11
12.06.2019,"8.950,00","8.999,00","8.950,00","8.974,03","-0,72",263,"2.360.170,00","2.360.170,00",ALK,2019-06-12
13.06.2019,"8.705,00","8.950,00","8.705,00","8.877,43","-1,08",511,"4.536.367,00","4.536.367,00",ALK,2019-06-13
17.06.2019,"8.700,00","8.700,00","8.695,00","8.697,07","-2,03",242,"2.104.690,00","2.104.690,00",ALK,2019-06-17
18.06.2019,"8.700,00","8.700,00","8.700,00","8.700,00","0,03",21,"182.700,00","182.700,00",ALK,2019-06-18
19.06.2019,"8.803,00","8.803,00","8.701,00","8.778,34","0,90",77,"675.932,00","675.932,00",ALK,2019-06-19
20.06.2019,"8.998,00","9.000,00","8.900,00","8.997,21","2,49",568,"5.110.418,00","5.110.418,00",ALK,2019-06-20
21.06.2019,"9.000,00","9.039,00","9.000,00","9.000,76","0,04",309,"2.781.234,00","2.781.234,00",ALK,2019-06-21
24.06.2019,"9.039,00","9.039,00","9.000,00","9.030,33","0,33",144,"1.300.368,00","1.300.368,00",ALK,2019-06-24
25.06.2019,"9.039,00","9.039,00","9.000,00","9.013,06","-0,19",643,"5.795.397,00","5.795.397,00",ALK,2019-06-25
26.06.2019,"9.050,00","9.050,00","9.050,00","9.050,00","0,41",57,"515.850,00","515.850,00",ALK,2019-06-26
27.06.2019,"9.098,00","9.098,00","9.000,00","9.049,23","-0,01",13,"117.640,00","117.640,00",ALK,2019-06-27
28.06.2019,"9.050,00","9.050,00","9.045,00","9.045,98","-0,04",87,"787.000,00","787.000,00",ALK,2019-06-28
01.07.2019,"9.050,00","9.050,00","9.050,00","9.050,00","0,04",9,"81.450,00","81.450,00",ALK,2019-07-01
02.07.2019,"9.080,00","9.080,00","9.050,00","9.051,50","0,02",238,"2.154.256,00","2.154.256,00",ALK,2019-07-02
03.07.2019,"9.099,00","9.099,00","9.050,00","9.084,58","0,37",165,"1.498.955,00","1.498.955,00",ALK,2019-07-03
04.07.2019,"9.100,00","9.100,00","9.100,00","9.100,00","0,17",40,"364.000,00","364.000,00",ALK,2019-07-04
05.07.2019,"9.150,00","9.150,00","9.100,00","9.140,91","0,45",66,"603.300,00","603.300,00",ALK,2019-07-05
08.07.2019,"9.100,00","9.150,00","9.100,00","9.101,11","-0,44",315,"2.866.850,00","2.866.850,00",ALK,2019-07-08
09.07.2019,"9.100,00","9.150,00","9.100,00","9.124,29","0,25",35,"319.350,00","319.350,00",ALK,2019-07-09
10.07.2019,"9.101,00","9.101,00","9.100,00","9.100,12","-0,26",24,"218.403,00","218.403,00",ALK,2019-07-10
11.07.2019,"9.148,00","9.148,00","9.105,00","9.134,86","0,38",144,"1.315.420,00","1.315.420,00",ALK,2019-07-11
12.07.2019,"9.100,00","9.106,00","9.051,00","9.103,33","-0,35",205,"1.866.182,00","1.866.182,00",ALK,2019-07-12
15.07.2019,"9.100,00","9.100,00","9.100,00","9.100,00","-0,04",119,"1.082.900,00","1.082.900,00",ALK,2019-07-15
16.07.2019,"9.050,00","9.050,00","9.050,00","9.050,00","-0,55",20,"181.000,00","181.000,00",ALK,2019-07-16
17.07.2019,"9.051,00","9.051,00","9.002,00","9.048,87","-0,01",83,"751.056,00","751.056,00",ALK,2019-07-17
18.07.2019,"9.100,00","9.100,00","9.052,00","9.084,89","0,40",54,"490.584,00","490.584,00",ALK,2019-07-18
19.07.2019,"9.100,00","9.100,00","9.061,00","9.096,52","0,13",112,"1.018.810,00","1.018.810,00",ALK,2019-07-19
22.07.2019,"9.101,00","9.120,00","9.101,00","9.119,07","0,25",149,"1.358.741,00","1.358.741,00",ALK,2019-07-22
23.07.2019,"9.150,00","9.150,00","9.104,00","9.145,72","0,29",276,"2.524.219,00","2.524.219,00",ALK,2019-07-23
24.07.2019,"9.150,00","9.151,00","9.150,00","9.150,04","0,05",239,"2.186.860,00","2.186.860,00",ALK,2019-07-24
25.07.2019,"9.157,00","9.200,00","9.151,00","9.157,63","0,08",83,"760.083,00","760.083,00",ALK,2019-07-25
26.07.2019,"9.159,00","9.160,00","9.158,00","9.158,45","0,01",161,"1.474.510,00","1.474.510,00",ALK,2019-07-26
29.07.2019,"9.250,00","9.250,00","9.160,00","9.182,91","0,27",538,"4.940.406,00","4.940.406,00",ALK,2019-07-29
30.07.2019,"9.211,00","9.211,00","9.209,00","9.210,11","0,30",141,"1.298.626,00","1.298.626,00",ALK,2019-07-30
31.07.2019,"9.350,00","9.350,00","9.248,00","9.295,34","0,93",344,"3.197.596,00","3.197.596,00",ALK,2019-07-31
01.08.2019,"9.430,00","9.430,00","9.303,00","9.392,74","1,05",42,"394.495,00","394.495,00",ALK,2019-08-01
05.08.2019,"9.600,00","9.600,00","9.430,00","9.553,08","1,71",237,"2.264.080,00","2.264.080,00",ALK,2019-08-05
06.08.2019,"9.650,00","9.650,00","9.550,00","9.636,96","0,88",207,"1.994.850,00","1.994.850,00",ALK,2019-08-06
07.08.2019,"9.700,00","9.730,00","9.655,00","9.692,62","0,58",895,"8.674.893,00","8.674.893,00",ALK,2019-08-07
08.08.2019,"9.651,00","9.700,00","9.651,00","9.693,88","0,01",81,"785.204,00","785.204,00",ALK,2019-08-08
09.08.2019,"9.700,00","9.700,00","9.650,00","9.699,01","0,05",509,"4.936.794,00","4.936.794,00",ALK,2019-08-09
12.08.2019,"9.690,00","9.690,00","9.650,00","9.663,97","-0,36",358,"3.459.700,00","3.459.700,00",ALK,2019-08-12
13.08.2019,"9.660,00","9.660,00","9.600,00","9.656,00","-0,08",15,"144.840,00","144.840,00",ALK,2019-08-13
14.08.2019,"9.600,00","9.640,00","9.590,00","9.616,90","-0,40",58,"557.780,00","557.780,00",ALK,2019-08-14
15.08.2019,"9.550,00","9.600,00","9.550,00","9.563,36","-0,56",85,"812.886,00","812.886,00",ALK,2019-08-15
16.08.2019,"9.401,00","9.550,00","9.400,00","9.513,51","-0,52",70,"665.946,00","665.946,00",ALK,2019-08-16
19.08.2019,"9.699,00","9.699,00","9.520,00","9.615,19","1,07",641,"6.163.334,00","6.163.334,00",ALK,2019-08-19
20.08.2019,"9.903,00","10.000,00","9.800,00","9.901,27","2,98",766,"7.584.374,00","7.584.374,00",ALK,2019-08-20
21.08.2019,"9.901,00","10.000,00","9.901,00","9.996,29","0,96",103,"1.029.618,00","1.029.618,00",ALK,2019-08-21
22.08.2019,"9.997,00","10.000,00","9.901,00","9.988,87","-0,07",208,"2.077.685,00","2.077.685,00",ALK,2019-08-22
23.08.2019,"9.905,00","9.999,00","9.905,00","9.953,32","-0,36",79,"786.312,00","786.312,00",ALK,2019-08-23
26.08.2019,"9.900,00","9.900,00","9.900,00","9.900,00","-0,54",120,"1.188.000,00","1.188.000,00",ALK,2019-08-26
27.08.2019,"9.800,00","9.896,00","9.800,00","9.800,46","-1,01",209,"2.048.296,00","2.048.296,00",ALK,2019-08-27
29.08.2019,"9.800,00","9.800,00","9.750,00","9.798,00","-0,03",495,"4.850.012,00","4.850.012,00",ALK,2019-08-29
30.08.2019,"9.900,00","9.900,00","9.800,00","9.890,91","0,95",55,"544.000,00","544.000,00",ALK,2019-08-30
02.09.2019,"9.950,00","9.950,00","9.821,00","9.919,93","0,29",216,"2.142.704,00","2.142.704,00",ALK,2019-09-02
03.09.2019,"9.950,00","9.998,00","9.950,00","9.961,38","0,42",486,"4.841.233,00","4.841.233,00",ALK,2019-09-03
04.09.2019,"9.950,00","9.997,00","9.950,00","9.958,08","-0,03",674,"6.711.745,00","6.711.745,00",ALK,2019-09-04
05.09.2019,"9.950,00","9.950,00","9.940,00","9.948,24","-0,10",675,"6.715.060,00","6.715.060,00",ALK,2019-09-05
06.09.2019,"9.950,00","9.950,00","9.949,00","9.949,99","0,02",345,"3.432.748,00","3.432.748,00",ALK,2019-09-06
10.09.2019,"9.951,00","9.998,00","9.910,00","9.950,67","0,01",226,"2.248.851,00","2.248.851,00",ALK,2019-09-10
11.09.2019,"9.998,00","9.998,00","9.950,00","9.984,56","0,34",25,"249.614,00","249.614,00",ALK,2019-09-11
12.09.2019,"9.990,00","9.990,00","9.990,00","9.990,00","0,05",80,"799.200,00","799.200,00",ALK,2019-09-12
13.09.2019,"10.000,00","10.000,00","9.990,00","9.997,06","0,07",326,"3.259.040,00","3.259.040,00",ALK,2019-09-13
16.09.2019,"10.100,00","10.100,00","10.050,00","10.099,60","1,03",248,"2.504.700,00","2.504.700,00",ALK,2019-09-16
17.09.2019,"10.200,00","10.200,00","10.100,00","10.168,98","0,69",122,"1.240.616,00","1.240.616,00",ALK,2019-09-17
18.09.2019,"10.470,00","10.470,00","10.200,00","10.275,91","1,05",44,"452.140,00","452.140,00",ALK,2019-09-18
19.09.2019,"10.700,00","10.700,00","10.470,00","10.551,22","2,68",154,"1.624.888,00","1.624.888,00",ALK,2019-09-19
20.09.2019,"11.000,00","11.000,00","10.300,00","10.731,73","1,71",466,"5.000.984,00","5.000.984,00",ALK,2019-09-20
23.09.2019,"11.000,00","11.001,00","10.800,00","10.987,99","2,39",486,"5.340.165,00","5.340.165,00",ALK,2019-09-23
24.09.2019,"11.400,00","11.400,00","11.000,00","11.272,61","2,59",338,"3.810.142,00","3.810.142,00",ALK,2019-09-24
25.09.2019,"11.400,00","11.500,00","11.380,00","11.459,60","1,66",623,"7.139.333,00","7.139.333,00",ALK,2019-09-25
26.09.2019,"11.500,00","11.500,00","11.400,00","11.483,91","0,21",245,"2.813.559,00","2.813.559,00",ALK,2019-09-26
27.09.2019,"11.398,00","11.400,00","11.321,00","11.394,20","-0,78",115,"1.310.333,00","1.310.333,00",ALK,2019-09-27
30.09.2019,"11.150,00","11.300,00","11.150,00","11.201,33","-1,69",530,"5.936.706,00","5.936.706,00",ALK,2019-09-30
01.10.2019,"11.120,00","11.213,00","11.100,00","11.187,22","-0,13",626,"7.003.200,00","7.003.200,00",ALK,2019-10-01
03.10.2019,"10.852,00","11.000,00","10.852,00","10.952,28","-2,10",199,"2.179.503,00","2.179.503,00",ALK,2019-10-03
04.10.2019,"10.999,00","11.000,00","10.624,00","10.924,07","-0,26",264,"2.883.954,00","2.883.954,00",ALK,2019-10-04
07.10.2019,"11.000,00","11.000,00","10.950,00","10.995,69","0,66",542,"5.959.665,00","5.959.665,00",ALK,2019-10-07
08.10.2019,"11.130,00","11.130,00","11.000,00","11.041,94","0,42",297,"3.279.456,00","3.279.456,00",ALK,2019-10-08
09.10.2019,"11.100,00","11.200,00","11.100,00","11.135,56","0,85",211,"2.349.604,00","2.349.604,00",ALK,2019-10-09
10.10.2019,"11.150,00","11.190,00","11.103,00","11.187,93","0,47",287,"3.210.935,00","3.210.935,00",ALK,2019-10-10
14.10.2019,"10.800,00","11.000,00","10.800,00","10.839,16","-3,12",96,"1.040.559,00","1.040.559,00",ALK,2019-10-14
15.10.2019,"10.800,00","10.800,00","10.661,00","10.797,55","-0,38",371,"4.005.890,00","4.005.890,00",ALK,2019-10-15
16.10.2019,"11.100,00","11.100,00","10.800,00","10.964,48","1,55",569,"6.238.790,00","82.011.590,00",ALK,2019-10-16
17.10.2019,"11.010,00","11.100,00","11.000,00","11.015,23","0,46",327,"3.601.981,00","3.601.981,00",ALK,2019-10-17
18.10.2019,"10.550,00","10.780,00","10.550,00","10.689,14","-2,96",118,"1.261.319,00","1.261.319,00",ALK,2019-10-18
21.10.2019,"10.000,00","10.100,00","9.860,00","10.002,10","-6,43",693,"6.931.455,00","6.931.455,00",ALK,2019-10-21
22.10.2019,"10.500,00","10.500,00","9.999,00","10.034,12","0,32",659,"6.612.482,00","6.612.482,00",ALK,2019-10-22
24.10.2019,"11.010,00","11.010,00","10.511,00","10.905,07","8,68",477,"5.201.719,00","5.201.719,00",ALK,2019-10-24
25.10.2019,"11.000,00","11.050,00","10.826,00","10.983,15","0,72",477,"5.238.963,00","5.238.963,00",ALK,2019-10-25
28.10.2019,"10.990,00","10.990,00","10.989,00","10.989,09","0,05",22,"241.760,00","241.760,00",ALK,2019-10-28
29.10.2019,"11.050,00","11.050,00","10.990,00","11.001,15","0,11",499,"5.489.572,00","5.489.572,00",ALK,2019-10-29
30.10.2019,"11.150,00","11.200,00","11.050,00","11.113,82","1,02",194,"2.156.082,00","2.156.082,00",ALK,2019-10-30
31.10.2019,"11.050,00","11.100,00","11.050,00","11.085,00","-0,26",50,"554.250,00","554.250,00",ALK,2019-10-31
01.11.2019,"11.150,00","11.150,00","11.050,00","11.095,09","0,09",575,"6.379.676,00","6.379.676,00",ALK,2019-11-01
04.11.2019,"11.100,00","11.150,00","11.050,00","11.073,53","-0,19",85,"941.250,00","941.250,00",ALK,2019-11-04
05.11.2019,"11.100,00","11.102,00","11.057,00","11.099,96","0,24",246,"2.730.590,00","2.730.590,00",ALK,2019-11-05
06.11.2019,"11.150,00","11.150,00","11.112,00","11.147,23","0,43",248,"2.764.512,00","2.764.512,00",ALK,2019-11-06
07.11.2019,"11.012,00","11.148,00","11.012,00","11.107,40","-0,36",149,"1.655.002,00","1.655.002,00",ALK,2019-11-07
08.11.2019,"11.101,00","11.101,00","11.100,00","11.100,82","-0,06",45,"499.537,00","499.537,00",ALK,2019-11-08
11.11.2019,"11.130,00","11.130,00","11.130,00","11.130,00","0,26",67,"745.710,00","745.710,00",ALK,2019-11-11
12.11.2019,"11.130,00","11.130,00","11.102,00","11.124,50","-0,05",90,"1.001.205,00","1.001.205,00",ALK,2019-11-12
13.11.2019,"11.130,00","11.130,00","11.100,00","11.115,52","-0,08",115,"1.278.285,00","1.278.285,00",ALK,2019-11-13
14.11.2019,"11.100,00","11.130,00","11.100,00","11.108,11","-0,07",74,"822.000,00","822.000,00",ALK,2019-11-14
15.11.2019,"11.030,00","11.090,00","11.021,00","11.031,83","-0,69",386,"4.258.285,00","4.258.285,00",ALK,2019-11-15
18.11.2019,"11.030,00","11.031,00","11.030,00","11.030,09","-0,02",56,"617.685,00","617.685,00",ALK,2019-11-18
19.11.2019,"11.099,00","11.100,00","11.026,00","11.059,91","0,27",212,"2.344.700,00","2.344.700,00",ALK,2019-11-19
20.11.2019,"11.060,00","11.060,00","11.030,00","11.056,67","-0,03",27,"298.530,00","298.530,00",ALK,2019-11-20
21.11.2019,"11.041,00","11.041,00","11.031,00","11.034,23","-0,20",991,"10.934.926,00","10.934.926,00",ALK,2019-11-21
22.11.2019,"11.100,00","11.100,00","11.046,00","11.086,53","0,47",299,"3.314.872,00","3.314.872,00",ALK,2019-11-22
25.11.2019,"11.100,00","11.100,00","11.056,00","11.089,68","0,03",31,"343.780,00","343.780,00",ALK,2019-11-25
26.11.2019,"11.150,00","11.150,00","11.147,00","11.149,81","0,54",190,"2.118.463,00","2.118.463,00",ALK,2019-11-26
27.11.2019,"11.170,00","11.170,00","11.150,00","11.159,62","0,09",52,"580.300,00","580.300,00",ALK,2019-11-27
28.11.2019,"11.200,00","11.200,00","11.152,00","11.199,05","0,35",101,"1.131.104,00","1.131.104,00",ALK,2019-11-28
29.11.2019,"11.203,00","11.249,00","11.201,00","11.214,78","0,14",72,"807.464,00","807.464,00",ALK,2019-11-29
02.12.2019,"11.299,00","11.305,00","11.219,00","11.298,20","0,74",396,"4.474.089,00","4.474.089,00",ALK,2019-12-02
03.12.2019,"11.300,00","11.300,00","11.299,00","11.299,81","0,01",269,"3.039.649,00","3.039.649,00",ALK,2019-12-03
04.12.2019,"11.227,00","11.300,00","11.226,00","11.297,92","-0,02",108,"1.220.175,00","1.220.175,00",ALK,2019-12-04
05.12.2019,"11.251,00","11.298,00","11.231,00","11.288,79","-0,08",43,"485.418,00","485.418,00",ALK,2019-12-05
06.12.2019,"11.350,00","11.350,00","11.298,00","11.303,85","0,13",148,"1.672.970,00","1.672.970,00",ALK,2019-12-06
10.12.2019,"11.300,00","11.351,00","11.300,00","11.316,41","0,11",288,"3.259.127,00","3.259.127,00",ALK,2019-12-10
11.12.2019,"11.300,00","11.301,00","11.300,00","11.300,42","-0,14",31,"350.313,00","350.313,00",ALK,2019-12-11
12.12.2019,"11.300,00","11.300,00","11.260,00","11.296,14","-0,04",360,"4.066.609,00","4.066.609,00",ALK,2019-12-12
13.12.2019,"11.280,00","11.300,00","11.251,00","11.298,51","0,02",526,"5.943.018,00","5.943.018,00",ALK,2019-12-13
16.12.2019,"11.300,00","11.300,00","11.280,00","11.296,15","-0,02",52,"587.400,00","587.400,00",ALK,2019-12-16
17.12.2019,"11.300,00","11.300,00","11.299,00","11.299,94","0,03",118,"1.333.393,00","1.333.393,00",ALK,2019-12-17
18.12.2019,"11.300,00","11.300,00","11.270,00","11.298,27","-0,01",260,"2.937.550,00","2.937.550,00",ALK,2019-12-18
19.12.2019,"11.250,00","11.299,00","11.201,00","11.265,33","-0,29",356,"4.010.458,00","4.010.458,00",ALK,2019-12-19
20.12.2019,"11.299,00","11.299,00","11.250,00","11.262,88","-0,02",103,"1.160.077,00","1.160.077,00",ALK,2019-12-20
23.12.2019,"11.400,00","11.400,00","11.251,00","11.299,79","0,33",711,"8.034.149,00","11.026.149,00",ALK,2019-12-23
24.12.2019,"11.520,00","11.520,00","11.300,00","11.486,71","1,65",811,"9.315.721,00","9.315.721,00",ALK,2019-12-24
25.12.2019,"11.502,00","11.550,00","11.400,00","11.465,84","-0,18",149,"1.708.410,00","1.708.410,00",ALK,2019-12-25
26.12.2019,"11.601,00","11.601,00","11.600,00","11.600,22","1,17",92,"1.067.220,00","1.067.220,00",ALK,2019-12-26
27.12.2019,"11.800,00","11.800,00","11.700,00","11.786,99","1,61",449,"5.292.360,00","5.292.360,00",ALK,2019-12-27
30.12.2019,"11.900,00","11.901,00","11.900,00","11.900,13","0,96",245,"2.915.531,00","2.915.531,00",ALK,2019-12-30
02.01.2020,"11.999,00","11.999,00","11.898,00","11.908,01","0,07",83,"988.365,00","988.365,00",ALK,2020-01-02
03.01.2020,"12.000,00","12.000,00","11.900,00","11.974,25","0,56",443,"5.304.592,00","5.304.592,00",ALK,2020-01-03
08.01.2020,"12.250,00","12.250,00","12.000,00","12.068,88","0,79",98,"1.182.750,00","1.182.750,00",ALK,2020-01-08
09.01.2020,"12.500,00","12.500,00","12.280,00","12.388,80","2,65",157,"1.945.041,00","1.945.041,00",ALK,2020-01-09
10.01.2020,"12.965,00","12.965,00","12.760,00","12.960,73","4,62",670,"8.683.686,00","8.683.686,00",ALK,2020-01-10
13.01.2020,"13.353,00","13.353,00","13.149,00","13.347,60","2,98",865,"11.545.678,00","11.545.678,00",ALK,2020-01-13
14.01.2020,"13.100,00","13.347,00","13.099,00","13.166,88","-1,35",607,"7.992.299,00","7.992.299,00",ALK,2020-01-14
15.01.2020,"13.000,00","13.000,00","13.000,00","13.000,00","-1,27",84,"1.092.000,00","1.092.000,00",ALK,2020-01-15
16.01.2020,"12.799,00","12.802,00","12.611,00","12.763,90","-1,82",334,"4.263.143,00","4.263.143,00",ALK,2020-01-16
17.01.2020,"12.801,00","12.802,00","12.700,00","12.760,64","-0,03",362,"4.619.353,00","4.619.353,00",ALK,2020-01-17
20.01.2020,"13.050,00","13.100,00","12.999,00","13.014,56","1,99",502,"6.533.307,00","6.533.307,00",ALK,2020-01-20
21.01.2020,"13.050,00","13.050,00","13.000,00","13.000,48","-0,11",520,"6.760.250,00","6.760.250,00",ALK,2020-01-21
22.01.2020,"13.100,00","13.102,00","13.016,00","13.097,70","0,75",152,"1.990.851,00","1.990.851,00",ALK,2020-01-22
23.01.2020,"13.050,00","13.110,00","13.050,00","13.095,08","-0,02",179,"2.344.019,00","2.344.019,00",ALK,2020-01-23
24.01.2020,"13.020,00","13.100,00","13.020,00","13.096,21","0,01",281,"3.680.035,00","3.680.035,00",ALK,2020-01-24
27.01.2020,"13.099,00","13.103,00","13.099,00","13.100,48","0,03",73,"956.335,00","956.335,00",ALK,2020-01-27
28.01.2020,"13.100,00","13.100,00","13.050,00","13.093,77","-0,05",204,"2.671.130,00","2.671.130,00",ALK,2020-01-28
29.01.2020,"13.100,00","13.100,00","13.090,00","13.093,91","0,00",116,"1.518.893,00","1.518.893,00",ALK,2020-01-29
30.01.2020,"12.809,00","13.050,00","12.809,00","13.004,33","-0,68",175,"2.275.757,00","2.275.757,00",ALK,2020-01-30
31.01.2020,"12.900,00","12.950,00","12.900,00","12.917,50","-0,67",100,"1.291.750,00","1.291.750,00",ALK,2020-01-31
03.02.2020,"12.900,00","12.900,00","12.800,00","12.807,75","-0,85",329,"4.213.751,00","4.213.751,00",ALK,2020-02-03
04.02.2020,"12.999,00","12.999,00","12.820,00","12.861,38","0,42",439,"5.646.145,00","5.646.145,00",ALK,2020-02-04
05.02.2020,"12.853,00","12.853,00","12.853,00","12.853,00","-0,07",11,"141.383,00","141.383,00",ALK,2020-02-05
06.02.2020,"13.000,00","13.003,00","12.900,00","12.994,33","1,10",580,"7.536.710,00","7.536.710,00",ALK,2020-02-06
07.02.2020,"13.050,00","13.098,00","13.001,00","13.052,40","0,45",165,"2.153.646,00","2.153.646,00",ALK,2020-02-07
10.02.2020,"13.169,00","13.169,00","13.100,00","13.123,45","0,54",190,"2.493.455,00","2.493.455,00",ALK,2020-02-10
11.02.2020,"13.200,00","13.250,00","13.200,00","13.202,82","0,60",103,"1.359.890,00","1.359.890,00",ALK,2020-02-11
12.02.2020,"13.250,00","13.250,00","13.220,00","13.247,02","0,33",161,"2.132.770,00","2.132.770,00",ALK,2020-02-12
13.02.2020,"13.250,00","13.250,00","13.153,00","13.192,13","-0,41",127,"1.675.400,00","1.675.400,00",ALK,2020-02-13
14.02.2020,"13.299,00","13.299,00","13.200,00","13.212,04","0,15",51,"673.814,00","673.814,00",ALK,2020-02-14
17.02.2020,"13.300,00","13.300,00","13.203,00","13.276,51","0,49",284,"3.770.528,00","3.770.528,00",ALK,2020-02-17
18.02.2020,"13.261,00","13.300,00","13.250,00","13.279,82","0,02",271,"3.598.832,00","3.598.832,00",ALK,2020-02-18
19.02.2020,"13.300,00","13.300,00","13.251,00","13.298,85","0,14",773,"10.280.012,00","10.280.012,00",ALK,2020-02-19
20.02.2020,"13.350,00","13.350,00","13.330,00","13.343,68","0,34",38,"507.060,00","507.060,00",ALK,2020-02-20
21.02.2020,"13.400,00","13.400,00","13.300,00","13.366,09","0,17",463,"6.188.500,00","6.188.500,00",ALK,2020-02-21
24.02.2020,"13.330,00","13.390,00","13.202,00","13.347,93","-0,14",288,"3.844.205,00","3.844.205,00",ALK,2020-02-24
25.02.2020,"13.000,00","13.250,00","12.948,00","13.123,02","-1,68",227,"2.978.926,00","2.978.926,00",ALK,2020-02-25
26.02.2020,"12.550,00","12.700,00","12.500,00","12.600,92","-3,98","2,745","34.589.530,00","34.589.530,00",ALK,2020-02-26
27.02.2020,"12.400,00","12.400,00","12.010,00","12.297,39","-2,41",744,"9.149.255,00","9.149.255,00",ALK,2020-02-27
28.02.2020,"12.799,00","12.900,00","12.400,00","12.514,90","1,77","4,370","54.690.094,00","54.690.094,00",ALK,2020-02-28
02.03.2020,"13.000,00","13.002,00","12.840,00","12.989,68","3,79",639,"8.300.405,00","8.300.405,00",ALK,2020-03-02
03.03.2020,"12.998,00","13.000,00","12.997,00","12.998,84","0,07",575,"7.474.335,00","7.474.335,00",ALK,2020-03-03
04.03.2020,"12.997,00","12.997,00","12.911,00","12.966,32","-0,25",137,"1.776.386,00","1.776.386,00",ALK,2020-03-04
05.03.2020,"13.026,00","13.200,00","12.997,00","13.033,43","0,52","1,183","15.418.542,00","15.418.542,00",ALK,2020-03-05
06.03.2020,"13.000,00","13.100,00","12.650,00","13.086,30","0,41","4,657","60.942.894,00","60.942.894,00",ALK,2020-03-06
09.03.2020,"12.100,00","12.400,00","11.900,00","12.180,87","-6,92",689,"8.392.620,00","8.392.620,00",ALK,2020-03-09
10.03.2020,"12.700,00","12.700,00","12.001,00","12.620,47","3,61",336,"4.240.478,00","4.240.478,00",ALK,2020-03-10
11.03.2020,"12.100,00","12.401,00","12.001,00","12.200,61","-3,33",350,"4.270.212,00","4.270.212,00",ALK,2020-03-11
12.03.2020,"10.981,00","11.000,00","10.981,00","10.982,80","-9,98","1,253","13.761.447,00","13.761.447,00",ALK,2020-03-12
13.03.2020,"10.899,00","11.301,00","10.850,00","10.994,44","0,11","2,887","31.740.943,00","51.528.873,00",ALK,2020-03-13
16.03.2020,"9.895,00","9.895,00","9.895,00","9.895,00","-10,00",892,"8.826.340,00","8.826.340,00",ALK,2020-03-16
17.03.2020,"9.401,00","9.747,00","9.401,00","9.451,05","-4,49","2,370","22.398.993,00","22.398.993,00",ALK,2020-03-17
18.03.2020,"8.979,00","9.000,00","8.979,00","8.981,00","-4,97","1,918","17.225.550,00","17.225.550,00",ALK,2020-03-18
19.03.2020,"8.532,00","8.671,00","8.532,00","8.542,68","-4,88","3,277","27.994.361,00","41.645.561,00",ALK,2020-03-19
20.03.2020,"8.969,00","8.969,00","8.670,00","8.793,03","2,93","1,463","12.864.208,00","12.864.208,00",ALK,2020-03-20
23.03.2020,"8.490,00","8.642,00","8.354,00","8.405,68","-4,41","1,260","10.591.163,00","10.591.163,00",ALK,2020-03-23
24.03.2020,"8.750,00","8.750,00","8.531,00","8.671,99","3,17",398,"3.451.453,00","3.451.453,00",ALK,2020-03-24
25.03.2020,"9.105,00","9.105,00","9.105,00","9.105,00","4,99",23,"209.415,00","209.415,00",ALK,2020-03-25
26.03.2020,"8.925,00","10.015,00","8.800,00","9.456,30","3,86","2,051","19.394.881,00","19.394.881,00",ALK,2020-03-26
27.03.2020,"9.000,00","9.739,00","8.995,00","9.091,31","-3,86",558,"5.072.950,00","5.072.950,00",ALK,2020-03-27
30.03.2020,"9.200,00","9.200,00","9.000,00","9.069,63","-0,24","1,021","9.260.092,00","9.260.092,00",ALK,2020-03-30
31.03.2020,"9.782,00","9.782,00","9.498,00","9.704,50","7,00",462,"4.483.479,00","4.483.479,00",ALK,2020-03-31
01.04.2020,"9.699,00","9.700,00","9.414,00","9.563,53","-1,45",301,"2.878.623,00","2.878.623,00",ALK,2020-04-01
02.04.2020,"9.500,00","9.500,00","9.500,00","9.500,00","-0,66",100,"950.000,00","950.000,00",ALK,2020-04-02
03.04.2020,"10.450,00","10.450,00","10.300,00","10.359,76","9,05",748,"7.749.100,00","7.749.100,00",ALK,2020-04-03
06.04.2020,"11.000,00","11.020,00","10.700,00","10.879,44","5,02",486,"5.287.408,00","5.287.408,00",ALK,2020-04-06
07.04.2020,"11.680,00","11.690,00","11.000,00","11.271,27","3,60","1,020","11.496.698,00","11.496.698,00",ALK,2020-04-07
08.04.2020,"11.001,00","11.202,00","10.950,00","11.103,61","-1,49",522,"5.796.087,00","8.092.227,00",ALK,2020-04-08
09.04.2020,"10.957,00","11.100,00","10.954,00","11.056,41","-0,43",490,"5.417.643,00","7.571.843,00",ALK,2020-04-09
10.04.2020,"11.000,00","11.034,00","11.000,00","11.002,38","-0,49",430,"4.731.025,00","4.731.025,00",ALK,2020-04-10
13.04.2020,"11.005,00","11.010,00","11.000,00","11.002,20","0,00",280,"3.080.615,00","3.080.615,00",ALK,2020-04-13
14.04.2020,"11.005,00","11.200,00","11.005,00","11.134,23","1,20",247,"2.750.155,00","2.750.155,00",ALK,2020-04-14
15.04.2020,"11.001,00","11.100,00","11.001,00","11.004,29","-1,17",322,"3.543.380,00","3.543.380,00",ALK,2020-04-15
16.04.2020,"11.100,00","11.130,00","11.000,00","11.041,76","0,34",536,"5.918.384,00","5.918.384,00",ALK,2020-04-16
21.04.2020,"11.135,00","11.199,00","11.065,00","11.132,36","0,82",897,"9.985.727,00","9.985.727,00",ALK,2020-04-21
22.04.2020,"10.800,00","10.800,00","10.800,00","10.800,00","-2,99",60,"648.000,00","648.000,00",ALK,2020-04-22
23.04.2020,"11.000,00","11.100,00","10.995,00","11.010,17","1,95",59,"649.600,00","649.600,00",ALK,2020-04-23
24.04.2020,"11.340,00","11.340,00","11.100,00","11.203,96","1,76","1,901","21.298.721,00","21.298.721,00",ALK,2020-04-24
27.04.2020,"11.896,00","11.896,00","11.500,00","11.534,65","2,95",658,"7.589.801,00","21.334.996,00",ALK,2020-04-27
28.04.2020,"12.688,00","12.688,00","11.935,00","12.427,86","7,74",476,"5.915.661,00","5.915.661,00",ALK,2020-04-28
29.04.2020,"12.930,00","12.950,00","12.800,00","12.880,56","3,64",705,"9.080.795,00","9.080.795,00",ALK,2020-04-29
30.04.2020,"12.500,00","12.928,00","12.495,00","12.678,13","-1,57",513,"6.503.882,00","6.503.882,00",ALK,2020-04-30
04.05.2020,"12.300,00","12.850,00","12.290,00","12.334,70","-2,71",173,"2.133.903,00","2.133.903,00",ALK,2020-05-04
05.05.2020,"12.300,00","12.300,00","12.100,00","12.157,16","-1,44",44,"534.915,00","534.915,00",ALK,2020-05-05
06.05.2020,"12.250,00","12.350,00","12.103,00","12.236,53","0,65",190,"2.324.941,00","2.324.941,00",ALK,2020-05-06
07.05.2020,"12.749,00","12.790,00","12.200,00","12.457,80","1,81",139,"1.731.634,00","1.731.634,00",ALK,2020-05-07
08.05.2020,"12.769,00","12.780,00","12.768,00","12.772,90","2,53",106,"1.353.927,00","1.353.927,00",ALK,2020-05-08
11.05.2020,"12.799,00","12.800,00","12.798,00","12.798,94","0,20",142,"1.817.450,00","1.817.450,00",ALK,2020-05-11
12.05.2020,"12.700,00","12.798,00","12.500,00","12.688,65","-0,86",54,"685.187,00","685.187,00",ALK,2020-05-12
13.05.2020,"12.600,00","12.600,00","12.600,00","12.600,00","-0,70",12,"151.200,00","151.200,00",ALK,2020-05-13
14.05.2020,"12.600,00","12.600,00","12.600,00","12.600,00","0,00",33,"415.800,00","415.800,00",ALK,2020-05-14
15.05.2020,"12.230,00","12.590,00","12.230,00","12.290,33","-2,46",60,"737.420,00","737.420,00",ALK,2020-05-15
18.05.2020,"12.200,00","12.250,00","12.000,00","12.158,12","-1,08",283,"3.440.748,00","3.440.748,00",ALK,2020-05-18
19.05.2020,"12.250,00","12.251,00","12.200,00","12.231,84","0,61",393,"4.807.115,00","4.807.115,00",ALK,2020-05-19
20.05.2020,"12.550,00","12.550,00","12.301,00","12.476,43","2,00",101,"1.260.119,00","1.260.119,00",ALK,2020-05-20
21.05.2020,"12.600,00","12.700,00","12.600,00","12.603,53","1,02",657,"8.280.520,00","8.280.520,00",ALK,2020-05-21
22.05.2020,"12.500,00","12.600,00","12.500,00","12.595,67","-0,06",245,"3.085.940,00","13.085.940,00",ALK,2020-05-22
26.05.2020,"12.495,00","12.500,00","12.252,00","12.496,65","-0,79",386,"4.823.707,00","4.823.707,00",ALK,2020-05-26
27.05.2020,"12.495,00","12.498,00","12.495,00","12.497,54","0,01",13,"162.468,00","162.468,00",ALK,2020-05-27
28.05.2020,"12.302,00","12.400,00","12.300,00","12.344,27","-1,23",290,"3.579.839,00","3.579.839,00",ALK,2020-05-28
29.05.2020,"12.300,00","12.303,00","12.300,00","12.301,16","-0,35",215,"2.644.750,00","2.644.750,00",ALK,2020-05-29
01.06.2020,"12.160,00","12.299,00","12.160,00","12.191,03","-0,90",141,"1.718.935,00","1.718.935,00",ALK,2020-06-01
02.06.2020,"11.999,00","12.150,00","11.999,00","12.004,92","-1,53",795,"9.543.908,00","9.543.908,00",ALK,2020-06-02
03.06.2020,"11.950,00","11.950,00","11.950,00","11.950,00","-0,46",36,"430.200,00","430.200,00",ALK,2020-06-03
04.06.2020,"11.999,00","12.000,00","11.950,00","11.992,58","0,36",453,"5.432.641,00","5.432.641,00",ALK,2020-06-04
08.06.2020,"11.950,00","11.950,00","11.900,00","11.935,21","-0,48",71,"847.400,00","847.400,00",ALK,2020-06-08
09.06.2020,"11.800,00","11.950,00","11.800,00","11.808,73","-1,06",244,"2.881.329,00","2.881.329,00",ALK,2020-06-09
10.06.2020,"11.600,00","11.780,00","11.512,00","11.579,56","-1,94","1,038","12.019.586,00","12.019.586,00",ALK,2020-06-10
11.06.2020,"11.450,00","11.600,00","11.400,00","11.486,43","-0,80",623,"7.156.047,00","7.156.047,00",ALK,2020-06-11
12.06.2020,"11.490,00","11.500,00","11.450,00","11.487,22","0,01",434,"4.985.452,00","4.985.452,00",ALK,2020-06-12
15.06.2020,"11.600,00","11.600,00","11.500,00","11.515,38","0,25",65,"748.500,00","748.500,00",ALK,2020-06-15
16.06.2020,"11.500,00","11.510,00","11.500,00","11.503,88","-0,10",80,"920.310,00","920.310,00",ALK,2020-06-16
17.06.2020,"11.650,00","11.650,00","11.599,00","11.629,87","1,10",234,"2.721.390,00","2.721.390,00",ALK,2020-06-17
18.06.2020,"11.600,00","11.600,00","11.600,00","11.600,00","-0,26",141,"1.635.600,00","1.635.600,00",ALK,2020-06-18
23.06.2020,"11.900,00","11.900,00","11.900,00","11.900,00","2,59",50,"595.000,00","595.000,00",ALK,2020-06-23
24.06.2020,"11.752,00","11.753,00","11.750,00","11.752,24","-1,24",17,"199.788,00","199.788,00",ALK,2020-06-24
25.06.2020,"11.753,00","11.754,00","11.753,00","11.753,80","0,01",25,"293.845,00","293.845,00",ALK,2020-06-25
26.06.2020,"11.850,00","11.850,00","11.850,00","11.850,00","0,82",41,"485.850,00","485.850,00",ALK,2020-06-26
29.06.2020,"11.807,00","11.807,00","11.800,00","11.805,15","-0,38",53,"625.673,00","625.673,00",ALK,2020-06-29
30.06.2020,"11.999,00","11.999,00","11.900,00","11.905,05","0,85",196,"2.333.390,00","2.333.390,00",ALK,2020-06-30
01.07.2020,"11.999,00","11.999,00","11.900,00","11.942,08","0,31",52,"620.988,00","620.988,00",ALK,2020-07-01
02.07.2020,"11.950,00","12.000,00","11.940,00","11.986,36","0,37",253,"3.032.550,00","3.032.550,00",ALK,2020-07-02
03.07.2020,"12.000,00","12.000,00","11.999,00","11.999,38","0,11",139,"1.667.914,00","1.667.914,00",ALK,2020-07-03
06.07.2020,"11.900,00","11.950,00","11.900,00","11.900,89","-0,82",112,"1.332.900,00","1.332.900,00",ALK,2020-07-06
07.07.2020,"11.950,00","11.950,00","11.850,00","11.937,62","0,31",240,"2.865.030,00","2.865.030,00",ALK,2020-07-07
08.07.2020,"11.900,00","11.998,00","11.900,00","11.909,25","-0,24",16,"190.548,00","190.548,00",ALK,2020-07-08
10.07.2020,"11.900,00","11.909,00","11.900,00","11.902,73","-0,05",99,"1.178.370,00","1.178.370,00",ALK,2020-07-10
13.07.2020,"11.905,00","11.905,00","11.903,00","11.903,09","0,00",230,"2.737.710,00","2.737.710,00",ALK,2020-07-13
14.07.2020,"11.905,00","11.996,00","11.905,00","11.931,87","0,24",38,"453.411,00","453.411,00",ALK,2020-07-14
16.07.2020,"11.992,00","11.994,00","11.905,00","11.974,70","0,36",104,"1.245.369,00","1.245.369,00",ALK,2020-07-16
17.07.2020,"11.989,00","11.993,00","11.980,00","11.990,68","0,13",269,"3.225.494,00","3.225.494,00",ALK,2020-07-17
20.07.2020,"11.988,00","11.988,00","11.901,00","11.982,88","-0,07",34,"407.418,00","407.418,00",ALK,2020-07-20
21.07.2020,"12.050,00","12.051,00","11.988,00","12.003,53","0,17",605,"7.262.134,00","7.262.134,00",ALK,2020-07-21
22.07.2020,"12.201,00","12.300,00","12.115,00","12.173,35","1,41",136,"1.655.576,00","1.655.576,00",ALK,2020-07-22
23.07.2020,"12.300,00","12.300,00","12.200,00","12.284,70","0,91",491,"6.031.790,00","6.031.790,00",ALK,2020-07-23
24.07.2020,"12.500,00","12.500,00","12.261,00","12.433,16","1,21",31,"385.428,00","385.428,00",ALK,2020-07-24
27.07.2020,"12.750,00","12.750,00","12.500,00","12.696,51","2,12",86,"1.091.900,00","1.091.900,00",ALK,2020-07-27
28.07.2020,"12.330,00","12.331,00","12.300,00","12.330,00","-2,89",160,"1.972.800,00","1.972.800,00",ALK,2020-07-28
29.07.2020,"12.600,00","12.600,00","12.500,00","12.579,33","2,02",225,"2.830.350,00","2.830.350,00",ALK,2020-07-29
30.07.2020,"12.700,00","12.799,00","12.551,00","12.703,33","0,99",388,"4.928.891,00","4.928.891,00",ALK,2020-07-30
31.07.2020,"12.500,00","12.699,00","12.500,00","12.512,02","-1,51",58,"725.697,00","725.697,00",ALK,2020-07-31
04.08.2020,"12.400,00","12.497,00","12.400,00","12.406,01","-0,85",199,"2.468.796,00","2.468.796,00",ALK,2020-08-04
05.08.2020,"12.350,00","12.351,00","12.350,00","12.350,12","-0,45",170,"2.099.520,00","2.099.520,00",ALK,2020-08-05
06.08.2020,"12.200,00","12.350,00","12.200,00","12.209,19","-1,14",971,"11.855.125,00","11.855.125,00",ALK,2020-08-06
07.08.2020,"12.400,00","12.400,00","12.200,00","12.322,35","0,93",132,"1.626.550,00","1.626.550,00",ALK,2020-08-07
10.08.2020,"12.350,00","12.350,00","12.251,00","12.330,78","0,07",247,"3.045.702,00","3.045.702,00",ALK,2020-08-10
11.08.2020,"12.500,00","12.600,00","12.350,00","12.469,72","1,13",235,"2.930.385,00","2.930.385,00",ALK,2020-08-11
12.08.2020,"12.500,00","12.500,00","12.400,00","12.488,10","0,15",84,"1.049.000,00","1.049.000,00",ALK,2020-08-12
14.08.2020,"12.500,00","12.500,00","12.450,00","12.491,56","0,03",64,"799.460,00","799.460,00",ALK,2020-08-14
17.08.2020,"12.399,00","12.399,00","12.399,00","12.399,00","-0,74",2,"24.798,00","24.798,00",ALK,2020-08-17
18.08.2020,"12.300,00","12.300,00","12.300,00","12.300,00","-0,80",126,"1.549.800,00","1.549.800,00",ALK,2020-08-18
19.08.2020,"12.300,00","12.300,00","12.300,00","12.300,00","0,00",240,"2.952.000,00","2.952.000,00",ALK,2020-08-19
20.08.2020,"12.223,00","12.300,00","12.223,00","12.295,09","-0,04",53,"651.640,00","651.640,00",ALK,2020-08-20
21.08.2020,"12.290,00","12.290,00","12.289,00","12.289,52","-0,05",50,"614.476,00","614.476,00",ALK,2020-08-21
24.08.2020,"12.290,00","12.290,00","12.289,00","12.289,67","0,00",6,"73.738,00","73.738,00",ALK,2020-08-24
25.08.2020,"12.200,00","12.222,00","12.200,00","12.201,47","-0,72",300,"3.660.440,00","3.660.440,00",ALK,2020-08-25
26.08.2020,"12.200,00","12.200,00","12.198,00","12.199,58","-0,02",346,"4.221.053,00","4.221.053,00",ALK,2020-08-26
27.08.2020,"12.289,00","12.289,00","12.200,00","12.270,03","0,58",237,"2.907.997,00","2.907.997,00",ALK,2020-08-27
31.08.2020,"12.200,00","12.250,00","12.200,00","12.202,23","-0,55",157,"1.915.750,00","1.915.750,00",ALK,2020-08-31
01.09.2020,"12.200,00","12.200,00","12.200,00","12.200,00","-0,02",200,"2.440.000,00","2.440.000,00",ALK,2020-09-01
02.09.2020,"12.250,00","12.250,00","12.199,00","12.209,67","0,08",153,"1.868.080,00","1.868.080,00",ALK,2020-09-02
03.09.2020,"12.200,00","12.201,00","12.200,00","12.200,16","-0,08",320,"3.904.050,00","3.904.050,00",ALK,2020-09-03
04.09.2020,"12.250,00","12.250,00","12.200,00","12.239,76","0,32",156,"1.909.402,00","1.909.402,00",ALK,2020-09-04
07.09.2020,"12.250,00","12.251,00","12.240,00","12.248,49","0,07",367,"4.495.194,00","4.495.194,00",ALK,2020-09-07
09.09.2020,"12.300,00","12.300,00","12.250,00","12.294,63","0,38",134,"1.647.480,00","1.647.480,00",ALK,2020-09-09
10.09.2020,"12.399,00","12.399,00","12.250,00","12.331,07","0,30",141,"1.738.681,00","1.738.681,00",ALK,2020-09-10
11.09.2020,"12.630,00","12.639,00","12.350,00","12.505,62","1,42",515,"6.440.392,00","6.440.392,00",ALK,2020-09-11
14.09.2020,"12.620,00","12.660,00","12.550,00","12.604,64","0,79",239,"3.012.510,00","3.012.510,00",ALK,2020-09-14
15.09.2020,"12.650,00","12.660,00","12.599,00","12.630,53","0,21",521,"6.580.504,00","6.580.504,00",ALK,2020-09-15
16.09.2020,"12.659,00","12.659,00","12.600,00","12.646,76","0,13",131,"1.656.726,00","1.656.726,00",ALK,2020-09-16
17.09.2020,"12.800,00","12.800,00","12.662,00","12.716,27","0,55",453,"5.760.470,00","7.767.070,00",ALK,2020-09-17
18.09.2020,"12.750,00","12.999,00","12.750,00","12.834,57","0,93",591,"7.585.230,00","7.585.230,00",ALK,2020-09-18
21.09.2020,"12.800,00","12.890,00","12.800,00","12.801,76","-0,26",51,"652.890,00","652.890,00",ALK,2020-09-21
23.09.2020,"12.501,00","12.700,00","12.501,00","12.693,19","-0,85",155,"1.967.445,00","1.967.445,00",ALK,2020-09-23
24.09.2020,"12.500,00","12.501,00","12.500,00","12.500,24","-1,52",206,"2.575.050,00","2.575.050,00",ALK,2020-09-24
25.09.2020,"12.600,00","12.600,00","12.600,00","12.600,00","0,80",7,"88.200,00","88.200,00",ALK,2020-09-25
28.09.2020,"12.500,00","12.500,00","12.420,00","12.467,78","-1,05",120,"1.496.134,00","1.496.134,00",ALK,2020-09-28
29.09.2020,"12.500,00","12.500,00","12.410,00","12.480,98","0,11",52,"649.011,00","649.011,00",ALK,2020-09-29
30.09.2020,"12.500,00","12.501,00","12.500,00","12.500,05","0,15",313,"3.912.515,00","3.912.515,00",ALK,2020-09-30
01.10.2020,"12.650,00","12.690,00","12.650,00","12.676,51","1,41",146,"1.850.770,00","1.850.770,00",ALK,2020-10-01
02.10.2020,"12.640,00","12.697,00","12.640,00","12.667,43","-0,07",588,"7.448.449,00","7.448.449,00",ALK,2020-10-02
05.10.2020,"12.648,00","12.649,00","12.648,00","12.648,14","-0,15",14,"177.074,00","177.074,00",ALK,2020-10-05
06.10.2020,"12.600,00","12.600,00","12.600,00","12.600,00","-0,38",40,"504.000,00","504.000,00",ALK,2020-10-06
07.10.2020,"12.600,00","12.650,00","12.502,00","12.613,30","0,11",331,"4.175.003,00","4.175.003,00",ALK,2020-10-07
08.10.2020,"12.550,00","12.550,00","12.500,00","12.515,19","-0,78",150,"1.877.278,00","1.877.278,00",ALK,2020-10-08
09.10.2020,"12.547,00","12.547,00","12.520,00","12.544,85","0,24",105,"1.317.209,00","1.317.209,00",ALK,2020-10-09
13.10.2020,"12.400,00","12.499,00","12.380,00","12.403,54","-1,13",151,"1.872.934,00","1.872.934,00",ALK,2020-10-13
14.10.2020,"12.399,00","12.497,00","12.350,00","12.363,10","-0,33",318,"3.931.467,00","3.931.467,00",ALK,2020-10-14
15.10.2020,"12.200,00","12.300,00","12.200,00","12.209,68","-1,24",142,"1.733.775,00","1.733.775,00",ALK,2020-10-15
16.10.2020,"12.200,00","12.201,00","12.157,00","12.189,83","-0,16",230,"2.803.660,00","2.803.660,00",ALK,2020-10-16
19.10.2020,"12.200,00","12.300,00","12.200,00","12.220,40","0,25",50,"611.020,00","611.020,00",ALK,2020-10-19
20.10.2020,"12.180,00","12.200,00","12.180,00","12.198,58","-0,18",169,"2.061.560,00","2.061.560,00",ALK,2020-10-20
21.10.2020,"12.250,00","12.250,00","12.200,00","12.210,71","0,10",467,"5.702.400,00","5.702.400,00",ALK,2020-10-21
22.10.2020,"12.300,00","12.301,00","12.250,00","12.297,15","0,71",299,"3.676.847,00","3.676.847,00",ALK,2020-10-22
26.10.2020,"12.300,00","12.300,00","12.250,00","12.267,60","-0,24",169,"2.073.225,00","2.073.225,00",ALK,2020-10-26
27.10.2020,"12.300,00","12.300,00","12.250,00","12.287,68","0,16",261,"3.207.084,00","3.207.084,00",ALK,2020-10-27
28.10.2020,"12.250,00","12.300,00","12.250,00","12.297,34","0,08",41,"504.191,00","504.191,00",ALK,2020-10-28
29.10.2020,"12.249,00","12.299,00","12.230,00","12.245,48","-0,42",221,"2.706.252,00","2.706.252,00",ALK,2020-10-29
30.10.2020,"12.300,00","12.300,00","12.249,00","12.277,57","0,26",533,"6.543.944,00","6.543.944,00",ALK,2020-10-30
02.11.2020,"12.220,00","12.250,00","12.220,00","12.249,15","-0,23",410,"5.022.150,00","5.022.150,00",ALK,2020-11-02
03.11.2020,"12.100,00","12.250,00","12.100,00","12.160,72","-0,72",530,"6.445.180,00","6.445.180,00",ALK,2020-11-03
04.11.2020,"12.100,00","12.100,00","12.098,00","12.099,53","-0,50",251,"3.036.982,00","3.036.982,00",ALK,2020-11-04
05.11.2020,"12.100,00","12.200,00","12.099,00","12.107,33","0,06",136,"1.646.597,00","1.646.597,00",ALK,2020-11-05
06.11.2020,"12.100,00","12.180,00","12.080,00","12.101,69","-0,05",118,"1.428.000,00","1.428.000,00",ALK,2020-11-06
09.11.2020,"12.250,00","12.250,00","12.100,00","12.212,17","0,91",192,"2.344.736,00","2.344.736,00",ALK,2020-11-09
10.11.2020,"12.300,00","12.300,00","12.300,00","12.300,00","0,72",105,"1.291.500,00","1.291.500,00",ALK,2020-11-10
11.11.2020,"12.350,00","12.350,00","12.350,00","12.350,00","0,41",365,"4.507.750,00","4.507.750,00",ALK,2020-11-11
12.11.2020,"12.380,00","12.380,00","12.380,00","12.380,00","0,24",100,"1.238.000,00","1.238.000,00",ALK,2020-11-12
13.11.2020,"12.350,00","12.350,00","12.350,00","12.350,00","-0,24",64,"790.400,00","790.400,00",ALK,2020-11-13
16.11.2020,"12.320,00","12.350,00","12.320,00","12.343,55","-0,05",93,"1.147.950,00","1.147.950,00",ALK,2020-11-16
17.11.2020,"12.300,00","12.300,00","12.300,00","12.300,00","-0,35",10,"123.000,00","123.000,00",ALK,2020-11-17
18.11.2020,"12.300,00","12.340,00","12.300,00","12.323,26","0,19",43,"529.900,00","529.900,00",ALK,2020-11-18
19.11.2020,"12.500,00","12.500,00","12.349,00","12.411,57","0,72",293,"3.636.590,00","3.636.590,00",ALK,2020-11-19
20.11.2020,"12.499,00","12.499,00","12.499,00","12.499,00","0,70",29,"362.471,00","362.471,00",ALK,2020-11-20
23.11.2020,"12.500,00","12.549,00","12.499,00","12.510,99","0,10",138,"1.726.516,00","1.726.516,00",ALK,2020-11-23
24.11.2020,"12.602,00","12.650,00","12.548,00","12.589,96","0,63",593,"7.465.844,00","7.465.844,00",ALK,2020-11-24
25.11.2020,"12.598,00","12.599,00","12.595,00","12.598,22","0,07",96,"1.209.429,00","1.209.429,00",ALK,2020-11-25
27.11.2020,"12.595,00","12.595,00","12.594,00","12.594,81","-0,03",131,"1.649.920,00","1.649.920,00",ALK,2020-11-27
30.11.2020,"12.500,00","12.500,00","12.500,00","12.500,00","-0,75",22,"275.000,00","275.000,00",ALK,2020-11-30
01.12.2020,"12.500,00","12.500,00","12.311,00","12.498,17","-0,01",103,"1.287.311,00","1.287.311,00",ALK,2020-12-01
02.12.2020,"12.550,00","12.550,00","12.355,00","12.527,87","0,24",324,"4.059.030,00","4.059.030,00",ALK,2020-12-02
03.12.2020,"12.550,00","12.550,00","12.500,00","12.525,00","-0,02",26,"325.650,00","325.650,00",ALK,2020-12-03
04.12.2020,"12.550,00","12.590,00","12.550,00","12.550,83","0,21",290,"3.639.740,00","3.639.740,00",ALK,2020-12-04
07.12.2020,"12.500,00","12.549,00","12.500,00","12.546,91","-0,03",234,"2.935.976,00","2.935.976,00",ALK,2020-12-07
09.12.2020,"12.500,00","12.548,00","12.500,00","12.517,63","-0,23",98,"1.226.728,00","1.226.728,00",ALK,2020-12-09
10.12.2020,"12.500,00","12.500,00","12.500,00","12.500,00","-0,14",150,"1.875.000,00","1.875.000,00",ALK,2020-12-10
11.12.2020,"12.500,00","12.500,00","12.500,00","12.500,00","0,00",160,"2.000.000,00","2.000.000,00",ALK,2020-12-11
14.12.2020,"12.421,00","12.500,00","12.421,00","12.497,34","-0,02",208,"2.599.446,00","2.599.446,00",ALK,2020-12-14
15.12.2020,"12.600,00","12.600,00","12.500,00","12.519,77","0,18",220,"2.754.350,00","2.754.350,00",ALK,2020-12-15
16.12.2020,"12.600,00","12.600,00","12.550,00","12.597,25","0,62",91,"1.146.350,00","1.146.350,00",ALK,2020-12-16
17.12.2020,"12.611,00","12.700,00","12.599,00","12.613,60","0,13",590,"7.442.022,00","22.171.422,00",ALK,2020-12-17
18.12.2020,"12.800,00","12.800,00","12.650,00","12.699,34","0,68",80,"1.015.947,00","1.015.947,00",ALK,2020-12-18
21.12.2020,"12.800,00","12.830,00","12.720,00","12.798,66","0,78",73,"934.302,00","934.302,00",ALK,2020-12-21
22.12.2020,"12.700,00","12.800,00","12.700,00","12.781,32","-0,14",120,"1.533.759,00","1.533.759,00",ALK,2020-12-22
23.12.2020,"12.800,00","12.800,00","12.730,00","12.797,13","0,12",230,"2.943.340,00","2.943.340,00",ALK,2020-12-23
24.12.2020,"12.850,00","12.850,00","12.800,00","12.846,58","0,39",73,"937.800,00","937.800,00",ALK,2020-12-24
25.12.2020,"12.990,00","12.990,00","12.900,00","12.957,95","0,87",44,"570.150,00","570.150,00",ALK,2020-12-25
28.12.2020,"13.099,00","13.099,00","12.990,00","13.019,77","0,48",60,"781.186,00","781.186,00",ALK,2020-12-28
29.12.2020,"13.200,00","13.201,00","13.199,00","13.199,55","1,38",337,"4.448.250,00","4.448.250,00",ALK,2020-12-29
30.12.2020,"13.200,00","13.499,00","13.200,00","13.206,98","0,06",343,"4.529.995,00","4.529.995,00",ALK,2020-12-30
05.01.2021,"13.300,00","13.350,00","13.300,00","13.341,38","1,02",58,"773.800,00","773.800,00",ALK,2021-01-05
08.01.2021,"13.353,00","13.400,00","13.328,00","13.384,44","0,32",101,"1.351.828,00","1.351.828,00",ALK,2021-01-08
11.01.2021,"13.497,00","13.497,00","13.400,00","13.404,88","0,15",428,"5.737.287,00","5.737.287,00",ALK,2021-01-11
12.01.2021,"13.652,00","13.750,00","13.500,00","13.563,71","1,18",449,"6.090.105,00","6.090.105,00",ALK,2021-01-12
13.01.2021,"13.850,00","13.900,00","13.650,00","13.817,00","1,87",657,"9.077.769,00","9.077.769,00",ALK,2021-01-13
14.01.2021,"13.977,00","14.000,00","13.950,00","13.986,41","1,23",425,"5.944.225,00","17.604.835,00",ALK,2021-01-14
15.01.2021,"13.800,00","14.000,00","13.790,00","13.872,12","-0,82",346,"4.799.754,00","4.799.754,00",ALK,2021-01-15
18.01.2021,"13.880,00","13.880,00","13.801,00","13.875,89","0,03",96,"1.332.085,00","1.332.085,00",ALK,2021-01-18
20.01.2021,"13.800,00","13.800,00","13.700,00","13.778,57","-0,70",168,"2.314.800,00","2.314.800,00",ALK,2021-01-20
21.01.2021,"13.750,00","13.789,00","13.701,00","13.759,07","-0,14",356,"4.898.230,00","4.898.230,00",ALK,2021-01-21
22.01.2021,"13.800,00","13.800,00","13.661,00","13.712,70","-0,34",70,"959.889,00","959.889,00",ALK,2021-01-22
25.01.2021,"13.650,00","13.700,00","13.650,00","13.694,38","-0,13",32,"438.220,00","438.220,00",ALK,2021-01-25
26.01.2021,"13.629,00","13.630,00","13.600,00","13.625,51","-0,50",180,"2.452.592,00","10.866.322,00",ALK,2021-01-26
27.01.2021,"13.750,00","13.750,00","13.650,00","13.683,93","0,43",56,"766.300,00","766.300,00",ALK,2021-01-27
28.01.2021,"13.800,00","13.880,00","13.800,00","13.810,93","0,93",427,"5.897.268,00","5.897.268,00",ALK,2021-01-28
29.01.2021,"13.750,00","13.799,00","13.750,00","13.765,32","-0,33",174,"2.395.166,00","2.395.166,00",ALK,2021-01-29
01.02.2021,"13.750,00","13.810,00","13.750,00","13.761,40","-0,03",107,"1.472.470,00","1.472.470,00",ALK,2021-02-01
02.02.2021,"13.651,00","13.700,00","13.651,00","13.697,99","-0,46",73,"999.953,00","999.953,00",ALK,2021-02-02
03.02.2021,"13.700,00","13.710,00","13.700,00","13.700,24","0,02",424,"5.808.900,00","5.808.900,00",ALK,2021-02-03
04.02.2021,"13.700,00","13.700,00","13.700,00","13.700,00","0,00",42,"575.400,00","575.400,00",ALK,2021-02-04
05.02.2021,"13.750,00","13.750,00","13.700,00","13.733,16","0,24",297,"4.078.750,00","4.078.750,00",ALK,2021-02-05
08.02.2021,"13.791,00","13.791,00","13.780,00","13.786,85","0,39",234,"3.226.122,00","3.226.122,00",ALK,2021-02-08
09.02.2021,"13.900,00","13.900,00","13.810,00","13.876,39","0,65",238,"3.302.580,00","3.302.580,00",ALK,2021-02-09
10.02.2021,"13.901,00","13.940,00","13.900,00","13.900,95","0,18",292,"4.059.078,00","4.059.078,00",ALK,2021-02-10
11.02.2021,"13.900,00","13.950,00","13.900,00","13.913,50","0,09",632,"8.793.333,00","8.793.333,00",ALK,2021-02-11
12.02.2021,"13.900,00","13.900,00","13.900,00","13.900,00","-0,10",44,"611.600,00","611.600,00",ALK,2021-02-12
15.02.2021,"13.950,00","13.989,00","13.850,00","13.948,61","0,35",38,"530.047,00","530.047,00",ALK,2021-02-15
16.02.2021,"13.989,00","13.990,00","13.989,00","13.989,67","0,29",88,"1.231.091,00","1.231.091,00",ALK,2021-02-16
17.02.2021,"13.830,00","13.990,00","13.830,00","13.971,10","-0,13",109,"1.522.850,00","1.522.850,00",ALK,2021-02-17
18.02.2021,"13.965,00","13.970,00","13.850,00","13.938,89","-0,23",122,"1.700.544,00","1.700.544,00",ALK,2021-02-18
19.02.2021,"13.851,00","13.851,00","13.851,00","13.851,00","-0,63",9,"124.659,00","124.659,00",ALK,2021-02-19
22.02.2021,"13.900,00","13.900,00","13.800,00","13.804,24","-0,34",943,"13.017.403,00","13.017.403,00",ALK,2021-02-22
23.02.2021,"13.900,00","13.900,00","13.801,00","13.887,73","0,60",122,"1.694.303,00","1.694.303,00",ALK,2021-02-23
24.02.2021,"13.985,00","14.000,00","13.901,00","13.970,84","0,60",486,"6.789.828,00","6.789.828,00",ALK,2021-02-24
25.02.2021,"14.000,00","14.000,00","13.999,00","13.999,79","0,21",286,"4.003.940,00","4.003.940,00",ALK,2021-02-25
26.02.2021,"14.000,00","14.001,00","13.999,00","13.999,58","0,00",306,"4.283.872,00","4.283.872,00",ALK,2021-02-26
01.03.2021,"14.100,00","14.110,00","14.000,00","14.056,61","0,41",546,"7.674.910,00","7.674.910,00",ALK,2021-03-01
02.03.2021,"14.250,00","14.250,00","14.110,00","14.223,94","1,19",327,"4.651.227,00","4.651.227,00",ALK,2021-03-02
03.03.2021,"14.500,00","14.530,00","14.113,00","14.360,00","0,96",445,"6.390.200,00","6.390.200,00",ALK,2021-03-03
04.03.2021,"14.450,00","14.500,00","14.350,00","14.457,80","0,68",91,"1.315.660,00","1.315.660,00",ALK,2021-03-04
05.03.2021,"14.349,00","14.450,00","14.300,00","14.357,77","-0,69",179,"2.570.041,00","2.570.041,00",ALK,2021-03-05
08.03.2021,"14.000,00","14.458,00","14.000,00","14.042,53","-2,20",298,"4.184.675,00","4.184.675,00",ALK,2021-03-08
09.03.2021,"14.105,00","14.105,00","14.000,00","14.036,99","-0,04",103,"1.445.810,00","1.445.810,00",ALK,2021-03-09
10.03.2021,"14.010,00","14.010,00","13.999,00","14.004,04","-0,23",335,"4.691.354,00","4.691.354,00",ALK,2021-03-10
11.03.2021,"14.010,00","14.010,00","14.000,00","14.006,92","0,02",117,"1.638.810,00","1.638.810,00",ALK,2021-03-11
12.03.2021,"14.000,00","14.010,00","14.000,00","14.002,88","-0,03",358,"5.013.030,00","5.013.030,00",ALK,2021-03-12
15.03.2021,"14.010,00","14.010,00","14.000,00","14.002,61","0,00",46,"644.120,00","644.120,00",ALK,2021-03-15
16.03.2021,"14.006,00","14.100,00","14.001,00","14.031,87","0,21",69,"968.199,00","968.199,00",ALK,2021-03-16
18.03.2021,"14.027,00","14.100,00","14.027,00","14.045,23","0,10",26,"365.176,00","365.176,00",ALK,2021-03-18
19.03.2021,"14.111,00","14.111,00","14.050,00","14.096,90","0,37",221,"3.115.414,00","3.115.414,00",ALK,2021-03-19
22.03.2021,"14.160,00","14.200,00","14.150,00","14.157,58","0,43",135,"1.911.273,00","1.911.273,00",ALK,2021-03-22
23.03.2021,"14.200,00","14.200,00","14.160,00","14.198,61","0,29",154,"2.186.586,00","2.186.586,00",ALK,2021-03-23
24.03.2021,"14.200,00","14.250,00","14.200,00","14.201,58","0,02",158,"2.243.850,00","2.243.850,00",ALK,2021-03-24
25.03.2021,"14.161,00","14.200,00","14.161,00","14.188,78","-0,09",135,"1.915.485,00","1.915.485,00",ALK,2021-03-25
26.03.2021,"14.221,00","14.221,00","14.161,00","14.202,00","0,09",28,"397.656,00","397.656,00",ALK,2021-03-26
31.03.2021,"14.300,00","14.300,00","14.265,00","14.294,12","0,65",119,"1.701.000,00","1.701.000,00",ALK,2021-03-31
01.04.2021,"14.450,00","14.450,00","14.440,00","14.449,74","1,09",78,"1.127.080,00","1.127.080,00",ALK,2021-04-01
02.04.2021,"14.501,00","14.501,00","14.440,00","14.474,66","0,17",175,"2.533.065,00","2.533.065,00",ALK,2021-04-02
05.04.2021,"14.799,00","14.800,00","14.500,00","14.668,32","1,34",123,"1.804.203,00","1.804.203,00",ALK,2021-04-05
06.04.2021,"14.650,00","14.700,00","14.650,00","14.681,83","0,09",176,"2.584.002,00","2.584.002,00",ALK,2021-04-06
07.04.2021,"14.600,00","14.698,00","14.600,00","14.681,54","0,00",149,"2.187.550,00","2.187.550,00",ALK,2021-04-07
08.04.2021,"14.800,00","14.800,00","14.681,00","14.710,10","0,19","1,152","16.946.040,00","16.946.040,00",ALK,2021-04-08
09.04.2021,"14.850,00","14.850,00","14.800,00","14.801,39","0,62",397,"5.876.150,00","5.876.150,00",ALK,2021-04-09
12.04.2021,"14.800,00","14.850,00","14.800,00","14.808,37","0,05",209,"3.094.950,00","3.094.950,00",ALK,2021-04-12
13.04.2021,"14.900,00","14.910,00","14.750,00","14.889,03","0,54",344,"5.121.825,00","5.121.825,00",ALK,2021-04-13
14.04.2021,"15.100,00","15.100,00","14.999,00","15.017,91","0,87",444,"6.667.950,00","6.667.950,00",ALK,2021-04-14
15.04.2021,"15.050,00","15.100,00","15.050,00","15.077,03","0,39",111,"1.673.550,00","1.673.550,00",ALK,2021-04-15
16.04.2021,"15.100,00","15.100,00","15.001,00","15.059,07","-0,12",585,"8.809.557,00","8.809.557,00",ALK,2021-04-16
19.04.2021,"15.200,00","15.200,00","15.100,00","15.125,53","0,44",427,"6.458.600,00","6.458.600,00",ALK,2021-04-19
20.04.2021,"15.101,00","15.289,00","15.101,00","15.191,31","0,43",387,"5.879.037,00","5.879.037,00",ALK,2021-04-20
21.04.2021,"14.900,00","14.950,00","14.900,00","14.920,73","-1,78",150,"2.238.110,00","2.238.110,00",ALK,2021-04-21
22.04.2021,"14.890,00","14.900,00","14.851,00","14.894,78","-0,17",238,"3.544.958,00","3.544.958,00",ALK,2021-04-22
23.04.2021,"14.801,00","14.890,00","14.801,00","14.840,31","-0,37",241,"3.576.515,00","3.576.515,00",ALK,2021-04-23
26.04.2021,"14.770,00","14.810,00","14.770,00","14.800,59","-0,27",170,"2.516.100,00","2.516.100,00",ALK,2021-04-26
27.04.2021,"14.820,00","14.820,00","14.800,00","14.817,15","0,11",239,"3.541.300,00","3.541.300,00",ALK,2021-04-27
28.04.2021,"14.850,00","14.850,00","14.802,00","14.821,46","0,03",37,"548.394,00","548.394,00",ALK,2021-04-28
29.04.2021,"14.972,00","15.000,00","14.950,00","14.972,15","1,02",13,"194.638,00","194.638,00",ALK,2021-04-29
04.05.2021,"15.000,00","15.000,00","15.000,00","15.000,00","0,19",20,"300.000,00","300.000,00",ALK,2021-05-04
05.05.2021,"14.949,00","14.999,00","14.945,00","14.954,00","-0,31",34,"508.436,00","508.436,00",ALK,2021-05-05
06.05.2021,"14.948,00","14.949,00","14.901,00","14.946,12","-0,05",146,"2.182.134,00","2.182.134,00",ALK,2021-05-06
07.05.2021,"14.990,00","14.990,00","14.950,00","14.957,71","0,08",109,"1.630.390,00","1.630.390,00",ALK,2021-05-07
10.05.2021,"15.000,00","15.000,00","14.955,00","14.999,40","0,28",534,"8.009.680,00","8.009.680,00",ALK,2021-05-10
11.05.2021,"15.050,00","15.050,00","15.002,00","15.018,81","0,13",203,"3.048.819,00","5.718.819,00",ALK,2021-05-11
12.05.2021,"15.150,00","15.280,00","15.061,00","15.103,83","0,57",245,"3.700.439,00","3.700.439,00",ALK,2021-05-12
14.05.2021,"15.300,00","15.300,00","15.260,00","15.280,00","1,17",20,"305.600,00","305.600,00",ALK,2021-05-14
17.05.2021,"15.300,00","15.300,00","15.190,00","15.274,37","-0,04",413,"6.308.314,00","6.308.314,00",ALK,2021-05-17
18.05.2021,"15.401,00","15.401,00","15.400,00","15.400,06","0,82",170,"2.618.010,00","2.618.010,00",ALK,2021-05-18
19.05.2021,"15.579,00","15.579,00","15.400,00","15.525,28","0,81",151,"2.344.318,00","2.344.318,00",ALK,2021-05-19
20.05.2021,"15.799,00","15.800,00","15.559,00","15.641,09","0,75",338,"5.286.690,00","5.286.690,00",ALK,2021-05-20
21.05.2021,"15.850,00","16.000,00","15.797,00","15.887,67","1,58",410,"6.513.946,00","6.513.946,00",ALK,2021-05-21
25.05.2021,"15.879,00","15.881,00","15.850,00","15.877,72","-0,06",241,"3.826.531,00","3.826.531,00",ALK,2021-05-25
26.05.2021,"15.705,00","15.880,00","15.652,00","15.817,41","-0,38",259,"4.096.709,00","4.096.709,00",ALK,2021-05-26
27.05.2021,"15.750,00","15.755,00","15.750,00","15.752,26","-0,41",124,"1.953.280,00","1.953.280,00",ALK,2021-05-27
28.05.2021,"15.648,00","15.651,00","15.645,00","15.646,92","-0,67",200,"3.129.383,00","3.129.383,00",ALK,2021-05-28
31.05.2021,"15.797,00","15.797,00","15.748,00","15.753,21","0,68",100,"1.575.321,00","1.575.321,00",ALK,2021-05-31
01.06.2021,"15.800,00","15.880,00","15.740,00","15.756,08","0,02",828,"13.046.031,00","13.046.031,00",ALK,2021-06-01
02.06.2021,"15.801,00","15.801,00","15.799,00","15.799,85","0,28",54,"853.192,00","853.192,00",ALK,2021-06-02
03.06.2021,"15.901,00","15.920,00","15.880,00","15.901,33","0,64",743,"11.814.687,00","11.814.687,00",ALK,2021-06-03
04.06.2021,"15.998,00","15.998,00","15.950,00","15.973,58","0,45",208,"3.322.504,00","3.322.504,00",ALK,2021-06-04
07.06.2021,"16.000,00","16.000,00","15.970,00","15.996,49","0,14",330,"5.278.842,00","5.278.842,00",ALK,2021-06-07
08.06.2021,"16.108,00","16.150,00","16.000,00","16.074,59","0,49",153,"2.459.412,00","2.459.412,00",ALK,2021-06-08
09.06.2021,"16.350,00","16.350,00","16.200,00","16.261,75","1,16",151,"2.455.524,00","7.932.324,00",ALK,2021-06-09
10.06.2021,"16.399,00","16.500,00","16.251,00","16.447,47","1,14",626,"10.296.117,00","10.296.117,00",ALK,2021-06-10
11.06.2021,"16.450,00","16.450,00","16.446,00","16.449,66","0,01",456,"7.501.045,00","7.501.045,00",ALK,2021-06-11
14.06.2021,"16.300,00","16.450,00","16.300,00","16.325,55","-0,75",317,"5.175.200,00","5.175.200,00",ALK,2021-06-14
15.06.2021,"16.200,00","16.265,00","16.200,00","16.250,23","-0,46",158,"2.567.537,00","2.567.537,00",ALK,2021-06-15
16.06.2021,"16.120,00","16.199,00","16.120,00","16.149,63","-0,62",68,"1.098.175,00","1.098.175,00",ALK,2021-06-16
17.06.2021,"16.200,00","16.200,00","16.120,00","16.198,49","0,30",237,"3.839.042,00","3.839.042,00",ALK,2021-06-17
21.06.2021,"15.971,00","16.201,00","15.971,00","16.020,26","-1,10",387,"6.199.841,00","6.199.841,00",ALK,2021-06-21
22.06.2021,"15.971,00","15.999,00","15.971,00","15.972,93","-0,30",218,"3.482.098,00","3.482.098,00",ALK,2021-06-22
23.06.2021,"15.700,00","15.800,00","15.700,00","15.796,46","-1,10",57,"900.398,00","900.398,00",ALK,2021-06-23
24.06.2021,"15.600,00","15.800,00","15.500,00","15.523,22","-1,73",319,"4.951.906,00","4.951.906,00",ALK,2021-06-24
25.06.2021,"15.450,00","15.500,00","15.450,00","15.494,28","-0,19",166,"2.572.050,00","2.572.050,00",ALK,2021-06-25
28.06.2021,"15.440,00","15.440,00","15.440,00","15.440,00","-0,35",2,"30.880,00","30.880,00",ALK,2021-06-28
29.06.2021,"15.500,00","15.500,00","15.400,00","15.404,35","-0,23",115,"1.771.500,00","1.771.500,00",ALK,2021-06-29
30.06.2021,"15.500,00","15.500,00","15.500,00","15.500,00","0,62",164,"2.542.000,00","2.542.000,00",ALK,2021-06-30
01.07.2021,"15.550,00","15.550,00","15.550,00","15.550,00","0,32",23,"357.650,00","357.650,00",ALK,2021-07-01
02.07.2021,"15.800,00","15.800,00","15.600,00","15.726,96","1,14",230,"3.617.200,00","3.617.200,00",ALK,2021-07-02
05.07.2021,"16.000,00","16.000,00","15.710,00","15.989,85","1,67","1,089","17.412.946,00","17.412.946,00",ALK,2021-07-05
06.07.2021,"16.000,00","16.000,00","15.998,00","15.999,86","0,06",124,"1.983.983,00","1.983.983,00",ALK,2021-07-06
07.07.2021,"16.004,00","16.004,00","16.000,00","16.001,62","0,01",32,"512.052,00","512.052,00",ALK,2021-07-07
08.07.2021,"16.005,00","16.199,00","16.000,00","16.027,18","0,16",171,"2.740.647,00","2.740.647,00",ALK,2021-07-08
09.07.2021,"16.000,00","16.000,00","15.910,00","15.968,76","-0,36",150,"2.395.314,00","2.395.314,00",ALK,2021-07-09
12.07.2021,"16.000,00","16.001,00","16.000,00","16.000,32","0,20",31,"496.010,00","496.010,00",ALK,2021-07-12
15.07.2021,"16.000,00","16.000,00","15.900,00","15.998,67","-0,01",154,"2.463.795,00","2.463.795,00",ALK,2021-07-15
16.07.2021,"16.000,00","16.000,00","15.999,00","15.999,78","0,01",114,"1.823.975,00","1.823.975,00",ALK,2021-07-16
19.07.2021,"15.850,00","15.900,00","15.850,00","15.895,36","-0,65",11,"174.849,00","174.849,00",ALK,2021-07-19
21.07.2021,"15.600,00","15.600,00","15.600,00","15.600,00","-1,86",2,"31.200,00","31.200,00",ALK,2021-07-21
22.07.2021,"15.800,00","15.800,00","15.654,00","15.758,08","1,01",173,"2.726.148,00","2.726.148,00",ALK,2021-07-22
23.07.2021,"15.750,00","15.850,00","15.750,00","15.787,50","0,19",32,"505.200,00","505.200,00",ALK,2021-07-23
26.07.2021,"15.750,00","15.750,00","15.750,00","15.750,00","-0,24",60,"945.000,00","945.000,00",ALK,2021-07-26
27.07.2021,"15.750,00","15.750,00","15.750,00","15.750,00","0,00",146,"2.299.500,00","2.299.500,00",ALK,2021-07-27
28.07.2021,"15.750,00","15.750,00","15.700,00","15.747,22","-0,02",37,"582.647,00","582.647,00",ALK,2021-07-28
29.07.2021,"15.800,00","15.878,00","15.761,00","15.777,06","0,19",187,"2.950.310,00","2.950.310,00",ALK,2021-07-29
30.07.2021,"15.800,00","15.800,00","15.799,00","15.799,93","0,14",57,"900.596,00","900.596,00",ALK,2021-07-30
03.08.2021,"15.800,00","15.900,00","15.800,00","15.810,00","0,06",92,"1.454.520,00","1.454.520,00",ALK,2021-08-03
04.08.2021,"15.800,00","15.800,00","15.799,00","15.799,99","-0,06",190,"3.001.999,00","3.001.999,00",ALK,2021-08-04
05.08.2021,"15.800,00","15.850,00","15.800,00","15.823,48","0,15",66,"1.044.350,00","1.044.350,00",ALK,2021-08-05
06.08.2021,"16.000,00","16.000,00","15.900,00","15.983,12","1,01",77,"1.230.700,00","1.230.700,00",ALK,2021-08-06
09.08.2021,"16.000,00","16.000,00","16.000,00","16.000,00","0,11",8,"128.000,00","7.312.000,00",ALK,2021-08-09
10.08.2021,"16.000,00","16.200,00","16.000,00","16.103,57","0,65",256,"4.122.514,00","4.122.514,00",ALK,2021-08-10
11.08.2021,"15.910,00","16.000,00","15.910,00","15.997,91","-0,66",43,"687.910,00","687.910,00",ALK,2021-08-11
12.08.2021,"15.900,00","15.910,00","15.900,00","15.900,50","-0,61",634,"10.080.915,00","10.080.915,00",ALK,2021-08-12
13.08.2021,"15.900,00","15.900,00","15.900,00","15.900,00","0,00",8,"127.200,00","127.200,00",ALK,2021-08-13
16.08.2021,"16.000,00","16.000,00","15.799,00","15.904,37","0,03",194,"3.085.447,00","3.085.447,00",ALK,2021-08-16
17.08.2021,"16.100,00","16.100,00","16.000,00","16.093,22","1,19",118,"1.899.000,00","1.899.000,00",ALK,2021-08-17
18.08.2021,"16.200,00","16.300,00","16.100,00","16.193,55","0,62",186,"3.012.000,00","3.012.000,00",ALK,2021-08-18
19.08.2021,"16.150,00","16.155,00","16.100,00","16.112,81","-0,50",326,"5.252.775,00","5.252.775,00",ALK,2021-08-19
20.08.2021,"16.200,00","16.200,00","16.100,00","16.168,75","0,35",32,"517.400,00","517.400,00",ALK,2021-08-20
23.08.2021,"16.300,00","16.300,00","16.250,00","16.280,31","0,69",196,"3.190.940,00","3.190.940,00",ALK,2021-08-23
24.08.2021,"16.600,00","16.600,00","16.250,00","16.363,93","0,51",427,"6.987.399,00","6.987.399,00",ALK,2021-08-24
25.08.2021,"16.700,00","16.850,00","16.650,00","16.674,40","1,90",84,"1.400.650,00","1.400.650,00",ALK,2021-08-25
26.08.2021,"16.651,00","16.800,00","16.650,00","16.746,18","0,43",39,"653.101,00","653.101,00",ALK,2021-08-26
27.08.2021,"16.900,00","16.900,00","16.652,00","16.811,78","0,39",107,"1.798.860,00","1.798.860,00",ALK,2021-08-27
30.08.2021,"16.813,00","16.814,00","16.804,00","16.812,39","0,00",49,"823.807,00","823.807,00",ALK,2021-08-30
31.08.2021,"17.000,00","17.000,00","16.900,00","16.919,69","0,64",81,"1.370.495,00","1.370.495,00",ALK,2021-08-31
01.09.2021,"16.910,00","16.910,00","16.910,00","16.910,00","-0,06",2,"33.820,00","33.820,00",ALK,2021-09-01
02.09.2021,"17.300,00","17.350,00","16.951,00","17.135,34","1,33",136,"2.330.406,00","2.330.406,00",ALK,2021-09-02
03.09.2021,"17.410,00","17.410,00","17.410,00","17.410,00","1,60",24,"417.840,00","417.840,00",ALK,2021-09-03
06.09.2021,"17.600,00","17.600,00","17.401,00","17.517,02","0,61",84,"1.471.430,00","1.471.430,00",ALK,2021-09-06
07.09.2021,"18.000,00","18.000,00","17.600,00","17.966,19","2,56",258,"4.635.276,00","4.635.276,00",ALK,2021-09-07
09.09.2021,"18.350,00","18.350,00","17.950,00","18.005,47","0,22",283,"5.095.547,00","5.095.547,00",ALK,2021-09-09
10.09.2021,"18.000,00","18.300,00","18.000,00","18.007,98","0,01",895,"16.117.142,00","16.117.142,00",ALK,2021-09-10
13.09.2021,"17.898,00","18.010,00","17.898,00","17.943,42","-0,36",361,"6.477.575,00","6.477.575,00",ALK,2021-09-13
14.09.2021,"17.799,00","17.800,00","17.600,00","17.692,09","-1,40",91,"1.609.980,00","1.609.980,00",ALK,2021-09-14
15.09.2021,"17.551,00","17.699,00","17.550,00","17.554,66","-0,78",167,"2.931.628,00","2.931.628,00",ALK,2021-09-15
16.09.2021,"17.250,00","17.500,00","17.247,00","17.303,50","-1,43",208,"3.599.129,00","3.599.129,00",ALK,2021-09-16
17.09.2021,"16.750,00","17.200,00","16.650,00","16.838,65","-2,69",653,"10.995.636,00","10.995.636,00",ALK,2021-09-17
20.09.2021,"16.099,00","16.851,00","16.099,00","16.560,90","-1,65",288,"4.769.538,00","4.769.538,00",ALK,2021-09-20
21.09.2021,"16.700,00","16.700,00","15.987,00","16.211,68","-2,11",560,"9.078.538,00","9.078.538,00",ALK,2021-09-21
22.09.2021,"16.998,00","16.998,00","16.500,00","16.739,26","3,25",398,"6.662.227,00","6.662.227,00",ALK,2021-09-22
23.09.2021,"17.200,00","17.200,00","17.000,00","17.143,23","2,41",229,"3.925.800,00","3.925.800,00",ALK,2021-09-23
24.09.2021,"17.000,00","17.010,00","16.999,00","17.000,88","-0,83",443,"7.531.388,00","7.531.388,00",ALK,2021-09-24
27.09.2021,"17.250,00","17.250,00","17.200,00","17.217,74","1,28",31,"533.750,00","533.750,00",ALK,2021-09-27
28.09.2021,"17.200,00","17.210,00","17.031,00","17.199,34","-0,11",105,"1.805.931,00","1.805.931,00",ALK,2021-09-28
29.09.2021,"17.010,00","17.010,00","17.010,00","17.010,00","-1,10",60,"1.020.600,00","1.020.600,00",ALK,2021-09-29
30.09.2021,"17.200,00","17.200,00","17.000,00","17.114,19","0,61",183,"3.131.897,00","3.131.897,00",ALK,2021-09-30
01.10.2021,"17.000,00","17.200,00","17.000,00","17.022,08","-0,54",154,"2.621.401,00","2.621.401,00",ALK,2021-10-01
04.10.2021,"16.960,00","17.000,00","16.710,00","16.962,75","-0,35",40,"678.510,00","678.510,00",ALK,2021-10-04
05.10.2021,"16.952,00","17.000,00","16.950,00","16.951,62","-0,07",113,"1.915.533,00","1.915.533,00",ALK,2021-10-05
06.10.2021,"16.700,00","17.000,00","16.700,00","16.966,98","0,09",430,"7.295.802,00","9.299.802,00",ALK,2021-10-06
07.10.2021,"16.550,00","16.700,00","16.550,00","16.698,59","-1,58",331,"5.527.233,00","5.527.233,00",ALK,2021-10-07
08.10.2021,"16.700,00","16.700,00","16.700,00","16.700,00","0,01",23,"384.100,00","384.100,00",ALK,2021-10-08
12.10.2021,"17.000,00","17.000,00","16.500,00","16.926,43","1,36",385,"6.516.676,00","6.516.676,00",ALK,2021-10-12
13.10.2021,"17.200,00","17.200,00","17.000,00","17.002,72","0,45",224,"3.808.610,00","3.808.610,00",ALK,2021-10-13
14.10.2021,"17.300,00","17.399,00","17.135,00","17.290,35","1,69",155,"2.680.005,00","2.680.005,00",ALK,2021-10-14
15.10.2021,"17.400,00","17.400,00","17.396,00","17.399,36","0,63",173,"3.010.090,00","3.010.090,00",ALK,2021-10-15
18.10.2021,"17.500,00","17.500,00","17.256,00","17.426,35","0,16",162,"2.823.068,00","2.823.068,00",ALK,2021-10-18
19.10.2021,"17.601,00","17.601,00","17.499,00","17.544,42","0,68",289,"5.070.337,00","5.070.337,00",ALK,2021-10-19
20.10.2021,"17.701,00","17.790,00","17.650,00","17.687,40","0,81",144,"2.546.986,00","2.546.986,00",ALK,2021-10-20
21.10.2021,"17.750,00","17.798,00","17.749,00","17.752,18","0,37",255,"4.526.805,00","4.526.805,00",ALK,2021-10-21
22.10.2021,"17.900,00","17.901,00","17.750,00","17.849,86","0,55",499,"8.907.080,00","8.907.080,00",ALK,2021-10-22
25.10.2021,"17.900,00","18.000,00","17.900,00","17.974,44","0,70",277,"4.978.920,00","4.978.920,00",ALK,2021-10-25
26.10.2021,"17.900,00","17.900,00","17.800,00","17.831,06","-0,80",182,"3.245.253,00","3.245.253,00",ALK,2021-10-26
27.10.2021,"17.700,00","17.899,00","17.700,00","17.818,52","-0,07",264,"4.704.090,00","4.704.090,00",ALK,2021-10-27
28.10.2021,"17.800,00","17.801,00","17.800,00","17.800,13","-0,10",76,"1.352.810,00","1.352.810,00",ALK,2021-10-28
29.10.2021,"17.799,00","17.799,00","17.799,00","17.799,00","-0,01",20,"355.980,00","355.980,00",ALK,2021-10-29
01.11.2021,"17.799,00","17.799,00","17.551,00","17.696,71","-0,57",108,"1.911.245,00","1.911.245,00",ALK,2021-11-01
02.11.2021,"17.750,00","17.750,00","17.601,00","17.671,48","-0,14",122,"2.155.920,00","2.155.920,00",ALK,2021-11-02
03.11.2021,"17.526,00","17.526,00","17.525,00","17.525,09","-0,83",11,"192.776,00","192.776,00",ALK,2021-11-03
04.11.2021,"17.550,00","17.561,00","17.550,00","17.552,99","0,16",769,"13.498.247,00","13.498.247,00",ALK,2021-11-04
05.11.2021,"17.551,00","17.551,00","17.502,00","17.544,33","-0,05",118,"2.070.231,00","2.070.231,00",ALK,2021-11-05
08.11.2021,"17.350,00","17.550,00","17.350,00","17.498,37","-0,26",248,"4.339.595,00","4.339.595,00",ALK,2021-11-08
09.11.2021,"16.995,00","17.200,00","16.995,00","17.014,92","-2,76",59,"1.003.880,00","1.003.880,00",ALK,2021-11-09
10.11.2021,"17.004,00","17.004,00","16.900,00","16.999,59","-0,09",658,"11.185.729,00","11.185.729,00",ALK,2021-11-10
11.11.2021,"17.650,00","17.700,00","17.010,00","17.617,45","3,63",261,"4.598.154,00","4.598.154,00",ALK,2021-11-11
12.11.2021,"17.200,00","17.649,00","17.200,00","17.397,93","-1,25",73,"1.270.049,00","1.270.049,00",ALK,2021-11-12
15.11.2021,"17.400,00","17.400,00","17.300,00","17.385,24","-0,07",82,"1.425.590,00","1.425.590,00",ALK,2021-11-15
16.11.2021,"17.350,00","17.400,00","17.300,00","17.350,00","-0,20",25,"433.750,00","433.750,00",ALK,2021-11-16
17.11.2021,"17.500,00","17.500,00","17.490,00","17.499,45","0,86",87,"1.522.452,00","1.522.452,00",ALK,2021-11-17
18.11.2021,"17.570,00","17.570,00","17.500,00","17.519,60","0,12",25,"437.990,00","437.990,00",ALK,2021-11-18
19.11.2021,"17.580,00","17.590,00","17.501,00","17.581,08","0,35",79,"1.388.905,00","1.388.905,00",ALK,2021-11-19
22.11.2021,"17.600,00","17.600,00","17.503,00","17.589,37","0,05",191,"3.359.570,00","3.359.570,00",ALK,2021-11-22
23.11.2021,"17.699,00","17.700,00","17.501,00","17.681,33","0,52",453,"8.009.641,00","8.009.641,00",ALK,2021-11-23
24.11.2021,"17.502,00","17.502,00","17.502,00","17.502,00","-1,01",11,"192.522,00","192.522,00",ALK,2021-11-24
25.11.2021,"17.599,00","17.650,00","17.590,00","17.617,68","0,66",62,"1.092.296,00","1.092.296,00",ALK,2021-11-25
26.11.2021,"17.499,00","17.512,00","17.498,00","17.501,49","-0,66",63,"1.102.594,00","1.102.594,00",ALK,2021-11-26
29.11.2021,"17.499,00","17.499,00","17.311,00","17.392,05","-0,63",43,"747.858,00","747.858,00",ALK,2021-11-29
30.11.2021,"17.450,00","17.499,00","17.300,00","17.466,58","0,43",222,"3.877.581,00","3.877.581,00",ALK,2021-11-30
01.12.2021,"17.600,00","17.600,00","17.400,00","17.534,24","0,39",50,"876.712,00","876.712,00",ALK,2021-12-01
02.12.2021,"17.500,00","17.600,00","17.450,00","17.510,13","-0,14",237,"4.149.900,00","4.149.900,00",ALK,2021-12-02
03.12.2021,"17.600,00","17.600,00","17.500,00","17.528,57","0,11",14,"245.400,00","245.400,00",ALK,2021-12-03
06.12.2021,"17.680,00","17.700,00","17.650,00","17.676,70","0,85",103,"1.820.700,00","1.820.700,00",ALK,2021-12-06
07.12.2021,"17.790,00","17.799,00","17.789,00","17.790,46","0,64",114,"2.028.113,00","2.028.113,00",ALK,2021-12-07
09.12.2021,"17.900,00","17.900,00","17.800,00","17.824,87","0,19",305,"5.436.584,00","5.436.584,00",ALK,2021-12-09
10.12.2021,"17.900,00","17.900,00","17.850,00","17.897,36","0,41",121,"2.165.580,00","2.165.580,00",ALK,2021-12-10
13.12.2021,"17.850,00","17.900,00","17.701,00","17.873,49","-0,13",119,"2.126.945,00","2.126.945,00",ALK,2021-12-13
14.12.2021,"17.770,00","17.800,00","17.770,00","17.789,76","-0,47",109,"1.939.084,00","1.939.084,00",ALK,2021-12-14
15.12.2021,"17.850,00","17.850,00","17.751,00","17.801,01","0,06",94,"1.673.295,00","1.673.295,00",ALK,2021-12-15
16.12.2021,"17.750,00","17.900,00","17.750,00","17.867,78","0,38",370,"6.611.077,00","6.611.077,00",ALK,2021-12-16
17.12.2021,"17.900,00","17.900,00","17.800,00","17.856,43","-0,06",182,"3.249.870,00","3.249.870,00",ALK,2021-12-17
20.12.2021,"17.800,00","17.900,00","17.800,00","17.805,88","-0,28",85,"1.513.500,00","1.513.500,00",ALK,2021-12-20
21.12.2021,"17.900,00","17.900,00","17.800,00","17.893,06","0,49",286,"5.117.415,00","5.117.415,00",ALK,2021-12-21
22.12.2021,"17.810,00","17.900,00","17.810,00","17.886,94","-0,03",156,"2.790.363,00","2.790.363,00",ALK,2021-12-22
23.12.2021,"17.900,00","17.900,00","17.801,00","17.882,58","-0,02",267,"4.774.649,00","4.774.649,00",ALK,2021-12-23
24.12.2021,"18.000,00","18.000,00","17.900,00","17.986,91","0,58",154,"2.769.984,00","2.769.984,00",ALK,2021-12-24
27.12.2021,"18.200,00","18.200,00","18.000,00","18.105,01","0,66",116,"2.100.181,00","2.100.181,00",ALK,2021-12-27
28.12.2021,"18.500,00","18.501,00","18.250,00","18.484,62","2,10",229,"4.232.977,00","4.232.977,00",ALK,2021-12-28
29.12.2021,"18.399,00","18.500,00","18.399,00","18.494,13","0,05",279,"5.159.862,00","5.159.862,00",ALK,2021-12-29
30.12.2021,"18.170,00","18.500,00","18.170,00","18.440,17","-0,29",140,"2.581.624,00","2.581.624,00",ALK,2021-12-30
03.01.2022,"18.300,00","18.499,00","18.000,00","18.139,66","-1,63",68,"1.233.497,00","1.233.497,00",ALK,2022-01-03
04.01.2022,"18.200,00","18.200,00","18.000,00","18.057,58","-0,45",179,"3.232.307,00","3.232.307,00",ALK,2022-01-04
05.01.2022,"18.400,00","18.498,00","18.200,00","18.329,78","1,51",239,"4.380.818,00","4.380.818,00",ALK,2022-01-05
10.01.2022,"18.501,00","18.501,00","18.400,00","18.492,54","0,89",478,"8.839.433,00","8.839.433,00",ALK,2022-01-10
11.01.2022,"19.000,00","19.000,00","18.515,00","18.828,64","1,82",11,"207.115,00","207.115,00",ALK,2022-01-11
12.01.2022,"18.900,00","18.900,00","18.900,00","18.900,00","0,38",220,"4.158.000,00","4.158.000,00",ALK,2022-01-12
13.01.2022,"19.000,00","19.000,00","18.610,00","18.917,66","0,09",235,"4.445.650,00","4.445.650,00",ALK,2022-01-13
14.01.2022,"19.210,00","19.251,00","19.000,00","19.233,77","1,67",215,"4.135.261,00","4.135.261,00",ALK,2022-01-14
17.01.2022,"19.400,00","19.400,00","19.202,00","19.281,37","0,25",205,"3.952.680,00","3.952.680,00",ALK,2022-01-17
18.01.2022,"19.351,00","19.400,00","19.350,00","19.382,06","0,52",227,"4.399.728,00","4.399.728,00",ALK,2022-01-18
20.01.2022,"19.299,00","19.350,00","19.200,00","19.305,84","-0,39",268,"5.173.965,00","5.173.965,00",ALK,2022-01-20
21.01.2022,"19.200,00","19.297,00","19.200,00","19.201,81","-0,54",485,"9.312.876,00","9.312.876,00",ALK,2022-01-21
24.01.2022,"17.900,00","19.199,00","17.900,00","18.220,41","-5,11",584,"10.640.721,00","10.640.721,00",ALK,2022-01-24
25.01.2022,"17.150,00","18.100,00","17.150,00","17.734,23","-2,67",689,"12.218.886,00","12.218.886,00",ALK,2022-01-25
26.01.2022,"17.990,00","17.990,00","17.990,00","17.990,00","1,44",10,"179.900,00","179.900,00",ALK,2022-01-26
27.01.2022,"18.699,00","18.700,00","18.100,00","18.579,14","3,27",236,"4.384.677,00","4.384.677,00",ALK,2022-01-27
28.01.2022,"18.748,00","19.000,00","18.101,00","18.716,91","0,74",90,"1.684.522,00","1.684.522,00",ALK,2022-01-28
31.01.2022,"18.550,00","18.900,00","18.550,00","18.842,10","0,67",49,"923.263,00","923.263,00",ALK,2022-01-31
01.02.2022,"18.650,00","18.850,00","18.650,00","18.846,37","0,02",60,"1.130.782,00","1.130.782,00",ALK,2022-02-01
02.02.2022,"18.551,00","18.800,00","18.551,00","18.727,97","-0,63",33,"618.023,00","618.023,00",ALK,2022-02-02
03.02.2022,"18.554,00","18.600,00","18.550,00","18.566,67","-0,86",115,"2.135.167,00","2.135.167,00",ALK,2022-02-03
04.02.2022,"18.700,00","18.700,00","18.550,00","18.645,75","0,43",126,"2.349.365,00","2.349.365,00",ALK,2022-02-04
07.02.2022,"18.700,00","18.700,00","18.650,00","18.698,95","0,29",245,"4.581.242,00","4.581.242,00",ALK,2022-02-07
08.02.2022,"18.700,00","19.000,00","18.700,00","18.730,45","0,17",321,"6.012.476,00","6.012.476,00",ALK,2022-02-08
09.02.2022,"18.705,00","18.705,00","18.700,00","18.700,23","-0,16",698,"13.052.763,00","13.052.763,00",ALK,2022-02-09
10.02.2022,"18.725,00","18.800,00","18.700,00","18.737,70","0,20",368,"6.895.473,00","6.895.473,00",ALK,2022-02-10
11.02.2022,"18.800,00","18.800,00","18.701,00","18.761,27","0,13",404,"7.579.554,00","7.579.554,00",ALK,2022-02-11
14.02.2022,"18.650,00","18.761,00","18.199,00","18.458,68","-1,61",138,"2.547.298,00","2.547.298,00",ALK,2022-02-14
15.02.2022,"18.670,00","18.800,00","18.600,00","18.689,20","1,25",305,"5.700.206,00","5.700.206,00",ALK,2022-02-15
16.02.2022,"18.800,00","18.800,00","18.799,00","18.799,87","0,59",121,"2.274.784,00","2.274.784,00",ALK,2022-02-16
17.02.2022,"18.799,00","18.800,00","18.799,00","18.799,48","0,00",102,"1.917.547,00","1.917.547,00",ALK,2022-02-17
18.02.2022,"18.699,00","18.779,00","18.699,00","18.773,55","-0,14",88,"1.652.072,00","1.652.072,00",ALK,2022-02-18
21.02.2022,"18.600,00","18.650,00","18.595,00","18.608,59","-0,88",46,"855.995,00","855.995,00",ALK,2022-02-21
22.02.2022,"18.250,00","18.499,00","18.160,00","18.256,41","-1,89",235,"4.290.256,00","4.290.256,00",ALK,2022-02-22
23.02.2022,"18.189,00","18.300,00","18.189,00","18.204,90","-0,28",377,"6.863.248,00","6.863.248,00",ALK,2022-02-23
24.02.2022,"16.385,00","16.550,00","16.385,00","16.473,99","-9,51",685,"11.284.686,00","11.284.686,00",ALK,2022-02-24
25.02.2022,"17.700,00","18.121,00","16.600,00","17.535,51","6,44",898,"15.746.889,00","15.746.889,00",ALK,2022-02-25
28.02.2022,"17.500,00","17.500,00","17.200,00","17.456,15","-0,45",517,"9.024.832,00","9.024.832,00",ALK,2022-02-28
01.03.2022,"17.400,00","17.499,00","17.201,00","17.396,81","-0,34",646,"11.238.341,00","11.238.341,00",ALK,2022-03-01
02.03.2022,"17.450,00","17.450,00","17.210,00","17.284,99","-0,64",293,"5.064.501,00","5.064.501,00",ALK,2022-03-02
03.03.2022,"17.500,00","17.500,00","17.300,00","17.471,87","1,08",353,"6.167.569,00","6.167.569,00",ALK,2022-03-03
04.03.2022,"17.600,00","17.700,00","17.400,00","17.574,38","0,59",242,"4.253.000,00","4.253.000,00",ALK,2022-03-04
07.03.2022,"17.550,00","17.600,00","17.400,00","17.546,02","-0,16",525,"9.211.659,00","16.311.659,00",ALK,2022-03-07
08.03.2022,"17.300,00","17.520,00","17.300,00","17.449,56","-0,55",502,"8.759.678,00","8.759.678,00",ALK,2022-03-08
09.03.2022,"17.400,00","17.500,00","17.250,00","17.392,70","-0,33",262,"4.556.888,00","4.556.888,00",ALK,2022-03-09
10.03.2022,"17.300,00","17.400,00","17.250,00","17.340,65","-0,30",479,"8.306.170,00","8.306.170,00",ALK,2022-03-10
11.03.2022,"17.500,00","17.500,00","17.300,00","17.387,17","0,27",441,"7.667.744,00","7.667.744,00",ALK,2022-03-11
14.03.2022,"17.850,00","17.850,00","17.500,00","17.637,74","1,44",261,"4.603.450,00","4.603.450,00",ALK,2022-03-14
15.03.2022,"17.700,00","17.899,00","17.651,00","17.771,11","0,76",398,"7.072.901,00","7.072.901,00",ALK,2022-03-15
16.03.2022,"17.700,00","18.000,00","17.250,00","17.771,08","0,00",24,"426.506,00","426.506,00",ALK,2022-03-16
17.03.2022,"18.000,00","18.250,00","17.500,00","17.860,03","0,50",66,"1.178.762,00","1.178.762,00",ALK,2022-03-17
18.03.2022,"18.200,00","18.201,00","18.000,00","18.161,66","1,69",346,"6.283.933,00","6.283.933,00",ALK,2022-03-18
21.03.2022,"18.300,00","18.300,00","17.900,00","18.052,44","-0,60",120,"2.166.293,00","2.166.293,00",ALK,2022-03-21
22.03.2022,"18.500,00","18.500,00","18.498,00","18.499,16","2,47",86,"1.590.928,00","1.590.928,00",ALK,2022-03-22
23.03.2022,"18.300,00","18.350,00","18.200,00","18.309,24","-1,03",92,"1.684.450,00","1.684.450,00",ALK,2022-03-23
24.03.2022,"18.000,00","18.300,00","18.000,00","18.042,00","-1,46",50,"902.100,00","902.100,00",ALK,2022-03-24
25.03.2022,"18.110,00","18.110,00","18.000,00","18.007,66","-0,19",128,"2.304.980,00","2.304.980,00",ALK,2022-03-25
28.03.2022,"18.000,00","18.000,00","17.900,00","17.998,92","-0,05",93,"1.673.900,00","1.673.900,00",ALK,2022-03-28
29.03.2022,"18.000,00","18.000,00","17.901,00","17.990,10","-0,05",20,"359.802,00","359.802,00",ALK,2022-03-29
30.03.2022,"17.950,00","18.000,00","17.950,00","17.992,06","0,01",63,"1.133.500,00","1.133.500,00",ALK,2022-03-30
31.03.2022,"18.000,00","18.000,00","18.000,00","18.000,00","0,04",10,"180.000,00","180.000,00",ALK,2022-03-31
01.04.2022,"17.900,00","17.999,00","17.900,00","17.952,03","-0,27",38,"682.177,00","682.177,00",ALK,2022-04-01
04.04.2022,"18.000,00","18.000,00","17.800,00","17.996,66","0,25",105,"1.889.649,00","1.889.649,00",ALK,2022-04-04
05.04.2022,"18.000,00","18.000,00","17.900,00","17.998,33","0,01",60,"1.079.900,00","4.719.900,00",ALK,2022-04-05
06.04.2022,"18.250,00","18.250,00","18.020,00","18.176,72","0,99",247,"4.489.650,00","4.489.650,00",ALK,2022-04-06
07.04.2022,"18.240,00","18.250,00","18.150,00","18.243,12","0,37",448,"8.172.920,00","8.172.920,00",ALK,2022-04-07
08.04.2022,"18.249,00","18.250,00","18.152,00","18.243,51","0,00",170,"3.101.397,00","3.101.397,00",ALK,2022-04-08
11.04.2022,"18.100,00","18.200,00","18.100,00","18.194,49","-0,27",207,"3.766.260,00","3.766.260,00",ALK,2022-04-11
12.04.2022,"18.101,00","18.101,00","18.100,00","18.100,08","-0,52",141,"2.552.111,00","2.552.111,00",ALK,2022-04-12
13.04.2022,"18.200,00","18.289,00","18.150,00","18.232,16","0,73",89,"1.622.662,00","1.622.662,00",ALK,2022-04-13
14.04.2022,"18.250,00","18.250,00","18.200,00","18.238,52","0,03",141,"2.571.632,00","6.221.632,00",ALK,2022-04-14
15.04.2022,"18.250,00","18.255,00","18.220,00","18.247,78","0,05",172,"3.138.618,00","3.138.618,00",ALK,2022-04-15
18.04.2022,"18.250,00","18.290,00","18.247,00","18.249,97","0,01",688,"12.555.982,00","12.555.982,00",ALK,2022-04-18
19.04.2022,"17.802,00","18.290,00","17.802,00","18.022,74","-1,25",100,"1.802.274,00","1.802.274,00",ALK,2022-04-19
21.04.2022,"17.943,00","17.943,00","17.943,00","17.943,00","-0,44",22,"394.746,00","394.746,00",ALK,2022-04-21
26.04.2022,"17.943,00","17.943,00","17.800,00","17.941,94","-0,01",594,"10.657.514,00","10.657.514,00",ALK,2022-04-26
27.04.2022,"17.800,00","18.000,00","17.800,00","17.958,21","0,09",323,"5.800.501,00","5.800.501,00",ALK,2022-04-27
28.04.2022,"17.850,00","17.850,00","17.800,00","17.843,75","-0,63",40,"713.750,00","713.750,00",ALK,2022-04-28
29.04.2022,"17.850,00","17.943,00","17.850,00","17.918,73","0,42",244,"4.372.170,00","4.372.170,00",ALK,2022-04-29
03.05.2022,"17.901,00","17.901,00","17.800,00","17.859,76","-0,33",124,"2.214.610,00","2.214.610,00",ALK,2022-05-03
04.05.2022,"17.803,00","17.943,00","17.501,00","17.852,38","-0,04",309,"5.516.386,00","5.516.386,00",ALK,2022-05-04
05.05.2022,"17.850,00","17.943,00","17.850,00","17.927,95","0,43","4,029","72.231.711,00","72.231.711,00",ALK,2022-05-05
06.05.2022,"17.850,00","17.850,00","17.800,00","17.835,63","-0,51",101,"1.801.399,00","1.801.399,00",ALK,2022-05-06
09.05.2022,"17.800,00","17.800,00","17.800,00","17.800,00","-0,20",17,"302.600,00","302.600,00",ALK,2022-05-09
10.05.2022,"17.801,00","17.801,00","17.798,00","17.799,33","-0,01",303,"5.393.196,00","5.393.196,00",ALK,2022-05-10
11.05.2022,"17.650,00","17.800,00","17.650,00","17.795,38","-0,02",65,"1.156.700,00","1.156.700,00",ALK,2022-05-11
12.05.2022,"17.012,00","17.800,00","17.012,00","17.651,53","-0,81",406,"7.166.522,00","7.166.522,00",ALK,2022-05-12
13.05.2022,"17.600,00","17.600,00","17.550,00","17.584,34","-0,38",83,"1.459.500,00","1.459.500,00",ALK,2022-05-13
16.05.2022,"17.450,00","17.599,00","17.400,00","17.499,63","-0,48",27,"472.490,00","472.490,00",ALK,2022-05-16
17.05.2022,"17.500,00","17.500,00","17.400,00","17.419,03","-0,46",253,"4.407.015,00","4.407.015,00",ALK,2022-05-17
18.05.2022,"17.700,00","17.700,00","17.500,00","17.590,75","0,99",165,"2.902.474,00","2.902.474,00",ALK,2022-05-18
19.05.2022,"17.400,00","17.560,00","17.400,00","17.505,26","-0,48",154,"2.695.810,00","2.695.810,00",ALK,2022-05-19
20.05.2022,"17.400,00","17.400,00","17.300,00","17.392,97","-0,64",417,"7.252.870,00","7.252.870,00",ALK,2022-05-20
23.05.2022,"17.100,00","17.400,00","17.100,00","17.361,98","-0,18",145,"2.517.487,00","2.517.487,00",ALK,2022-05-23
25.05.2022,"16.950,00","17.100,00","16.900,00","17.020,33","-1,97",413,"7.029.396,00","7.029.396,00",ALK,2022-05-25
26.05.2022,"16.800,00","16.950,00","16.750,00","16.840,88","-1,05",340,"5.725.900,00","5.725.900,00",ALK,2022-05-26
27.05.2022,"16.800,00","16.800,00","16.750,00","16.782,38","-0,34",632,"10.606.464,00","10.606.464,00",ALK,2022-05-27
30.05.2022,"17.100,00","17.100,00","16.800,00","16.950,68","1,00",444,"7.526.100,00","7.526.100,00",ALK,2022-05-30
31.05.2022,"17.500,00","17.500,00","17.000,00","17.355,07","2,38",271,"4.703.223,00","4.703.223,00",ALK,2022-05-31
01.06.2022,"17.700,00","17.700,00","17.500,00","17.578,87","1,29",827,"14.537.724,00","14.537.724,00",ALK,2022-06-01
02.06.2022,"17.920,00","17.920,00","17.600,00","17.912,04","1,89",426,"7.630.527,00","7.630.527,00",ALK,2022-06-02
03.06.2022,"17.849,00","17.990,00","17.800,00","17.856,55","-0,31",40,"714.262,00","714.262,00",ALK,2022-06-03
06.06.2022,"17.601,00","17.920,00","17.601,00","17.860,11","0,02",18,"321.482,00","321.482,00",ALK,2022-06-06
07.06.2022,"17.600,00","17.601,00","17.500,00","17.591,26","-1,51",34,"598.103,00","598.103,00",ALK,2022-06-07
08.06.2022,"17.500,00","17.598,00","17.410,00","17.498,44","-0,53",168,"2.939.738,00","2.939.738,00",ALK,2022-06-08
09.06.2022,"17.400,00","17.400,00","17.350,00","17.390,46","-0,62",205,"3.565.045,00","3.565.045,00",ALK,2022-06-09
13.06.2022,"17.000,00","17.389,00","16.900,00","16.959,04","-2,48",355,"6.020.460,00","6.020.460,00",ALK,2022-06-13
14.06.2022,"16.650,00","16.900,00","16.451,00","16.673,65","-1,68",296,"4.935.400,00","4.935.400,00",ALK,2022-06-14
15.06.2022,"16.850,00","16.850,00","16.600,00","16.713,70","0,24",246,"4.111.569,00","4.111.569,00",ALK,2022-06-15
16.06.2022,"16.501,00","16.800,00","16.501,00","16.709,04","-0,03",76,"1.269.887,00","5.394.887,00",ALK,2022-06-16
17.06.2022,"16.750,00","16.750,00","16.700,00","16.711,47","0,01",109,"1.821.550,00","1.821.550,00",ALK,2022-06-17
20.06.2022,"16.703,00","16.711,00","16.700,00","16.704,60","-0,04",95,"1.586.937,00","1.586.937,00",ALK,2022-06-20
21.06.2022,"16.750,00","16.800,00","16.750,00","16.789,79","0,51",163,"2.736.735,00","7.776.735,00",ALK,2022-06-21
22.06.2022,"16.800,00","16.800,00","16.751,00","16.783,95","-0,04",147,"2.467.240,00","2.467.240,00",ALK,2022-06-22
23.06.2022,"16.800,00","16.800,00","16.799,00","16.799,95","0,10",104,"1.747.195,00","1.747.195,00",ALK,2022-06-23
24.06.2022,"16.800,00","16.800,00","16.799,00","16.799,98","0,00",125,"2.099.998,00","2.099.998,00",ALK,2022-06-24
27.06.2022,"16.710,00","16.751,00","16.710,00","16.726,67","-0,43",15,"250.900,00","250.900,00",ALK,2022-06-27
28.06.2022,"16.750,00","16.750,00","16.700,00","16.747,18","0,13",341,"5.710.790,00","5.710.790,00",ALK,2022-06-28
29.06.2022,"16.800,00","16.800,00","16.750,00","16.789,41","0,25",85,"1.427.100,00","1.427.100,00",ALK,2022-06-29
30.06.2022,"16.751,00","16.753,00","16.751,00","16.752,41","-0,22",78,"1.306.688,00","1.306.688,00",ALK,2022-06-30
01.07.2022,"16.751,00","16.900,00","16.751,00","16.783,79","0,19",52,"872.757,00","872.757,00",ALK,2022-07-01
04.07.2022,"16.800,00","16.800,00","16.752,00","16.767,00","-0,10",16,"268.272,00","268.272,00",ALK,2022-07-04
05.07.2022,"16.801,00","16.802,00","16.760,00","16.782,19","0,09",197,"3.306.091,00","3.306.091,00",ALK,2022-07-05
06.07.2022,"16.802,00","16.803,00","16.800,00","16.801,18","0,11",51,"856.860,00","856.860,00",ALK,2022-07-06
07.07.2022,"17.000,00","17.000,00","16.990,00","16.999,13","1,18",178,"3.025.845,00","3.025.845,00",ALK,2022-07-07
08.07.2022,"17.100,00","17.100,00","17.090,00","17.098,20","0,58",139,"2.376.650,00","2.376.650,00",ALK,2022-07-08
11.07.2022,"17.100,00","17.101,00","17.100,00","17.100,25","0,01",56,"957.614,00","957.614,00",ALK,2022-07-11
12.07.2022,"17.000,00","17.000,00","16.920,00","16.938,15","-0,95",46,"779.155,00","779.155,00",ALK,2022-07-12
13.07.2022,"16.800,00","16.901,00","16.751,00","16.799,64","-0,82",321,"5.392.685,00","5.392.685,00",ALK,2022-07-13
14.07.2022,"16.850,00","16.850,00","16.800,00","16.825,53","0,15",19,"319.685,00","319.685,00",ALK,2022-07-14
15.07.2022,"16.820,00","16.820,00","16.800,00","16.802,64","-0,14",101,"1.697.067,00","1.697.067,00",ALK,2022-07-15
18.07.2022,"16.850,00","16.900,00","16.805,00","16.860,80","0,35",44,"741.875,00","741.875,00",ALK,2022-07-18
19.07.2022,"17.100,00","17.100,00","16.997,00","17.004,36","0,85",528,"8.978.304,00","8.978.304,00",ALK,2022-07-19
20.07.2022,"17.001,00","17.499,00","17.000,00","17.089,21","0,50",28,"478.498,00","478.498,00",ALK,2022-07-20
21.07.2022,"17.031,00","17.100,00","17.031,00","17.098,71","0,06",160,"2.735.793,00","2.735.793,00",ALK,2022-07-21
22.07.2022,"17.100,00","17.150,00","17.100,00","17.105,86","0,04",88,"1.505.316,00","1.505.316,00",ALK,2022-07-22
25.07.2022,"17.001,00","17.100,00","17.000,00","17.034,51","-0,42",140,"2.384.831,00","2.384.831,00",ALK,2022-07-25
26.07.2022,"16.930,00","17.100,00","16.930,00","17.075,34","0,24",202,"3.449.218,00","3.449.218,00",ALK,2022-07-26
27.07.2022,"16.900,00","16.999,00","16.900,00","16.971,95","-0,60",76,"1.289.868,00","1.289.868,00",ALK,2022-07-27
28.07.2022,"17.000,00","17.050,00","17.000,00","17.013,36","0,24",116,"1.973.550,00","1.973.550,00",ALK,2022-07-28
29.07.2022,"17.200,00","17.200,00","17.000,00","17.098,86","0,51",88,"1.504.700,00","1.504.700,00",ALK,2022-07-29
03.08.2022,"17.050,00","17.050,00","16.999,00","17.031,85","-0,39",47,"800.497,00","800.497,00",ALK,2022-08-03
04.08.2022,"16.900,00","16.997,00","16.800,00","16.899,79","-0,78",29,"490.094,00","490.094,00",ALK,2022-08-04
05.08.2022,"16.996,00","16.998,00","16.900,00","16.974,81","0,44",210,"3.564.711,00","3.564.711,00",ALK,2022-08-05
08.08.2022,"16.850,00","16.900,00","16.850,00","16.884,45","-0,53",104,"1.755.983,00","1.755.983,00",ALK,2022-08-08
09.08.2022,"16.900,00","17.000,00","16.850,00","16.904,18","0,12",273,"4.614.842,00","4.614.842,00",ALK,2022-08-09
10.08.2022,"16.900,00","16.999,00","16.900,00","16.907,92","0,02",75,"1.268.094,00","1.268.094,00",ALK,2022-08-10
11.08.2022,"16.900,00","16.900,00","16.899,00","16.899,93","-0,05",71,"1.199.895,00","1.199.895,00",ALK,2022-08-11
12.08.2022,"17.000,00","17.000,00","16.870,00","16.980,43","0,47",69,"1.171.650,00","1.171.650,00",ALK,2022-08-12
15.08.2022,"17.100,00","17.100,00","17.000,00","17.001,93","0,13",467,"7.939.900,00","7.939.900,00",ALK,2022-08-15
16.08.2022,"17.000,00","17.000,00","17.000,00","17.000,00","-0,01",136,"2.312.000,00","2.312.000,00",ALK,2022-08-16
17.08.2022,"17.099,00","17.099,00","17.000,00","17.074,25","0,44",120,"2.048.910,00","2.048.910,00",ALK,2022-08-17
18.08.2022,"17.050,00","17.101,00","17.000,00","17.057,84","-0,09",134,"2.285.751,00","2.285.751,00",ALK,2022-08-18
19.08.2022,"17.000,00","17.000,00","16.999,00","16.999,76","-0,34",127,"2.158.969,00","2.158.969,00",ALK,2022-08-19
22.08.2022,"17.000,00","17.000,00","16.999,00","16.999,95","0,00",262,"4.453.987,00","4.453.987,00",ALK,2022-08-22
23.08.2022,"16.901,00","17.000,00","16.901,00","16.987,31","-0,08",48,"815.391,00","815.391,00",ALK,2022-08-23
24.08.2022,"17.001,00","17.001,00","17.000,00","17.000,91","0,08",56,"952.051,00","952.051,00",ALK,2022-08-24
25.08.2022,"17.000,00","17.001,00","17.000,00","17.000,16","-0,01",182,"3.094.030,00","3.094.030,00",ALK,2022-08-25
29.08.2022,"16.950,00","17.100,00","16.950,00","17.002,23","0,01",175,"2.975.390,00","2.975.390,00",ALK,2022-08-29
30.08.2022,"16.900,00","16.901,00","16.900,00","16.900,09","-0,60",214,"3.616.620,00","3.616.620,00",ALK,2022-08-30
31.08.2022,"16.900,00","16.950,00","16.900,00","16.901,49","0,01",74,"1.250.710,00","1.250.710,00",ALK,2022-08-31
02.09.2022,"16.849,00","16.899,00","16.849,00","16.859,25","-0,25",53,"893.540,00","893.540,00",ALK,2022-09-02
05.09.2022,"16.840,00","16.850,00","16.840,00","16.846,69","-0,08",52,"876.028,00","876.028,00",ALK,2022-09-05
06.09.2022,"16.799,00","16.800,00","16.799,00","16.799,49","-0,28",124,"2.083.137,00","2.083.137,00",ALK,2022-09-06
07.09.2022,"16.800,00","16.800,00","16.701,00","16.799,44","0,00",392,"6.585.380,00","6.585.380,00",ALK,2022-09-07
09.09.2022,"16.700,00","16.800,00","16.700,00","16.777,97","-0,13",118,"1.979.800,00","1.979.800,00",ALK,2022-09-09
12.09.2022,"16.750,00","16.750,00","16.700,00","16.735,29","-0,26",24,"401.647,00","3.751.647,00",ALK,2022-09-12
13.09.2022,"17.000,00","17.000,00","16.800,00","16.869,57","0,80",354,"5.971.829,00","5.971.829,00",ALK,2022-09-13
14.09.2022,"16.800,00","16.800,00","16.700,00","16.789,92","-0,47",65,"1.091.345,00","1.091.345,00",ALK,2022-09-14
15.09.2022,"16.800,00","16.800,00","16.650,00","16.797,01","0,04",117,"1.965.250,00","1.965.250,00",ALK,2022-09-15
16.09.2022,"16.760,00","16.800,00","16.760,00","16.778,75","-0,11",96,"1.610.760,00","1.610.760,00",ALK,2022-09-16
19.09.2022,"16.752,00","16.799,00","16.752,00","16.776,26","-0,01",31,"520.064,00","520.064,00",ALK,2022-09-19
20.09.2022,"16.707,00","16.750,00","16.707,00","16.742,96","-0,20",52,"870.634,00","870.634,00",ALK,2022-09-20
21.09.2022,"16.700,00","16.745,00","16.700,00","16.718,39","-0,15",298,"4.982.081,00","4.982.081,00",ALK,2022-09-21
22.09.2022,"16.700,00","16.700,00","16.650,00","16.685,87","-0,20",140,"2.336.022,00","2.336.022,00",ALK,2022-09-22
26.09.2022,"16.099,00","16.502,00","16.099,00","16.251,63","-2,60",54,"877.588,00","877.588,00",ALK,2022-09-26
27.09.2022,"15.598,00","15.900,00","15.598,00","15.771,98","-2,95",553,"8.721.906,00","8.721.906,00",ALK,2022-09-27
28.09.2022,"16.000,00","16.000,00","15.800,00","15.870,26","0,62",432,"6.855.953,00","6.855.953,00",ALK,2022-09-28
29.09.2022,"16.000,00","16.000,00","15.870,00","15.960,45","0,57",292,"4.660.450,00","4.660.450,00",ALK,2022-09-29
30.09.2022,"16.100,00","16.100,00","15.857,00","16.070,28","0,69",122,"1.960.574,00","1.960.574,00",ALK,2022-09-30
03.10.2022,"16.000,00","16.099,00","16.000,00","16.013,50","-0,35",22,"352.297,00","352.297,00",ALK,2022-10-03
04.10.2022,"16.100,00","16.100,00","16.000,00","16.087,42","0,46",159,"2.557.900,00","2.557.900,00",ALK,2022-10-04
05.10.2022,"16.100,00","16.100,00","16.000,00","16.001,68","-0,53",192,"3.072.322,00","3.072.322,00",ALK,2022-10-05
06.10.2022,"16.000,00","16.001,00","16.000,00","16.000,25","-0,01",28,"448.007,00","448.007,00",ALK,2022-10-06
07.10.2022,"16.100,00","16.100,00","16.000,00","16.057,95","0,36",109,"1.750.317,00","1.750.317,00",ALK,2022-10-07
10.10.2022,"16.100,00","16.201,00","16.050,00","16.176,72","0,74",83,"1.342.668,00","1.342.668,00",ALK,2022-10-10
12.10.2022,"16.000,00","16.100,00","16.000,00","16.040,94","-0,84",82,"1.315.357,00","1.315.357,00",ALK,2022-10-12
13.10.2022,"15.900,00","16.000,00","15.900,00","15.997,56","-0,27",82,"1.311.800,00","1.311.800,00",ALK,2022-10-13
14.10.2022,"15.950,00","15.950,00","15.900,00","15.923,53","-0,46",17,"270.700,00","270.700,00",ALK,2022-10-14
17.10.2022,"15.556,00","15.700,00","15.556,00","15.659,11","-1,66",9,"140.932,00","140.932,00",ALK,2022-10-17
18.10.2022,"15.750,00","15.750,00","15.750,00","15.750,00","0,58",11,"173.250,00","173.250,00",ALK,2022-10-18
19.10.2022,"15.750,00","15.770,00","15.750,00","15.755,71","0,04",91,"1.433.770,00","1.433.770,00",ALK,2022-10-19
20.10.2022,"15.750,00","15.790,00","15.610,00","15.706,23","-0,31",167,"2.622.940,00","2.622.940,00",ALK,2022-10-20
21.10.2022,"15.851,00","15.851,00","15.700,00","15.793,82","0,56",113,"1.784.702,00","1.784.702,00",ALK,2022-10-21
25.10.2022,"15.950,00","16.100,00","15.850,00","15.947,61","0,98",67,"1.068.490,00","1.068.490,00",ALK,2022-10-25
26.10.2022,"16.500,00","16.500,00","16.000,00","16.196,81","1,56",110,"1.781.649,00","1.781.649,00",ALK,2022-10-26
27.10.2022,"16.599,00","16.682,00","16.599,00","16.653,05","2,82",102,"1.698.611,00","1.698.611,00",ALK,2022-10-27
28.10.2022,"16.682,00","16.682,00","16.600,00","16.630,37","-0,14",135,"2.245.100,00","2.245.100,00",ALK,2022-10-28
31.10.2022,"16.530,00","16.680,00","16.530,00","16.650,93","0,13",152,"2.530.942,00","2.530.942,00",ALK,2022-10-31
01.11.2022,"16.500,00","16.600,00","16.500,00","16.590,19","-0,37",62,"1.028.592,00","1.028.592,00",ALK,2022-11-01
02.11.2022,"16.501,00","16.590,00","16.501,00","16.567,75","-0,13",40,"662.710,00","662.710,00",ALK,2022-11-02
03.11.2022,"16.499,00","16.500,00","16.498,00","16.499,08","-0,42",168,"2.771.845,00","2.771.845,00",ALK,2022-11-03
04.11.2022,"16.401,00","16.500,00","16.401,00","16.494,30","-0,03",277,"4.568.920,00","4.568.920,00",ALK,2022-11-04
07.11.2022,"16.600,00","16.600,00","16.499,00","16.583,63","0,54",142,"2.354.875,00","2.354.875,00",ALK,2022-11-07
08.11.2022,"16.800,00","16.800,00","16.650,00","16.728,33","0,87",213,"3.563.135,00","3.563.135,00",ALK,2022-11-08
09.11.2022,"16.700,00","16.700,00","16.601,00","16.659,78","-0,41",32,"533.113,00","533.113,00",ALK,2022-11-09
10.11.2022,"16.500,00","16.600,00","16.500,00","16.552,79","-0,64",19,"314.503,00","314.503,00",ALK,2022-11-10
11.11.2022,"16.500,00","16.503,00","16.500,00","16.502,02","-0,31",88,"1.452.178,00","1.452.178,00",ALK,2022-11-11
14.11.2022,"16.500,00","16.500,00","16.300,00","16.430,43","-0,44",23,"377.900,00","377.900,00",ALK,2022-11-14
15.11.2022,"16.500,00","16.500,00","16.301,00","16.412,83","-0,11",114,"1.871.063,00","1.871.063,00",ALK,2022-11-15
16.11.2022,"16.500,00","16.500,00","16.411,00","16.495,68","0,51",103,"1.699.055,00","1.699.055,00",ALK,2022-11-16
17.11.2022,"16.500,00","16.501,00","16.411,00","16.495,85","0,00",123,"2.028.990,00","2.028.990,00",ALK,2022-11-17
18.11.2022,"16.501,00","16.501,00","16.501,00","16.501,00","0,03",19,"313.519,00","313.519,00",ALK,2022-11-18
21.11.2022,"16.502,00","16.502,00","16.500,00","16.500,73","0,00",33,"544.524,00","544.524,00",ALK,2022-11-21
22.11.2022,"16.600,00","16.600,00","16.505,00","16.572,86","0,44",14,"232.020,00","232.020,00",ALK,2022-11-22
23.11.2022,"16.900,00","16.900,00","16.750,00","16.829,03","1,54",155,"2.608.500,00","2.608.500,00",ALK,2022-11-23
24.11.2022,"17.000,00","17.000,00","17.000,00","17.000,00","1,02",24,"408.000,00","408.000,00",ALK,2022-11-24
25.11.2022,"17.000,00","17.000,00","16.601,00","16.953,06","-0,28",17,"288.202,00","288.202,00",ALK,2022-11-25
28.11.2022,"16.900,00","16.900,00","16.850,00","16.862,18","-0,54",33,"556.452,00","556.452,00",ALK,2022-11-28
29.11.2022,"17.000,00","17.000,00","16.862,00","16.950,67","0,52",15,"254.260,00","254.260,00",ALK,2022-11-29
30.11.2022,"17.000,00","17.001,00","16.862,00","16.994,22","0,26",23,"390.867,00","390.867,00",ALK,2022-11-30
01.12.2022,"17.103,00","17.200,00","17.000,00","17.082,32","0,52",139,"2.374.442,00","2.374.442,00",ALK,2022-12-01
02.12.2022,"17.150,00","17.150,00","17.150,00","17.150,00","0,40",20,"343.000,00","343.000,00",ALK,2022-12-02
05.12.2022,"17.150,00","17.200,00","17.150,00","17.152,39","0,01",228,"3.910.745,00","3.910.745,00",ALK,2022-12-05
06.12.2022,"17.300,00","17.300,00","17.156,00","17.203,82","0,30",571,"9.823.380,00","9.823.380,00",ALK,2022-12-06
07.12.2022,"17.300,00","17.300,00","17.150,00","17.213,87","0,06",505,"8.693.005,00","8.693.005,00",ALK,2022-12-07
09.12.2022,"17.350,00","17.350,00","17.348,00","17.349,72","0,79",283,"4.909.970,00","4.909.970,00",ALK,2022-12-09
12.12.2022,"17.200,00","17.200,00","17.199,00","17.199,99","-0,86",426,"7.327.195,00","7.327.195,00",ALK,2022-12-12
13.12.2022,"17.300,00","17.300,00","17.200,00","17.277,44","0,45",89,"1.537.692,00","1.537.692,00",ALK,2022-12-13
14.12.2022,"17.100,00","17.100,00","17.100,00","17.100,00","-1,02",11,"188.100,00","188.100,00",ALK,2022-12-14
15.12.2022,"17.010,00","17.200,00","17.010,00","17.101,58","0,01",726,"12.415.744,00","12.415.744,00",ALK,2022-12-15
16.12.2022,"17.101,00","17.102,00","17.100,00","17.101,07","-0,01",274,"4.685.693,00","4.685.693,00",ALK,2022-12-16
19.12.2022,"17.099,00","17.100,00","17.001,00","17.048,95","-0,30",121,"2.062.923,00","2.062.923,00",ALK,2022-12-19
20.12.2022,"17.001,00","17.050,00","17.000,00","17.005,30","-0,26",133,"2.261.705,00","2.261.705,00",ALK,2022-12-20
21.12.2022,"17.100,00","17.100,00","17.001,00","17.085,69","0,47",231,"3.946.794,00","3.946.794,00",ALK,2022-12-21
22.12.2022,"17.100,00","17.200,00","17.000,00","17.067,79","-0,11",112,"1.911.592,00","1.911.592,00",ALK,2022-12-22
23.12.2022,"17.198,00","17.199,00","17.198,00","17.198,73","0,77",48,"825.539,00","825.539,00",ALK,2022-12-23
26.12.2022,"17.100,00","17.100,00","17.000,00","17.099,35","-0,58",154,"2.633.300,00","2.633.300,00",ALK,2022-12-26
27.12.2022,"17.100,00","17.110,00","17.100,00","17.103,85","0,03",26,"444.700,00","444.700,00",ALK,2022-12-27
28.12.2022,"17.101,00","17.198,00","17.101,00","17.145,41","0,24",117,"2.006.013,00","2.006.013,00",ALK,2022-12-28
29.12.2022,"17.200,00","17.200,00","17.102,00","17.157,28","0,07",209,"3.585.872,00","3.585.872,00",ALK,2022-12-29
03.01.2023,"17.450,00","17.450,00","17.200,00","17.334,21","1,03",95,"1.646.750,00","1.646.750,00",ALK,2023-01-03
04.01.2023,"17.502,00","17.600,00","17.300,00","17.558,08","1,29",181,"3.178.012,00","3.178.012,00",ALK,2023-01-04
05.01.2023,"17.700,00","17.770,00","17.500,00","17.660,73","0,58",90,"1.589.466,00","1.589.466,00",ALK,2023-01-05
09.01.2023,"17.701,00","17.980,00","17.701,00","17.969,27","1,75",52,"934.402,00","934.402,00",ALK,2023-01-09
11.01.2023,"17.700,00","17.701,00","17.700,00","17.700,65","-1,49",17,"300.911,00","300.911,00",ALK,2023-01-11
12.01.2023,"17.900,00","17.900,00","17.800,00","17.848,78","0,84",205,"3.659.000,00","3.659.000,00",ALK,2023-01-12
13.01.2023,"17.949,00","17.949,00","17.899,00","17.940,27","0,51",107,"1.919.609,00","1.919.609,00",ALK,2023-01-13
16.01.2023,"17.950,00","17.999,00","17.950,00","17.970,74","0,17",93,"1.671.279,00","1.671.279,00",ALK,2023-01-16
17.01.2023,"17.501,00","17.950,00","17.501,00","17.822,05","-0,83",39,"695.060,00","695.060,00",ALK,2023-01-17
18.01.2023,"17.800,00","17.800,00","17.800,00","17.800,00","-0,12",32,"569.600,00","569.600,00",ALK,2023-01-18
20.01.2023,"17.850,00","17.850,00","17.800,00","17.809,26","0,05",54,"961.700,00","961.700,00",ALK,2023-01-20
23.01.2023,"17.850,00","17.900,00","17.850,00","17.889,29","0,45",42,"751.350,00","751.350,00",ALK,2023-01-23
24.01.2023,"17.800,00","17.898,00","17.800,00","17.832,86","-0,32",21,"374.490,00","374.490,00",ALK,2023-01-24
25.01.2023,"17.600,00","17.700,00","17.501,00","17.590,55","-1,36",62,"1.090.614,00","1.090.614,00",ALK,2023-01-25
26.01.2023,"17.799,00","17.799,00","17.600,00","17.678,91","0,50",80,"1.414.313,00","1.414.313,00",ALK,2023-01-26
27.01.2023,"17.700,00","17.701,00","17.700,00","17.700,03","0,12",160,"2.832.005,00","2.832.005,00",ALK,2023-01-27
30.01.2023,"17.710,00","17.710,00","17.702,00","17.703,04","0,02",48,"849.746,00","849.746,00",ALK,2023-01-30
31.01.2023,"17.702,00","17.702,00","17.702,00","17.702,00","-0,01",35,"619.570,00","619.570,00",ALK,2023-01-31
01.02.2023,"17.704,00","17.704,00","17.704,00","17.704,00","0,01",1,"17.704,00","17.704,00",ALK,2023-02-01
02.02.2023,"17.800,00","17.800,00","17.710,00","17.789,29","0,48",85,"1.512.090,00","1.512.090,00",ALK,2023-02-02
03.02.2023,"17.750,00","17.750,00","17.702,00","17.746,07","-0,24",234,"4.152.581,00","4.152.581,00",ALK,2023-02-03
06.02.2023,"17.800,00","17.800,00","17.750,00","17.795,38","0,28",173,"3.078.600,00","3.078.600,00",ALK,2023-02-06
07.02.2023,"17.800,00","17.800,00","17.800,00","17.800,00","0,03",167,"2.972.600,00","2.972.600,00",ALK,2023-02-07
08.02.2023,"17.701,00","17.799,00","17.701,00","17.789,44","-0,06",41,"729.367,00","729.367,00",ALK,2023-02-08
09.02.2023,"17.700,00","17.703,00","17.700,00","17.701,14","-0,50",50,"885.057,00","885.057,00",ALK,2023-02-09
10.02.2023,"17.600,00","17.600,00","17.500,00","17.560,00","-0,80",25,"439.000,00","439.000,00",ALK,2023-02-10
13.02.2023,"17.500,00","17.500,00","17.500,00","17.500,00","-0,34",20,"350.000,00","350.000,00",ALK,2023-02-13
14.02.2023,"17.600,00","17.600,00","17.505,00","17.547,22","0,27",9,"157.925,00","157.925,00",ALK,2023-02-14
15.02.2023,"17.600,00","17.600,00","17.506,00","17.510,20","-0,21",25,"437.755,00","437.755,00",ALK,2023-02-15
17.02.2023,"17.701,00","17.701,00","17.551,00","17.699,53","1,08",216,"3.823.098,00","3.823.098,00",ALK,2023-02-17
20.02.2023,"17.750,00","17.799,00","17.750,00","17.758,05","0,33",73,"1.296.338,00","1.296.338,00",ALK,2023-02-20
21.02.2023,"17.750,00","17.750,00","17.699,00","17.710,26","-0,27",53,"938.644,00","938.644,00",ALK,2023-02-21
22.02.2023,"17.600,00","17.799,00","17.600,00","17.759,17","0,28",114,"2.024.545,00","2.024.545,00",ALK,2023-02-22
23.02.2023,"17.800,00","17.800,00","17.750,00","17.793,30","0,19",205,"3.647.627,00","3.647.627,00",ALK,2023-02-23
24.02.2023,"17.800,00","17.800,00","17.800,00","17.800,00","0,04",31,"551.800,00","551.800,00",ALK,2023-02-24
27.02.2023,"17.820,00","17.820,00","17.800,00","17.802,22","0,01",54,"961.320,00","961.320,00",ALK,2023-02-27
28.02.2023,"17.850,00","17.850,00","17.800,00","17.828,98","0,15",152,"2.710.005,00","2.710.005,00",ALK,2023-02-28
01.03.2023,"17.830,00","17.830,00","17.830,00","17.830,00","0,01",50,"891.500,00","891.500,00",ALK,2023-03-01
02.03.2023,"18.000,00","18.000,00","17.801,00","17.997,18","0,94",959,"17.259.291,00","17.259.291,00",ALK,2023-03-02
03.03.2023,"17.997,00","17.997,00","17.990,00","17.992,33","-0,03",12,"215.908,00","215.908,00",ALK,2023-03-03
06.03.2023,"18.015,00","18.100,00","18.000,00","18.014,39","0,12",623,"11.222.963,00","11.222.963,00",ALK,2023-03-06
07.03.2023,"18.016,00","18.016,00","18.000,00","18.013,33","-0,01",12,"216.160,00","216.160,00",ALK,2023-03-07
08.03.2023,"18.000,00","18.000,00","17.900,00","17.916,67","-0,54",6,"107.500,00","107.500,00",ALK,2023-03-08
09.03.2023,"17.998,00","18.016,00","17.998,00","17.999,18","0,46",155,"2.789.873,00","2.789.873,00",ALK,2023-03-09
10.03.2023,"17.990,00","17.999,00","17.990,00","17.995,62","-0,02",16,"287.930,00","287.930,00",ALK,2023-03-10
13.03.2023,"18.000,00","18.000,00","17.900,00","17.961,12","-0,19",194,"3.484.458,00","3.484.458,00",ALK,2023-03-13
14.03.2023,"17.910,00","18.000,00","17.910,00","17.964,00","0,02",10,"179.640,00","179.640,00",ALK,2023-03-14
15.03.2023,"17.850,00","17.999,00","17.850,00","17.874,27","-0,50",158,"2.824.134,00","2.824.134,00",ALK,2023-03-15
16.03.2023,"17.900,00","17.950,00","17.800,00","17.893,66","0,11",158,"2.827.199,00","2.827.199,00",ALK,2023-03-16
17.03.2023,"17.890,00","17.900,00","17.800,00","17.886,08","-0,04",79,"1.413.000,00","1.413.000,00",ALK,2023-03-17
20.03.2023,"17.800,00","17.800,00","17.800,00","17.800,00","-0,48",10,"178.000,00","178.000,00",ALK,2023-03-20
21.03.2023,"17.457,00","17.799,00","17.450,00","17.631,06","-0,95",17,"299.728,00","299.728,00",ALK,2023-03-21
22.03.2023,"17.559,00","17.559,00","17.559,00","17.559,00","-0,41",3,"52.677,00","52.677,00",ALK,2023-03-22
23.03.2023,"17.515,00","17.516,00","17.511,00","17.515,15","-0,25",33,"578.000,00","578.000,00",ALK,2023-03-23
24.03.2023,"17.800,00","17.800,00","17.720,00","17.736,06","1,26",520,"9.222.750,00","9.222.750,00",ALK,2023-03-24
27.03.2023,"17.900,00","17.900,00","17.900,00","17.900,00","0,92",14,"250.600,00","250.600,00",ALK,2023-03-27
28.03.2023,"17.900,00","18.000,00","17.900,00","17.925,29","0,14",48,"860.414,00","860.414,00",ALK,2023-03-28
29.03.2023,"18.000,00","18.000,00","17.925,00","17.943,53","0,10",266,"4.772.980,00","4.772.980,00",ALK,2023-03-29
30.03.2023,"17.920,00","18.000,00","17.920,00","17.969,73","0,15",185,"3.324.400,00","3.324.400,00",ALK,2023-03-30
31.03.2023,"17.998,00","17.998,00","17.901,00","17.914,64","-0,31",50,"895.732,00","895.732,00",ALK,2023-03-31
03.04.2023,"17.999,00","18.000,00","17.900,00","17.953,20","0,22",76,"1.364.443,00","1.364.443,00",ALK,2023-04-03
04.04.2023,"17.901,00","18.000,00","17.901,00","17.999,53","0,26",406,"7.307.809,00","7.307.809,00",ALK,2023-04-04
05.04.2023,"17.999,00","18.000,00","17.902,00","17.995,86","-0,02",219,"3.941.093,00","3.941.093,00",ALK,2023-04-05
06.04.2023,"18.000,00","18.000,00","17.902,00","17.997,51","0,01",426,"7.666.940,00","7.666.940,00",ALK,2023-04-06
07.04.2023,"18.100,00","18.150,00","18.000,00","18.076,04","0,44",192,"3.470.600,00","3.470.600,00",ALK,2023-04-07
10.04.2023,"18.099,00","18.400,00","18.099,00","18.306,09","1,27",193,"3.533.075,00","3.533.075,00",ALK,2023-04-10
11.04.2023,"18.300,00","18.300,00","18.100,00","18.215,61","-0,49",229,"4.171.375,00","4.171.375,00",ALK,2023-04-11
12.04.2023,"18.215,00","18.300,00","18.215,00","18.258,52","0,24",181,"3.304.792,00","3.304.792,00",ALK,2023-04-12
13.04.2023,"18.200,00","18.215,00","18.200,00","18.203,63","-0,30",62,"1.128.625,00","1.128.625,00",ALK,2023-04-13
18.04.2023,"18.002,00","18.250,00","18.002,00","18.229,50","0,14",50,"911.475,00","911.475,00",ALK,2023-04-18
19.04.2023,"17.690,00","17.800,00","17.690,00","17.767,00","-2,54",10,"177.670,00","177.670,00",ALK,2023-04-19
20.04.2023,"17.700,00","17.800,00","17.700,00","17.746,61","-0,11",28,"496.905,00","496.905,00",ALK,2023-04-20
24.04.2023,"17.500,00","17.601,00","17.500,00","17.585,57","-0,91",61,"1.072.720,00","6.472.720,00",ALK,2023-04-24
25.04.2023,"17.580,00","17.580,00","17.450,00","17.569,17","-0,09",12,"210.830,00","210.830,00",ALK,2023-04-25
26.04.2023,"17.501,00","17.800,00","17.500,00","17.688,19","0,68",21,"371.452,00","371.452,00",ALK,2023-04-26
27.04.2023,"18.050,00","18.050,00","17.799,00","18.024,06","1,90",234,"4.217.629,00","4.217.629,00",ALK,2023-04-27
28.04.2023,"18.080,00","18.100,00","18.000,00","18.088,16","0,36",38,"687.350,00","687.350,00",ALK,2023-04-28
02.05.2023,"18.350,00","18.350,00","18.099,00","18.198,43","0,61",142,"2.584.177,00","2.584.177,00",ALK,2023-05-02
03.05.2023,"18.201,00","18.300,00","18.110,00","18.225,25","0,15",142,"2.587.985,00","2.587.985,00",ALK,2023-05-03
04.05.2023,"18.151,00","18.200,00","18.150,00","18.165,33","-0,33",214,"3.887.381,00","3.887.381,00",ALK,2023-05-04
05.05.2023,"18.101,00","18.201,00","18.099,00","18.149,72","-0,09",248,"4.501.130,00","4.501.130,00",ALK,2023-05-05
08.05.2023,"18.100,00","18.150,00","18.100,00","18.146,67","-0,02",30,"544.400,00","544.400,00",ALK,2023-05-08
09.05.2023,"17.900,00","18.000,00","17.900,00","17.915,06","-1,28",166,"2.973.900,00","2.973.900,00",ALK,2023-05-09
10.05.2023,"17.894,00","17.899,00","17.800,00","17.888,51","-0,15",513,"9.176.808,00","9.176.808,00",ALK,2023-05-10
11.05.2023,"17.800,00","17.900,00","17.800,00","17.823,08","-0,37",13,"231.700,00","231.700,00",ALK,2023-05-11
12.05.2023,"18.000,00","18.000,00","17.899,00","17.907,26","0,47",110,"1.969.799,00","1.969.799,00",ALK,2023-05-12
15.05.2023,"17.750,00","17.900,00","17.750,00","17.850,00","-0,32",33,"589.050,00","589.050,00",ALK,2023-05-15
16.05.2023,"17.900,00","18.150,00","17.900,00","18.055,57","1,15",290,"5.236.114,00","5.236.114,00",ALK,2023-05-16
17.05.2023,"17.900,00","18.000,00","17.900,00","17.915,25","-0,78",59,"1.057.000,00","1.057.000,00",ALK,2023-05-17
18.05.2023,"18.000,00","18.100,00","18.000,00","18.018,18","0,57",33,"594.600,00","594.600,00",ALK,2023-05-18
19.05.2023,"17.950,00","17.950,00","17.950,00","17.950,00","-0,38",12,"215.400,00","215.400,00",ALK,2023-05-19
22.05.2023,"17.800,00","17.930,00","17.800,00","17.851,78","-0,55",73,"1.303.180,00","1.303.180,00",ALK,2023-05-22
23.05.2023,"17.700,00","17.898,00","17.700,00","17.759,07","-0,52",286,"5.079.094,00","5.079.094,00",ALK,2023-05-23
25.05.2023,"17.850,00","17.850,00","17.700,00","17.825,25","0,37",202,"3.600.700,00","3.600.700,00",ALK,2023-05-25
26.05.2023,"17.930,00","17.950,00","17.930,00","17.943,73","0,66",51,"915.130,00","915.130,00",ALK,2023-05-26
29.05.2023,"17.940,00","17.940,00","17.897,00","17.902,50","-0,23",34,"608.685,00","608.685,00",ALK,2023-05-29
30.05.2023,"17.900,00","17.905,00","17.899,00","17.901,47","-0,01",47,"841.369,00","841.369,00",ALK,2023-05-30
31.05.2023,"17.895,00","17.898,00","17.800,00","17.889,54","-0,07",57,"1.019.704,00","1.019.704,00",ALK,2023-05-31
01.06.2023,"17.889,00","17.889,00","17.800,00","17.884,06","-0,03",18,"321.913,00","14.717.913,00",ALK,2023-06-01
05.06.2023,"17.850,00","17.880,00","17.850,00","17.857,50","-0,15",40,"714.300,00","714.300,00",ALK,2023-06-05
06.06.2023,"17.790,00","17.860,00","17.790,00","17.856,25","-0,01",32,"571.400,00","571.400,00",ALK,2023-06-06
07.06.2023,"17.500,00","17.700,00","17.420,00","17.609,22","-1,38",93,"1.637.657,00","1.637.657,00",ALK,2023-06-07
08.06.2023,"17.600,00","17.600,00","17.600,00","17.600,00","-0,05",6,"105.600,00","105.600,00",ALK,2023-06-08
09.06.2023,"17.650,00","17.650,00","17.500,00","17.537,22","-0,36",54,"947.010,00","947.010,00",ALK,2023-06-09
12.06.2023,"17.500,00","17.600,00","17.500,00","17.592,37","0,31",146,"2.568.486,00","2.568.486,00",ALK,2023-06-12
13.06.2023,"17.500,00","17.595,00","17.500,00","17.559,38","-0,19",8,"140.475,00","140.475,00",ALK,2023-06-13
14.06.2023,"17.500,00","17.500,00","17.420,00","17.488,34","-0,40",151,"2.640.740,00","2.640.740,00",ALK,2023-06-14
15.06.2023,"17.550,00","17.550,00","17.500,00","17.538,46","0,29",65,"1.140.000,00","1.140.000,00",ALK,2023-06-15
16.06.2023,"17.500,00","17.501,00","17.500,00","17.500,19","-0,22",136,"2.380.026,00","2.380.026,00",ALK,2023-06-16
19.06.2023,"17.450,00","17.480,00","17.450,00","17.471,43","-0,16",35,"611.500,00","611.500,00",ALK,2023-06-19
20.06.2023,"17.450,00","17.497,00","17.420,00","17.455,26","-0,09",172,"3.002.305,00","3.002.305,00",ALK,2023-06-20
21.06.2023,"17.400,00","17.496,00","17.400,00","17.429,06","-0,15",440,"7.668.788,00","7.668.788,00",ALK,2023-06-21
22.06.2023,"17.399,00","17.400,00","17.399,00","17.399,25","-0,17",154,"2.679.484,00","2.679.484,00",ALK,2023-06-22
23.06.2023,"17.399,00","17.399,00","17.300,00","17.397,21","-0,01",58,"1.009.038,00","1.009.038,00",ALK,2023-06-23
26.06.2023,"17.400,00","17.400,00","17.301,00","17.398,61","0,01",174,"3.027.358,00","3.027.358,00",ALK,2023-06-26
27.06.2023,"17.500,00","17.500,00","17.400,00","17.422,73","0,14",22,"383.300,00","383.300,00",ALK,2023-06-27
28.06.2023,"17.500,00","17.501,00","17.500,00","17.500,06","0,44",168,"2.940.010,00","2.940.010,00",ALK,2023-06-28
29.06.2023,"17.600,00","17.600,00","17.595,00","17.599,35","0,57",144,"2.534.307,00","2.534.307,00",ALK,2023-06-29
30.06.2023,"17.900,00","17.900,00","17.650,00","17.848,48","1,42",164,"2.927.150,00","2.927.150,00",ALK,2023-06-30
04.07.2023,"17.700,00","17.798,00","17.697,00","17.705,18","-0,80",195,"3.452.511,00","3.452.511,00",ALK,2023-07-04
05.07.2023,"17.700,00","17.700,00","17.700,00","17.700,00","-0,03",90,"1.593.000,00","1.593.000,00",ALK,2023-07-05
06.07.2023,"17.600,00","17.600,00","17.600,00","17.600,00","-0,56",10,"176.000,00","176.000,00",ALK,2023-07-06
07.07.2023,"17.600,00","17.600,00","17.600,00","17.600,00","0,00",2,"35.200,00","35.200,00",ALK,2023-07-07
11.07.2023,"17.500,00","17.600,00","17.500,00","17.573,12","-0,15",41,"720.498,00","720.498,00",ALK,2023-07-11
12.07.2023,"17.502,00","17.502,00","17.500,00","17.500,81","-0,41",37,"647.530,00","647.530,00",ALK,2023-07-12
13.07.2023,"17.599,00","17.600,00","17.599,00","17.599,26","0,56",38,"668.772,00","668.772,00",ALK,2023-07-13
14.07.2023,"17.499,00","17.501,00","17.499,00","17.499,85","-0,56",133,"2.327.480,00","2.327.480,00",ALK,2023-07-14
17.07.2023,"17.300,00","17.500,00","17.200,00","17.235,62","-1,51",236,"4.067.607,00","4.067.607,00",ALK,2023-07-17
18.07.2023,"17.200,00","17.200,00","17.199,00","17.199,78","-0,21",215,"3.697.953,00","3.697.953,00",ALK,2023-07-18
19.07.2023,"17.449,00","17.449,00","17.400,00","17.409,94","1,22",222,"3.865.007,00","3.865.007,00",ALK,2023-07-19
20.07.2023,"17.449,00","17.450,00","17.400,00","17.444,66","0,20",32,"558.229,00","558.229,00",ALK,2023-07-20
21.07.2023,"17.500,00","17.500,00","17.450,00","17.461,84","0,10",63,"1.100.096,00","1.100.096,00",ALK,2023-07-21
24.07.2023,"17.451,00","17.500,00","17.450,00","17.469,18","0,04",174,"3.039.638,00","3.039.638,00",ALK,2023-07-24
25.07.2023,"17.440,00","17.499,00","17.400,00","17.464,71","-0,03",159,"2.776.889,00","2.776.889,00",ALK,2023-07-25
26.07.2023,"17.400,00","17.440,00","17.399,00","17.404,62","-0,34",326,"5.673.906,00","5.673.906,00",ALK,2023-07-26
27.07.2023,"17.400,00","17.400,00","17.399,00","17.399,94","-0,03",109,"1.896.593,00","1.896.593,00",ALK,2023-07-27
28.07.2023,"17.201,00","17.440,00","17.200,00","17.237,44","-0,93",41,"706.735,00","706.735,00",ALK,2023-07-28
31.07.2023,"17.450,00","17.450,00","17.400,00","17.438,60","1,17",100,"1.743.860,00","1.743.860,00",ALK,2023-07-31
01.08.2023,"17.400,00","17.500,00","17.400,00","17.479,22","0,23",527,"9.211.547,00","9.211.547,00",ALK,2023-08-01
03.08.2023,"17.500,00","17.500,00","17.400,00","17.479,60","0,00",5,"87.398,00","87.398,00",ALK,2023-08-03
04.08.2023,"17.500,00","17.500,00","17.450,00","17.499,74","0,12",190,"3.324.950,00","3.324.950,00",ALK,2023-08-04
07.08.2023,"17.300,00","17.500,00","17.300,00","17.477,05","-0,13",113,"1.974.907,00","1.974.907,00",ALK,2023-08-07
08.08.2023,"17.475,00","17.498,00","17.300,00","17.471,77","-0,03",125,"2.183.971,00","2.183.971,00",ALK,2023-08-08
09.08.2023,"17.497,00","17.497,00","17.495,00","17.496,06","0,14",17,"297.433,00","297.433,00",ALK,2023-08-09
10.08.2023,"17.494,00","17.494,00","17.450,00","17.490,17","-0,03",35,"612.156,00","612.156,00",ALK,2023-08-10
11.08.2023,"17.470,00","17.489,00","17.400,00","17.474,87","-0,09",182,"3.180.427,00","3.180.427,00",ALK,2023-08-11
14.08.2023,"17.300,00","17.300,00","17.300,00","17.300,00","-1,00",19,"328.700,00","328.700,00",ALK,2023-08-14
15.08.2023,"17.399,00","17.400,00","17.300,00","17.383,57","0,48",145,"2.520.618,00","2.520.618,00",ALK,2023-08-15
16.08.2023,"17.350,00","17.350,00","17.350,00","17.350,00","-0,19",135,"2.342.250,00","2.342.250,00",ALK,2023-08-16
17.08.2023,"17.350,00","17.350,00","17.350,00","17.350,00","0,00",150,"2.602.500,00","2.602.500,00",ALK,2023-08-17
18.08.2023,"17.349,00","17.349,00","17.300,00","17.335,13","-0,09",53,"918.762,00","918.762,00",ALK,2023-08-18
21.08.2023,"17.349,00","17.350,00","17.349,00","17.349,52","0,08",33,"572.534,00","572.534,00",ALK,2023-08-21
22.08.2023,"17.349,00","17.349,00","17.211,00","17.332,00","-0,10",11,"190.652,00","190.652,00",ALK,2023-08-22
23.08.2023,"17.212,00","17.250,00","17.210,00","17.213,33","-0,68",27,"464.760,00","464.760,00",ALK,2023-08-23
24.08.2023,"17.300,00","17.300,00","17.212,00","17.215,52","0,01",50,"860.776,00","860.776,00",ALK,2023-08-24
25.08.2023,"17.301,00","17.301,00","17.250,00","17.292,08","0,44",53,"916.480,00","916.480,00",ALK,2023-08-25
29.08.2023,"17.300,00","17.350,00","17.300,00","17.306,79","0,09",81,"1.401.850,00","1.401.850,00",ALK,2023-08-29
30.08.2023,"17.300,00","17.350,00","17.300,00","17.315,00","0,05",24,"415.560,00","415.560,00",ALK,2023-08-30
31.08.2023,"17.300,00","17.350,00","17.300,00","17.348,91","0,20",138,"2.394.150,00","2.394.150,00",ALK,2023-08-31
01.09.2023,"17.320,00","17.350,00","17.300,00","17.340,46","-0,05",131,"2.271.600,00","2.271.600,00",ALK,2023-09-01
04.09.2023,"17.351,00","17.351,00","17.300,00","17.344,19","0,02",172,"2.983.200,00","2.983.200,00",ALK,2023-09-04
05.09.2023,"17.350,00","17.350,00","17.350,00","17.350,00","0,03",185,"3.209.750,00","3.209.750,00",ALK,2023-09-05
06.09.2023,"17.300,00","17.350,00","17.300,00","17.344,00","-0,03",25,"433.600,00","433.600,00",ALK,2023-09-06
07.09.2023,"17.350,00","17.350,00","17.300,00","17.325,43","-0,11",129,"2.234.981,00","4.621.781,00",ALK,2023-09-07
11.09.2023,"17.350,00","17.350,00","17.300,00","17.335,71","0,06",45,"780.107,00","780.107,00",ALK,2023-09-11
12.09.2023,"17.500,00","17.500,00","17.300,00","17.353,09","0,10",81,"1.405.600,00","1.405.600,00",ALK,2023-09-12
13.09.2023,"17.500,00","17.500,00","17.487,00","17.494,54","0,82",209,"3.656.358,00","3.656.358,00",ALK,2023-09-13
14.09.2023,"17.350,00","17.360,00","17.350,00","17.351,81","-0,82",37,"642.017,00","642.017,00",ALK,2023-09-14
15.09.2023,"17.351,00","17.500,00","17.350,00","17.369,98","0,10",47,"816.389,00","816.389,00",ALK,2023-09-15
18.09.2023,"17.352,00","17.352,00","17.300,00","17.349,39","-0,12",183,"3.174.938,00","3.174.938,00",ALK,2023-09-18
19.09.2023,"17.500,00","17.500,00","17.400,00","17.493,35","0,83",60,"1.049.601,00","1.049.601,00",ALK,2023-09-19
20.09.2023,"17.499,00","17.500,00","17.400,00","17.495,98","0,02",227,"3.971.587,00","3.971.587,00",ALK,2023-09-20
21.09.2023,"17.600,00","17.600,00","17.499,00","17.510,10","0,08",197,"3.449.489,00","3.449.489,00",ALK,2023-09-21
22.09.2023,"17.700,00","17.700,00","17.550,00","17.592,86","0,47",21,"369.450,00","369.450,00",ALK,2023-09-22
25.09.2023,"17.600,00","17.600,00","17.550,00","17.578,57","-0,08",35,"615.250,00","615.250,00",ALK,2023-09-25
26.09.2023,"17.400,00","17.550,00","17.400,00","17.514,13","-0,37",46,"805.650,00","805.650,00",ALK,2023-09-26
27.09.2023,"17.500,00","17.502,00","17.500,00","17.501,33","-0,07",75,"1.312.600,00","1.312.600,00",ALK,2023-09-27
29.09.2023,"17.600,00","17.600,00","17.500,00","17.587,50","0,49",16,"281.400,00","281.400,00",ALK,2023-09-29
02.10.2023,"17.400,00","17.600,00","17.400,00","17.564,86","-0,13",37,"649.900,00","649.900,00",ALK,2023-10-02
03.10.2023,"17.600,00","17.600,00","17.599,00","17.599,06","0,19",53,"932.750,00","932.750,00",ALK,2023-10-03
04.10.2023,"17.650,00","17.700,00","17.550,00","17.626,98","0,16",61,"1.075.246,00","1.075.246,00",ALK,2023-10-04
05.10.2023,"17.603,00","17.650,00","17.600,00","17.622,72","-0,02",80,"1.409.818,00","1.409.818,00",ALK,2023-10-05
06.10.2023,"17.747,00","17.747,00","17.650,00","17.699,04","0,43",252,"4.460.157,00","4.460.157,00",ALK,2023-10-06
09.10.2023,"17.700,00","17.747,00","17.680,00","17.701,27","0,01",125,"2.212.659,00","2.212.659,00",ALK,2023-10-09
10.10.2023,"17.700,00","17.702,00","17.700,00","17.700,11","-0,01",170,"3.009.019,00","3.009.019,00",ALK,2023-10-10
12.10.2023,"17.720,00","17.850,00","17.702,00","17.708,15","0,05",27,"478.120,00","478.120,00",ALK,2023-10-12
13.10.2023,"17.750,00","17.850,00","17.712,00","17.752,20","0,25",305,"5.414.422,00","5.414.422,00",ALK,2023-10-13
16.10.2023,"17.801,00","17.900,00","17.760,00","17.807,26","0,31",99,"1.762.919,00","1.762.919,00",ALK,2023-10-16
17.10.2023,"18.000,00","18.000,00","17.800,00","17.901,71","0,53",143,"2.559.944,00","2.559.944,00",ALK,2023-10-17
18.10.2023,"18.000,00","18.100,00","18.000,00","18.005,12","0,58",316,"5.689.618,00","5.689.618,00",ALK,2023-10-18
19.10.2023,"18.300,00","18.300,00","18.300,00","18.300,00","1,64",5,"91.500,00","91.500,00",ALK,2023-10-19
20.10.2023,"18.099,00","18.099,00","18.000,00","18.015,35","-1,56",185,"3.332.840,00","3.332.840,00",ALK,2023-10-20
24.10.2023,"17.850,00","18.010,00","17.850,00","17.992,60","-0,13",88,"1.583.349,00","1.583.349,00",ALK,2023-10-24
25.10.2023,"18.000,00","18.000,00","18.000,00","18.000,00","0,04",36,"648.000,00","648.000,00",ALK,2023-10-25
26.10.2023,"17.900,00","18.100,00","17.900,00","18.025,69","0,14",101,"1.820.595,00","1.820.595,00",ALK,2023-10-26
27.10.2023,"18.000,00","18.051,00","18.000,00","18.048,60","0,13",162,"2.923.873,00","2.923.873,00",ALK,2023-10-27
30.10.2023,"17.901,00","18.000,00","17.901,00","17.984,78","-0,35",136,"2.445.930,00","2.445.930,00",ALK,2023-10-30
31.10.2023,"17.900,00","18.000,00","17.900,00","17.957,26","-0,15",100,"1.795.726,00","1.795.726,00",ALK,2023-10-31
01.11.2023,"17.900,00","17.900,00","17.900,00","17.900,00","-0,32",6,"107.400,00","107.400,00",ALK,2023-11-01
02.11.2023,"17.900,00","17.900,00","17.850,00","17.884,93","-0,08",46,"822.707,00","822.707,00",ALK,2023-11-02
03.11.2023,"17.700,00","17.900,00","17.700,00","17.789,66","-0,53",211,"3.753.618,00","3.753.618,00",ALK,2023-11-03
06.11.2023,"17.700,00","17.800,00","17.700,00","17.713,04","-0,43",92,"1.629.600,00","1.629.600,00",ALK,2023-11-06
07.11.2023,"17.698,00","17.700,00","17.690,00","17.694,87","-0,10",349,"6.175.510,00","6.175.510,00",ALK,2023-11-07
08.11.2023,"17.635,00","17.698,00","17.600,00","17.642,12","-0,30",266,"4.692.804,00","4.692.804,00",ALK,2023-11-08
09.11.2023,"17.650,00","17.650,00","17.602,00","17.647,80","0,03",112,"1.976.554,00","1.976.554,00",ALK,2023-11-09
10.11.2023,"17.699,00","17.700,00","17.650,00","17.680,19","0,18",75,"1.326.014,00","1.326.014,00",ALK,2023-11-10
13.11.2023,"17.700,00","17.700,00","17.500,00","17.643,72","-0,21",78,"1.376.210,00","1.376.210,00",ALK,2023-11-13
14.11.2023,"17.700,00","17.700,00","17.700,00","17.700,00","0,32",70,"1.239.000,00","1.239.000,00",ALK,2023-11-14
15.11.2023,"17.700,00","18.050,00","17.700,00","17.985,22","1,61",92,"1.654.640,00","1.654.640,00",ALK,2023-11-15
16.11.2023,"17.980,00","18.050,00","17.950,00","17.996,32","0,06",136,"2.447.500,00","2.447.500,00",ALK,2023-11-16
17.11.2023,"17.950,00","17.950,00","17.900,00","17.944,37","-0,29",38,"681.886,00","681.886,00",ALK,2023-11-17
20.11.2023,"17.800,00","17.980,00","17.800,00","17.954,93","0,06",130,"2.334.141,00","2.334.141,00",ALK,2023-11-20
21.11.2023,"17.900,00","17.900,00","17.802,00","17.868,60","-0,48",20,"357.372,00","357.372,00",ALK,2023-11-21
22.11.2023,"18.000,00","18.000,00","17.980,00","17.998,88","0,73",196,"3.527.780,00","3.527.780,00",ALK,2023-11-22
23.11.2023,"18.000,00","18.000,00","17.900,00","17.991,98","-0,04",131,"2.356.950,00","2.356.950,00",ALK,2023-11-23
24.11.2023,"18.000,00","18.000,00","18.000,00","18.000,00","0,04",111,"1.998.000,00","1.998.000,00",ALK,2023-11-24
27.11.2023,"18.100,00","18.100,00","18.002,00","18.062,42","0,35",414,"7.477.841,00","7.477.841,00",ALK,2023-11-27
28.11.2023,"18.149,00","18.149,00","18.100,00","18.146,55","0,47",100,"1.814.655,00","1.814.655,00",ALK,2023-11-28
29.11.2023,"18.100,00","18.146,00","18.100,00","18.126,41","-0,11",232,"4.205.328,00","4.205.328,00",ALK,2023-11-29
30.11.2023,"18.200,00","18.298,00","18.101,00","18.193,20","0,37",44,"800.501,00","800.501,00",ALK,2023-11-30
01.12.2023,"18.300,00","18.300,00","18.200,00","18.245,81","0,29",37,"675.095,00","675.095,00",ALK,2023-12-01
04.12.2023,"18.400,00","18.500,00","18.400,00","18.405,56","0,88",18,"331.300,00","331.300,00",ALK,2023-12-04
05.12.2023,"18.400,00","18.400,00","18.400,00","18.400,00","-0,03",88,"1.619.200,00","1.619.200,00",ALK,2023-12-05
06.12.2023,"18.350,00","18.350,00","18.201,00","18.334,20","-0,36",66,"1.210.057,00","1.210.057,00",ALK,2023-12-06
07.12.2023,"18.350,00","18.350,00","18.350,00","18.350,00","0,09",12,"220.200,00","220.200,00",ALK,2023-12-07
11.12.2023,"18.100,00","18.399,00","18.100,00","18.157,22","-1,05",129,"2.342.281,00","2.342.281,00",ALK,2023-12-11
12.12.2023,"18.150,00","18.150,00","18.150,00","18.150,00","-0,04",20,"363.000,00","363.000,00",ALK,2023-12-12
13.12.2023,"18.151,00","18.200,00","18.150,00","18.167,61","0,10",144,"2.616.136,00","2.616.136,00",ALK,2023-12-13
14.12.2023,"18.300,00","18.300,00","18.201,00","18.284,65","0,64",178,"3.254.668,00","3.254.668,00",ALK,2023-12-14
15.12.2023,"18.300,00","18.300,00","18.300,00","18.300,00","0,08",48,"878.400,00","878.400,00",ALK,2023-12-15
18.12.2023,"18.299,00","18.300,00","18.250,00","18.292,66","-0,04",76,"1.390.242,00","1.390.242,00",ALK,2023-12-18
19.12.2023,"18.250,00","18.250,00","18.250,00","18.250,00","-0,23",48,"876.000,00","876.000,00",ALK,2023-12-19
20.12.2023,"18.000,00","18.151,00","18.000,00","18.023,52","-1,24",234,"4.217.504,00","4.217.504,00",ALK,2023-12-20
21.12.2023,"18.200,00","18.200,00","18.200,00","18.200,00","0,98",3,"54.600,00","54.600,00",ALK,2023-12-21
22.12.2023,"18.250,00","18.250,00","18.150,00","18.206,52","0,04",23,"418.750,00","418.750,00",ALK,2023-12-22
25.12.2023,"18.150,00","18.200,00","18.150,00","18.158,87","-0,26",141,"2.560.400,00","2.560.400,00",ALK,2023-12-25
26.12.2023,"18.149,00","18.150,00","18.149,00","18.149,17","-0,05",60,"1.088.950,00","1.088.950,00",ALK,2023-12-26
27.12.2023,"18.100,00","18.145,00","18.100,00","18.104,17","-0,25",54,"977.625,00","977.625,00",ALK,2023-12-27
28.12.2023,"18.150,00","18.249,00","18.102,00","18.154,55","0,28",370,"6.717.182,00","6.717.182,00",ALK,2023-12-28
02.01.2024,"18.151,00","18.300,00","18.151,00","18.283,19","0,71",27,"493.646,00","493.646,00",ALK,2024-01-02
03.01.2024,"18.300,00","18.400,00","18.290,00","18.318,52","0,19",81,"1.483.800,00","1.483.800,00",ALK,2024-01-03
04.01.2024,"18.399,00","18.400,00","18.399,00","18.399,08","0,44",127,"2.336.683,00","2.336.683,00",ALK,2024-01-04
05.01.2024,"18.450,00","18.450,00","18.301,00","18.399,39","0,00",148,"2.723.110,00","2.723.110,00",ALK,2024-01-05
09.01.2024,"18.450,00","18.450,00","18.400,00","18.415,77","0,09",222,"4.088.300,00","4.088.300,00",ALK,2024-01-09
10.01.2024,"18.399,00","18.400,00","18.399,00","18.399,33","-0,09",97,"1.784.735,00","1.784.735,00",ALK,2024-01-10
11.01.2024,"18.399,00","18.400,00","18.399,00","18.399,45","0,00",128,"2.355.130,00","2.355.130,00",ALK,2024-01-11
12.01.2024,"18.350,00","18.448,00","18.350,00","18.400,60","0,01",63,"1.159.238,00","1.159.238,00",ALK,2024-01-12
15.01.2024,"18.350,00","18.449,00","18.301,00","18.391,13","-0,05",330,"6.069.072,00","6.069.072,00",ALK,2024-01-15
16.01.2024,"18.350,00","18.399,00","18.350,00","18.388,11","-0,02",18,"330.986,00","330.986,00",ALK,2024-01-16
17.01.2024,"18.350,00","18.400,00","18.350,00","18.396,38","0,04",233,"4.286.356,00","4.286.356,00",ALK,2024-01-17
18.01.2024,"18.449,00","18.449,00","18.400,00","18.439,20","0,23",10,"184.392,00","4.584.392,00",ALK,2024-01-18
22.01.2024,"18.400,00","18.400,00","18.400,00","18.400,00","-0,21",254,"4.673.600,00","4.673.600,00",ALK,2024-01-22
23.01.2024,"18.449,00","18.449,00","18.362,00","18.416,43","0,09",63,"1.160.235,00","1.160.235,00",ALK,2024-01-23
24.01.2024,"18.400,00","18.550,00","18.400,00","18.466,77","0,27",401,"7.405.175,00","7.405.175,00",ALK,2024-01-24
25.01.2024,"18.420,00","18.420,00","18.420,00","18.420,00","-0,25",10,"184.200,00","184.200,00",ALK,2024-01-25
26.01.2024,"18.548,00","18.550,00","18.548,00","18.548,18","0,70",132,"2.448.360,00","2.448.360,00",ALK,2024-01-26
29.01.2024,"18.650,00","18.650,00","18.450,00","18.583,80","0,19",235,"4.367.192,00","4.367.192,00",ALK,2024-01-29
30.01.2024,"19.000,00","19.000,00","18.584,00","18.761,08","0,95",221,"4.146.198,00","7.689.698,00",ALK,2024-01-30
31.01.2024,"19.300,00","19.300,00","19.300,00","19.300,00","2,87",138,"2.663.400,00","2.663.400,00",ALK,2024-01-31
01.02.2024,"20.299,00","20.399,00","20.299,00","20.368,70","5,54",33,"672.167,00","672.167,00",ALK,2024-02-01
02.02.2024,"19.899,00","19.999,00","19.899,00","19.993,44","-1,84",36,"719.764,00","719.764,00",ALK,2024-02-02
05.02.2024,"19.500,00","19.500,00","19.500,00","19.500,00","-2,47",110,"2.145.000,00","2.145.000,00",ALK,2024-02-05
06.02.2024,"19.301,00","19.500,00","19.301,00","19.495,54","-0,02",239,"4.659.435,00","4.659.435,00",ALK,2024-02-06
07.02.2024,"19.400,00","19.500,00","19.400,00","19.477,47","-0,09",312,"6.076.970,00","6.076.970,00",ALK,2024-02-07
08.02.2024,"19.400,00","19.498,00","19.400,00","19.440,83","-0,19",72,"1.399.740,00","1.399.740,00",ALK,2024-02-08
09.02.2024,"19.750,00","19.750,00","19.499,00","19.522,76","0,42",142,"2.772.232,00","2.772.232,00",ALK,2024-02-09
12.02.2024,"19.750,00","19.750,00","19.551,00","19.725,38","1,04",214,"4.221.231,00","4.221.231,00",ALK,2024-02-12
13.02.2024,"19.750,00","19.800,00","19.600,00","19.745,33","0,10",302,"5.963.090,00","5.963.090,00",ALK,2024-02-13
14.02.2024,"19.997,00","19.997,00","19.852,00","19.880,14","0,68",111,"2.206.696,00","2.206.696,00",ALK,2024-02-14
15.02.2024,"19.999,00","20.000,00","19.880,00","19.987,36","0,54",236,"4.717.016,00","4.717.016,00",ALK,2024-02-15
16.02.2024,"19.997,00","19.998,00","19.950,00","19.996,66","0,05",250,"4.999.165,00","4.999.165,00",ALK,2024-02-16
19.02.2024,"20.000,00","20.000,00","19.999,00","19.999,85","0,02",522,"10.439.920,00","10.439.920,00",ALK,2024-02-19
20.02.2024,"20.050,00","20.199,00","20.000,00","20.094,49","0,47",49,"984.630,00","984.630,00",ALK,2024-02-20
21.02.2024,"20.249,00","20.250,00","20.200,00","20.209,59","0,57",258,"5.214.075,00","5.214.075,00",ALK,2024-02-21
22.02.2024,"20.250,00","20.250,00","20.001,00","20.247,21","0,19",232,"4.697.352,00","4.697.352,00",ALK,2024-02-22
23.02.2024,"20.400,00","20.400,00","20.298,00","20.313,79","0,33",768,"15.600.990,00","15.600.990,00",ALK,2024-02-23
26.02.2024,"20.700,00","20.700,00","20.300,00","20.559,44","1,21",209,"4.296.922,00","4.296.922,00",ALK,2024-02-26
27.02.2024,"20.700,00","20.900,00","20.699,00","20.700,29","0,69","1,374","28.442.192,00","28.442.192,00",ALK,2024-02-27
28.02.2024,"20.600,00","20.600,00","20.599,00","20.599,08","-0,49",65,"1.338.940,00","1.338.940,00",ALK,2024-02-28
29.02.2024,"20.500,00","20.700,00","20.499,00","20.512,91","-0,42",106,"2.174.368,00","37.868.268,00",ALK,2024-02-29
01.03.2024,"20.480,00","20.480,00","20.480,00","20.480,00","-0,16",4,"81.920,00","81.920,00",ALK,2024-03-01
04.03.2024,"20.300,00","20.480,00","20.300,00","20.379,05","-0,49",186,"3.790.503,00","3.790.503,00",ALK,2024-03-04
05.03.2024,"20.200,00","20.350,00","20.200,00","20.232,38","-0,72",185,"3.742.990,00","3.742.990,00",ALK,2024-03-05
06.03.2024,"20.100,00","20.200,00","20.100,00","20.134,98","-0,48",257,"5.174.690,00","5.174.690,00",ALK,2024-03-06
07.03.2024,"20.100,00","20.200,00","20.000,00","20.063,01","-0,36",146,"2.929.200,00","2.929.200,00",ALK,2024-03-07
08.03.2024,"19.982,00","20.100,00","19.982,00","20.007,09","-0,28",266,"5.321.887,00","5.321.887,00",ALK,2024-03-08
11.03.2024,"20.000,00","20.000,00","19.920,00","19.983,88","-0,12",34,"679.452,00","679.452,00",ALK,2024-03-11
12.03.2024,"20.100,00","20.100,00","20.000,00","20.042,28","0,29",68,"1.362.875,00","1.362.875,00",ALK,2024-03-12
13.03.2024,"20.000,00","20.101,00","20.000,00","20.091,48","0,25",569,"11.432.050,00","11.432.050,00",ALK,2024-03-13
14.03.2024,"20.100,00","20.100,00","20.001,00","20.091,48","0,00",131,"2.631.984,00","2.631.984,00",ALK,2024-03-14
15.03.2024,"20.300,00","20.300,00","20.300,00","20.300,00","1,04",12,"243.600,00","243.600,00",ALK,2024-03-15
18.03.2024,"20.300,00","20.300,00","20.300,00","20.300,00","0,00",16,"324.800,00","324.800,00",ALK,2024-03-18
19.03.2024,"20.302,00","20.302,00","20.299,00","20.300,36","0,00",364,"7.389.330,00","7.389.330,00",ALK,2024-03-19
20.03.2024,"20.350,00","20.350,00","20.300,00","20.319,44","0,09",161,"3.271.430,00","3.271.430,00",ALK,2024-03-20
21.03.2024,"20.401,00","20.401,00","20.302,00","20.355,31","0,18",65,"1.323.095,00","1.323.095,00",ALK,2024-03-21
22.03.2024,"20.400,00","20.401,00","20.350,00","20.397,32","0,21",515,"10.504.619,00","10.504.619,00",ALK,2024-03-22
25.03.2024,"20.400,00","20.499,00","20.400,00","20.430,56","0,16",81,"1.654.875,00","1.654.875,00",ALK,2024-03-25
26.03.2024,"20.304,00","20.500,00","20.300,00","20.380,53","-0,24",49,"998.646,00","998.646,00",ALK,2024-03-26
27.03.2024,"20.396,00","20.400,00","20.396,00","20.398,61","0,09",173,"3.528.959,00","3.528.959,00",ALK,2024-03-27
28.03.2024,"20.395,00","20.397,00","20.394,00","20.395,21","-0,02",275,"5.608.684,00","5.608.684,00",ALK,2024-03-28
29.03.2024,"20.395,00","20.400,00","20.395,00","20.395,21","0,00",316,"6.444.885,00","6.444.885,00",ALK,2024-03-29
01.04.2024,"20.499,00","20.499,00","20.340,00","20.421,96","0,13",188,"3.839.329,00","3.839.329,00",ALK,2024-04-01
02.04.2024,"20.500,00","20.501,00","20.400,00","20.486,78","0,32",379,"7.764.490,00","7.764.490,00",ALK,2024-04-02
03.04.2024,"20.601,00","20.601,00","20.500,00","20.592,50","0,52",177,"3.644.872,00","3.644.872,00",ALK,2024-04-03
04.04.2024,"20.400,00","20.600,00","20.400,00","20.549,06","-0,21",159,"3.267.301,00","3.267.301,00",ALK,2024-04-04
05.04.2024,"20.600,00","20.600,00","20.598,00","20.599,25","0,24",227,"4.676.030,00","17.652.530,00",ALK,2024-04-05
08.04.2024,"20.595,00","20.600,00","20.500,00","20.572,22","-0,13",209,"4.299.594,00","4.299.594,00",ALK,2024-04-08
09.04.2024,"20.598,00","20.598,00","20.597,00","20.597,22","0,12",46,"947.472,00","947.472,00",ALK,2024-04-09
11.04.2024,"20.600,00","20.625,00","20.599,00","20.600,62","0,02",157,"3.234.297,00","3.234.297,00",ALK,2024-04-11
12.04.2024,"20.600,00","20.600,00","20.599,00","20.599,94","0,00",160,"3.295.991,00","3.295.991,00",ALK,2024-04-12
15.04.2024,"20.600,00","20.602,00","20.600,00","20.600,43","0,00",416,"8.569.780,00","8.569.780,00",ALK,2024-04-15
16.04.2024,"20.600,00","20.600,00","20.549,00","20.594,10","-0,03",389,"8.011.106,00","8.011.106,00",ALK,2024-04-16
18.04.2024,"20.100,00","20.100,00","20.100,00","20.100,00","-2,40",18,"361.800,00","361.800,00",ALK,2024-04-18
19.04.2024,"20.002,00","20.101,00","20.000,00","20.034,91","-0,32",68,"1.362.374,00","1.362.374,00",ALK,2024-04-19
22.04.2024,"20.050,00","20.050,00","20.001,00","20.039,94","0,03",101,"2.024.034,00","2.024.034,00",ALK,2024-04-22
23.04.2024,"20.100,00","20.100,00","20.002,00","20.077,78","0,19",83,"1.666.456,00","1.666.456,00",ALK,2024-04-23
25.04.2024,"20.151,00","20.200,00","20.101,00","20.152,25","0,37",32,"644.872,00","644.872,00",ALK,2024-04-25
26.04.2024,"20.200,00","20.202,00","20.199,00","20.200,45","0,24",262,"5.292.519,00","5.292.519,00",ALK,2024-04-26
29.04.2024,"20.350,00","20.350,00","20.298,00","20.303,92","0,51",239,"4.852.638,00","4.852.638,00",ALK,2024-04-29
30.04.2024,"20.400,00","20.400,00","20.351,00","20.374,27","0,35",260,"5.297.310,00","5.297.310,00",ALK,2024-04-30
02.05.2024,"20.450,00","20.450,00","20.422,00","20.449,49","0,37",109,"2.228.994,00","2.228.994,00",ALK,2024-05-02
07.05.2024,"20.500,00","20.500,00","20.450,00","20.460,16","0,05",192,"3.928.350,00","3.928.350,00",ALK,2024-05-07
09.05.2024,"20.600,00","20.600,00","20.545,00","20.553,42","0,46",73,"1.500.400,00","1.500.400,00",ALK,2024-05-09
10.05.2024,"20.752,00","21.000,00","20.600,00","20.728,55","0,85",266,"5.513.795,00","5.513.795,00",ALK,2024-05-10
13.05.2024,"21.000,00","21.000,00","20.998,00","20.999,48","1,31",42,"881.978,00","881.978,00",ALK,2024-05-13
14.05.2024,"21.000,00","21.100,00","21.000,00","21.093,20","0,45",598,"12.613.736,00","12.613.736,00",ALK,2024-05-14
15.05.2024,"20.950,00","21.000,00","20.950,00","20.987,90","-0,50",214,"4.491.410,00","4.491.410,00",ALK,2024-05-15
16.05.2024,"20.651,00","20.800,00","20.650,00","20.778,34","-1,00",460,"9.558.036,00","9.558.036,00",ALK,2024-05-16
17.05.2024,"20.700,00","20.797,00","20.650,00","20.714,67","-0,31",135,"2.796.481,00","2.796.481,00",ALK,2024-05-17
20.05.2024,"20.699,00","20.700,00","20.690,00","20.697,99","-0,08",82,"1.697.235,00","1.697.235,00",ALK,2024-05-20
21.05.2024,"20.700,00","20.700,00","20.600,00","20.614,65","-0,40",273,"5.627.800,00","5.627.800,00",ALK,2024-05-21
22.05.2024,"20.800,00","20.800,00","20.700,00","20.743,41","0,62",69,"1.431.295,00","1.431.295,00",ALK,2024-05-22
23.05.2024,"20.800,00","20.800,00","20.800,00","20.800,00","0,27",36,"748.800,00","748.800,00",ALK,2024-05-23
27.05.2024,"20.800,00","20.801,00","20.800,00","20.800,10","0,00",102,"2.121.610,00","2.121.610,00",ALK,2024-05-27
28.05.2024,"20.800,00","20.801,00","20.700,00","20.794,51","-0,03",508,"10.563.610,00","10.563.610,00",ALK,2024-05-28
29.05.2024,"20.800,00","20.800,00","20.800,00","20.800,00","0,03",429,"8.923.200,00","8.923.200,00",ALK,2024-05-29
30.05.2024,"20.900,00","20.902,00","20.801,00","20.877,74","0,37",727,"15.178.116,00","15.178.116,00",ALK,2024-05-30
31.05.2024,"20.800,00","20.899,00","20.800,00","20.805,44","-0,35",255,"5.305.386,00","5.305.386,00",ALK,2024-05-31
03.06.2024,"20.750,00","20.750,00","20.750,00","20.750,00","-0,27",4,"83.000,00","83.000,00",ALK,2024-06-03
04.06.2024,"20.700,00","20.800,00","20.700,00","20.734,18","-0,08",34,"704.962,00","704.962,00",ALK,2024-06-04
05.06.2024,"20.800,00","20.800,00","20.700,00","20.796,69","0,30",500,"10.398.344,00","10.398.344,00",ALK,2024-06-05
06.06.2024,"20.998,00","20.999,00","20.750,00","20.846,26","0,24",210,"4.377.715,00","4.377.715,00",ALK,2024-06-06
07.06.2024,"20.997,00","20.997,00","20.996,00","20.996,59","0,72",220,"4.619.250,00","4.619.250,00",ALK,2024-06-07
10.06.2024,"20.850,00","20.996,00","20.850,00","20.853,98","-0,68",256,"5.338.620,00","5.338.620,00",ALK,2024-06-10
11.06.2024,"20.900,00","20.900,00","20.850,00","20.860,89","0,03",209,"4.359.927,00","4.359.927,00",ALK,2024-06-11
12.06.2024,"20.900,00","20.900,00","20.850,00","20.885,35","0,12",359,"7.497.841,00","7.497.841,00",ALK,2024-06-12
13.06.2024,"20.800,00","20.900,00","20.800,00","20.894,59","0,04",414,"8.650.360,00","8.650.360,00",ALK,2024-06-13
14.06.2024,"20.800,00","20.900,00","20.800,00","20.880,41","-0,07",296,"6.180.600,00","6.180.600,00",ALK,2024-06-14
17.06.2024,"20.800,00","20.800,00","20.750,00","20.792,39","-0,42",230,"4.782.249,00","4.782.249,00",ALK,2024-06-17
18.06.2024,"20.750,00","20.750,00","20.700,00","20.742,66","-0,24",79,"1.638.670,00","1.638.670,00",ALK,2024-06-18
19.06.2024,"20.700,00","20.750,00","20.700,00","20.727,50","-0,07",84,"1.741.110,00","1.741.110,00",ALK,2024-06-19
20.06.2024,"20.749,00","20.750,00","20.730,00","20.749,23","0,10",128,"2.655.902,00","2.655.902,00",ALK,2024-06-20
24.06.2024,"20.750,00","20.750,00","20.700,00","20.725,00","-0,12",4,"82.900,00","82.900,00",ALK,2024-06-24
25.06.2024,"20.550,00","20.600,00","20.501,00","20.590,46","-0,65",126,"2.594.398,00","2.594.398,00",ALK,2024-06-25
26.06.2024,"20.600,00","20.600,00","20.500,00","20.531,37","-0,29",128,"2.628.015,00","2.628.015,00",ALK,2024-06-26
27.06.2024,"20.600,00","20.600,00","20.500,00","20.529,13","-0,01",237,"4.865.404,00","4.865.404,00",ALK,2024-06-27
28.06.2024,"20.600,00","20.600,00","20.501,00","20.589,00","0,29",81,"1.667.709,00","1.667.709,00",ALK,2024-06-28
01.07.2024,"20.540,00","20.700,00","20.540,00","20.603,42","0,07",646,"13.309.807,00","13.309.807,00",ALK,2024-07-01
02.07.2024,"20.800,00","20.900,00","20.600,00","20.713,06","0,53",786,"16.280.469,00","16.280.469,00",ALK,2024-07-02
03.07.2024,"20.800,00","20.900,00","20.800,00","20.804,99","0,44",141,"2.933.503,00","2.933.503,00",ALK,2024-07-03
04.07.2024,"21.004,00","21.004,00","20.850,00","20.941,01","0,65",163,"3.413.385,00","3.413.385,00",ALK,2024-07-04
05.07.2024,"21.550,00","21.550,00","21.201,00","21.366,32","2,03",19,"405.960,00","405.960,00",ALK,2024-07-05
08.07.2024,"21.500,00","21.500,00","21.200,00","21.210,14","-0,73",148,"3.139.100,00","3.139.100,00",ALK,2024-07-08
09.07.2024,"21.500,00","21.800,00","21.300,00","21.509,80","1,41",102,"2.194.000,00","2.194.000,00",ALK,2024-07-09
10.07.2024,"22.100,00","22.155,00","22.000,00","22.067,56","2,59",43,"948.905,00","948.905,00",ALK,2024-07-10
11.07.2024,"22.050,00","22.500,00","22.050,00","22.133,55","0,30",391,"8.654.219,00","8.654.219,00",ALK,2024-07-11
12.07.2024,"22.100,00","22.100,00","22.000,00","22.019,75","-0,51",81,"1.783.600,00","1.783.600,00",ALK,2024-07-12
15.07.2024,"22.000,00","22.000,00","21.999,00","21.999,93","-0,09",135,"2.969.990,00","2.969.990,00",ALK,2024-07-15
16.07.2024,"22.150,00","22.150,00","22.000,00","22.048,82","0,22",242,"5.335.815,00","5.335.815,00",ALK,2024-07-16
17.07.2024,"22.500,00","22.500,00","22.100,00","22.128,55","0,36",605,"13.387.770,00","13.387.770,00",ALK,2024-07-17
18.07.2024,"22.149,00","22.150,00","22.147,00","22.149,44","0,09",222,"4.917.175,00","4.917.175,00",ALK,2024-07-18
19.07.2024,"22.149,00","22.150,00","22.140,00","22.147,18","-0,01",390,"8.637.401,00","8.637.401,00",ALK,2024-07-19
22.07.2024,"22.146,00","22.148,00","22.146,00","22.147,09","0,00",105,"2.325.444,00","2.325.444,00",ALK,2024-07-22
23.07.2024,"22.150,00","22.200,00","22.139,00","22.150,20","0,01",402,"8.904.382,00","8.904.382,00",ALK,2024-07-23
24.07.2024,"22.211,00","22.220,00","22.150,00","22.192,72","0,19",380,"8.433.232,00","8.433.232,00",ALK,2024-07-24
25.07.2024,"22.350,00","22.350,00","22.220,00","22.220,59","0,13",264,"5.866.237,00","5.866.237,00",ALK,2024-07-25
26.07.2024,"22.250,00","22.250,00","22.220,00","22.231,92","0,05",330,"7.336.535,00","7.336.535,00",ALK,2024-07-26
29.07.2024,"22.350,00","22.350,00","22.249,00","22.253,34","0,10",416,"9.257.388,00","9.257.388,00",ALK,2024-07-29
30.07.2024,"22.300,00","22.350,00","22.299,00","22.302,01","0,22",239,"5.330.180,00","5.330.180,00",ALK,2024-07-30
31.07.2024,"22.300,00","22.300,00","22.295,00","22.298,95","-0,01",157,"3.500.935,00","3.500.935,00",ALK,2024-07-31
01.08.2024,"22.249,00","22.250,00","22.200,00","22.224,82","-0,33",38,"844.543,00","844.543,00",ALK,2024-08-01
05.08.2024,"21.800,00","22.100,00","21.800,00","22.010,90","-0,96",92,"2.025.003,00","2.025.003,00",ALK,2024-08-05
06.08.2024,"21.989,00","21.999,00","21.989,00","21.997,45","-0,06",31,"681.921,00","681.921,00",ALK,2024-08-06
07.08.2024,"21.875,00","21.989,00","21.800,00","21.904,34","-0,42",217,"4.753.241,00","4.753.241,00",ALK,2024-08-07
08.08.2024,"21.980,00","21.980,00","21.875,00","21.889,14","-0,07",191,"4.180.825,00","4.180.825,00",ALK,2024-08-08
09.08.2024,"22.000,00","22.000,00","21.979,00","21.982,42","0,43",221,"4.858.114,00","4.858.114,00",ALK,2024-08-09
12.08.2024,"22.150,00","22.150,00","21.910,00","22.141,58","0,72",57,"1.262.070,00","1.262.070,00",ALK,2024-08-12
13.08.2024,"22.200,00","22.250,00","21.910,00","22.141,31","0,00",132,"2.922.653,00","2.922.653,00",ALK,2024-08-13
14.08.2024,"22.200,00","22.250,00","22.200,00","22.215,34","0,33",118,"2.621.410,00","2.621.410,00",ALK,2024-08-14
15.08.2024,"22.100,00","22.249,00","21.650,00","22.090,70","-0,56",87,"1.921.891,00","1.921.891,00",ALK,2024-08-15
16.08.2024,"22.099,00","22.200,00","22.099,00","22.100,77","0,05",199,"4.398.053,00","4.398.053,00",ALK,2024-08-16
19.08.2024,"22.000,00","22.100,00","22.000,00","22.014,46","-0,39",35,"770.506,00","5.788.006,00",ALK,2024-08-19
20.08.2024,"21.999,00","22.050,00","21.998,00","22.002,84","-0,05",267,"5.874.759,00","5.874.759,00",ALK,2024-08-20
21.08.2024,"22.000,00","22.000,00","21.950,00","21.996,57","-0,03",640,"14.077.805,00","14.077.805,00",ALK,2024-08-21
22.08.2024,"22.000,00","22.000,00","21.999,00","21.999,41","0,01",222,"4.883.870,00","4.883.870,00",ALK,2024-08-22
23.08.2024,"21.999,00","21.999,00","21.990,00","21.995,20","-0,02",79,"1.737.621,00","1.737.621,00",ALK,2024-08-23
26.08.2024,"21.999,00","22.000,00","21.999,00","21.999,49","0,02",69,"1.517.965,00","1.517.965,00",ALK,2024-08-26
27.08.2024,"21.999,00","21.999,00","21.995,00","21.996,62","-0,01",198,"4.355.331,00","4.355.331,00",ALK,2024-08-27
29.08.2024,"21.940,00","21.999,00","21.900,00","21.938,50","-0,26",84,"1.842.834,00","1.842.834,00",ALK,2024-08-29
30.08.2024,"22.000,00","22.000,00","21.940,00","21.989,63","0,23",185,"4.068.081,00","4.068.081,00",ALK,2024-08-30
02.09.2024,"21.950,00","22.000,00","21.950,00","21.993,43","0,02",145,"3.189.048,00","3.189.048,00",ALK,2024-09-02
03.09.2024,"22.000,00","22.000,00","21.899,00","21.967,90","-0,12",159,"3.492.896,00","3.492.896,00",ALK,2024-09-03
04.09.2024,"21.995,00","21.995,00","21.900,00","21.906,25","-0,28",32,"701.000,00","701.000,00",ALK,2024-09-04
05.09.2024,"21.995,00","21.995,00","21.994,00","21.994,90","0,40",50,"1.099.745,00","1.099.745,00",ALK,2024-09-05
06.09.2024,"21.993,00","21.994,00","21.900,00","21.962,32","-0,15",367,"8.060.173,00","8.060.173,00",ALK,2024-09-06
10.09.2024,"22.000,00","22.000,00","21.963,00","21.992,51","0,14",364,"8.005.275,00","8.005.275,00",ALK,2024-09-10
11.09.2024,"22.100,00","22.100,00","21.900,00","21.999,92","0,03",211,"4.641.983,00","4.641.983,00",ALK,2024-09-11
12.09.2024,"22.002,00","22.150,00","22.002,00","22.126,76","0,58",184,"4.071.324,00","4.071.324,00",ALK,2024-09-12
13.09.2024,"22.399,00","22.700,00","22.151,00","22.269,03","0,64",471,"10.488.714,00","10.488.714,00",ALK,2024-09-13
16.09.2024,"22.004,00","22.004,00","22.000,00","22.002,37","-1,20",57,"1.254.135,00","1.254.135,00",ALK,2024-09-16
17.09.2024,"22.200,00","22.200,00","22.198,00","22.198,93","0,89",162,"3.596.227,00","3.596.227,00",ALK,2024-09-17
18.09.2024,"22.310,00","22.350,00","22.300,00","22.309,76","0,50",123,"2.744.100,00","2.744.100,00",ALK,2024-09-18
19.09.2024,"22.150,00","22.300,00","22.100,00","22.146,50","-0,73",760,"16.831.341,00","16.831.341,00",ALK,2024-09-19
20.09.2024,"22.200,00","22.300,00","22.150,00","22.217,21","0,32",61,"1.355.250,00","1.355.250,00",ALK,2024-09-20
23.09.2024,"22.299,00","22.300,00","22.200,00","22.295,52","0,35",84,"1.872.824,00","1.872.824,00",ALK,2024-09-23
24.09.2024,"22.300,00","22.300,00","22.250,00","22.298,10","0,01",30,"668.943,00","668.943,00",ALK,2024-09-24
25.09.2024,"22.222,00","22.300,00","22.222,00","22.264,43","-0,15",37,"823.784,00","823.784,00",ALK,2024-09-25
26.09.2024,"22.300,00","22.300,00","22.250,00","22.291,80","0,12",61,"1.359.800,00","1.359.800,00",ALK,2024-09-26
27.09.2024,"22.300,00","22.301,00","22.300,00","22.300,39","0,04",77,"1.717.130,00","1.717.130,00",ALK,2024-09-27
30.09.2024,"22.300,00","22.303,00","22.300,00","22.300,96","0,00",253,"5.642.142,00","5.642.142,00",ALK,2024-09-30
01.10.2024,"22.250,00","22.300,00","22.250,00","22.294,28","-0,03",128,"2.853.668,00","2.853.668,00",ALK,2024-10-01
02.10.2024,"22.300,00","22.350,00","22.250,00","22.296,09","0,01",225,"5.016.620,00","5.016.620,00",ALK,2024-10-02
03.10.2024,"22.250,00","22.300,00","22.250,00","22.269,75","-0,12",119,"2.650.100,00","2.650.100,00",ALK,2024-10-03
04.10.2024,"22.201,00","22.250,00","22.201,00","22.242,51","-0,12",72,"1.601.461,00","1.601.461,00",ALK,2024-10-04
07.10.2024,"22.150,00","22.250,00","22.150,00","22.204,41","-0,17",78,"1.731.944,00","1.731.944,00",ALK,2024-10-07
08.10.2024,"22.300,00","22.300,00","22.155,00","22.251,97","0,21",77,"1.713.402,00","1.713.402,00",ALK,2024-10-08
09.10.2024,"22.300,00","22.300,00","22.250,00","22.286,23","0,15",61,"1.359.460,00","1.359.460,00",ALK,2024-10-09
10.10.2024,"22.350,00","22.400,00","22.300,00","22.347,50","0,27",177,"3.955.508,00","3.955.508,00",ALK,2024-10-10
14.10.2024,"22.300,00","22.350,00","22.300,00","22.301,63","-0,21",195,"4.348.818,00","4.348.818,00",ALK,2024-10-14
15.10.2024,"22.101,00","22.300,00","22.100,00","22.240,91","-0,27",92,"2.046.164,00","2.046.164,00",ALK,2024-10-15
16.10.2024,"22.295,00","22.295,00","22.100,00","22.140,92","-0,45",74,"1.638.428,00","1.638.428,00",ALK,2024-10-16
17.10.2024,"22.250,00","22.296,00","22.160,00","22.246,02","0,47",317,"7.051.987,00","7.051.987,00",ALK,2024-10-17
18.10.2024,"22.250,00","22.300,00","22.249,00","22.254,15","0,04",222,"4.940.421,00","4.940.421,00",ALK,2024-10-18
21.10.2024,"22.250,00","22.300,00","22.200,00","22.274,43","0,09",298,"6.637.780,00","6.637.780,00",ALK,2024-10-21
22.10.2024,"22.250,00","22.500,00","22.200,00","22.288,64","0,06",78,"1.738.514,00","1.738.514,00",ALK,2024-10-22
24.10.2024,"22.250,00","22.251,00","22.200,00","22.243,51","-0,20",359,"7.985.420,00","7.985.420,00",ALK,2024-10-24
25.10.2024,"22.200,00","22.251,00","22.200,00","22.225,74","-0,08",339,"7.534.525,00","7.534.525,00",ALK,2024-10-25
28.10.2024,"22.300,00","22.350,00","22.250,00","22.266,81","0,18",111,"2.471.616,00","2.471.616,00",ALK,2024-10-28
29.10.2024,"22.200,00","22.260,00","22.200,00","22.252,00","-0,07",125,"2.781.500,00","2.781.500,00",ALK,2024-10-29
30.10.2024,"22.250,00","22.250,00","22.250,00","22.250,00","-0,01",86,"1.913.500,00","1.913.500,00",ALK,2024-10-30
31.10.2024,"22.250,00","22.310,00","22.250,00","22.291,33","0,19",218,"4.859.510,00","4.859.510,00",ALK,2024-10-31
01.11.2024,"22.300,00","22.351,00","22.300,00","22.316,35","0,11",712,"15.889.243,00","26.615.543,00",ALK,2024-11-01
04.11.2024,"22.300,00","22.300,00","22.250,00","22.293,98","-0,10",408,"9.095.944,00","9.095.944,00",ALK,2024-11-04
05.11.2024,"22.300,00","22.300,00","22.298,00","22.299,74","0,03","3,434","76.577.300,00","76.577.300,00",ALK,2024-11-05
06.11.2024,"22.500,00","22.502,00","22.301,00","22.484,06","0,83",187,"4.204.519,00","4.204.519,00",ALK,2024-11-06
07.11.2024,"23.000,00","23.000,00","22.990,00","22.997,62","2,28",130,"2.989.691,00","2.989.691,00",ALK,2024-11-07
08.11.2024,"23.299,00","23.400,00","23.010,00","23.193,84","0,85",64,"1.484.406,00","1.484.406,00",ALK,2024-11-08
30.10.2015,"12.000,00",/,/,"12.000,00","0,00",0,"0,00","0,00",ALKB,2015-10-30
28.10.2016,"12.000,00",/,/,"12.000,00","0,00",0,"0,00","0,00",ALKB,2016-10-28
31.10.2016,"18.510,00","18.510,00","18.510,00","18.510,00","54,25",50,"925.500,00","925.500,00",ALKB,2016-10-31
28.11.2016,"18.510,00","18.510,00","18.510,00","18.510,00","0,00",11,"203.610,00","203.610,00",ALKB,2016-11-28
22.12.2016,"18.510,00","18.510,00","18.510,00","18.510,00","0,00",13,"240.630,00","240.630,00",ALKB,2016-12-22
24.03.2017,"18.510,00","18.510,00","18.510,00","18.510,00","0,00",273,"5.053.230,00","5.053.230,00",ALKB,2017-03-24
28.03.2017,"18.510,00","18.510,00","18.510,00","18.510,00","0,00",280,"5.182.800,00","5.182.800,00",ALKB,2017-03-28
22.05.2017,"18.510,00","18.510,00","18.510,00","18.510,00","0,00",45,"832.950,00","832.950,00",ALKB,2017-05-22
30.10.2017,"18.510,00",/,/,"18.510,00","0,00",0,"0,00","0,00",ALKB,2017-10-30
25.04.2018,"18.510,00","18.510,00","18.510,00","18.510,00","0,00",37,"684.870,00","684.870,00",ALKB,2018-04-25
05.07.2018,"18.510,00","18.510,00","18.510,00","18.510,00","0,00",14,"259.140,00","259.140,00",ALKB,2018-07-05
29.08.2018,"18.510,00","18.510,00","18.510,00","18.510,00","0,00",14,"259.140,00","259.140,00",ALKB,2018-08-29
30.10.2018,"18.510,00",/,/,"18.510,00","0,00",0,"0,00","0,00",ALKB,2018-10-30
27.09.2019,"18.510,00","18.510,00","18.510,00","18.510,00","0,00",15,"277.650,00","277.650,00",ALKB,2019-09-27
30.10.2019,"18.510,00",/,/,"18.510,00","0,00",0,"0,00","0,00",ALKB,2019-10-30
29.10.2020,"18.510,00",/,/,"18.510,00","0,00",0,"0,00","0,00",ALKB,2020-10-29
30.12.2020,"18.510,00",/,/,"18.510,00","0,00",0,"0,00","0,00",ALKB,2020-12-30
03.10.2022,"18.510,00","18.510,00","18.510,00","18.510,00","0,00",15,"277.650,00","277.650,00",ALKB,2022-10-03
28.10.2022,"18.510,00",/,/,"18.510,00","0,00",0,"0,00","0,00",ALKB,2022-10-28
27.10.2023,"18.510,00",/,/,"18.510,00","0,00",0,"0,00","0,00",ALKB,2023-10-27
19.07.2024,"18.510,00","18.510,00","18.510,00","18.510,00","0,00",33,"610.830,00","610.830,00",ALKB,2024-07-19
28.10.2024,"18.510,00",/,/,"18.510,00","0,00",0,"0,00","0,00",ALKB,2024-10-28
08.11.2024,"18.510,00",/,/,"18.510,00","0,00",0,"0,00","0,00",ALKB,2024-11-08
30.10.2015,"400,00",/,/,"400,00","0,00",0,"0,00","0,00",AMEH,2015-10-30
16.12.2015,"400,00","400,00","400,00","400,00","0,00",80,"32.000,00","32.000,00",AMEH,2015-12-16
28.10.2016,"400,00",/,/,"400,00","0,00",0,"0,00","0,00",AMEH,2016-10-28
25.11.2016,"2.800,00","2.800,00","2.800,00","2.800,00","600,00",15,"42.000,00","42.000,00",AMEH,2016-11-25
30.10.2017,"2.800,00",/,/,"2.800,00","0,00",0,"0,00","0,00",AMEH,2017-10-30
30.10.2018,"2.800,00",/,/,"2.800,00","0,00",0,"0,00","0,00",AMEH,2018-10-30
15.05.2019,"615,00","615,00","615,00","615,00","-78,04",80,"49.200,00","49.200,00",AMEH,2019-05-15
16.05.2019,"615,00","615,00","615,00","615,00","0,00",120,"73.800,00","73.800,00",AMEH,2019-05-16
21.05.2019,"500,00","500,00","500,00","500,00","-18,70",35,"17.500,00","17.500,00",AMEH,2019-05-21
19.08.2019,"300,00","300,00","300,00","300,00","-40,00",30,"9.000,00","9.000,00",AMEH,2019-08-19
30.10.2019,"300,00",/,/,"300,00","0,00",0,"0,00","0,00",AMEH,2019-10-30
29.10.2020,"300,00",/,/,"300,00","0,00",0,"0,00","0,00",AMEH,2020-10-29
29.10.2021,"300,00",/,/,"300,00","0,00",0,"0,00","0,00",AMEH,2021-10-29
28.10.2022,"300,00",/,/,"300,00","0,00",0,"0,00","0,00",AMEH,2022-10-28
27.10.2023,"300,00",/,/,"300,00","0,00",0,"0,00","0,00",AMEH,2023-10-27
28.10.2024,"300,00",/,/,"300,00","0,00",0,"0,00","0,00",AMEH,2024-10-28
08.11.2024,"300,00",/,/,"300,00","0,00",0,"0,00","0,00",AMEH,2024-11-08
29.12.2014,"750,00","750,00","750,00","750,00","0,00","1,100","825.000,00","825.000,00",APTK,2014-12-29
07.05.2015,"750,00","750,00","750,00","750,00","0,00",110,"82.500,00","82.500,00",APTK,2015-05-07
22.10.2015,"750,00","750,00","750,00","750,00","0,00",125,"93.750,00","93.750,00",APTK,2015-10-22
30.10.2015,"750,00",/,/,"750,00","0,00",0,"0,00","0,00",APTK,2015-10-30
28.10.2016,"750,00",/,/,"750,00","0,00",0,"0,00","0,00",APTK,2016-10-28
30.10.2017,"750,00",/,/,"750,00","0,00",0,"0,00","0,00",APTK,2017-10-30
17.07.2018,"750,00","750,00","750,00","750,00","0,00",11,"8.250,00","8.250,00",APTK,2018-07-17
30.10.2018,"750,00",/,/,"750,00","0,00",0,"0,00","0,00",APTK,2018-10-30
04.03.2019,"750,00","750,00","750,00","750,00","0,00",20,"15.000,00","15.000,00",APTK,2019-03-04
30.10.2019,"750,00",/,/,"750,00","0,00",0,"0,00","0,00",APTK,2019-10-30
29.10.2020,"750,00",/,/,"750,00","0,00",0,"0,00","0,00",APTK,2020-10-29
29.10.2021,"750,00",/,/,"750,00","0,00",0,"0,00","0,00",APTK,2021-10-29
28.10.2022,"750,00",/,/,"750,00","0,00",0,"0,00","0,00",APTK,2022-10-28
12.05.2023,"750,00","750,00","750,00","750,00","0,00",566,"424.500,00","424.500,00",APTK,2023-05-12
27.10.2023,"750,00",/,/,"750,00","0,00",0,"0,00","0,00",APTK,2023-10-27
10.11.2023,"750,00","750,00","750,00","750,00","0,00",9,"6.750,00","6.750,00",APTK,2023-11-10
11.12.2023,"750,00","750,00","750,00","750,00","0,00",409,"306.750,00","306.750,00",APTK,2023-12-11
20.12.2023,"750,00","750,00","750,00","750,00","0,00",10,"7.500,00","7.500,00",APTK,2023-12-20
16.08.2024,"750,00","750,00","750,00","750,00","0,00",94,"70.500,00","70.500,00",APTK,2024-08-16
28.10.2024,"750,00",/,/,"750,00","0,00",0,"0,00","0,00",APTK,2024-10-28
08.11.2024,"750,00",/,/,"750,00","0,00",0,"0,00","0,00",APTK,2024-11-08
24.11.2014,"307,00","307,00","307,00","307,00","0,00",24,"7.368,00","7.368,00",ATPP,2014-11-24
26.11.2014,"307,00","307,00","307,00","307,00","0,00",23,"7.061,00","7.061,00",ATPP,2014-11-26
24.12.2014,"307,00","307,00","307,00","307,00","0,00",18,"5.526,00","5.526,00",ATPP,2014-12-24
06.02.2015,"307,00","307,00","307,00","307,00","0,00",22,"6.754,00","6.754,00",ATPP,2015-02-06
07.07.2015,"307,00","307,00","307,00","307,00","0,00",21,"6.447,00","6.447,00",ATPP,2015-07-07
10.11.2015,"307,00",/,/,"307,00","0,00",0,"0,00","0,00",ATPP,2015-11-10
31.05.2016,"615,00","615,00","615,00","615,00","100,33",17,"10.455,00","10.455,00",ATPP,2016-05-31
09.11.2016,"615,00",/,/,"615,00","0,00",0,"0,00","0,00",ATPP,2016-11-09
07.09.2017,"615,00","615,00","615,00","615,00","0,00",38,"23.370,00","23.370,00",ATPP,2017-09-07
09.11.2017,"615,00",/,/,"615,00","0,00",0,"0,00","0,00",ATPP,2017-11-09
25.07.2018,"615,00","615,00","615,00","615,00","0,00",24,"14.760,00","14.760,00",ATPP,2018-07-25
09.11.2018,"615,00",/,/,"615,00","0,00",0,"0,00","0,00",ATPP,2018-11-09
08.11.2019,"615,00",/,/,"615,00","0,00",0,"0,00","0,00",ATPP,2019-11-08
02.01.2020,"615,00",/,/,"615,00","0,00",0,"0,00","0,00",ATPP,2020-01-02
26.05.2021,"615,00","615,00","615,00","615,00","0,00",20,"12.300,00","12.300,00",ATPP,2021-05-26
08.11.2021,"615,00",/,/,"615,00","0,00",0,"0,00","0,00",ATPP,2021-11-08
08.11.2022,"615,00",/,/,"615,00","0,00",0,"0,00","0,00",ATPP,2022-11-08
22.02.2023,"923,00","923,00","923,00","923,00","50,08",20,"18.460,00","18.460,00",ATPP,2023-02-22
30.03.2023,"923,00","923,00","923,00","923,00","0,00",14,"12.922,00","12.922,00",ATPP,2023-03-30
03.11.2023,"923,00","923,00","923,00","923,00","0,00",46,"42.458,00","42.458,00",ATPP,2023-11-03
08.11.2023,"923,00",/,/,"923,00","0,00",0,"0,00","0,00",ATPP,2023-11-08
13.03.2024,"923,00","923,00","923,00","923,00","0,00",30,"27.690,00","27.690,00",ATPP,2024-03-13
21.03.2024,"923,00","923,00","923,00","923,00","0,00",18,"16.614,00","16.614,00",ATPP,2024-03-21
07.11.2024,"923,00",/,/,"923,00","0,00",0,"0,00","0,00",ATPP,2024-11-07
24.11.2014,"1.300,00","1.300,00","1.300,00","1.300,00","0,00",100,"130.000,00","130.000,00",AUMK,2014-11-24
20.02.2015,"1.300,00","1.300,00","1.300,00","1.300,00","0,00",30,"39.000,00","39.000,00",AUMK,2015-02-20
27.04.2015,"1.300,00","1.300,00","1.300,00","1.300,00","0,00",10,"13.000,00","13.000,00",AUMK,2015-04-27
30.04.2015,"1.300,00","1.300,00","1.300,00","1.300,00","0,00",65,"84.500,00","84.500,00",AUMK,2015-04-30
27.07.2015,"1.147,00","1.147,00","1.147,00","1.147,00","-11,77",50,"57.350,00","57.350,00",AUMK,2015-07-27
24.09.2015,"1.150,00","1.150,00","1.150,00","1.150,00","0,26",201,"231.150,00","231.150,00",AUMK,2015-09-24
02.10.2015,"1.499,00","1.499,00","1.499,00","1.499,00","30,35",5,"7.495,00","7.495,00",AUMK,2015-10-02
10.11.2015,"1.499,00",/,/,"1.499,00","0,00",0,"0,00","0,00",AUMK,2015-11-10
18.02.2016,"1.499,00","1.499,00","1.499,00","1.499,00","0,00",500,"749.500,00","749.500,00",AUMK,2016-02-18
02.06.2016,"1.300,00","1.300,00","1.300,00","1.300,00","-13,28",50,"65.000,00","65.000,00",AUMK,2016-06-02
05.09.2016,"1.205,00","1.205,00","1.205,00","1.205,00","-7,31",60,"72.300,00","72.300,00",AUMK,2016-09-05
06.09.2016,"1.200,00","1.200,00","1.200,00","1.200,00","-0,41",127,"152.400,00","152.400,00",AUMK,2016-09-06
20.10.2016,"1.200,00","1.200,00","1.200,00","1.200,00","0,00",31,"37.200,00","37.200,00",AUMK,2016-10-20
09.11.2016,"1.200,00",/,/,"1.200,00","0,00",0,"0,00","0,00",AUMK,2016-11-09
14.11.2016,"1.330,00","1.330,00","1.330,00","1.330,00","10,83",50,"66.500,00","66.500,00",AUMK,2016-11-14
15.11.2016,"1.201,00","1.201,00","1.201,00","1.201,00","-9,70",150,"180.150,00","180.150,00",AUMK,2016-11-15
16.11.2016,"1.330,00","1.330,00","1.330,00","1.330,00","10,74",270,"359.100,00","359.100,00",AUMK,2016-11-16
17.11.2016,"1.500,00","1.500,00","1.500,00","1.500,00","12,78",25,"37.500,00","37.500,00",AUMK,2016-11-17
18.11.2016,"1.650,00","1.650,00","1.650,00","1.650,00","10,00",50,"82.500,00","82.500,00",AUMK,2016-11-18
01.12.2016,"1.650,00","1.650,00","1.650,00","1.650,00","0,00",117,"193.050,00","193.050,00",AUMK,2016-12-01
02.12.2016,"1.330,00","1.330,00","1.330,00","1.330,00","-19,39",292,"388.360,00","388.360,00",AUMK,2016-12-02
22.12.2016,"1.463,00","1.463,00","1.463,00","1.463,00","10,00",22,"32.186,00","32.186,00",AUMK,2016-12-22
02.02.2017,"1.507,00","1.507,00","1.507,00","1.507,00","3,01",50,"75.350,00","75.350,00",AUMK,2017-02-02
27.04.2017,"1.650,00","1.650,00","1.650,00","1.650,00","9,49",55,"90.750,00","90.750,00",AUMK,2017-04-27
05.07.2017,"1.650,00","1.650,00","1.650,00","1.650,00","0,00",50,"82.500,00","82.500,00",AUMK,2017-07-05
13.07.2017,"1.750,00","1.750,00","1.750,00","1.750,00","6,06",103,"180.250,00","180.250,00",AUMK,2017-07-13
19.07.2017,"1.910,00","1.910,00","1.910,00","1.910,00","9,14",55,"105.050,00","105.050,00",AUMK,2017-07-19
20.07.2017,"1.950,00","1.950,00","1.950,00","1.950,00","2,09",100,"195.000,00","195.000,00",AUMK,2017-07-20
24.07.2017,"1.951,00","1.951,00","1.951,00","1.951,00","0,05",12,"23.412,00","23.412,00",AUMK,2017-07-24
25.07.2017,"2.140,00","2.140,00","2.140,00","2.140,00","9,69",10,"21.400,00","21.400,00",AUMK,2017-07-25
08.08.2017,"2.140,00","2.140,00","2.140,00","2.140,00","0,00",40,"85.600,00","85.600,00",AUMK,2017-08-08
09.11.2017,"2.140,00",/,/,"2.140,00","0,00",0,"0,00","0,00",AUMK,2017-11-09
17.01.2018,"1.699,00","1.699,00","1.699,00","1.699,00","-20,61",52,"88.348,00","88.348,00",AUMK,2018-01-17
22.01.2018,"1.700,00","1.700,00","1.700,00","1.700,00","0,06",140,"238.000,00","238.000,00",AUMK,2018-01-22
07.02.2018,"1.650,00","1.650,00","1.650,00","1.650,00","-2,94",50,"82.500,00","82.500,00",AUMK,2018-02-07
12.02.2018,"1.650,00","1.650,00","1.650,00","1.650,00","0,00",50,"82.500,00","82.500,00",AUMK,2018-02-12
08.03.2018,"1.650,00","1.650,00","1.650,00","1.650,00","0,00",157,"259.050,00","259.050,00",AUMK,2018-03-08
14.03.2018,"1.820,00","1.820,00","1.820,00","1.820,00","10,30",59,"107.380,00","107.380,00",AUMK,2018-03-14
14.06.2018,"1.700,00","1.700,00","1.700,00","1.700,00","-6,59",71,"120.700,00","120.700,00",AUMK,2018-06-14
29.06.2018,"1.700,00","1.700,00","1.700,00","1.700,00","0,00",118,"200.600,00","200.600,00",AUMK,2018-06-29
03.07.2018,"1.799,00","1.799,00","1.799,00","1.799,00","5,82",60,"107.940,00","107.940,00",AUMK,2018-07-03
05.07.2018,"1.751,00","1.751,00","1.751,00","1.751,00","-2,67",50,"87.550,00","87.550,00",AUMK,2018-07-05
06.07.2018,"1.751,00","1.751,00","1.751,00","1.751,00","0,00",151,"264.401,00","264.401,00",AUMK,2018-07-06
17.07.2018,"1.803,00","1.803,00","1.803,00","1.803,00","2,97",793,"1.429.779,00","1.429.779,00",AUMK,2018-07-17
24.07.2018,"1.900,00","1.900,00","1.900,00","1.900,00","5,38",37,"70.300,00","70.300,00",AUMK,2018-07-24
30.07.2018,"1.900,00","1.900,00","1.900,00","1.900,00","0,00",50,"95.000,00","95.000,00",AUMK,2018-07-30
06.08.2018,"1.900,00","1.900,00","1.900,00","1.900,00","0,00",38,"72.200,00","72.200,00",AUMK,2018-08-06
10.08.2018,"1.901,00","1.901,00","1.901,00","1.901,00","0,05",40,"76.040,00","76.040,00",AUMK,2018-08-10
21.08.2018,"1.899,00","1.899,00","1.899,00","1.899,00","-0,11",80,"151.920,00","151.920,00",AUMK,2018-08-21
22.08.2018,"1.900,00","1.900,00","1.900,00","1.900,00","0,05",150,"285.000,00","285.000,00",AUMK,2018-08-22
27.09.2018,"1.900,00","1.900,00","1.900,00","1.900,00","0,00",17,"32.300,00","32.300,00",AUMK,2018-09-27
05.10.2018,"1.805,00","1.805,00","1.805,00","1.805,00","-5,00",100,"180.500,00","180.500,00",AUMK,2018-10-05
15.10.2018,"1.700,00","1.700,00","1.700,00","1.700,00","-5,82",20,"34.000,00","34.000,00",AUMK,2018-10-15
18.10.2018,"1.800,00","1.800,00","1.800,00","1.800,00","5,88",20,"36.000,00","36.000,00",AUMK,2018-10-18
09.11.2018,"1.800,00",/,/,"1.800,00","0,00",0,"0,00","0,00",AUMK,2018-11-09
04.03.2019,"1.900,00","1.900,00","1.900,00","1.900,00","5,56",200,"380.000,00","380.000,00",AUMK,2019-03-04
14.03.2019,"1.900,00","1.900,00","1.900,00","1.900,00","0,00",40,"76.000,00","76.000,00",AUMK,2019-03-14
29.03.2019,"1.900,00","1.900,00","1.900,00","1.900,00","0,00",78,"148.200,00","148.200,00",AUMK,2019-03-29
08.04.2019,"1.900,00","1.900,00","1.900,00","1.900,00","0,00",117,"222.300,00","222.300,00",AUMK,2019-04-08
05.06.2019,"2.000,00","2.000,00","2.000,00","2.000,00","5,26",685,"1.370.000,00","1.370.000,00",AUMK,2019-06-05
12.06.2019,"2.000,00","2.000,00","2.000,00","2.000,00","0,00",215,"430.000,00","430.000,00",AUMK,2019-06-12
08.10.2019,"2.000,00","2.000,00","2.000,00","2.000,00","0,00",355,"710.000,00","710.000,00",AUMK,2019-10-08
06.11.2019,"2.001,00","2.001,00","2.001,00","2.001,00","0,05",50,"100.050,00","100.050,00",AUMK,2019-11-06
07.11.2019,"2.000,00","2.000,00","2.000,00","2.000,00","-0,05",100,"200.000,00","200.000,00",AUMK,2019-11-07
08.11.2019,"2.000,00","2.000,00","2.000,00","2.000,00","0,00",100,"200.000,00","200.000,00",AUMK,2019-11-08
15.11.2019,"2.000,00","2.000,00","2.000,00","2.000,00","0,00",50,"100.000,00","100.000,00",AUMK,2019-11-15
20.12.2019,"2.398,00","2.398,00","2.398,00","2.398,00","19,90",4,"9.592,00","9.592,00",AUMK,2019-12-20
14.01.2020,"2.398,00","2.398,00","2.398,00","2.398,00","0,00",20,"47.960,00","47.960,00",AUMK,2020-01-14
27.01.2020,"2.200,00","2.200,00","2.200,00","2.200,00","-8,26",151,"332.200,00","332.200,00",AUMK,2020-01-27
13.04.2020,"2.400,00","2.400,00","2.400,00","2.400,00","9,09",7,"16.800,00","16.800,00",AUMK,2020-04-13
12.06.2020,"2.200,00","2.200,00","2.200,00","2.200,00","-8,33","1,998","4.395.600,00","4.395.600,00",AUMK,2020-06-12
15.06.2020,"2.200,00","2.200,00","2.200,00","2.200,00","0,00",260,"572.000,00","572.000,00",AUMK,2020-06-15
13.08.2020,"2.004,00","2.004,00","2.004,00","2.004,00","-8,91",5,"10.020,00","10.020,00",AUMK,2020-08-13
14.08.2020,"2.202,00","2.202,00","2.202,00","2.202,00","9,88",298,"656.196,00","656.196,00",AUMK,2020-08-14
17.08.2020,"2.202,00","2.202,00","2.202,00","2.202,00","0,00",156,"343.512,00","343.512,00",AUMK,2020-08-17
19.08.2020,"2.100,00","2.100,00","2.100,00","2.100,00","-4,63",110,"231.000,00","231.000,00",AUMK,2020-08-19
06.11.2020,"2.100,00",/,/,"2.100,00","0,00",0,"0,00","0,00",AUMK,2020-11-06
17.11.2020,"2.160,00","2.160,00","2.160,00","2.160,00","2,86",11,"23.760,00","23.760,00",AUMK,2020-11-17
28.01.2021,"2.200,00","2.200,00","2.200,00","2.200,00","1,85",33,"72.600,00","72.600,00",AUMK,2021-01-28
03.02.2021,"2.300,00","2.300,00","2.300,00","2.300,00","4,55",125,"287.500,00","287.500,00",AUMK,2021-02-03
22.02.2021,"2.300,00","2.300,00","2.300,00","2.300,00","0,00",90,"207.000,00","207.000,00",AUMK,2021-02-22
09.03.2021,"2.258,00","2.258,00","2.258,00","2.258,00","-1,83",300,"677.400,00","677.400,00",AUMK,2021-03-09
19.03.2021,"2.292,00","2.292,00","2.292,00","2.292,00","1,51",100,"229.200,00","229.200,00",AUMK,2021-03-19
13.04.2021,"2.309,00","2.309,00","2.309,00","2.309,00","0,74",85,"196.265,00","196.265,00",AUMK,2021-04-13
27.04.2021,"2.424,00","2.424,00","2.424,00","2.424,00","4,98",335,"812.040,00","812.040,00",AUMK,2021-04-27
28.04.2021,"2.429,00","2.429,00","2.429,00","2.429,00","0,21",178,"432.362,00","432.362,00",AUMK,2021-04-28
04.05.2021,"2.500,00","2.500,00","2.500,00","2.500,00","2,92",13,"32.500,00","32.500,00",AUMK,2021-05-04
17.05.2021,"2.500,00","2.500,00","2.500,00","2.500,00","0,00",18,"45.000,00","45.000,00",AUMK,2021-05-17
28.05.2021,"2.500,00","2.500,00","2.500,00","2.500,00","0,00",181,"452.500,00","452.500,00",AUMK,2021-05-28
13.07.2021,"2.500,00","2.500,00","2.500,00","2.500,00","0,00",50,"125.000,00","125.000,00",AUMK,2021-07-13
03.11.2021,"2.507,00","2.507,00","2.507,00","2.507,00","0,28",100,"250.700,00","250.700,00",AUMK,2021-11-03
08.11.2021,"2.507,00",/,/,"2.507,00","0,00",0,"0,00","0,00",AUMK,2021-11-08
09.11.2021,"2.507,00","2.507,00","2.507,00","2.507,00","0,00",20,"50.140,00","50.140,00",AUMK,2021-11-09
03.02.2022,"2.450,00","2.450,00","2.450,00","2.450,00","-2,27",141,"345.450,00","345.450,00",AUMK,2022-02-03
08.02.2022,"2.700,00","2.700,00","2.700,00","2.700,00","10,20","1,025","2.767.500,00","2.767.500,00",AUMK,2022-02-08
09.02.2022,"2.700,00","2.700,00","2.700,00","2.700,00","0,00",250,"675.000,00","675.000,00",AUMK,2022-02-09
15.04.2022,"2.500,00","2.500,00","2.500,00","2.500,00","-7,41",3,"7.500,00","7.500,00",AUMK,2022-04-15
01.06.2022,"2.500,00","2.500,00","2.500,00","2.500,00","0,00",121,"302.500,00","302.500,00",AUMK,2022-06-01
25.08.2022,"2.700,00","2.700,00","2.700,00","2.700,00","8,00",60,"162.000,00","162.000,00",AUMK,2022-08-25
08.11.2022,"2.700,00",/,/,"2.700,00","0,00",0,"0,00","0,00",AUMK,2022-11-08
16.01.2023,"2.781,00","2.781,00","2.781,00","2.781,00","3,00",25,"69.525,00","69.525,00",AUMK,2023-01-16
25.01.2023,"2.864,00","2.864,00","2.864,00","2.864,00","2,98",117,"335.088,00","335.088,00",AUMK,2023-01-25
06.02.2023,"2.864,00","2.864,00","2.864,00","2.864,00","0,00",105,"300.720,00","300.720,00",AUMK,2023-02-06
02.03.2023,"2.900,00","2.900,00","2.900,00","2.900,00","1,26",100,"290.000,00","290.000,00",AUMK,2023-03-02
25.04.2023,"2.987,00","2.987,00","2.987,00","2.987,00","3,00",158,"471.946,00","471.946,00",AUMK,2023-04-25
04.05.2023,"2.987,00","2.987,00","2.987,00","2.987,00","0,00",158,"471.946,00","471.946,00",AUMK,2023-05-04
06.06.2023,"2.987,00","2.987,00","2.987,00","2.987,00","0,00",14,"41.818,00","41.818,00",AUMK,2023-06-06
04.07.2023,"3.040,00","3.040,00","3.040,00","3.040,00","1,77",200,"608.000,00","608.000,00",AUMK,2023-07-04
21.07.2023,"3.040,00","3.040,00","3.040,00","3.040,00","0,00",100,"304.000,00","304.000,00",AUMK,2023-07-21
14.09.2023,"2.950,00","2.950,00","2.950,00","2.950,00","-2,96",55,"162.250,00","162.250,00",AUMK,2023-09-14
29.09.2023,"3.040,00","3.040,00","3.040,00","3.040,00","3,05",20,"60.800,00","60.800,00",AUMK,2023-09-29
08.11.2023,"3.040,00",/,/,"3.040,00","0,00",0,"0,00","0,00",AUMK,2023-11-08
20.11.2023,"2.950,00","2.950,00","2.950,00","2.950,00","-2,96",15,"44.250,00","44.250,00",AUMK,2023-11-20
28.11.2023,"2.950,00","2.950,00","2.950,00","2.950,00","0,00",114,"336.300,00","336.300,00",AUMK,2023-11-28
05.03.2024,"2.950,00","2.950,00","2.950,00","2.950,00","0,00",100,"295.000,00","295.000,00",AUMK,2024-03-05
04.04.2024,"2.950,00","2.950,00","2.950,00","2.950,00","0,00",7,"20.650,00","20.650,00",AUMK,2024-04-04
02.05.2024,"2.950,00","2.950,00","2.950,00","2.950,00","0,00",70,"206.500,00","206.500,00",AUMK,2024-05-02
04.06.2024,"2.950,00","2.950,00","2.950,00","2.950,00","0,00",31,"91.450,00","91.450,00",AUMK,2024-06-04
16.09.2024,"3.030,00","3.030,00","3.030,00","3.030,00","2,71",400,"1.212.000,00","1.212.000,00",AUMK,2024-09-16
01.10.2024,"3.030,00","3.030,00","3.030,00","3.030,00","0,00",15,"45.450,00","45.450,00",AUMK,2024-10-01
07.11.2024,"3.030,00",/,/,"3.030,00","0,00",0,"0,00","0,00",AUMK,2024-11-07
10.11.2015,"550,00",/,/,"550,00","0,00",0,"0,00","0,00",BANA,2015-11-10
03.02.2016,"550,00","550,00","550,00","550,00","0,00",155,"85.250,00","85.250,00",BANA,2016-02-03
16.02.2016,"550,00","550,00","550,00","550,00","0,00",417,"229.350,00","229.350,00",BANA,2016-02-16
04.07.2016,"550,00","550,00","550,00","550,00","0,00",174,"95.700,00","95.700,00",BANA,2016-07-04
09.11.2016,"550,00",/,/,"550,00","0,00",0,"0,00","0,00",BANA,2016-11-09
29.06.2017,"550,00","550,00","550,00","550,00","0,00",70,"38.500,00","38.500,00",BANA,2017-06-29
07.08.2017,"550,00","550,00","550,00","550,00","0,00",192,"105.600,00","105.600,00",BANA,2017-08-07
09.11.2017,"550,00",/,/,"550,00","0,00",0,"0,00","0,00",BANA,2017-11-09
17.01.2018,"550,00","550,00","550,00","550,00","0,00",197,"108.350,00","108.350,00",BANA,2018-01-17
23.03.2018,"621,00","621,00","621,00","621,00","12,91",164,"101.844,00","101.844,00",BANA,2018-03-23
26.06.2018,"603,00","603,00","603,00","603,00","-2,90",147,"88.641,00","88.641,00",BANA,2018-06-26
09.11.2018,"603,00",/,/,"603,00","0,00",0,"0,00","0,00",BANA,2018-11-09
05.04.2019,"603,00","603,00","603,00","603,00","0,00",280,"168.840,00","168.840,00",BANA,2019-04-05
08.11.2019,"603,00",/,/,"603,00","0,00",0,"0,00","0,00",BANA,2019-11-08
12.11.2019,"603,00","603,00","603,00","603,00","0,00",79,"47.637,00","47.637,00",BANA,2019-11-12
06.11.2020,"603,00",/,/,"603,00","0,00",0,"0,00","0,00",BANA,2020-11-06
09.04.2021,"603,00","603,00","603,00","603,00","0,00",201,"121.203,00","121.203,00",BANA,2021-04-09
22.09.2021,"603,00","603,00","603,00","603,00","0,00",67,"40.401,00","40.401,00",BANA,2021-09-22
08.11.2021,"603,00",/,/,"603,00","0,00",0,"0,00","0,00",BANA,2021-11-08
08.11.2022,"603,00",/,/,"603,00","0,00",0,"0,00","0,00",BANA,2022-11-08
05.09.2023,"603,00","603,00","603,00","603,00","0,00",225,"135.675,00","135.675,00",BANA,2023-09-05
06.09.2023,"603,00","603,00","603,00","603,00","0,00",100,"60.300,00","60.300,00",BANA,2023-09-06
08.11.2023,"603,00",/,/,"603,00","0,00",0,"0,00","0,00",BANA,2023-11-08
20.12.2023,"603,00","603,00","603,00","603,00","0,00",180,"108.540,00","108.540,00",BANA,2023-12-20
07.11.2024,"603,00",/,/,"603,00","0,00",0,"0,00","0,00",BANA,2024-11-07
19.12.2014,"360,00","360,00","360,00","360,00","-2,17",10,"3.600,00","3.600,00",BGOR,2014-12-19
17.02.2015,"370,00","370,00","370,00","370,00","2,78",80,"29.600,00","29.600,00",BGOR,2015-02-17
05.03.2015,"360,00","360,00","360,00","360,00","-2,70",100,"36.000,00","36.000,00",BGOR,2015-03-05
23.03.2015,"350,00","350,00","350,00","350,00","-2,78","1,100","385.000,00","385.000,00",BGOR,2015-03-23
10.11.2015,"350,00",/,/,"350,00","0,00",0,"0,00","0,00",BGOR,2015-11-10
19.11.2015,"360,00","360,00","360,00","360,00","2,86","3,300","1.188.000,00","1.188.000,00",BGOR,2015-11-19
09.11.2016,"360,00",/,/,"360,00","0,00",0,"0,00","0,00",BGOR,2016-11-09
14.06.2017,"350,00","350,00","350,00","350,00","-2,78",900,"315.000,00","315.000,00",BGOR,2017-06-14
09.11.2017,"350,00",/,/,"350,00","0,00",0,"0,00","0,00",BGOR,2017-11-09
09.11.2018,"350,00",/,/,"350,00","0,00",0,"0,00","0,00",BGOR,2018-11-09
29.11.2018,"320,00","320,00","320,00","320,00","-8,57",500,"160.000,00","160.000,00",BGOR,2018-11-29
13.12.2018,"285,00","285,00","285,00","285,00","-10,94",510,"145.350,00","145.350,00",BGOR,2018-12-13
21.01.2019,"270,00","270,00","270,00","270,00","-5,26",300,"81.000,00","81.000,00",BGOR,2019-01-21
19.03.2019,"240,00","240,00","240,00","240,00","-11,11",200,"48.000,00","48.000,00",BGOR,2019-03-19
18.04.2019,"220,00","220,00","220,00","220,00","-8,33",500,"110.000,00","110.000,00",BGOR,2019-04-18
17.05.2019,"214,00","214,00","214,00","214,00","-2,73",551,"117.914,00","117.914,00",BGOR,2019-05-17
17.06.2019,"208,00","208,00","208,00","208,00","-2,80",700,"145.600,00","145.600,00",BGOR,2019-06-17
27.06.2019,"202,00","202,00","202,00","202,00","-2,88","1,000","202.000,00","202.000,00",BGOR,2019-06-27
18.10.2019,"196,00","196,00","196,00","196,00","-2,97",390,"76.440,00","76.440,00",BGOR,2019-10-18
08.11.2019,"196,00",/,/,"196,00","0,00",0,"0,00","0,00",BGOR,2019-11-08
12.11.2019,"191,00","191,00","191,00","191,00","-2,55",380,"72.580,00","72.580,00",BGOR,2019-11-12
29.01.2020,"188,00","188,00","188,00","188,00","-1,57","1,000","188.000,00","188.000,00",BGOR,2020-01-29
03.03.2020,"185,00","185,00","185,00","185,00","-1,60",400,"74.000,00","74.000,00",BGOR,2020-03-03
18.03.2020,"170,00","170,00","170,00","170,00","-8,11",465,"79.050,00","79.050,00",BGOR,2020-03-18
20.03.2020,"161,00","161,00","161,00","161,00","-5,29",500,"80.500,00","80.500,00",BGOR,2020-03-20
26.03.2020,"152,00","152,00","152,00","152,00","-5,59",500,"76.000,00","76.000,00",BGOR,2020-03-26
18.09.2020,"150,00","150,00","150,00","150,00","-1,32","1,400","210.000,00","210.000,00",BGOR,2020-09-18
16.10.2020,"149,00","149,00","149,00","149,00","-0,67","9,385","1.398.365,00","1.398.365,00",BGOR,2020-10-16
06.11.2020,"149,00",/,/,"149,00","0,00",0,"0,00","0,00",BGOR,2020-11-06
28.01.2021,"149,00","149,00","149,00","149,00","0,00","3,300","491.700,00","491.700,00",BGOR,2021-01-28
25.02.2021,"147,00","147,00","147,00","147,00","-1,34","6,858","1.008.126,00","1.008.126,00",BGOR,2021-02-25
12.04.2021,"146,00","146,00","146,00","146,00","-0,68",300,"43.800,00","43.800,00",BGOR,2021-04-12
22.07.2021,"150,00","150,00","150,00","150,00","2,74",100,"15.000,00","15.000,00",BGOR,2021-07-22
08.11.2021,"150,00",/,/,"150,00","0,00",0,"0,00","0,00",BGOR,2021-11-08
09.06.2022,"152,00","152,00","152,00","152,00","1,33",10,"1.520,00","1.520,00",BGOR,2022-06-09
23.06.2022,"152,00","152,00","152,00","152,00","0,00","1,910","290.320,00","290.320,00",BGOR,2022-06-23
08.08.2022,"152,00","152,00","152,00","152,00","0,00","1,232","187.264,00","187.264,00",BGOR,2022-08-08
08.11.2022,"152,00",/,/,"152,00","0,00",0,"0,00","0,00",BGOR,2022-11-08
10.11.2022,"156,00","156,00","156,00","156,00","2,63","5,066","790.296,00","790.296,00",BGOR,2022-11-10
24.11.2022,"160,00","160,00","160,00","160,00","2,56",760,"121.600,00","121.600,00",BGOR,2022-11-24
05.01.2023,"158,00","158,00","158,00","158,00","-1,25",10,"1.580,00","1.580,00",BGOR,2023-01-05
08.11.2023,"158,00",/,/,"158,00","0,00",0,"0,00","0,00",BGOR,2023-11-08
07.11.2024,"158,00",/,/,"158,00","0,00",0,"0,00","0,00",BGOR,2024-11-07
10.11.2015,"615,00",/,/,"615,00","0,00",0,"0,00","0,00",BIKF,2015-11-10
29.12.2015,"615,00",/,/,"615,00","0,00",0,"0,00","0,00",BIKF,2015-12-29
09.08.2017,"615,00","615,00","615,00","615,00","0,00",7,"4.305,00","4.305,00",BIKF,2017-08-09
27.09.2017,"615,00","615,00","615,00","615,00","0,00",18,"11.070,00","11.070,00",BIKF,2017-09-27
09.11.2017,"615,00",/,/,"615,00","0,00",0,"0,00","0,00",BIKF,2017-11-09
09.11.2018,"615,00",/,/,"615,00","0,00",0,"0,00","0,00",BIKF,2018-11-09
31.05.2019,"615,00","615,00","615,00","615,00","0,00",18,"11.070,00","11.070,00",BIKF,2019-05-31
08.11.2019,"615,00",/,/,"615,00","0,00",0,"0,00","0,00",BIKF,2019-11-08
23.09.2020,"1.357,00","1.357,00","1.357,00","1.357,00","120,65",830,"1.126.310,00","1.126.310,00",BIKF,2020-09-23
06.11.2020,"1.357,00",/,/,"1.357,00","0,00",0,"0,00","0,00",BIKF,2020-11-06
08.11.2021,"1.357,00",/,/,"1.357,00","0,00",0,"0,00","0,00",BIKF,2021-11-08
30.12.2021,"1.357,00",/,/,"1.357,00","0,00",0,"0,00","0,00",BIKF,2021-12-30
22.02.2024,"1.086,00","1.086,00","1.086,00","1.086,00","-19,97",19,"20.634,00","20.634,00",BIKF,2024-02-22
07.11.2024,"1.086,00",/,/,"1.086,00","0,00",0,"0,00","0,00",BIKF,2024-11-07
10.11.2015,"7.000,00",/,/,"7.000,00","0,00",0,"0,00","0,00",BIM,2015-11-10
09.11.2016,"7.000,00",/,/,"7.000,00","0,00",0,"0,00","0,00",BIM,2016-11-09
29.12.2016,"7.210,00","7.210,00","7.210,00","7.210,00","3,00",20,"144.200,00","144.200,00",BIM,2016-12-29
09.11.2017,"7.210,00",/,/,"7.210,00","0,00",0,"0,00","0,00",BIM,2017-11-09
04.07.2018,"10.100,00","10.100,00","10.100,00","10.100,00","40,08",23,"232.300,00","232.300,00",BIM,2018-07-04
09.11.2018,"10.100,00",/,/,"10.100,00","0,00",0,"0,00","0,00",BIM,2018-11-09
08.11.2019,"10.100,00",/,/,"10.100,00","0,00",0,"0,00","0,00",BIM,2019-11-08
06.11.2020,"10.100,00",/,/,"10.100,00","0,00",0,"0,00","0,00",BIM,2020-11-06
25.12.2020,"12.300,00","12.300,00","12.300,00","12.300,00","21,78",62,"762.600,00","762.600,00",BIM,2020-12-25
08.11.2021,"15.550,00","15.550,00","15.550,00","15.550,00","26,42",16,"248.800,00","248.800,00",BIM,2021-11-08
08.11.2022,"15.550,00",/,/,"15.550,00","0,00",0,"0,00","0,00",BIM,2022-11-08
08.11.2023,"15.550,00",/,/,"15.550,00","0,00",0,"0,00","0,00",BIM,2023-11-08
22.07.2024,"18.001,00","18.001,00","18.001,00","18.001,00","15,76",25,"450.025,00","450.025,00",BIM,2024-07-22
07.11.2024,"18.001,00",/,/,"18.001,00","0,00",0,"0,00","0,00",BIM,2024-11-07
10.11.2015,"100,00",/,/,"100,00","0,00",0,"0,00","0,00",BLTU,2015-11-10
09.11.2016,"100,00",/,/,"100,00","0,00",0,"0,00","0,00",BLTU,2016-11-09
09.11.2017,"100,00",/,/,"100,00","0,00",0,"0,00","0,00",BLTU,2017-11-09
09.11.2018,"100,00",/,/,"100,00","0,00",0,"0,00","0,00",BLTU,2018-11-09
08.11.2019,"100,00",/,/,"100,00","0,00",0,"0,00","0,00",BLTU,2019-11-08
06.11.2020,"100,00",/,/,"100,00","0,00",0,"0,00","0,00",BLTU,2020-11-06
08.11.2021,"100,00",/,/,"100,00","0,00",0,"0,00","0,00",BLTU,2021-11-08
08.11.2022,"100,00",/,/,"100,00","0,00",0,"0,00","0,00",BLTU,2022-11-08
08.11.2023,"100,00",/,/,"100,00","0,00",0,"0,00","0,00",BLTU,2023-11-08
07.11.2024,"100,00",/,/,"100,00","0,00",0,"0,00","0,00",BLTU,2024-11-07
10.11.2015,"3.200,00",/,/,"3.200,00","0,00",0,"0,00","0,00",CBNG,2015-11-10
29.12.2015,"3.200,00",/,/,"3.200,00","0,00",0,"0,00","0,00",CBNG,2015-12-29
08.11.2019,"3.200,00",/,/,"3.200,00","0,00",0,"0,00","0,00",CBNG,2019-11-08
06.11.2020,"3.200,00",/,/,"3.200,00","0,00",0,"0,00","0,00",CBNG,2020-11-06
08.11.2021,"3.200,00",/,/,"3.200,00","0,00",0,"0,00","0,00",CBNG,2021-11-08
08.11.2022,"3.200,00",/,/,"3.200,00","0,00",0,"0,00","0,00",CBNG,2022-11-08
08.11.2023,"3.200,00",/,/,"3.200,00","0,00",0,"0,00","0,00",CBNG,2023-11-08
07.11.2024,"3.200,00",/,/,"3.200,00","0,00",0,"0,00","0,00",CBNG,2024-11-07
10.11.2015,"15.000,00",/,/,"15.000,00","0,00",0,"0,00","0,00",CDHV,2015-11-10
04.10.2016,"15.000,00","15.000,00","15.000,00","15.000,00","0,00",93,"1.395.000,00","1.395.000,00",CDHV,2016-10-04
09.11.2016,"15.000,00",/,/,"15.000,00","0,00",0,"0,00","0,00",CDHV,2016-11-09
13.04.2017,"15.000,00","15.000,00","15.000,00","15.000,00","0,00",17,"255.000,00","255.000,00",CDHV,2017-04-13
27.10.2017,"15.000,00","15.000,00","15.000,00","15.000,00","0,00",36,"540.000,00","540.000,00",CDHV,2017-10-27
09.11.2017,"15.000,00",/,/,"15.000,00","0,00",0,"0,00","0,00",CDHV,2017-11-09
09.11.2018,"15.000,00",/,/,"15.000,00","0,00",0,"0,00","0,00",CDHV,2018-11-09
08.11.2019,"15.000,00",/,/,"15.000,00","0,00",0,"0,00","0,00",CDHV,2019-11-08
02.01.2020,"15.000,00",/,/,"15.000,00","0,00",0,"0,00","0,00",CDHV,2020-01-02
08.11.2022,"15.000,00",/,/,"15.000,00","0,00",0,"0,00","0,00",CDHV,2022-11-08
16.06.2023,"17.000,00","17.000,00","17.000,00","17.000,00","13,33",140,"2.380.000,00","2.380.000,00",CDHV,2023-06-16
08.11.2023,"17.000,00",/,/,"17.000,00","0,00",0,"0,00","0,00",CDHV,2023-11-08
07.11.2024,"17.000,00",/,/,"17.000,00","0,00",0,"0,00","0,00",CDHV,2024-11-07
26.01.2015,"400,00","400,00","400,00","400,00","13,31",110,"44.000,00","44.000,00",CEVI,2015-01-26
28.01.2015,"427,00","427,00","427,00","427,00","6,75",13,"5.551,00","5.551,00",CEVI,2015-01-28
30.01.2015,"485,00","485,00","485,00","485,00","13,58",100,"48.500,00","48.500,00",CEVI,2015-01-30
10.02.2015,"427,00","427,00","427,00","427,00","-11,96",31,"13.237,00","13.237,00",CEVI,2015-02-10
13.02.2015,"425,00","425,00","425,00","425,00","-0,47",100,"42.500,00","42.500,00",CEVI,2015-02-13
05.03.2015,"425,00","425,00","425,00","425,00","0,00",331,"140.675,00","140.675,00",CEVI,2015-03-05
10.03.2015,"500,00","500,00","500,00","500,00","17,65",286,"143.000,00","143.000,00",CEVI,2015-03-10
11.03.2015,"501,00","501,00","501,00","501,00","0,20",69,"34.569,00","34.569,00",CEVI,2015-03-11
13.03.2015,"501,00","501,00","501,00","501,00","0,00",147,"73.647,00","73.647,00",CEVI,2015-03-13
17.03.2015,"599,00","599,00","599,00","599,00","19,56",559,"334.841,00","334.841,00",CEVI,2015-03-17
18.03.2015,"650,00","650,00","650,00","650,00","8,51",100,"65.000,00","65.000,00",CEVI,2015-03-18
19.03.2015,"750,00","750,00","750,00","750,00","15,38",160,"120.000,00","120.000,00",CEVI,2015-03-19
20.03.2015,"750,00","750,00","750,00","750,00","0,00",2,"1.500,00","1.500,00",CEVI,2015-03-20
02.04.2015,"500,00","500,00","500,00","500,00","-33,33",521,"260.500,00","260.500,00",CEVI,2015-04-02
06.04.2015,"501,00","501,00","501,00","501,00","0,20",352,"176.352,00","176.352,00",CEVI,2015-04-06
08.04.2015,"506,00","506,00","506,00","506,00","1,00",195,"98.670,00","98.670,00",CEVI,2015-04-08
21.04.2015,"511,00","511,00","511,00","511,00","0,99",258,"131.838,00","131.838,00",CEVI,2015-04-21
22.04.2015,"517,00","517,00","517,00","517,00","1,17","1,480","765.160,00","765.160,00",CEVI,2015-04-22
27.04.2015,"518,00","518,00","518,00","518,00","0,19",200,"103.600,00","103.600,00",CEVI,2015-04-27
04.05.2015,"503,00","503,00","503,00","503,00","-2,90",482,"242.446,00","242.446,00",CEVI,2015-05-04
05.05.2015,"510,00","510,00","510,00","510,00","1,39",50,"25.500,00","25.500,00",CEVI,2015-05-05
07.05.2015,"489,00","489,00","489,00","489,00","-4,12",60,"29.340,00","29.340,00",CEVI,2015-05-07
13.05.2015,"504,00","504,00","504,00","504,00","3,07",100,"50.400,00","50.400,00",CEVI,2015-05-13
14.05.2015,"505,00","505,00","505,00","505,00","0,20",27,"13.635,00","13.635,00",CEVI,2015-05-14
18.05.2015,"526,00","526,00","526,00","526,00","4,16",220,"115.720,00","115.720,00",CEVI,2015-05-18
20.05.2015,"520,00","520,00","520,00","520,00","-1,14",244,"126.880,00","126.880,00",CEVI,2015-05-20
21.05.2015,"522,00","522,00","522,00","522,00","0,38",180,"93.960,00","93.960,00",CEVI,2015-05-21
22.05.2015,"525,00","525,00","525,00","525,00","0,57",142,"74.550,00","74.550,00",CEVI,2015-05-22
26.05.2015,"522,00","522,00","522,00","522,00","-0,57",20,"10.440,00","10.440,00",CEVI,2015-05-26
28.05.2015,"526,00","526,00","526,00","526,00","0,77",400,"210.400,00","210.400,00",CEVI,2015-05-28
01.06.2015,"525,00","525,00","525,00","525,00","-0,19",25,"13.125,00","13.125,00",CEVI,2015-06-01
03.06.2015,"532,00","532,00","532,00","532,00","1,33",100,"53.200,00","53.200,00",CEVI,2015-06-03
05.06.2015,"531,00","531,00","531,00","531,00","-0,19",50,"26.550,00","26.550,00",CEVI,2015-06-05
08.06.2015,"530,00","530,00","530,00","530,00","-0,19",50,"26.500,00","26.500,00",CEVI,2015-06-08
29.06.2015,"515,00","515,00","515,00","515,00","-2,83",330,"169.950,00","169.950,00",CEVI,2015-06-29
26.10.2015,"400,00","400,00","400,00","400,00","-22,33",77,"30.800,00","30.800,00",CEVI,2015-10-26
02.11.2015,"400,00","400,00","400,00","400,00","0,00",70,"28.000,00","28.000,00",CEVI,2015-11-02
05.11.2015,"400,00","400,00","400,00","400,00","0,00",156,"62.400,00","62.400,00",CEVI,2015-11-05
09.11.2015,"400,00","400,00","400,00","400,00","0,00",75,"30.000,00","30.000,00",CEVI,2015-11-09
10.11.2015,"400,00",/,/,"400,00","0,00",0,"0,00","0,00",CEVI,2015-11-10
04.12.2015,"400,00","400,00","400,00","400,00","0,00",110,"44.000,00","44.000,00",CEVI,2015-12-04
24.12.2015,"380,00","380,00","380,00","380,00","-5,00",15,"5.700,00","5.700,00",CEVI,2015-12-24
25.12.2015,"380,00","380,00","380,00","380,00","0,00",117,"44.460,00","13.344.460,00",CEVI,2015-12-25
05.01.2016,"383,00","383,00","383,00","383,00","0,79",238,"91.154,00","91.154,00",CEVI,2016-01-05
12.01.2016,"380,00","380,00","380,00","380,00","-0,78",95,"36.100,00","36.100,00",CEVI,2016-01-12
26.01.2016,"391,00","391,00","391,00","391,00","2,89",85,"33.235,00","33.235,00",CEVI,2016-01-26
10.02.2016,"380,00","380,00","380,00","380,00","-2,81",80,"30.400,00","30.400,00",CEVI,2016-02-10
11.02.2016,"380,00","380,00","380,00","380,00","0,00",15,"5.700,00","5.700,00",CEVI,2016-02-11
17.02.2016,"380,00","380,00","380,00","380,00","0,00",50,"19.000,00","19.000,00",CEVI,2016-02-17
23.02.2016,"350,00","350,00","350,00","350,00","-7,89",88,"30.800,00","30.800,00",CEVI,2016-02-23
26.02.2016,"350,00","350,00","350,00","350,00","0,00",112,"39.200,00","39.200,00",CEVI,2016-02-26
07.03.2016,"360,00","360,00","360,00","360,00","2,86",93,"33.480,00","33.480,00",CEVI,2016-03-07
28.03.2016,"360,00","360,00","360,00","360,00","0,00",75,"27.000,00","27.000,00",CEVI,2016-03-28
29.03.2016,"354,00","354,00","354,00","354,00","-1,67",140,"49.560,00","49.560,00",CEVI,2016-03-29
07.04.2016,"351,00","351,00","351,00","351,00","-0,85",20,"7.020,00","7.020,00",CEVI,2016-04-07
10.05.2016,"361,00","361,00","361,00","361,00","2,85",80,"28.880,00","28.880,00",CEVI,2016-05-10
26.05.2016,"380,00","380,00","380,00","380,00","5,26",60,"22.800,00","22.800,00",CEVI,2016-05-26
31.05.2016,"396,00","396,00","396,00","396,00","4,21",38,"15.048,00","15.048,00",CEVI,2016-05-31
02.06.2016,"397,00","397,00","397,00","397,00","0,25",100,"39.700,00","39.700,00",CEVI,2016-06-02
14.06.2016,"397,00","397,00","397,00","397,00","0,00",70,"27.790,00","27.790,00",CEVI,2016-06-14
04.07.2016,"400,00","400,00","400,00","400,00","0,76",80,"32.000,00","32.000,00",CEVI,2016-07-04
07.07.2016,"400,00","400,00","400,00","400,00","0,00",400,"160.000,00","160.000,00",CEVI,2016-07-07
13.07.2016,"413,00","413,00","413,00","413,00","3,25",27,"11.151,00","11.151,00",CEVI,2016-07-13
15.07.2016,"401,00","401,00","401,00","401,00","-2,91","1,203","482.403,00","482.403,00",CEVI,2016-07-15
20.07.2016,"397,00","397,00","397,00","397,00","-1,00",7,"2.779,00","2.779,00",CEVI,2016-07-20
25.07.2016,"408,00","408,00","408,00","408,00","2,77",80,"32.640,00","32.640,00",CEVI,2016-07-25
09.09.2016,"420,00","420,00","420,00","420,00","2,94",50,"21.000,00","21.000,00",CEVI,2016-09-09
14.09.2016,"408,00","408,00","408,00","408,00","-2,86",20,"8.160,00","8.160,00",CEVI,2016-09-14
25.10.2016,"420,00","420,00","420,00","420,00","2,94",135,"56.700,00","56.700,00",CEVI,2016-10-25
26.10.2016,"503,00","503,00","503,00","503,00","19,76",140,"70.420,00","70.420,00",CEVI,2016-10-26
27.10.2016,"601,00","601,00","601,00","601,00","19,48",156,"93.756,00","93.756,00",CEVI,2016-10-27
31.10.2016,"601,00","601,00","601,00","601,00","0,00",30,"18.030,00","18.030,00",CEVI,2016-10-31
09.11.2016,"601,00",/,/,"601,00","0,00",0,"0,00","0,00",CEVI,2016-11-09
11.11.2016,"701,00","701,00","701,00","701,00","16,64",149,"104.449,00","104.449,00",CEVI,2016-11-11
14.11.2016,"951,00","951,00","951,00","951,00","35,66",60,"57.060,00","57.060,00",CEVI,2016-11-14
18.11.2016,"700,00","700,00","700,00","700,00","-26,39",478,"334.600,00","334.600,00",CEVI,2016-11-18
24.11.2016,"701,00","701,00","701,00","701,00","0,14",440,"308.440,00","308.440,00",CEVI,2016-11-24
28.11.2016,"700,00","700,00","700,00","700,00","-0,14",82,"57.400,00","57.400,00",CEVI,2016-11-28
13.12.2016,"700,00","700,00","700,00","700,00","0,00",198,"138.600,00","138.600,00",CEVI,2016-12-13
16.12.2016,"700,00","700,00","700,00","700,00","0,00",155,"108.500,00","108.500,00",CEVI,2016-12-16
23.12.2016,"700,00","700,00","700,00","700,00","0,00",62,"43.400,00","43.400,00",CEVI,2016-12-23
29.12.2016,"700,00","700,00","700,00","700,00","0,00",66,"46.200,00","46.200,00",CEVI,2016-12-29
05.01.2017,"700,00","700,00","700,00","700,00","0,00",200,"140.000,00","140.000,00",CEVI,2017-01-05
09.01.2017,"750,00","750,00","750,00","750,00","7,14",93,"69.750,00","69.750,00",CEVI,2017-01-09
13.01.2017,"750,00","750,00","750,00","750,00","0,00",100,"75.000,00","75.000,00",CEVI,2017-01-13
16.01.2017,"750,00","750,00","750,00","750,00","0,00",50,"37.500,00","37.500,00",CEVI,2017-01-16
17.01.2017,"800,00","800,00","800,00","800,00","6,67",104,"83.200,00","83.200,00",CEVI,2017-01-17
23.01.2017,"800,00","800,00","800,00","800,00","0,00",30,"24.000,00","24.000,00",CEVI,2017-01-23
24.01.2017,"800,00","800,00","800,00","800,00","0,00",85,"68.000,00","68.000,00",CEVI,2017-01-24
25.01.2017,"800,00","800,00","800,00","800,00","0,00",90,"72.000,00","72.000,00",CEVI,2017-01-25
06.02.2017,"800,00","800,00","800,00","800,00","0,00",50,"40.000,00","40.000,00",CEVI,2017-02-06
08.02.2017,"800,00","800,00","800,00","800,00","0,00",310,"248.000,00","248.000,00",CEVI,2017-02-08
09.02.2017,"800,00","800,00","800,00","800,00","0,00",27,"21.600,00","21.600,00",CEVI,2017-02-09
10.02.2017,"824,00","824,00","824,00","824,00","3,00",42,"34.608,00","34.608,00",CEVI,2017-02-10
14.02.2017,"880,00","880,00","880,00","880,00","6,80",20,"17.600,00","17.600,00",CEVI,2017-02-14
15.02.2017,"900,00","900,00","870,00","890,65","1,21",367,"326.870,00","326.870,00",CEVI,2017-02-15
13.03.2017,"864,00","870,00","864,00","864,61","-2,92",198,"171.192,00","171.192,00",CEVI,2017-03-13
15.03.2017,"840,00","840,00","840,00","840,00","-2,85",50,"42.000,00","42.000,00",CEVI,2017-03-15
28.03.2017,"865,00","865,00","865,00","865,00","2,98",100,"86.500,00","86.500,00",CEVI,2017-03-28
29.03.2017,"865,00","870,00","865,00","867,37","0,27",211,"183.015,00","183.015,00",CEVI,2017-03-29
30.03.2017,"865,00","865,00","865,00","865,00","-0,27",225,"194.625,00","194.625,00",CEVI,2017-03-30
06.04.2017,"870,00","870,00","870,00","870,00","0,58",10,"8.700,00","8.700,00",CEVI,2017-04-06
21.04.2017,"845,00","845,00","845,00","845,00","-2,87",136,"114.920,00","114.920,00",CEVI,2017-04-21
24.04.2017,"845,00","845,00","845,00","845,00","0,00",14,"11.830,00","11.830,00",CEVI,2017-04-24
27.04.2017,"845,00","846,00","845,00","845,28","0,03",160,"135.244,00","135.244,00",CEVI,2017-04-27
12.05.2017,"846,00","846,00","845,00","845,87","0,07",115,"97.275,00","97.275,00",CEVI,2017-05-12
15.05.2017,"845,00","845,00","845,00","845,00","-0,10",238,"201.110,00","201.110,00",CEVI,2017-05-15
18.05.2017,"850,00","850,00","845,00","849,66","0,55",295,"250.650,00","250.650,00",CEVI,2017-05-18
19.05.2017,"850,00","850,00","850,00","850,00","0,04",106,"90.100,00","90.100,00",CEVI,2017-05-19
23.05.2017,"875,00","875,00","875,00","875,00","2,94",100,"87.500,00","87.500,00",CEVI,2017-05-23
29.05.2017,"856,00","856,00","856,00","856,00","-2,17",27,"23.112,00","23.112,00",CEVI,2017-05-29
30.05.2017,"855,00","855,00","855,00","855,00","-0,12",220,"188.100,00","188.100,00",CEVI,2017-05-30
01.06.2017,"880,00","880,00","880,00","880,00","2,92",16,"14.080,00","14.080,00",CEVI,2017-06-01
05.06.2017,"905,00","905,00","870,00","896,90","1,92",159,"142.607,00","142.607,00",CEVI,2017-06-05
12.07.2017,"950,00","950,00","923,00","941,69","4,99",322,"303.225,00","303.225,00",CEVI,2017-07-12
13.07.2017,"910,00","910,00","910,00","910,00","-3,37",103,"93.730,00","93.730,00",CEVI,2017-07-13
18.07.2017,"950,00","950,00","950,00","950,00","4,40",24,"22.800,00","22.800,00",CEVI,2017-07-18
19.07.2017,"900,00","950,00","900,00","934,15","-1,67",82,"76.600,00","76.600,00",CEVI,2017-07-19
20.07.2017,"1.000,00","1.000,00","1.000,00","1.000,00","7,05",170,"170.000,00","170.000,00",CEVI,2017-07-20
24.07.2017,"900,00","900,00","900,00","900,00","-10,00",10,"9.000,00","9.000,00",CEVI,2017-07-24
25.07.2017,"989,00","989,00","989,00","989,00","9,89",290,"286.810,00","286.810,00",CEVI,2017-07-25
28.07.2017,"1.018,00","1.018,00","1.018,00","1.018,00","2,93",400,"407.200,00","407.200,00",CEVI,2017-07-28
31.07.2017,"1.100,00","1.100,00","1.100,00","1.100,00","8,06",12,"13.200,00","13.200,00",CEVI,2017-07-31
01.08.2017,"1.100,00","1.100,00","1.100,00","1.100,00","0,00",50,"55.000,00","55.000,00",CEVI,2017-08-01
10.08.2017,"1.133,00","1.133,00","1.133,00","1.133,00","3,00",50,"56.650,00","56.650,00",CEVI,2017-08-10
14.08.2017,"1.100,00","1.100,00","1.100,00","1.100,00","-2,91",210,"231.000,00","231.000,00",CEVI,2017-08-14
16.08.2017,"1.133,00","1.133,00","1.080,00","1.105,08","0,46",258,"285.110,00","285.110,00",CEVI,2017-08-16
21.08.2017,"1.110,00","1.110,00","1.110,00","1.110,00","0,45",18,"19.980,00","19.980,00",CEVI,2017-08-21
24.08.2017,"1.110,00","1.110,00","1.110,00","1.110,00","0,00",10,"11.100,00","11.100,00",CEVI,2017-08-24
29.08.2017,"1.170,00","1.170,00","1.140,00","1.147,14","3,35",105,"120.450,00","120.450,00",CEVI,2017-08-29
01.09.2017,"1.145,00","1.145,00","1.145,00","1.145,00","-0,19",152,"174.040,00","174.040,00",CEVI,2017-09-01
04.09.2017,"1.101,00","1.101,00","1.101,00","1.101,00","-3,84",35,"38.535,00","38.535,00",CEVI,2017-09-04
06.09.2017,"1.140,00","1.140,00","1.140,00","1.140,00","3,54",230,"262.200,00","262.200,00",CEVI,2017-09-06
20.09.2017,"1.050,00","1.050,00","1.050,00","1.050,00","-7,89",5,"5.250,00","5.250,00",CEVI,2017-09-20
06.10.2017,"1.039,00","1.039,00","1.039,00","1.039,00","-1,05",50,"51.950,00","51.950,00",CEVI,2017-10-06
19.10.2017,"940,00","940,00","940,00","940,00","-9,53",100,"94.000,00","94.000,00",CEVI,2017-10-19
26.10.2017,"940,00","940,00","940,00","940,00","0,00",4,"3.760,00","3.760,00",CEVI,2017-10-26
01.11.2017,"912,00","913,00","912,00","912,91","-2,88",110,"100.420,00","100.420,00",CEVI,2017-11-01
02.11.2017,"912,00","913,00","912,00","912,50","-0,04",100,"91.250,00","91.250,00",CEVI,2017-11-02
03.11.2017,"912,00","912,00","912,00","912,00","-0,05",150,"136.800,00","136.800,00",CEVI,2017-11-03
09.11.2017,"912,00",/,/,"912,00","0,00",0,"0,00","0,00",CEVI,2017-11-09
16.11.2017,"912,00","912,00","912,00","912,00","0,00",11,"10.032,00","10.032,00",CEVI,2017-11-16
21.11.2017,"912,00","912,00","912,00","912,00","0,00",59,"53.808,00","53.808,00",CEVI,2017-11-21
05.12.2017,"939,00","939,00","921,00","936,88","2,73",170,"159.270,00","159.270,00",CEVI,2017-12-05
12.12.2017,"964,00","964,00","964,00","964,00","2,89",22,"21.208,00","21.208,00",CEVI,2017-12-12
13.12.2017,"1.040,00","1.040,00","1.040,00","1.040,00","7,88",45,"46.800,00","46.800,00",CEVI,2017-12-13
14.12.2017,"1.144,00","1.144,00","1.144,00","1.144,00","10,00",278,"318.032,00","318.032,00",CEVI,2017-12-14
15.12.2017,"1.144,00","1.144,00","1.144,00","1.144,00","0,00",206,"235.664,00","235.664,00",CEVI,2017-12-15
19.12.2017,"1.144,00","1.144,00","1.144,00","1.144,00","0,00",71,"81.224,00","81.224,00",CEVI,2017-12-19
21.12.2017,"1.144,00","1.144,00","1.144,00","1.144,00","0,00",125,"143.000,00","143.000,00",CEVI,2017-12-21
25.12.2017,"1.144,00","1.144,00","1.144,00","1.144,00","0,00",123,"140.712,00","140.712,00",CEVI,2017-12-25
21.02.2018,"1.099,00","1.100,00","1.099,00","1.099,00","-3,93",772,"848.430,00","848.430,00",CEVI,2018-02-21
08.03.2018,"1.000,00","1.000,00","1.000,00","1.000,00","-9,01",215,"215.000,00","215.000,00",CEVI,2018-03-08
13.03.2018,"1.000,00","1.000,00","1.000,00","1.000,00","0,00",155,"155.000,00","155.000,00",CEVI,2018-03-13
14.03.2018,"1.100,00","1.100,00","1.100,00","1.100,00","10,00",28,"30.800,00","30.800,00",CEVI,2018-03-14
19.03.2018,"1.000,00","1.000,00","1.000,00","1.000,00","-9,09",138,"138.000,00","138.000,00",CEVI,2018-03-19
21.03.2018,"1.000,00","1.000,00","1.000,00","1.000,00","0,00",22,"22.000,00","22.000,00",CEVI,2018-03-21
22.03.2018,"970,00","970,00","970,00","970,00","-3,00",40,"38.800,00","38.800,00",CEVI,2018-03-22
23.03.2018,"970,00","1.000,00","970,00","984,16","1,46",231,"227.340,00","227.340,00",CEVI,2018-03-23
15.05.2018,"955,00","955,00","955,00","955,00","-2,96",57,"54.435,00","54.435,00",CEVI,2018-05-15
22.05.2018,"927,00","927,00","927,00","927,00","-2,93",95,"88.065,00","88.065,00",CEVI,2018-05-22
05.06.2018,"860,00","860,00","860,00","860,00","-7,23",180,"154.800,00","154.800,00",CEVI,2018-06-05
06.06.2018,"899,00","899,00","899,00","899,00","4,53",15,"13.485,00","13.485,00",CEVI,2018-06-06
25.06.2018,"899,00","899,00","899,00","899,00","0,00",65,"58.435,00","58.435,00",CEVI,2018-06-25
26.06.2018,"880,00","880,00","880,00","880,00","-2,11",75,"66.000,00","66.000,00",CEVI,2018-06-26
29.06.2018,"880,00","880,00","880,00","880,00","0,00",160,"140.800,00","140.800,00",CEVI,2018-06-29
10.07.2018,"847,00","847,00","847,00","847,00","-3,75",80,"67.760,00","67.760,00",CEVI,2018-07-10
19.07.2018,"888,00","888,00","888,00","888,00","4,84",184,"163.392,00","163.392,00",CEVI,2018-07-19
20.07.2018,"950,00","950,00","950,00","950,00","6,98",66,"62.700,00","62.700,00",CEVI,2018-07-20
24.07.2018,"999,00","999,00","999,00","999,00","5,16",20,"19.980,00","19.980,00",CEVI,2018-07-24
22.08.2018,"1.000,00","1.000,00","1.000,00","1.000,00","0,10",806,"806.000,00","806.000,00",CEVI,2018-08-22
24.08.2018,"1.000,00","1.000,00","1.000,00","1.000,00","0,00",164,"164.000,00","164.000,00",CEVI,2018-08-24
31.08.2018,"1.000,00","1.000,00","1.000,00","1.000,00","0,00",378,"378.000,00","378.000,00",CEVI,2018-08-31
05.09.2018,"1.000,00","1.000,00","1.000,00","1.000,00","0,00",346,"346.000,00","346.000,00",CEVI,2018-09-05
06.09.2018,"1.000,00","1.000,00","1.000,00","1.000,00","0,00",347,"347.000,00","347.000,00",CEVI,2018-09-06
11.09.2018,"1.000,00","1.000,00","1.000,00","1.000,00","0,00",200,"200.000,00","200.000,00",CEVI,2018-09-11
17.09.2018,"1.000,00","1.000,00","1.000,00","1.000,00","0,00",174,"174.000,00","174.000,00",CEVI,2018-09-17
18.09.2018,"1.000,00","1.000,00","1.000,00","1.000,00","0,00",100,"100.000,00","100.000,00",CEVI,2018-09-18
19.09.2018,"1.000,00","1.000,00","1.000,00","1.000,00","0,00",203,"203.000,00","203.000,00",CEVI,2018-09-19
21.09.2018,"1.000,00","1.000,00","1.000,00","1.000,00","0,00",628,"628.000,00","628.000,00",CEVI,2018-09-21
24.09.2018,"1.000,00","1.000,00","1.000,00","1.000,00","0,00",170,"170.000,00","170.000,00",CEVI,2018-09-24
28.09.2018,"1.000,00","1.000,00","1.000,00","1.000,00","0,00",846,"846.000,00","846.000,00",CEVI,2018-09-28
01.10.2018,"1.000,00","1.000,00","1.000,00","1.000,00","0,00",514,"514.000,00","514.000,00",CEVI,2018-10-01
03.10.2018,"1.000,00","1.000,00","1.000,00","1.000,00","0,00",509,"509.000,00","509.000,00",CEVI,2018-10-03
05.10.2018,"1.000,00","1.000,00","999,00","999,56","-0,04",180,"179.920,00","179.920,00",CEVI,2018-10-05
08.10.2018,"1.000,00","1.000,00","1.000,00","1.000,00","0,04",764,"764.000,00","764.000,00",CEVI,2018-10-08
10.10.2018,"1.000,00","1.000,00","1.000,00","1.000,00","0,00",359,"359.000,00","359.000,00",CEVI,2018-10-10
12.10.2018,"1.000,00","1.000,00","1.000,00","1.000,00","0,00",209,"209.000,00","209.000,00",CEVI,2018-10-12
15.10.2018,"1.000,00","1.000,00","1.000,00","1.000,00","0,00",200,"200.000,00","200.000,00",CEVI,2018-10-15
16.10.2018,"1.000,00","1.000,00","1.000,00","1.000,00","0,00",495,"495.000,00","495.000,00",CEVI,2018-10-16
17.10.2018,"1.000,00","1.000,00","1.000,00","1.000,00","0,00",149,"149.000,00","149.000,00",CEVI,2018-10-17
18.10.2018,"1.000,00","1.000,00","1.000,00","1.000,00","0,00",236,"236.000,00","236.000,00",CEVI,2018-10-18
19.10.2018,"1.000,00","1.000,00","1.000,00","1.000,00","0,00",141,"141.000,00","141.000,00",CEVI,2018-10-19
22.10.2018,"1.050,00","1.050,00","1.050,00","1.050,00","5,00",29,"30.450,00","30.450,00",CEVI,2018-10-22
24.10.2018,"1.000,00","1.000,00","1.000,00","1.000,00","-4,76",20,"20.000,00","20.000,00",CEVI,2018-10-24
25.10.2018,"1.001,00","1.001,00","1.001,00","1.001,00","0,10",129,"129.129,00","129.129,00",CEVI,2018-10-25
29.10.2018,"1.001,00","1.002,00","1.001,00","1.001,75","0,07",497,"497.870,00","497.870,00",CEVI,2018-10-29
30.10.2018,"1.000,00","1.001,00","1.000,00","1.000,80","-0,09",660,"660.529,00","660.529,00",CEVI,2018-10-30
31.10.2018,"1.000,00","1.000,00","1.000,00","1.000,00","-0,08",80,"80.000,00","80.000,00",CEVI,2018-10-31
05.11.2018,"1.000,00","1.000,00","1.000,00","1.000,00","0,00",100,"100.000,00","100.000,00",CEVI,2018-11-05
06.11.2018,"1.000,00","1.000,00","1.000,00","1.000,00","0,00",135,"135.000,00","135.000,00",CEVI,2018-11-06
07.11.2018,"1.000,00","1.000,00","1.000,00","1.000,00","0,00",25,"25.000,00","25.000,00",CEVI,2018-11-07
08.11.2018,"1.000,00","1.000,00","1.000,00","1.000,00","0,00",103,"103.000,00","103.000,00",CEVI,2018-11-08
09.11.2018,"1.000,00",/,/,"1.000,00","0,00",0,"0,00","0,00",CEVI,2018-11-09
12.11.2018,"1.000,00","1.000,00","1.000,00","1.000,00","0,00",178,"178.000,00","178.000,00",CEVI,2018-11-12
13.11.2018,"1.000,00","1.000,00","1.000,00","1.000,00","0,00",70,"70.000,00","70.000,00",CEVI,2018-11-13
14.11.2018,"1.000,00","1.000,00","1.000,00","1.000,00","0,00",103,"103.000,00","103.000,00",CEVI,2018-11-14
15.11.2018,"1.000,00","1.000,00","1.000,00","1.000,00","0,00",317,"317.000,00","317.000,00",CEVI,2018-11-15
19.11.2018,"1.000,00","1.001,00","1.000,00","1.000,65","0,06",306,"306.200,00","306.200,00",CEVI,2018-11-19
20.11.2018,"1.000,00","1.000,00","1.000,00","1.000,00","-0,06",284,"284.000,00","284.000,00",CEVI,2018-11-20
21.11.2018,"1.000,00","1.001,00","1.000,00","1.000,25","0,02",620,"620.156,00","620.156,00",CEVI,2018-11-21
22.11.2018,"1.000,00","1.000,00","1.000,00","1.000,00","-0,02",289,"289.000,00","289.000,00",CEVI,2018-11-22
23.11.2018,"1.000,00","1.000,00","1.000,00","1.000,00","0,00",115,"115.000,00","115.000,00",CEVI,2018-11-23
26.11.2018,"1.000,00","1.000,00","1.000,00","1.000,00","0,00",516,"516.000,00","516.000,00",CEVI,2018-11-26
27.11.2018,"1.000,00","1.000,00","1.000,00","1.000,00","0,00",92,"92.000,00","92.000,00",CEVI,2018-11-27
28.11.2018,"1.000,00","1.000,00","1.000,00","1.000,00","0,00",187,"187.000,00","187.000,00",CEVI,2018-11-28
17.12.2018,"920,00","920,00","920,00","920,00","-8,00",524,"482.080,00","482.080,00",CEVI,2018-12-17
24.12.2018,"850,00","850,00","850,00","850,00","-7,61",100,"85.000,00","85.000,00",CEVI,2018-12-24
28.12.2018,"893,00","893,00","893,00","893,00","5,06",499,"445.607,00","445.607,00",CEVI,2018-12-28
10.01.2019,"893,00","893,00","893,00","893,00","0,00",100,"89.300,00","89.300,00",CEVI,2019-01-10
11.01.2019,"894,00","894,00","894,00","894,00","0,11",43,"38.442,00","38.442,00",CEVI,2019-01-11
14.01.2019,"919,00","919,00","919,00","919,00","2,80",300,"275.700,00","275.700,00",CEVI,2019-01-14
15.01.2019,"893,00","893,00","893,00","893,00","-2,83",35,"31.255,00","31.255,00",CEVI,2019-01-15
22.01.2019,"893,00","893,00","893,00","893,00","0,00",7,"6.251,00","6.251,00",CEVI,2019-01-22
30.01.2019,"893,00","893,00","893,00","893,00","0,00",53,"47.329,00","47.329,00",CEVI,2019-01-30
31.01.2019,"919,00","919,00","919,00","919,00","2,91",39,"35.841,00","35.841,00",CEVI,2019-01-31
01.02.2019,"893,00","893,00","893,00","893,00","-2,83",10,"8.930,00","8.930,00",CEVI,2019-02-01
05.02.2019,"900,00","900,00","894,00","898,86","0,66",105,"94.380,00","94.380,00",CEVI,2019-02-05
08.02.2019,"900,00","900,00","900,00","900,00","0,13",110,"99.000,00","99.000,00",CEVI,2019-02-08
11.02.2019,"900,00","900,00","885,00","894,02","-0,66",256,"228.868,00","228.868,00",CEVI,2019-02-11
14.02.2019,"900,00","900,00","900,00","900,00","0,67",56,"50.400,00","50.400,00",CEVI,2019-02-14
20.02.2019,"900,00","900,00","900,00","900,00","0,00",20,"18.000,00","18.000,00",CEVI,2019-02-20
22.02.2019,"900,00","900,00","900,00","900,00","0,00",50,"45.000,00","45.000,00",CEVI,2019-02-22
04.03.2019,"900,00","900,00","900,00","900,00","0,00",254,"228.600,00","228.600,00",CEVI,2019-03-04
04.04.2019,"810,00","810,00","810,00","810,00","-10,00",205,"166.050,00","166.050,00",CEVI,2019-04-04
19.04.2019,"800,00","801,00","800,00","800,53","-1,17",94,"75.250,00","75.250,00",CEVI,2019-04-19
17.05.2019,"781,00","800,00","781,00","790,69","-1,23",196,"154.976,00","154.976,00",CEVI,2019-05-17
28.06.2019,"800,00","800,00","800,00","800,00","1,18",20,"16.000,00","16.000,00",CEVI,2019-06-28
11.07.2019,"730,00","730,00","730,00","730,00","-8,75",40,"29.200,00","29.200,00",CEVI,2019-07-11
24.09.2019,"751,00","751,00","751,00","751,00","2,88",220,"165.220,00","165.220,00",CEVI,2019-09-24
14.10.2019,"650,00","650,00","650,00","650,00","-13,45",15,"9.750,00","9.750,00",CEVI,2019-10-14
22.10.2019,"650,00","650,00","650,00","650,00","0,00",149,"96.850,00","96.850,00",CEVI,2019-10-22
08.11.2019,"650,00",/,/,"650,00","0,00",0,"0,00","0,00",CEVI,2019-11-08
28.11.2019,"601,00","601,00","601,00","601,00","-7,54",37,"22.237,00","22.237,00",CEVI,2019-11-28
24.12.2019,"601,00","601,00","601,00","601,00","0,00",232,"139.432,00","139.432,00",CEVI,2019-12-24
25.12.2019,"583,00","583,00","583,00","583,00","-3,00",23,"13.409,00","13.409,00",CEVI,2019-12-25
27.12.2019,"584,00","584,00","584,00","584,00","0,17",130,"75.920,00","75.920,00",CEVI,2019-12-27
17.01.2020,"567,00","567,00","567,00","567,00","-2,91",30,"17.010,00","17.010,00",CEVI,2020-01-17
22.01.2020,"567,00","567,00","567,00","567,00","0,00",8,"4.536,00","4.536,00",CEVI,2020-01-22
17.02.2020,"550,00","550,00","550,00","550,00","-3,00",102,"56.100,00","56.100,00",CEVI,2020-02-17
03.03.2020,"600,00","600,00","600,00","600,00","9,09",111,"66.600,00","66.600,00",CEVI,2020-03-03
13.10.2020,"431,00","431,00","431,00","431,00","-28,17",10,"4.310,00","4.310,00",CEVI,2020-10-13
15.10.2020,"431,00","431,00","431,00","431,00","0,00",39,"16.809,00","16.809,00",CEVI,2020-10-15
06.11.2020,"431,00",/,/,"431,00","0,00",0,"0,00","0,00",CEVI,2020-11-06
16.11.2020,"400,00","400,00","400,00","400,00","-7,19",35,"14.000,00","14.000,00",CEVI,2020-11-16
14.12.2020,"400,00","400,00","400,00","400,00","0,00","5,267","2.106.800,00","2.106.800,00",CEVI,2020-12-14
13.01.2021,"400,00","400,00","400,00","400,00","0,00",436,"174.400,00","174.400,00",CEVI,2021-01-13
20.01.2021,"401,00","401,00","401,00","401,00","0,25",119,"47.719,00","47.719,00",CEVI,2021-01-20
21.01.2021,"400,00","400,00","400,00","400,00","-0,25",100,"40.000,00","40.000,00",CEVI,2021-01-21
25.01.2021,"400,00","400,00","400,00","400,00","0,00",150,"60.000,00","60.000,00",CEVI,2021-01-25
20.04.2021,"400,00","400,00","400,00","400,00","0,00",524,"209.600,00","209.600,00",CEVI,2021-04-20
23.04.2021,"400,00","400,00","400,00","400,00","0,00",129,"51.600,00","51.600,00",CEVI,2021-04-23
19.05.2021,"400,00","400,00","400,00","400,00","0,00",100,"40.000,00","40.000,00",CEVI,2021-05-19
31.05.2021,"400,00","400,00","400,00","400,00","0,00",50,"20.000,00","20.000,00",CEVI,2021-05-31
02.06.2021,"400,00","400,00","400,00","400,00","0,00",100,"40.000,00","40.000,00",CEVI,2021-06-02
26.10.2021,"400,00","400,00","400,00","400,00","0,00",125,"50.000,00","50.000,00",CEVI,2021-10-26
08.11.2021,"400,00",/,/,"400,00","0,00",0,"0,00","0,00",CEVI,2021-11-08
09.11.2021,"400,00","400,00","400,00","400,00","0,00",804,"321.600,00","321.600,00",CEVI,2021-11-09
18.11.2021,"400,00","400,00","400,00","400,00","0,00",27,"10.800,00","10.800,00",CEVI,2021-11-18
03.02.2022,"400,00","400,00","400,00","400,00","0,00","1,311","524.400,00","524.400,00",CEVI,2022-02-03
26.04.2022,"400,00","400,00","400,00","400,00","0,00",115,"46.000,00","46.000,00",CEVI,2022-04-26
01.06.2022,"400,00","400,00","400,00","400,00","0,00",65,"26.000,00","26.000,00",CEVI,2022-06-01
08.11.2022,"400,00",/,/,"400,00","0,00",0,"0,00","0,00",CEVI,2022-11-08
21.11.2022,"399,00","399,00","399,00","399,00","-0,25",115,"45.885,00","45.885,00",CEVI,2022-11-21
08.03.2023,"399,00","399,00","399,00","399,00","0,00",12,"4.788,00","4.788,00",CEVI,2023-03-08
05.06.2023,"200,00","200,00","200,00","200,00","-49,87","9,153","1.830.600,00","1.830.600,00",CEVI,2023-06-05
12.06.2023,"200,00","200,00","200,00","200,00","0,00",202,"40.400,00","40.400,00",CEVI,2023-06-12
13.06.2023,"200,00","200,00","200,00","200,00","0,00",125,"25.000,00","25.000,00",CEVI,2023-06-13
10.08.2023,"200,00","200,00","200,00","200,00","0,00",454,"90.800,00","90.800,00",CEVI,2023-08-10
06.11.2023,"220,00","220,00","220,00","220,00","10,00",35,"7.700,00","7.700,00",CEVI,2023-11-06
08.11.2023,"220,00",/,/,"220,00","0,00",0,"0,00","0,00",CEVI,2023-11-08
20.11.2023,"300,00","300,00","300,00","300,00","36,36",100,"30.000,00","30.000,00",CEVI,2023-11-20
25.12.2023,"400,00","400,00","400,00","400,00","33,33",28,"11.200,00","11.200,00",CEVI,2023-12-25
29.03.2024,"220,00","220,00","220,00","220,00","-45,00",5,"1.100,00","1.100,00",CEVI,2024-03-29
09.04.2024,"220,00","220,00","220,00","220,00","0,00",17,"3.740,00","3.740,00",CEVI,2024-04-09
07.05.2024,"220,00","220,00","220,00","220,00","0,00",83,"18.260,00","18.260,00",CEVI,2024-05-07
09.05.2024,"220,00","220,00","220,00","220,00","0,00",97,"21.340,00","21.340,00",CEVI,2024-05-09
13.09.2024,"199,00","199,00","199,00","199,00","-9,55",209,"41.591,00","41.591,00",CEVI,2024-09-13
07.11.2024,"199,00",/,/,"199,00","0,00",0,"0,00","0,00",CEVI,2024-11-07
25.12.2014,"615,00","615,00","615,00","615,00","2,50",5,"3.075,00","3.075,00",CKB,2014-12-25
10.11.2015,"615,00",/,/,"615,00","0,00",0,"0,00","0,00",CKB,2015-11-10
09.11.2016,"615,00",/,/,"615,00","0,00",0,"0,00","0,00",CKB,2016-11-09
01.03.2017,"615,00","615,00","615,00","615,00","0,00",344,"211.560,00","211.560,00",CKB,2017-03-01
07.09.2017,"400,00","400,00","400,00","400,00","-34,96",8,"3.200,00","3.200,00",CKB,2017-09-07
02.11.2017,"520,00","520,00","520,00","520,00","30,00",16,"8.320,00","8.320,00",CKB,2017-11-02
09.11.2017,"520,00",/,/,"520,00","0,00",0,"0,00","0,00",CKB,2017-11-09
19.02.2018,"600,00","600,00","600,00","600,00","15,38",750,"450.000,00","450.000,00",CKB,2018-02-19
20.04.2018,"600,00","600,00","600,00","600,00","0,00",157,"94.200,00","94.200,00",CKB,2018-04-20
02.11.2018,"700,00","700,00","700,00","700,00","16,67",95,"66.500,00","66.500,00",CKB,2018-11-02
08.11.2018,"700,00","700,00","700,00","700,00","0,00",64,"44.800,00","44.800,00",CKB,2018-11-08
09.11.2018,"700,00",/,/,"700,00","0,00",0,"0,00","0,00",CKB,2018-11-09
20.03.2019,"700,00","700,00","700,00","700,00","0,00",182,"127.400,00","127.400,00",CKB,2019-03-20
17.05.2019,"700,00","700,00","700,00","700,00","0,00",136,"95.200,00","95.200,00",CKB,2019-05-17
20.05.2019,"700,00","700,00","700,00","700,00","0,00",600,"420.000,00","420.000,00",CKB,2019-05-20
21.05.2019,"700,00","700,00","700,00","700,00","0,00","1,395","976.500,00","976.500,00",CKB,2019-05-21
08.11.2019,"700,00",/,/,"700,00","0,00",0,"0,00","0,00",CKB,2019-11-08
06.11.2020,"700,00",/,/,"700,00","0,00",0,"0,00","0,00",CKB,2020-11-06
15.07.2021,"600,00","600,00","600,00","600,00","-14,29",6,"3.600,00","3.600,00",CKB,2021-07-15
08.11.2021,"600,00",/,/,"600,00","0,00",0,"0,00","0,00",CKB,2021-11-08
05.01.2022,"600,00","600,00","600,00","600,00","0,00",14,"8.400,00","8.400,00",CKB,2022-01-05
08.06.2022,"450,00","450,00","450,00","450,00","-25,00",48,"21.600,00","21.600,00",CKB,2022-06-08
04.11.2022,"600,00","600,00","600,00","600,00","33,33",6,"3.600,00","3.600,00",CKB,2022-11-04
08.11.2022,"600,00",/,/,"600,00","0,00",0,"0,00","0,00",CKB,2022-11-08
05.01.2023,"450,00","450,00","450,00","450,00","-25,00",30,"13.500,00","13.500,00",CKB,2023-01-05
31.05.2023,"350,00","350,00","350,00","350,00","-22,22",174,"60.900,00","60.900,00",CKB,2023-05-31
08.11.2023,"350,00",/,/,"350,00","0,00",0,"0,00","0,00",CKB,2023-11-08
07.11.2024,"350,00",/,/,"350,00","0,00",0,"0,00","0,00",CKB,2024-11-07
08.11.2019,/,/,/,/,/,0,"0,00","0,00",CKBKO,2019-11-08
06.11.2020,/,/,/,/,/,0,"0,00","0,00",CKBKO,2020-11-06
09.06.2021,"100,00","100,00","100,00","100,00",/,500,"30.839.750,00","30.839.750,00",CKBKO,2021-06-09
08.07.2021,"100,00","100,00","100,00","100,00","0,00",250,"15.412.175,00","15.412.175,00",CKBKO,2021-07-08
19.08.2021,"100,00","100,00","100,00","100,00","0,00",250,"15.374.825,00","15.374.825,00",CKBKO,2021-08-19
15.09.2021,"100,00","100,00","100,00","100,00","0,00",250,"15.400.750,00","15.400.750,00",CKBKO,2021-09-15
19.10.2021,"100,00","100,00","100,00","100,00","0,00",250,"15.423.750,00","15.423.750,00",CKBKO,2021-10-19
08.11.2021,"100,00",/,/,"100,00","0,00",0,"0,00","0,00",CKBKO,2021-11-08
10.12.2021,"100,00","100,00","100,00","100,00","0,00","1,500","92.542.500,00","92.542.500,00",CKBKO,2021-12-10
08.11.2022,"100,00",/,/,"100,00","0,00",0,"0,00","0,00",CKBKO,2022-11-08
08.11.2023,"100,00",/,/,"100,00","0,00",0,"0,00","0,00",CKBKO,2023-11-08
07.11.2024,"100,00",/,/,"100,00","0,00",0,"0,00","0,00",CKBKO,2024-11-07
06.07.2015,"1.550,00","1.550,00","1.550,00","1.550,00","0,00",30,"46.500,00","46.500,00",DEBA,2015-07-06
10.11.2015,"1.550,00",/,/,"1.550,00","0,00",0,"0,00","0,00",DEBA,2015-11-10
31.05.2016,"1.550,00","1.550,00","1.550,00","1.550,00","0,00",31,"48.050,00","48.050,00",DEBA,2016-05-31
01.06.2016,"1.550,00","1.550,00","1.550,00","1.550,00","0,00",31,"48.050,00","48.050,00",DEBA,2016-06-01
09.11.2016,"1.550,00",/,/,"1.550,00","0,00",0,"0,00","0,00",DEBA,2016-11-09
09.11.2017,"1.550,00",/,/,"1.550,00","0,00",0,"0,00","0,00",DEBA,2017-11-09
09.11.2018,"1.550,00",/,/,"1.550,00","0,00",0,"0,00","0,00",DEBA,2018-11-09
08.11.2019,"1.550,00",/,/,"1.550,00","0,00",0,"0,00","0,00",DEBA,2019-11-08
06.11.2020,"1.550,00",/,/,"1.550,00","0,00",0,"0,00","0,00",DEBA,2020-11-06
08.11.2021,"1.550,00",/,/,"1.550,00","0,00",0,"0,00","0,00",DEBA,2021-11-08
08.11.2022,"1.550,00",/,/,"1.550,00","0,00",0,"0,00","0,00",DEBA,2022-11-08
08.11.2023,"1.550,00",/,/,"1.550,00","0,00",0,"0,00","0,00",DEBA,2023-11-08
07.11.2024,"1.550,00",/,/,"1.550,00","0,00",0,"0,00","0,00",DEBA,2024-11-07
12.05.2015,"185,00","185,00","185,00","185,00","-85,21",400,"74.000,00","74.000,00",DIMI,2015-05-12
10.11.2015,"185,00",/,/,"185,00","0,00",0,"0,00","0,00",DIMI,2015-11-10
02.02.2016,"185,00","185,00","185,00","185,00","0,00",78,"14.430,00","14.430,00",DIMI,2016-02-02
09.11.2016,"185,00",/,/,"185,00","0,00",0,"0,00","0,00",DIMI,2016-11-09
09.11.2017,"185,00",/,/,"185,00","0,00",0,"0,00","0,00",DIMI,2017-11-09
09.11.2018,"185,00",/,/,"185,00","0,00",0,"0,00","0,00",DIMI,2018-11-09
08.11.2019,"185,00",/,/,"185,00","0,00",0,"0,00","0,00",DIMI,2019-11-08
06.11.2020,"185,00",/,/,"185,00","0,00",0,"0,00","0,00",DIMI,2020-11-06
08.11.2021,"185,00",/,/,"185,00","0,00",0,"0,00","0,00",DIMI,2021-11-08
08.11.2022,"185,00",/,/,"185,00","0,00",0,"0,00","0,00",DIMI,2022-11-08
08.11.2023,"185,00",/,/,"185,00","0,00",0,"0,00","0,00",DIMI,2023-11-08
11.03.2024,"185,00","185,00","185,00","185,00","0,00",400,"74.000,00","74.000,00",DIMI,2024-03-11
13.09.2024,"185,00","185,00","185,00","185,00","0,00",139,"25.715,00","25.715,00",DIMI,2024-09-13
07.11.2024,"185,00",/,/,"185,00","0,00",0,"0,00","0,00",DIMI,2024-11-07
10.11.2015,"61,00",/,/,"61,00","0,00",0,"0,00","0,00",EDST,2015-11-10
29.12.2015,"61,00",/,/,"61,00","0,00",0,"0,00","0,00",EDST,2015-12-29
09.11.2017,"61,00",/,/,"61,00","0,00",0,"0,00","0,00",EDST,2017-11-09
02.01.2018,"61,00",/,/,"61,00","0,00",0,"0,00","0,00",EDST,2018-01-02
21.04.2022,"61,00","61,00","61,00","61,00","0,00","5,507","335.927,00","335.927,00",EDST,2022-04-21
26.04.2022,"61,00","61,00","61,00","61,00","0,00","5,632","343.552,00","343.552,00",EDST,2022-04-26
27.04.2022,"61,00","61,00","61,00","61,00","0,00","5,117","312.137,00","312.137,00",EDST,2022-04-27
28.04.2022,"61,00","61,00","61,00","61,00","0,00","5,506","335.866,00","335.866,00",EDST,2022-04-28
29.04.2022,"61,00","61,00","61,00","61,00","0,00","5,479","334.219,00","334.219,00",EDST,2022-04-29
04.05.2022,"61,00","61,00","61,00","61,00","0,00","10,706","653.066,00","653.066,00",EDST,2022-05-04
12.05.2022,"61,00","61,00","61,00","61,00","0,00","9,007","549.427,00","549.427,00",EDST,2022-05-12
16.05.2022,"61,00","61,00","61,00","61,00","0,00","5,182","316.102,00","316.102,00",EDST,2022-05-16
18.05.2022,"61,00","61,00","61,00","61,00","0,00","1,129","68.869,00","68.869,00",EDST,2022-05-18
26.05.2022,"61,00","61,00","61,00","61,00","0,00","2,756","168.116,00","168.116,00",EDST,2022-05-26
30.05.2022,"61,00","61,00","61,00","61,00","0,00","2,132","130.052,00","130.052,00",EDST,2022-05-30
01.06.2022,"61,00","61,00","61,00","61,00","0,00",707,"43.127,00","43.127,00",EDST,2022-06-01
02.06.2022,"61,00","61,00","61,00","61,00","0,00",545,"33.245,00","33.245,00",EDST,2022-06-02
07.06.2022,"61,00","61,00","61,00","61,00","0,00","8,791","536.251,00","536.251,00",EDST,2022-06-07
08.06.2022,"61,00","61,00","61,00","61,00","0,00","9,082","554.002,00","554.002,00",EDST,2022-06-08
09.06.2022,"61,00","61,00","61,00","61,00","0,00","5,853","357.033,00","357.033,00",EDST,2022-06-09
06.07.2022,"61,00","61,00","61,00","61,00","0,00","3,216","196.176,00","196.176,00",EDST,2022-07-06
12.07.2022,"61,00","61,00","61,00","61,00","0,00",278,"16.958,00","16.958,00",EDST,2022-07-12
20.07.2022,"61,00","61,00","61,00","61,00","0,00","1,086","66.246,00","66.246,00",EDST,2022-07-20
21.07.2022,"61,00","61,00","61,00","61,00","0,00",760,"46.360,00","46.360,00",EDST,2022-07-21
29.07.2022,"61,00","61,00","61,00","61,00","0,00",638,"38.918,00","38.918,00",EDST,2022-07-29
15.08.2022,"61,00","61,00","61,00","61,00","0,00",591,"36.051,00","36.051,00",EDST,2022-08-15
23.08.2022,"61,00","61,00","61,00","61,00","0,00","1,100","67.100,00","67.100,00",EDST,2022-08-23
24.08.2022,"61,00","61,00","61,00","61,00","0,00","1,391","84.851,00","84.851,00",EDST,2022-08-24
25.08.2022,"61,00","61,00","61,00","61,00","0,00",203,"12.383,00","12.383,00",EDST,2022-08-25
30.08.2022,"61,00","61,00","61,00","61,00","0,00",294,"17.934,00","17.934,00",EDST,2022-08-30
06.09.2022,"61,00","61,00","61,00","61,00","0,00",864,"52.704,00","52.704,00",EDST,2022-09-06
28.09.2022,"61,00","61,00","61,00","61,00","0,00","1,042","63.562,00","63.562,00",EDST,2022-09-28
29.09.2022,"61,00","61,00","61,00","61,00","0,00",757,"46.177,00","46.177,00",EDST,2022-09-29
12.10.2022,"61,00","61,00","61,00","61,00","0,00","1,079","65.819,00","65.819,00",EDST,2022-10-12
13.10.2022,"61,00","61,00","61,00","61,00","0,00",861,"52.521,00","52.521,00",EDST,2022-10-13
08.11.2022,"61,00",/,/,"61,00","0,00",0,"0,00","0,00",EDST,2022-11-08
16.11.2022,"61,00","61,00","61,00","61,00","0,00",524,"31.964,00","31.964,00",EDST,2022-11-16
22.12.2022,"61,00","61,00","61,00","61,00","0,00",783,"47.763,00","47.763,00",EDST,2022-12-22
23.12.2022,"61,00","61,00","61,00","61,00","0,00",182,"11.102,00","11.102,00",EDST,2022-12-23
12.01.2023,"61,00","61,00","61,00","61,00","0,00",763,"46.543,00","46.543,00",EDST,2023-01-12
28.02.2023,"61,00","61,00","61,00","61,00","0,00",852,"51.972,00","51.972,00",EDST,2023-02-28
31.07.2023,"61,00","61,00","61,00","61,00","0,00",285,"17.385,00","17.385,00",EDST,2023-07-31
13.09.2023,"61,00","61,00","61,00","61,00","0,00",159,"9.699,00","9.699,00",EDST,2023-09-13
08.11.2023,"61,00",/,/,"61,00","0,00",0,"0,00","0,00",EDST,2023-11-08
28.11.2023,"61,00","61,00","61,00","61,00","0,00",306,"18.666,00","18.666,00",EDST,2023-11-28
03.01.2024,"61,00","61,00","61,00","61,00","0,00",490,"29.890,00","29.890,00",EDST,2024-01-03
09.04.2024,"61,00","61,00","61,00","61,00","0,00","2,589","157.929,00","157.929,00",EDST,2024-04-09
12.09.2024,"61,00","61,00","61,00","61,00","0,00",242,"14.762,00","14.762,00",EDST,2024-09-12
07.11.2024,"61,00",/,/,"61,00","0,00",0,"0,00","0,00",EDST,2024-11-07
11.02.2015,"30,00","30,00","30,00","30,00","0,00","1,221","36.630,00","36.630,00",ELMA,2015-02-11
21.07.2015,"30,00","30,00","30,00","30,00","0,00",730,"21.900,00","21.900,00",ELMA,2015-07-21
10.08.2015,"40,00","40,00","40,00","40,00","33,33","1,363","54.520,00","54.520,00",ELMA,2015-08-10
01.09.2015,"50,00","50,00","50,00","50,00","25,00","2,556","127.800,00","127.800,00",ELMA,2015-09-01
10.11.2015,"50,00",/,/,"50,00","0,00",0,"0,00","0,00",ELMA,2015-11-10
09.11.2016,"50,00",/,/,"50,00","0,00",0,"0,00","0,00",ELMA,2016-11-09
29.12.2016,"50,00",/,/,"50,00","0,00",0,"0,00","0,00",ELMA,2016-12-29
01.06.2018,"40,00","40,00","40,00","40,00","-20,00",614,"24.560,00","24.560,00",ELMA,2018-06-01
27.08.2018,"39,00","39,00","39,00","39,00","-2,50","1,533","59.787,00","59.787,00",ELMA,2018-08-27
09.11.2018,"39,00",/,/,"39,00","0,00",0,"0,00","0,00",ELMA,2018-11-09
08.11.2019,"39,00",/,/,"39,00","0,00",0,"0,00","0,00",ELMA,2019-11-08
02.01.2020,"39,00",/,/,"39,00","0,00",0,"0,00","0,00",ELMA,2020-01-02
07.11.2024,"39,00",/,/,"39,00","0,00",0,"0,00","0,00",ELMA,2024-11-07
10.11.2015,"3.150,00",/,/,"3.150,00","0,00",0,"0,00","0,00",ELNC,2015-11-10
29.12.2015,"3.150,00",/,/,"3.150,00","0,00",0,"0,00","0,00",ELNC,2015-12-29
30.12.2020,"3.150,00",/,/,"3.150,00","0,00",0,"0,00","0,00",ELNC,2020-12-30
07.11.2024,"3.150,00",/,/,"3.150,00","0,00",0,"0,00","0,00",ELNC,2024-11-07
10.11.2015,"1.200,00",/,/,"1.200,00","0,00",0,"0,00","0,00",ENER,2015-11-10
29.12.2015,"1.200,00",/,/,"1.200,00","0,00",0,"0,00","0,00",ENER,2015-12-29
16.01.2017,"1.200,00","1.200,00","1.200,00","1.200,00","0,00",65,"78.000,00","78.000,00",ENER,2017-01-16
11.08.2017,"1.200,00","1.200,00","1.200,00","1.200,00","0,00",55,"66.000,00","66.000,00",ENER,2017-08-11
09.11.2017,"1.200,00",/,/,"1.200,00","0,00",0,"0,00","0,00",ENER,2017-11-09
09.11.2018,"1.200,00",/,/,"1.200,00","0,00",0,"0,00","0,00",ENER,2018-11-09
28.12.2018,"1.200,00",/,/,"1.200,00","0,00",0,"0,00","0,00",ENER,2018-12-28
16.09.2022,"1.200,00","1.200,00","1.200,00","1.200,00","0,00",22,"26.400,00","26.400,00",ENER,2022-09-16
07.11.2022,"1.200,00","1.200,00","1.200,00","1.200,00","0,00",19,"22.800,00","22.800,00",ENER,2022-11-07
08.11.2022,"1.200,00",/,/,"1.200,00","0,00",0,"0,00","0,00",ENER,2022-11-08
03.01.2023,"1.200,00","1.200,00","1.200,00","1.200,00","0,00",102,"122.400,00","122.400,00",ENER,2023-01-03
18.01.2023,"1.200,00","1.200,00","1.200,00","1.200,00","0,00",7,"8.400,00","8.400,00",ENER,2023-01-18
23.01.2023,"1.200,00","1.200,00","1.200,00","1.200,00","0,00",35,"42.000,00","42.000,00",ENER,2023-01-23
10.04.2023,"1.200,00","1.200,00","1.200,00","1.200,00","0,00",14,"16.800,00","16.800,00",ENER,2023-04-10
12.06.2023,"1.200,00","1.200,00","1.200,00","1.200,00","0,00",12,"14.400,00","14.400,00",ENER,2023-06-12
08.11.2023,"1.200,00",/,/,"1.200,00","0,00",0,"0,00","0,00",ENER,2023-11-08
10.11.2023,"1.200,00","1.200,00","1.200,00","1.200,00","0,00",19,"22.800,00","22.800,00",ENER,2023-11-10
06.12.2023,"1.200,00","1.200,00","1.200,00","1.200,00","0,00",9,"10.800,00","10.800,00",ENER,2023-12-06
07.08.2024,"1.200,00","1.200,00","1.200,00","1.200,00","0,00",41,"49.200,00","49.200,00",ENER,2024-08-07
07.11.2024,"1.200,00",/,/,"1.200,00","0,00",0,"0,00","0,00",ENER,2024-11-07
07.11.2024,/,/,/,/,/,0,"0,00","0,00",ENSA,2024-11-07
10.11.2015,/,/,/,/,/,0,"0,00","0,00",EUHA,2015-11-10
10.10.2016,"3,00","3,00","3,00","3,00",/,"90,000","270.000,00","270.000,00",EUHA,2016-10-10
09.11.2016,"3,00",/,/,"3,00","0,00",0,"0,00","0,00",EUHA,2016-11-09
09.11.2017,"3,00",/,/,"3,00","0,00",0,"0,00","0,00",EUHA,2017-11-09
11.05.2018,"3,00","3,00","3,00","3,00","0,00","30,000","90.000,00","90.000,00",EUHA,2018-05-11
22.05.2018,"3,00","3,00","3,00","3,00","0,00","15,000","45.000,00","45.000,00",EUHA,2018-05-22
09.11.2018,"3,00",/,/,"3,00","0,00",0,"0,00","0,00",EUHA,2018-11-09
30.11.2018,"3,00","3,00","3,00","3,00","0,00","15,000","45.000,00","45.000,00",EUHA,2018-11-30
08.11.2019,"3,00",/,/,"3,00","0,00",0,"0,00","0,00",EUHA,2019-11-08
06.11.2020,"3,00",/,/,"3,00","0,00",0,"0,00","0,00",EUHA,2020-11-06
07.06.2021,"30,00","30,00","30,00","30,00","900,00","40,000","1.200.000,00","1.200.000,00",EUHA,2021-06-07
08.11.2021,"30,00",/,/,"30,00","0,00",0,"0,00","0,00",EUHA,2021-11-08
28.06.2022,"15,00","15,00","15,00","15,00","-50,00","14,000","210.000,00","210.000,00",EUHA,2022-06-28
08.11.2022,"15,00",/,/,"15,00","0,00",0,"0,00","0,00",EUHA,2022-11-08
08.11.2023,"15,00",/,/,"15,00","0,00",0,"0,00","0,00",EUHA,2023-11-08
07.11.2024,"15,00",/,/,"15,00","0,00",0,"0,00","0,00",EUHA,2024-11-07
10.11.2015,"10.250,00",/,/,"10.250,00","0,00",0,"0,00","0,00",EUMK,2015-11-10
02.03.2016,"9.245,00","9.245,00","9.245,00","9.245,00","-9,80",1,"9.245,00","9.245,00",EUMK,2016-03-02
03.03.2016,"9.522,00","9.522,00","9.522,00","9.522,00","3,00",10,"95.220,00","95.220,00",EUMK,2016-03-03
05.04.2016,"9.522,00","9.522,00","9.522,00","9.522,00","0,00",4,"38.088,00","38.088,00",EUMK,2016-04-05
20.04.2016,"9.522,00","9.522,00","9.522,00","9.522,00","0,00",10,"95.220,00","95.220,00",EUMK,2016-04-20
14.06.2016,"9.300,00","9.300,00","9.300,00","9.300,00","-2,33",106,"985.800,00","985.800,00",EUMK,2016-06-14
09.11.2016,"9.300,00",/,/,"9.300,00","0,00",0,"0,00","0,00",EUMK,2016-11-09
04.07.2017,"9.500,00","9.500,00","9.500,00","9.500,00","2,15",5,"47.500,00","47.500,00",EUMK,2017-07-04
07.09.2017,"9.785,00","9.785,00","9.785,00","9.785,00","3,00",13,"127.205,00","127.205,00",EUMK,2017-09-07
09.11.2017,"9.785,00",/,/,"9.785,00","0,00",0,"0,00","0,00",EUMK,2017-11-09
09.11.2018,"9.785,00",/,/,"9.785,00","0,00",0,"0,00","0,00",EUMK,2018-11-09
28.12.2018,"9.785,00",/,/,"9.785,00","0,00",0,"0,00","0,00",EUMK,2018-12-28
08.11.2022,"9.785,00",/,/,"9.785,00","0,00",0,"0,00","0,00",EUMK,2022-11-08
29.12.2022,"9.785,00",/,/,"9.785,00","0,00",0,"0,00","0,00",EUMK,2022-12-29
07.11.2024,"9.785,00",/,/,"9.785,00","0,00",0,"0,00","0,00",EUMK,2024-11-07
10.11.2015,"3.145,00",/,/,"3.145,00","0,00",0,"0,00","0,00",EVRO,2015-11-10
02.11.2016,"3.239,00","3.239,00","3.239,00","3.239,00","2,99",97,"314.183,00","314.183,00",EVRO,2016-11-02
09.11.2016,"3.239,00",/,/,"3.239,00","0,00",0,"0,00","0,00",EVRO,2016-11-09
08.06.2017,"3.142,00","3.142,00","3.142,00","3.142,00","-2,99",3,"9.426,00","9.426,00",EVRO,2017-06-08
09.11.2017,"3.142,00",/,/,"3.142,00","0,00",0,"0,00","0,00",EVRO,2017-11-09
14.11.2017,"2.800,00","2.800,00","2.800,00","2.800,00","-10,88",1,"2.800,00","33.448.800,00",EVRO,2017-11-14
14.03.2018,"2.716,00","2.716,00","2.716,00","2.716,00","-3,00",31,"84.196,00","84.196,00",EVRO,2018-03-14
05.04.2018,"2.797,00","2.797,00","2.797,00","2.797,00","2,98",116,"324.452,00","324.452,00",EVRO,2018-04-05
22.05.2018,"3.000,00","3.000,00","3.000,00","3.000,00","7,26",29,"87.000,00","87.000,00",EVRO,2018-05-22
05.06.2018,"2.911,00","2.911,00","2.911,00","2.911,00","-2,97",5,"14.555,00","14.555,00",EVRO,2018-06-05
04.09.2018,"3.276,00","3.276,00","3.276,00","3.276,00","12,54",36,"117.936,00","117.936,00",EVRO,2018-09-04
09.11.2018,"3.276,00",/,/,"3.276,00","0,00",0,"0,00","0,00",EVRO,2018-11-09
06.02.2019,"2.851,00","2.851,00","2.851,00","2.851,00","-12,97",1,"2.851,00","1.962.851,00",EVRO,2019-02-06
21.03.2019,"3.010,00","3.010,00","3.010,00","3.010,00","5,58",1,"3.010,00","3.010,00",EVRO,2019-03-21
08.11.2019,"3.010,00",/,/,"3.010,00","0,00",0,"0,00","0,00",EVRO,2019-11-08
06.11.2020,"3.010,00",/,/,"3.010,00","0,00",0,"0,00","0,00",EVRO,2020-11-06
26.11.2020,"3.000,00","3.000,00","3.000,00","3.000,00","-0,33",40,"120.000,00","120.000,00",EVRO,2020-11-26
27.11.2020,"3.000,00","3.000,00","3.000,00","3.000,00","0,00",15,"45.000,00","45.000,00",EVRO,2020-11-27
17.12.2020,"3.090,00","3.090,00","3.090,00","3.090,00","3,00",42,"129.780,00","129.780,00",EVRO,2020-12-17
23.12.2020,"3.182,00","3.182,00","3.182,00","3.182,00","2,98",40,"127.280,00","127.280,00",EVRO,2020-12-23
29.12.2020,"3.301,00","3.301,00","3.301,00","3.301,00","3,74",18,"59.418,00","59.418,00",EVRO,2020-12-29
09.03.2021,"3.301,00","3.301,00","3.301,00","3.301,00","0,00",100,"330.100,00","330.100,00",EVRO,2021-03-09
09.09.2021,"2.900,00","2.900,00","2.900,00","2.900,00","-12,15",115,"333.500,00","333.500,00",EVRO,2021-09-09
08.11.2021,"2.900,00",/,/,"2.900,00","0,00",0,"0,00","0,00",EVRO,2021-11-08
08.11.2022,"2.900,00",/,/,"2.900,00","0,00",0,"0,00","0,00",EVRO,2022-11-08
08.11.2023,"2.900,00",/,/,"2.900,00","0,00",0,"0,00","0,00",EVRO,2023-11-08
27.12.2023,"2.987,00","2.987,00","2.987,00","2.987,00","3,00",20,"59.740,00","59.740,00",EVRO,2023-12-27
20.03.2024,"3.076,00","3.076,00","3.076,00","3.076,00","2,98",21,"64.596,00","64.596,00",EVRO,2024-03-20
22.03.2024,"3.168,00","3.168,00","3.168,00","3.168,00","2,99",20,"63.360,00","63.360,00",EVRO,2024-03-22
27.03.2024,"3.168,00","3.168,00","3.168,00","3.168,00","0,00",20,"63.360,00","63.360,00",EVRO,2024-03-27
07.11.2024,"3.168,00",/,/,"3.168,00","0,00",0,"0,00","0,00",EVRO,2024-11-07
06.02.2015,"5.900,00","5.900,00","5.900,00","5.900,00","0,34",50,"295.000,00","295.000,00",FAKM,2015-02-06
11.02.2015,"5.900,00","5.900,00","5.900,00","5.900,00","0,00",21,"123.900,00","123.900,00",FAKM,2015-02-11
12.02.2015,"5.500,00","5.500,00","5.500,00","5.500,00","-6,78",8,"44.000,00","44.000,00",FAKM,2015-02-12
13.02.2015,"5.500,00","5.500,00","5.500,00","5.500,00","0,00",4,"22.000,00","22.000,00",FAKM,2015-02-13
10.11.2015,"5.500,00",/,/,"5.500,00","0,00",0,"0,00","0,00",FAKM,2015-11-10
04.02.2016,"5.500,00","5.500,00","5.500,00","5.500,00","0,00",10,"55.000,00","55.000,00",FAKM,2016-02-04
22.02.2016,"8.001,00","8.001,00","8.001,00","8.001,00","45,47",10,"80.010,00","80.010,00",FAKM,2016-02-22
26.02.2016,"8.000,00","8.000,00","8.000,00","8.000,00","-0,01",12,"96.000,00","96.000,00",FAKM,2016-02-26
03.03.2016,"7.201,00","7.201,00","7.201,00","7.201,00","-9,99",11,"79.211,00","79.211,00",FAKM,2016-03-03
22.06.2016,"5.530,00","5.530,00","5.530,00","5.530,00","-23,21",10,"55.300,00","55.300,00",FAKM,2016-06-22
18.08.2016,"5.055,00","5.055,00","5.055,00","5.055,00","-8,59",10,"50.550,00","50.550,00",FAKM,2016-08-18
07.09.2016,"5.500,00","5.500,00","5.500,00","5.500,00","8,80",10,"55.000,00","55.000,00",FAKM,2016-09-07
09.11.2016,"5.500,00",/,/,"5.500,00","0,00",0,"0,00","0,00",FAKM,2016-11-09
29.05.2017,"6.000,00","6.000,00","6.000,00","6.000,00","9,09",7,"42.000,00","42.000,00",FAKM,2017-05-29
29.09.2017,"6.000,00","6.000,00","6.000,00","6.000,00","0,00",10,"60.000,00","60.000,00",FAKM,2017-09-29
04.10.2017,"6.000,00","6.000,00","6.000,00","6.000,00","0,00",20,"120.000,00","120.000,00",FAKM,2017-10-04
09.11.2017,"6.000,00",/,/,"6.000,00","0,00",0,"0,00","0,00",FAKM,2017-11-09
02.02.2018,"5.000,00","5.000,00","5.000,00","5.000,00","-16,67",3,"15.000,00","15.000,00",FAKM,2018-02-02
10.05.2018,"6.000,00","6.000,00","6.000,00","6.000,00","20,00",15,"90.000,00","90.000,00",FAKM,2018-05-10
01.08.2018,"6.000,00","6.000,00","6.000,00","6.000,00","0,00",24,"144.000,00","144.000,00",FAKM,2018-08-01
09.11.2018,"6.000,00",/,/,"6.000,00","0,00",0,"0,00","0,00",FAKM,2018-11-09
07.05.2019,"6.300,00","6.300,00","6.300,00","6.300,00","5,00",11,"69.300,00","69.300,00",FAKM,2019-05-07
08.05.2019,"7.200,00","7.200,00","7.200,00","7.200,00","14,29",10,"72.000,00","72.000,00",FAKM,2019-05-08
08.11.2019,"7.200,00",/,/,"7.200,00","0,00",0,"0,00","0,00",FAKM,2019-11-08
06.11.2020,"7.200,00",/,/,"7.200,00","0,00",0,"0,00","0,00",FAKM,2020-11-06
08.11.2021,"7.200,00",/,/,"7.200,00","0,00",0,"0,00","0,00",FAKM,2021-11-08
08.11.2022,"7.200,00",/,/,"7.200,00","0,00",0,"0,00","0,00",FAKM,2022-11-08
16.06.2023,"6.984,00","6.984,00","6.984,00","6.984,00","-3,00",104,"726.336,00","726.336,00",FAKM,2023-06-16
08.11.2023,"6.984,00",/,/,"6.984,00","0,00",0,"0,00","0,00",FAKM,2023-11-08
07.11.2024,"6.984,00",/,/,"6.984,00","0,00",0,"0,00","0,00",FAKM,2024-11-07
02.12.2014,"57.000,00","57.000,00","57.000,00","57.000,00","3,64",2,"114.000,00","114.000,00",FERS,2014-12-02
04.12.2014,"57.000,00","57.000,00","57.000,00","57.000,00","0,00",4,"228.000,00","228.000,00",FERS,2014-12-04
10.12.2014,"56.000,00","56.000,00","56.000,00","56.000,00","-1,75",5,"280.000,00","280.000,00",FERS,2014-12-10
30.12.2014,"56.000,00","56.000,00","55.000,00","55.500,00","-0,89",4,"222.000,00","222.000,00",FERS,2014-12-30
23.01.2015,"55.500,00","55.500,00","55.500,00","55.500,00","0,00",1,"55.500,00","55.500,00",FERS,2015-01-23
26.01.2015,"55.400,00","55.400,00","55.400,00","55.400,00","-0,18",1,"55.400,00","22.805.600,00",FERS,2015-01-26
06.04.2015,"46.018,00","46.018,00","46.018,00","46.018,00","-16,94",2,"92.036,00","92.036,00",FERS,2015-04-06
07.04.2015,"49.000,00","49.000,00","49.000,00","49.000,00","6,48",12,"588.000,00","588.000,00",FERS,2015-04-07
08.04.2015,"49.000,00","49.000,00","49.000,00","49.000,00","0,00",28,"1.372.000,00","1.372.000,00",FERS,2015-04-08
09.04.2015,"49.000,00","49.000,00","49.000,00","49.000,00","0,00",2,"98.000,00","98.000,00",FERS,2015-04-09
04.05.2015,"47.000,00","47.000,00","47.000,00","47.000,00","-4,08",7,"329.000,00","329.000,00",FERS,2015-05-04
05.05.2015,"47.000,00","47.000,00","47.000,00","47.000,00","0,00",5,"235.000,00","235.000,00",FERS,2015-05-05
08.05.2015,"48.000,00","48.000,00","48.000,00","48.000,00","2,13",3,"144.000,00","144.000,00",FERS,2015-05-08
12.05.2015,"48.000,00","48.000,00","48.000,00","48.000,00","0,00",6,"288.000,00","288.000,00",FERS,2015-05-12
01.06.2015,"48.000,00","48.000,00","48.000,00","48.000,00","0,00",6,"288.000,00","288.000,00",FERS,2015-06-01
15.09.2015,"46.560,00","46.560,00","46.560,00","46.560,00","-3,00",2,"93.120,00","93.120,00",FERS,2015-09-15
04.11.2015,"40.500,00","40.500,00","40.500,00","40.500,00","-13,02",1,"40.500,00","40.500,00",FERS,2015-11-04
10.11.2015,"40.500,00",/,/,"40.500,00","0,00",0,"0,00","0,00",FERS,2015-11-10
16.11.2015,"38.000,00","38.000,00","38.000,00","38.000,00","-6,17",2,"76.000,00","76.000,00",FERS,2015-11-16
18.11.2015,"39.000,00","39.000,00","39.000,00","39.000,00","2,63",17,"663.000,00","663.000,00",FERS,2015-11-18
07.12.2015,"40.000,00","40.000,00","40.000,00","40.000,00","2,56",1,"40.000,00","40.000,00",FERS,2015-12-07
16.12.2015,"40.000,00","40.000,00","40.000,00","40.000,00","0,00",12,"480.000,00","480.000,00",FERS,2015-12-16
18.12.2015,"38.800,00","38.800,00","38.800,00","38.800,00","-3,00",2,"77.600,00","77.600,00",FERS,2015-12-18
21.12.2015,"40.000,00","40.000,00","40.000,00","40.000,00","3,09",1,"40.000,00","57.640.000,00",FERS,2015-12-21
24.12.2015,"40.000,00","40.000,00","40.000,00","40.000,00","0,00",48,"1.920.000,00","1.920.000,00",FERS,2015-12-24
25.12.2015,"40.000,00","40.000,00","40.000,00","40.000,00","0,00",150,"6.000.000,00","6.000.000,00",FERS,2015-12-25
29.12.2015,"37.830,00","37.830,00","37.830,00","37.830,00","-5,42",5,"189.150,00","189.150,00",FERS,2015-12-29
05.01.2016,"39.500,00","39.500,00","39.500,00","39.500,00","4,41",2,"79.000,00","79.000,00",FERS,2016-01-05
25.01.2016,"40.000,00","40.000,00","40.000,00","40.000,00","1,27",8,"320.000,00","320.000,00",FERS,2016-01-25
27.01.2016,"40.002,00","40.002,00","40.002,00","40.002,00","0,00",10,"400.020,00","400.020,00",FERS,2016-01-27
18.02.2016,"40.002,00","40.002,00","40.002,00","40.002,00","0,00",1,"40.002,00","40.002,00",FERS,2016-02-18
25.02.2016,"40.002,00","40.002,00","40.002,00","40.002,00","0,00",5,"200.010,00","200.010,00",FERS,2016-02-25
26.02.2016,"40.002,00","40.002,00","40.002,00","40.002,00","0,00",1,"40.002,00","40.002,00",FERS,2016-02-26
03.03.2016,"40.002,00","40.002,00","40.002,00","40.002,00","0,00",3,"120.006,00","120.006,00",FERS,2016-03-03
07.03.2016,"40.002,00","40.002,00","40.002,00","40.002,00","0,00",2,"80.004,00","80.004,00",FERS,2016-03-07
11.03.2016,"40.002,00","40.002,00","40.002,00","40.002,00","0,00",6,"240.012,00","240.012,00",FERS,2016-03-11
25.03.2016,"40.000,00","40.000,00","40.000,00","40.000,00","0,00",3,"120.000,00","1.320.000,00",FERS,2016-03-25
28.03.2016,"40.000,00","40.000,00","40.000,00","40.000,00","0,00",1,"40.000,00","40.000,00",FERS,2016-03-28
04.04.2016,"40.000,00","40.000,00","40.000,00","40.000,00","0,00",4,"160.000,00","160.000,00",FERS,2016-04-04
05.04.2016,"40.000,00","40.001,00","40.000,00","40.000,50","0,00",4,"160.002,00","160.002,00",FERS,2016-04-05
11.04.2016,"40.000,00","40.000,00","40.000,00","40.000,00","0,00",5,"200.000,00","200.000,00",FERS,2016-04-11
12.04.2016,"40.000,00","40.000,00","40.000,00","40.000,00","0,00",4,"160.000,00","160.000,00",FERS,2016-04-12
20.04.2016,"40.000,00","40.000,00","40.000,00","40.000,00","0,00",4,"160.000,00","160.000,00",FERS,2016-04-20
05.05.2016,"40.000,00","40.000,00","40.000,00","40.000,00","0,00",3,"120.000,00","120.000,00",FERS,2016-05-05
09.06.2016,"40.000,00","40.000,00","40.000,00","40.000,00","0,00",1,"40.000,00","40.000,00",FERS,2016-06-09
28.06.2016,"40.000,00","40.000,00","40.000,00","40.000,00","0,00",1,"40.000,00","40.000,00",FERS,2016-06-28
11.07.2016,"38.800,00","38.800,00","38.800,00","38.800,00","-3,00",1,"38.800,00","38.800,00",FERS,2016-07-11
13.07.2016,"40.000,00","40.000,00","40.000,00","40.000,00","3,09",3,"120.000,00","120.000,00",FERS,2016-07-13
18.07.2016,"38.801,00","38.801,00","38.801,00","38.801,00","-3,00",1,"38.801,00","38.801,00",FERS,2016-07-18
05.08.2016,"39.970,00","39.970,00","39.970,00","39.970,00","3,01",20,"799.400,00","799.400,00",FERS,2016-08-05
15.08.2016,"40.000,00","40.000,00","40.000,00","40.000,00","0,08",1,"40.000,00","40.000,00",FERS,2016-08-15
02.09.2016,"41.204,00","41.204,00","41.204,00","41.204,00","3,01",3,"123.612,00","1.123.612,00",FERS,2016-09-02
07.09.2016,"42.440,00","42.440,00","42.440,00","42.440,00","3,00",3,"127.320,00","127.320,00",FERS,2016-09-07
13.09.2016,"41.203,00","41.203,00","41.203,00","41.203,00","-2,91",1,"41.203,00","41.203,00",FERS,2016-09-13
14.09.2016,"41.000,00","41.000,00","40.500,00","40.777,78","-1,03",9,"367.000,00","367.000,00",FERS,2016-09-14
23.09.2016,"41.116,00","41.116,00","41.116,00","41.116,00","0,83",3,"123.348,00","123.348,00",FERS,2016-09-23
05.10.2016,"39.901,00","39.901,00","39.901,00","39.901,00","-2,96",1,"39.901,00","39.901,00",FERS,2016-10-05
13.10.2016,"41.098,00","41.098,00","41.098,00","41.098,00","3,00",5,"205.490,00","205.490,00",FERS,2016-10-13
18.10.2016,"42.010,00","42.010,00","42.010,00","42.010,00","2,22",3,"126.030,00","126.030,00",FERS,2016-10-18
25.10.2016,"41.000,00","41.000,00","41.000,00","41.000,00","-2,40",13,"533.000,00","533.000,00",FERS,2016-10-25
31.10.2016,"42.000,00","42.000,00","42.000,00","42.000,00","2,44",3,"126.000,00","126.000,00",FERS,2016-10-31
09.11.2016,"42.000,00",/,/,"42.000,00","0,00",0,"0,00","0,00",FERS,2016-11-09
18.11.2016,"42.010,00","42.010,00","42.010,00","42.010,00","0,02",7,"294.070,00","294.070,00",FERS,2016-11-18
22.11.2016,"43.128,00","43.128,00","43.128,00","43.128,00","2,66",12,"517.536,00","517.536,00",FERS,2016-11-22
09.12.2016,"43.001,00","43.001,00","43.001,00","43.001,00","-0,29",2,"86.002,00","86.002,00",FERS,2016-12-09
15.12.2016,"43.000,00","43.000,00","43.000,00","43.000,00","0,00",1,"43.000,00","43.000,00",FERS,2016-12-15
19.12.2016,"43.000,00","43.000,00","43.000,00","43.000,00","0,00",2,"86.000,00","86.000,00",FERS,2016-12-19
23.12.2016,"40.050,00","40.050,00","40.050,00","40.050,00","-6,86",6,"240.300,00","240.300,00",FERS,2016-12-23
29.12.2016,"42.000,00","42.000,00","42.000,00","42.000,00","4,87",1,"42.000,00","5.602.000,00",FERS,2016-12-29
17.01.2017,"43.000,00","43.000,00","43.000,00","43.000,00","2,38",2,"86.000,00","86.000,00",FERS,2017-01-17
25.01.2017,"42.000,00","42.000,00","42.000,00","42.000,00","-2,33",4,"168.000,00","168.000,00",FERS,2017-01-25
27.01.2017,"43.000,00","43.000,00","43.000,00","43.000,00","2,38",1,"43.000,00","43.000,00",FERS,2017-01-27
30.01.2017,"41.710,00","41.710,00","41.710,00","41.710,00","-3,00",4,"166.840,00","166.840,00",FERS,2017-01-30
31.01.2017,"42.961,00","42.961,00","42.961,00","42.961,00","3,00",12,"515.532,00","515.532,00",FERS,2017-01-31
02.02.2017,"44.000,00","44.000,00","43.000,00","43.581,40","1,44",43,"1.874.000,00","1.874.000,00",FERS,2017-02-02
06.02.2017,"43.800,00","43.800,00","43.800,00","43.800,00","0,50",5,"219.000,00","219.000,00",FERS,2017-02-06
07.02.2017,"44.000,00","44.000,00","44.000,00","44.000,00","0,46",2,"88.000,00","88.000,00",FERS,2017-02-07
14.02.2017,"43.000,00","43.000,00","43.000,00","43.000,00","-2,27",2,"86.000,00","86.000,00",FERS,2017-02-14
15.02.2017,"41.710,00","41.710,00","41.710,00","41.710,00","-3,00",3,"125.130,00","125.130,00",FERS,2017-02-15
17.03.2017,"42.960,00","42.960,00","42.960,00","42.960,00","3,00",1,"42.960,00","42.960,00",FERS,2017-03-17
27.03.2017,"42.001,00","42.001,00","42.001,00","42.001,00","-2,23",1,"42.001,00","42.001,00",FERS,2017-03-27
06.04.2017,"42.500,00","42.501,00","42.500,00","42.500,40","1,19",5,"212.502,00","212.502,00",FERS,2017-04-06
18.04.2017,"42.500,00","42.500,00","42.500,00","42.500,00","0,00",4,"170.000,00","170.000,00",FERS,2017-04-18
09.05.2017,"43.775,00","43.775,00","43.775,00","43.775,00","3,00",6,"262.650,00","262.650,00",FERS,2017-05-09
12.05.2017,"43.775,00","43.775,00","43.775,00","43.775,00","0,00",1,"43.775,00","43.775,00",FERS,2017-05-12
15.05.2017,"43.775,00","43.775,00","43.775,00","43.775,00","0,00",1,"43.775,00","43.775,00",FERS,2017-05-15
26.05.2017,"45.088,00","45.088,00","45.000,00","45.072,47","2,96",34,"1.532.464,00","1.532.464,00",FERS,2017-05-26
06.06.2017,"46.000,00","46.000,00","46.000,00","46.000,00","2,06",7,"322.000,00","322.000,00",FERS,2017-06-06
07.06.2017,"44.620,00","44.620,00","44.620,00","44.620,00","-3,00",2,"89.240,00","89.240,00",FERS,2017-06-07
21.06.2017,"45.000,00","45.000,00","45.000,00","45.000,00","0,85",1,"45.000,00","20.634.184,00",FERS,2017-06-21
05.07.2017,"46.000,00","46.000,00","46.000,00","46.000,00","2,22",16,"736.000,00","736.000,00",FERS,2017-07-05
07.07.2017,"47.380,00","47.380,00","47.380,00","47.380,00","3,00",1,"47.380,00","47.380,00",FERS,2017-07-07
10.07.2017,"47.380,00","47.380,00","47.380,00","47.380,00","0,00",1,"47.380,00","47.380,00",FERS,2017-07-10
12.07.2017,"48.000,00","48.000,00","47.000,00","47.666,67","0,61",6,"286.000,00","10.743.500,00",FERS,2017-07-12
18.07.2017,"49.000,00","49.000,00","49.000,00","49.000,00","2,80",4,"196.000,00","196.000,00",FERS,2017-07-18
19.07.2017,"49.000,00","49.000,00","49.000,00","49.000,00","0,00",5,"245.000,00","245.000,00",FERS,2017-07-19
20.07.2017,"52.100,00","52.100,00","49.203,00","50.168,67","2,39",6,"301.012,00","5.408.212,00",FERS,2017-07-20
21.07.2017,"49.501,00","49.501,00","49.501,00","49.501,00","-1,33",3,"148.503,00","148.503,00",FERS,2017-07-21
26.07.2017,"52.000,00","52.000,00","52.000,00","52.000,00","5,05",4,"208.000,00","208.000,00",FERS,2017-07-26
31.07.2017,"50.440,00","50.440,00","50.440,00","50.440,00","-3,00",5,"252.200,00","252.200,00",FERS,2017-07-31
04.08.2017,"51.700,00","51.700,00","51.700,00","51.700,00","2,50",2,"103.400,00","103.400,00",FERS,2017-08-04
08.08.2017,"55.000,00","55.000,00","54.501,00","54.750,50","5,90",2,"109.501,00","109.501,00",FERS,2017-08-08
29.08.2017,"53.108,00","53.108,00","53.108,00","53.108,00","-3,00",4,"212.432,00","212.432,00",FERS,2017-08-29
03.10.2017,"58.418,00","58.418,00","58.418,00","58.418,00","10,00",3,"175.254,00","175.254,00",FERS,2017-10-03
06.10.2017,"60.500,00","60.500,00","60.500,00","60.500,00","3,56",1,"60.500,00","60.500,00",FERS,2017-10-06
10.10.2017,"66.550,00","66.550,00","66.550,00","66.550,00","10,00",1,"66.550,00","18.216.550,00",FERS,2017-10-10
12.10.2017,"66.550,00","66.550,00","66.550,00","66.550,00","0,00",1,"66.550,00","4.843.546,00",FERS,2017-10-12
13.10.2017,"60.500,00","60.500,00","60.500,00","60.500,00","-9,09",192,"11.616.000,00","11.616.000,00",FERS,2017-10-13
16.10.2017,"60.500,00","60.500,00","60.500,00","60.500,00","0,00",1,"60.500,00","60.500,00",FERS,2017-10-16
18.10.2017,"60.500,00","60.500,00","60.500,00","60.500,00","0,00",100,"6.050.000,00","6.050.000,00",FERS,2017-10-18
06.11.2017,"58.686,00","58.686,00","58.686,00","58.686,00","-3,00",2,"117.372,00","117.372,00",FERS,2017-11-06
07.11.2017,"59.500,00","59.500,00","59.500,00","59.500,00","1,39",200,"11.900.000,00","11.900.000,00",FERS,2017-11-07
09.11.2017,"59.500,00",/,/,"59.500,00","0,00",0,"0,00","0,00",FERS,2017-11-09
21.11.2017,"57.750,00","57.750,00","57.750,00","57.750,00","-2,94",2,"115.500,00","115.500,00",FERS,2017-11-21
29.11.2017,"57.750,00","57.750,00","57.750,00","57.750,00","0,00",1,"57.750,00","57.750,00",FERS,2017-11-29
06.12.2017,"56.009,00","56.009,00","56.009,00","56.009,00","-3,01",1,"56.009,00","56.009,00",FERS,2017-12-06
11.12.2017,"59.000,00","59.000,00","59.000,00","59.000,00","5,34",3,"177.000,00","177.000,00",FERS,2017-12-11
13.12.2017,"58.000,00","58.000,00","58.000,00","58.000,00","-1,69",200,"11.600.000,00","11.600.000,00",FERS,2017-12-13
21.12.2017,"57.000,00","57.000,00","57.000,00","57.000,00","-1,72",1,"57.000,00","57.000,00",FERS,2017-12-21
25.12.2017,"55.290,00","55.290,00","55.290,00","55.290,00","-3,00",1,"55.290,00","55.290,00",FERS,2017-12-25
09.01.2018,"53.640,00","56.948,00","53.640,00","55.845,33","1,00",3,"167.536,00","167.536,00",FERS,2018-01-09
10.01.2018,"56.000,00","56.000,00","56.000,00","56.000,00","0,28",3,"168.000,00","168.000,00",FERS,2018-01-10
23.01.2018,"56.000,00","56.000,00","56.000,00","56.000,00","0,00",24,"1.344.000,00","1.344.000,00",FERS,2018-01-23
24.01.2018,"56.000,00","56.000,00","56.000,00","56.000,00","0,00",28,"1.568.000,00","1.568.000,00",FERS,2018-01-24
25.01.2018,"56.000,00","56.000,00","56.000,00","56.000,00","0,00",45,"2.520.000,00","2.520.000,00",FERS,2018-01-25
26.01.2018,"56.000,00","56.000,00","56.000,00","56.000,00","0,00",42,"2.352.000,00","2.352.000,00",FERS,2018-01-26
12.03.2018,"61.599,00","61.599,00","61.599,00","61.599,00","10,00",3,"184.797,00","184.797,00",FERS,2018-03-12
13.03.2018,"62.500,00","62.500,00","62.500,00","62.500,00","1,46",10,"625.000,00","625.000,00",FERS,2018-03-13
14.03.2018,"62.000,00","62.000,00","61.000,00","61.571,43","-1,49",7,"431.000,00","8.103.000,00",FERS,2018-03-14
17.04.2018,"55.000,00","55.000,00","55.000,00","55.000,00","-10,67",8,"440.000,00","440.000,00",FERS,2018-04-17
18.04.2018,"55.500,00","55.500,00","55.500,00","55.500,00","0,91",1,"55.500,00","55.500,00",FERS,2018-04-18
02.05.2018,"55.500,00","55.500,00","55.500,00","55.500,00","0,00",1,"55.500,00","1.776.000,00",FERS,2018-05-02
04.05.2018,"55.502,00","55.502,00","55.502,00","55.502,00","0,00",3,"166.506,00","166.506,00",FERS,2018-05-04
09.05.2018,"57.000,00","57.000,00","57.000,00","57.000,00","2,70",1,"57.000,00","57.000,00",FERS,2018-05-09
15.05.2018,"59.000,00","59.000,00","59.000,00","59.000,00","3,51",2,"118.000,00","118.000,00",FERS,2018-05-15
17.05.2018,"56.500,00","56.500,00","56.500,00","56.500,00","-4,24",8,"452.000,00","6.687.160,00",FERS,2018-05-17
04.06.2018,"56.500,00","56.500,00","56.500,00","56.500,00","0,00",14,"791.000,00","791.000,00",FERS,2018-06-04
05.06.2018,"57.000,00","57.000,00","57.000,00","57.000,00","0,88",7,"399.000,00","399.000,00",FERS,2018-06-05
06.06.2018,"60.000,00","60.000,00","60.000,00","60.000,00","5,26",2,"120.000,00","120.000,00",FERS,2018-06-06
08.06.2018,"60.000,00","60.000,00","60.000,00","60.000,00","0,00",10,"600.000,00","600.000,00",FERS,2018-06-08
12.06.2018,"58.200,00","58.200,00","58.200,00","58.200,00","-3,00",6,"349.200,00","349.200,00",FERS,2018-06-12
25.06.2018,"60.250,00","60.250,00","60.250,00","60.250,00","3,52",5,"301.250,00","301.250,00",FERS,2018-06-25
26.06.2018,"61.000,00","61.000,00","61.000,00","61.000,00","1,24",4,"244.000,00","244.000,00",FERS,2018-06-26
03.07.2018,"60.302,00","61.000,00","60.302,00","60.767,33","-0,38",3,"182.302,00","182.302,00",FERS,2018-07-03
17.07.2018,"59.500,00","59.500,00","59.500,00","59.500,00","-2,09",2,"119.000,00","119.000,00",FERS,2018-07-17
20.08.2018,"58.000,00","58.000,00","58.000,00","58.000,00","-2,52",4,"232.000,00","232.000,00",FERS,2018-08-20
03.09.2018,"61.001,00","61.001,00","61.001,00","61.001,00","5,17",7,"427.007,00","427.007,00",FERS,2018-09-03
13.09.2018,"61.100,00","61.100,00","61.100,00","61.100,00","0,16",1,"61.100,00","61.100,00",FERS,2018-09-13
18.09.2018,"61.100,00","61.100,00","61.100,00","61.100,00","0,00",3,"183.300,00","183.300,00",FERS,2018-09-18
24.09.2018,"61.100,00","61.100,00","61.100,00","61.100,00","0,00",1,"61.100,00","61.100,00",FERS,2018-09-24
27.09.2018,"62.831,00","62.831,00","62.830,00","62.830,25","2,83",12,"753.963,00","753.963,00",FERS,2018-09-27
01.10.2018,"61.101,00","61.101,00","61.101,00","61.101,00","-2,75",2,"122.202,00","122.202,00",FERS,2018-10-01
03.10.2018,"61.101,00","61.101,00","61.101,00","61.101,00","0,00",3,"183.303,00","183.303,00",FERS,2018-10-03
04.10.2018,"61.100,00","61.100,00","61.100,00","61.100,00","0,00",5,"305.500,00","305.500,00",FERS,2018-10-04
05.10.2018,"59.267,00","59.267,00","59.267,00","59.267,00","-3,00",4,"237.068,00","237.068,00",FERS,2018-10-05
08.10.2018,"57.489,00","58.999,00","57.489,00","58.567,57","-1,18",7,"409.973,00","409.973,00",FERS,2018-10-08
09.10.2018,"57.000,00","57.000,00","57.000,00","57.000,00","-2,68",2,"114.000,00","114.000,00",FERS,2018-10-09
10.10.2018,"62.000,00","62.000,00","61.000,00","61.500,00","7,89",4,"246.000,00","3.479.000,00",FERS,2018-10-10
12.10.2018,"60.000,00","60.000,00","60.000,00","60.000,00","-2,44",1,"60.000,00","60.000,00",FERS,2018-10-12
15.10.2018,"60.000,00","60.000,00","60.000,00","60.000,00","0,00",2,"120.000,00","120.000,00",FERS,2018-10-15
16.10.2018,"59.002,00","59.002,00","59.002,00","59.002,00","-1,66",39,"2.301.078,00","2.301.078,00",FERS,2018-10-16
18.10.2018,"59.005,00","59.005,00","59.005,00","59.005,00","0,01",3,"177.015,00","177.015,00",FERS,2018-10-18
19.10.2018,"62.002,00","62.002,00","60.510,00","61.933,45","4,96",22,"1.362.536,00","1.362.536,00",FERS,2018-10-19
22.10.2018,"68.126,00","68.126,00","68.126,00","68.126,00","10,00",13,"885.638,00","885.638,00",FERS,2018-10-22
24.10.2018,"68.126,00","68.126,00","68.126,00","68.126,00","0,00",9,"613.134,00","613.134,00",FERS,2018-10-24
25.10.2018,"67.000,00","67.000,00","67.000,00","67.000,00","-1,65",9,"603.000,00","603.000,00",FERS,2018-10-25
30.10.2018,"68.000,00","68.000,00","67.000,00","67.111,11","0,17",9,"604.000,00","604.000,00",FERS,2018-10-30
07.11.2018,"68.000,00","68.000,00","68.000,00","68.000,00","1,32",1,"68.000,00","68.000,00",FERS,2018-11-07
08.11.2018,"69.000,00","69.000,00","69.000,00","69.000,00","1,47",7,"483.000,00","483.000,00",FERS,2018-11-08
09.11.2018,"69.000,00",/,/,"69.000,00","0,00",0,"0,00","0,00",FERS,2018-11-09
13.11.2018,"70.000,00","70.000,00","70.000,00","70.000,00","1,45",5,"350.000,00","350.000,00",FERS,2018-11-13
21.11.2018,"70.000,00","70.000,00","70.000,00","70.000,00","0,00",6,"420.000,00","420.000,00",FERS,2018-11-21
12.12.2018,"67.900,00","67.900,00","67.900,00","67.900,00","-3,00",2,"135.800,00","135.800,00",FERS,2018-12-12
14.12.2018,"67.900,00","67.900,00","67.900,00","67.900,00","0,00",2,"135.800,00","135.800,00",FERS,2018-12-14
08.01.2019,"69.000,00","69.000,00","69.000,00","69.000,00","1,62",2,"138.000,00","138.000,00",FERS,2019-01-08
09.01.2019,"69.500,00","69.500,00","69.500,00","69.500,00","0,72",2,"139.000,00","139.000,00",FERS,2019-01-09
10.01.2019,"74.799,00","74.799,00","74.799,00","74.799,00","7,62",1,"74.799,00","74.799,00",FERS,2019-01-10
22.01.2019,"73.500,00","73.500,00","73.500,00","73.500,00","-1,74",3,"220.500,00","220.500,00",FERS,2019-01-22
23.01.2019,"73.500,00","73.500,00","73.500,00","73.500,00","0,00",1,"73.500,00","73.500,00",FERS,2019-01-23
25.01.2019,"74.799,00","74.799,00","73.500,00","74.474,25","1,33",8,"595.794,00","595.794,00",FERS,2019-01-25
28.01.2019,"75.000,00","75.000,00","75.000,00","75.000,00","0,71",1,"75.000,00","75.000,00",FERS,2019-01-28
05.02.2019,"72.777,00","72.777,00","72.777,00","72.777,00","-2,96",1,"72.777,00","72.777,00",FERS,2019-02-05
07.02.2019,"76.700,00","76.700,00","76.700,00","76.700,00","5,39",1,"76.700,00","76.700,00",FERS,2019-02-07
08.02.2019,"74.399,00","74.399,00","74.399,00","74.399,00","-3,00",2,"148.798,00","148.798,00",FERS,2019-02-08
18.02.2019,"75.000,00","75.000,00","75.000,00","75.000,00","0,81",2,"150.000,00","150.000,00",FERS,2019-02-18
21.02.2019,"76.600,00","76.600,00","76.600,00","76.600,00","2,13",5,"383.000,00","383.000,00",FERS,2019-02-21
22.02.2019,"76.700,00","76.700,00","76.700,00","76.700,00","0,13",10,"767.000,00","767.000,00",FERS,2019-02-22
25.02.2019,"76.700,00","76.700,00","76.700,00","76.700,00","0,00",5,"383.500,00","383.500,00",FERS,2019-02-25
04.03.2019,"76.000,00","76.500,00","76.000,00","76.250,00","-0,59",6,"457.500,00","457.500,00",FERS,2019-03-04
05.03.2019,"76.250,00","76.250,00","76.250,00","76.250,00","0,00",12,"915.000,00","915.000,00",FERS,2019-03-05
07.03.2019,"76.250,00","76.250,00","76.250,00","76.250,00","0,00",6,"457.500,00","457.500,00",FERS,2019-03-07
08.03.2019,"76.000,00","76.000,00","76.000,00","76.000,00","-0,33",5,"380.000,00","380.000,00",FERS,2019-03-08
11.03.2019,"76.000,00","76.000,00","76.000,00","76.000,00","0,00",3,"228.000,00","228.000,00",FERS,2019-03-11
12.03.2019,"76.000,00","76.000,00","75.999,00","75.999,80","0,00",5,"379.999,00","379.999,00",FERS,2019-03-12
14.03.2019,"76.000,00","76.000,00","76.000,00","76.000,00","0,00",2,"152.000,00","152.000,00",FERS,2019-03-14
09.04.2019,"76.000,00","76.000,00","76.000,00","76.000,00","0,00",3,"228.000,00","228.000,00",FERS,2019-04-09
17.04.2019,"78.280,00","78.280,00","78.279,00","78.279,40","3,00",5,"391.397,00","391.397,00",FERS,2019-04-17
19.04.2019,"78.000,00","78.000,00","78.000,00","78.000,00","-0,36",1,"78.000,00","78.000,00",FERS,2019-04-19
24.04.2019,"78.000,00","78.000,00","78.000,00","78.000,00","0,00",2,"156.000,00","156.000,00",FERS,2019-04-24
07.05.2019,"78.000,00","78.000,00","78.000,00","78.000,00","0,00",5,"390.000,00","390.000,00",FERS,2019-05-07
16.05.2019,"80.000,00","80.000,00","79.000,00","79.400,00","1,79",5,"397.000,00","397.000,00",FERS,2019-05-16
21.05.2019,"80.000,00","80.001,00","80.000,00","80.000,75","0,76",4,"320.003,00","320.003,00",FERS,2019-05-21
28.05.2019,"79.000,00","79.000,00","78.000,00","78.666,67","-1,67",3,"236.000,00","236.000,00",FERS,2019-05-28
31.05.2019,"78.200,00","78.200,00","78.000,00","78.066,67","-0,76",6,"468.400,00","468.400,00",FERS,2019-05-31
06.06.2019,"78.000,00","78.000,00","78.000,00","78.000,00","-0,09",1,"78.000,00","78.000,00",FERS,2019-06-06
10.06.2019,"78.000,00","78.000,00","78.000,00","78.000,00","0,00",2,"156.000,00","156.000,00",FERS,2019-06-10
11.06.2019,"77.000,00","77.000,00","77.000,00","77.000,00","-1,28",3,"231.000,00","231.000,00",FERS,2019-06-11
17.06.2019,"77.000,00","77.000,00","77.000,00","77.000,00","0,00",2,"154.000,00","154.000,00",FERS,2019-06-17
19.06.2019,"77.100,00","77.100,00","77.100,00","77.100,00","0,13",2,"154.200,00","154.200,00",FERS,2019-06-19
02.07.2019,"77.000,00","77.000,00","77.000,00","77.000,00","-0,13",9,"693.000,00","693.000,00",FERS,2019-07-02
09.07.2019,"76.500,00","76.500,00","76.500,00","76.500,00","-0,65",1,"76.500,00","76.500,00",FERS,2019-07-09
10.07.2019,"77.000,00","77.000,00","77.000,00","77.000,00","0,65",3,"231.000,00","231.000,00",FERS,2019-07-10
15.07.2019,"77.000,00","77.000,00","77.000,00","77.000,00","0,00",3,"231.000,00","231.000,00",FERS,2019-07-15
22.07.2019,"77.000,00","77.000,00","77.000,00","77.000,00","0,00",5,"385.000,00","385.000,00",FERS,2019-07-22
24.07.2019,"78.000,00","78.000,00","78.000,00","78.000,00","1,30",2,"156.000,00","156.000,00",FERS,2019-07-24
30.07.2019,"80.000,00","80.000,00","80.000,00","80.000,00","2,56",1,"80.000,00","80.000,00",FERS,2019-07-30
27.08.2019,"77.600,00","77.600,00","77.600,00","77.600,00","-3,00",2,"155.200,00","155.200,00",FERS,2019-08-27
02.09.2019,"75.800,00","75.800,00","75.800,00","75.800,00","-2,32",20,"1.516.000,00","1.516.000,00",FERS,2019-09-02
05.09.2019,"75.500,00","75.500,00","75.500,00","75.500,00","-0,40",2,"151.000,00","151.000,00",FERS,2019-09-05
18.10.2019,"73.235,00","73.235,00","73.235,00","73.235,00","-3,00",4,"292.940,00","292.940,00",FERS,2019-10-18
21.10.2019,"73.000,00","73.000,00","73.000,00","73.000,00","-0,32",3,"219.000,00","219.000,00",FERS,2019-10-21
30.10.2019,"74.000,00","74.000,00","74.000,00","74.000,00","1,37",2,"148.000,00","148.000,00",FERS,2019-10-30
08.11.2019,"74.000,00",/,/,"74.000,00","0,00",0,"0,00","0,00",FERS,2019-11-08
12.11.2019,"73.000,00","73.000,00","73.000,00","73.000,00","-1,35",8,"584.000,00","584.000,00",FERS,2019-11-12
18.11.2019,"73.000,00","73.000,00","73.000,00","73.000,00","0,00",1,"73.000,00","73.000,00",FERS,2019-11-18
02.12.2019,"73.000,00","73.000,00","73.000,00","73.000,00","0,00",10,"730.000,00","730.000,00",FERS,2019-12-02
04.12.2019,"73.006,00","73.006,00","73.006,00","73.006,00","0,01",10,"730.060,00","730.060,00",FERS,2019-12-04
13.12.2019,"74.000,00","74.000,00","74.000,00","74.000,00","1,36",2,"148.000,00","148.000,00",FERS,2019-12-13
18.12.2019,"73.000,00","73.000,00","73.000,00","73.000,00","-1,35",3,"219.000,00","219.000,00",FERS,2019-12-18
19.12.2019,"73.000,00","73.000,00","73.000,00","73.000,00","0,00",25,"1.825.000,00","1.825.000,00",FERS,2019-12-19
30.12.2019,"74.000,00","74.000,00","74.000,00","74.000,00","1,37",2,"148.000,00","148.000,00",FERS,2019-12-30
10.01.2020,"74.500,00","74.500,00","74.500,00","74.500,00","0,68",1,"74.500,00","74.500,00",FERS,2020-01-10
14.01.2020,"74.000,00","74.000,00","74.000,00","74.000,00","-0,67",11,"814.000,00","814.000,00",FERS,2020-01-14
15.01.2020,"73.000,00","73.000,00","73.000,00","73.000,00","-1,35",3,"219.000,00","219.000,00",FERS,2020-01-15
21.01.2020,"73.526,00","73.526,00","73.526,00","73.526,00","0,72",5,"367.630,00","367.630,00",FERS,2020-01-21
22.01.2020,"74.000,00","74.000,00","74.000,00","74.000,00","0,64",10,"740.000,00","740.000,00",FERS,2020-01-22
03.02.2020,"74.000,00","74.000,00","74.000,00","74.000,00","0,00",8,"592.000,00","592.000,00",FERS,2020-02-03
12.02.2020,"74.500,00","74.500,00","74.500,00","74.500,00","0,68",4,"298.000,00","298.000,00",FERS,2020-02-12
14.02.2020,"74.500,00","74.500,00","74.500,00","74.500,00","0,00",10,"745.000,00","745.000,00",FERS,2020-02-14
18.02.2020,"75.000,00","75.000,00","75.000,00","75.000,00","0,67",9,"675.000,00","675.000,00",FERS,2020-02-18
27.02.2020,"74.000,00","74.000,00","74.000,00","74.000,00","-1,33",4,"296.000,00","296.000,00",FERS,2020-02-27
28.02.2020,"74.000,00","74.000,00","74.000,00","74.000,00","0,00",1,"74.000,00","74.000,00",FERS,2020-02-28
09.03.2020,"73.000,00","73.000,00","73.000,00","73.000,00","-1,35",5,"365.000,00","365.000,00",FERS,2020-03-09
10.03.2020,"74.000,00","74.000,00","74.000,00","74.000,00","1,37",6,"444.000,00","444.000,00",FERS,2020-03-10
16.03.2020,"69.000,00","69.000,00","69.000,00","69.000,00","-6,76",8,"552.000,00","552.000,00",FERS,2020-03-16
17.03.2020,"66.533,00","66.533,00","65.550,00","66.313,10","-3,89",30,"1.989.393,00","1.989.393,00",FERS,2020-03-17
18.03.2020,"63.000,00","63.001,00","63.000,00","63.000,71","-5,00",7,"441.005,00","441.005,00",FERS,2020-03-18
19.03.2020,"60.000,00","60.000,00","60.000,00","60.000,00","-4,76",20,"1.200.000,00","1.200.000,00",FERS,2020-03-19
25.03.2020,"57.000,00","59.999,00","57.000,00","59.399,20","-1,00",5,"296.996,00","296.996,00",FERS,2020-03-25
27.03.2020,"53.460,00","53.460,00","53.460,00","53.460,00","-10,00",13,"694.980,00","694.980,00",FERS,2020-03-27
13.05.2020,"55.063,00","55.063,00","55.063,00","55.063,00","3,00",6,"330.378,00","330.378,00",FERS,2020-05-13
29.05.2020,"59.500,00","59.500,00","59.500,00","59.500,00","8,06",1,"59.500,00","59.500,00",FERS,2020-05-29
16.06.2020,"59.500,00","59.500,00","59.500,00","59.500,00","0,00",2,"119.000,00","119.000,00",FERS,2020-06-16
10.07.2020,"59.500,00","59.500,00","59.500,00","59.500,00","0,00",2,"119.000,00","119.000,00",FERS,2020-07-10
27.07.2020,"60.900,00","60.900,00","60.900,00","60.900,00","2,35",1,"60.900,00","60.900,00",FERS,2020-07-27
28.07.2020,"60.000,00","60.000,00","60.000,00","60.000,00","-1,48",1,"60.000,00","60.000,00",FERS,2020-07-28
05.08.2020,"61.000,00","61.000,00","61.000,00","61.000,00","1,67",5,"305.000,00","305.000,00",FERS,2020-08-05
27.08.2020,"61.000,00","61.000,00","61.000,00","61.000,00","0,00",2,"122.000,00","122.000,00",FERS,2020-08-27
01.09.2020,"61.000,00","61.000,00","61.000,00","61.000,00","0,00",5,"305.000,00","305.000,00",FERS,2020-09-01
11.09.2020,"61.000,00","61.000,00","61.000,00","61.000,00","0,00",13,"793.000,00","793.000,00",FERS,2020-09-11
18.09.2020,"62.000,00","62.000,00","62.000,00","62.000,00","1,64",2,"124.000,00","124.000,00",FERS,2020-09-18
23.09.2020,"61.000,00","61.000,00","61.000,00","61.000,00","-1,61",25,"1.525.000,00","1.525.000,00",FERS,2020-09-23
06.11.2020,"61.000,00",/,/,"61.000,00","0,00",0,"0,00","0,00",FERS,2020-11-06
17.11.2020,"60.000,00","60.000,00","60.000,00","60.000,00","-1,64",1,"60.000,00","60.000,00",FERS,2020-11-17
20.11.2020,"60.000,00","60.000,00","60.000,00","60.000,00","0,00",30,"1.800.000,00","1.800.000,00",FERS,2020-11-20
07.12.2020,"61.000,00","61.000,00","61.000,00","61.000,00","1,67",15,"915.000,00","915.000,00",FERS,2020-12-07
14.12.2020,"61.000,00","61.000,00","61.000,00","61.000,00","0,00",6,"366.000,00","366.000,00",FERS,2020-12-14
24.12.2020,"61.000,00","61.000,00","61.000,00","61.000,00","0,00",20,"1.220.000,00","1.220.000,00",FERS,2020-12-24
18.01.2021,"61.000,00","61.000,00","61.000,00","61.000,00","0,00",2,"122.000,00","122.000,00",FERS,2021-01-18
20.01.2021,"61.000,00","61.000,00","61.000,00","61.000,00","0,00",32,"1.952.000,00","1.952.000,00",FERS,2021-01-20
16.02.2021,"73.000,00","73.000,00","73.000,00","73.000,00","19,67",1,"73.000,00","73.000,00",FERS,2021-02-16
12.03.2021,"70.000,00","70.000,00","70.000,00","70.000,00","-4,11",5,"350.000,00","350.000,00",FERS,2021-03-12
16.03.2021,"70.000,00","70.000,00","70.000,00","70.000,00","0,00",6,"420.000,00","420.000,00",FERS,2021-03-16
22.03.2021,"68.001,00","68.001,00","68.001,00","68.001,00","-2,86",3,"204.003,00","204.003,00",FERS,2021-03-22
08.04.2021,"66.700,00","66.700,00","66.700,00","66.700,00","-1,91",15,"1.000.500,00","1.000.500,00",FERS,2021-04-08
19.04.2021,"64.780,00","64.780,00","64.780,00","64.780,00","-2,88",9,"583.020,00","583.020,00",FERS,2021-04-19
20.04.2021,"64.101,00","64.101,00","64.101,00","64.101,00","-1,05",3,"192.303,00","192.303,00",FERS,2021-04-20
21.04.2021,"66.800,00","66.800,00","66.800,00","66.800,00","4,21",8,"534.400,00","534.400,00",FERS,2021-04-21
22.04.2021,"67.510,00","67.510,00","67.510,00","67.510,00","1,06",5,"337.550,00","337.550,00",FERS,2021-04-22
23.04.2021,"67.999,00","67.999,00","67.999,00","67.999,00","0,72",4,"271.996,00","271.996,00",FERS,2021-04-23
07.05.2021,"68.000,00","68.000,00","68.000,00","68.000,00","0,00",1,"68.000,00","68.000,00",FERS,2021-05-07
19.05.2021,"68.000,00","68.000,00","68.000,00","68.000,00","0,00",3,"204.000,00","204.000,00",FERS,2021-05-19
21.05.2021,"66.000,00","66.000,00","66.000,00","66.000,00","-2,94",5,"330.000,00","330.000,00",FERS,2021-05-21
31.05.2021,"66.100,00","66.100,00","66.100,00","66.100,00","0,15",1,"66.100,00","66.100,00",FERS,2021-05-31
02.06.2021,"66.000,00","66.000,00","66.000,00","66.000,00","-0,15",1,"66.000,00","66.000,00",FERS,2021-06-02
12.07.2021,"64.020,00","64.020,00","64.020,00","64.020,00","-3,00",1,"64.020,00","64.020,00",FERS,2021-07-12
19.07.2021,"64.000,00","64.000,00","64.000,00","64.000,00","-0,03",3,"192.000,00","192.000,00",FERS,2021-07-19
06.09.2021,"62.080,00","62.080,00","62.080,00","62.080,00","-3,00",10,"620.800,00","620.800,00",FERS,2021-09-06
01.10.2021,"61.700,00","61.700,00","61.700,00","61.700,00","-0,61",3,"185.100,00","185.100,00",FERS,2021-10-01
04.10.2021,"61.700,00","61.700,00","61.700,00","61.700,00","0,00",2,"123.400,00","123.400,00",FERS,2021-10-04
08.11.2021,"61.700,00",/,/,"61.700,00","0,00",0,"0,00","0,00",FERS,2021-11-08
09.11.2021,"61.700,00","61.700,00","61.700,00","61.700,00","0,00",2,"123.400,00","123.400,00",FERS,2021-11-09
23.11.2021,"61.700,00","61.700,00","61.700,00","61.700,00","0,00",1,"61.700,00","61.700,00",FERS,2021-11-23
26.11.2021,"61.700,00","61.700,00","61.700,00","61.700,00","0,00",2,"123.400,00","123.400,00",FERS,2021-11-26
07.12.2021,"61.700,00","61.700,00","61.700,00","61.700,00","0,00",7,"431.900,00","431.900,00",FERS,2021-12-07
23.12.2021,"61.700,00","61.700,00","61.700,00","61.700,00","0,00",1,"61.700,00","61.700,00",FERS,2021-12-23
30.12.2021,"59.850,00","59.850,00","59.850,00","59.850,00","-3,00",23,"1.376.550,00","1.376.550,00",FERS,2021-12-30
10.01.2022,"59.850,00","59.850,00","59.850,00","59.850,00","0,00",2,"119.700,00","119.700,00",FERS,2022-01-10
21.01.2022,"59.500,00","59.500,00","59.500,00","59.500,00","-0,58",1,"59.500,00","59.500,00",FERS,2022-01-21
26.01.2022,"59.500,00","59.500,00","59.500,00","59.500,00","0,00",3,"178.500,00","178.500,00",FERS,2022-01-26
07.02.2022,"59.500,00","59.500,00","59.500,00","59.500,00","0,00",27,"1.606.500,00","1.606.500,00",FERS,2022-02-07
01.03.2022,"59.500,00","59.500,00","59.500,00","59.500,00","0,00",7,"416.500,00","416.500,00",FERS,2022-03-01
02.03.2022,"59.500,00","59.500,00","59.500,00","59.500,00","0,00",4,"238.000,00","238.000,00",FERS,2022-03-02
22.03.2022,"57.715,00","57.715,00","57.715,00","57.715,00","-3,00",2,"115.430,00","115.430,00",FERS,2022-03-22
23.03.2022,"57.000,00","57.000,00","57.000,00","57.000,00","-1,24",5,"285.000,00","285.000,00",FERS,2022-03-23
05.04.2022,"57.000,00","57.000,00","57.000,00","57.000,00","0,00",1,"57.000,00","57.000,00",FERS,2022-04-05
11.04.2022,"57.000,00","57.000,00","57.000,00","57.000,00","0,00",7,"399.000,00","399.000,00",FERS,2022-04-11
18.04.2022,"57.000,00","57.000,00","57.000,00","57.000,00","0,00",1,"57.000,00","57.000,00",FERS,2022-04-18
19.04.2022,"57.000,00","57.000,00","57.000,00","57.000,00","0,00",4,"228.000,00","228.000,00",FERS,2022-04-19
10.05.2022,"57.000,00","57.000,00","57.000,00","57.000,00","0,00",2,"114.000,00","114.000,00",FERS,2022-05-10
26.05.2022,"57.000,00","57.000,00","57.000,00","57.000,00","0,00",4,"228.000,00","228.000,00",FERS,2022-05-26
29.06.2022,"55.500,00","55.500,00","55.500,00","55.500,00","-2,63",3,"166.500,00","166.500,00",FERS,2022-06-29
07.07.2022,"54.000,00","54.000,00","54.000,00","54.000,00","-2,70",32,"1.728.000,00","1.728.000,00",FERS,2022-07-07
12.07.2022,"54.000,00","54.000,00","54.000,00","54.000,00","0,00",4,"216.000,00","216.000,00",FERS,2022-07-12
08.11.2022,"54.000,00",/,/,"54.000,00","0,00",0,"0,00","0,00",FERS,2022-11-08
22.11.2022,"53.000,00","53.000,00","53.000,00","53.000,00","-1,85",1,"53.000,00","53.000,00",FERS,2022-11-22
15.12.2022,"53.000,00","53.000,00","53.000,00","53.000,00","0,00",1,"53.000,00","53.000,00",FERS,2022-12-15
20.12.2022,"53.000,00","53.000,00","53.000,00","53.000,00","0,00",2,"106.000,00","106.000,00",FERS,2022-12-20
26.12.2022,"53.000,00","53.000,00","53.000,00","53.000,00","0,00",2,"106.000,00","106.000,00",FERS,2022-12-26
16.01.2023,"53.050,00","53.050,00","53.050,00","53.050,00","0,09",1,"53.050,00","53.050,00",FERS,2023-01-16
05.04.2023,"53.050,00","53.050,00","53.050,00","53.050,00","0,00",2,"106.100,00","106.100,00",FERS,2023-04-05
06.04.2023,"53.000,00","53.000,00","53.000,00","53.000,00","-0,09",10,"530.000,00","530.000,00",FERS,2023-04-06
04.05.2023,"51.410,00","51.410,00","51.410,00","51.410,00","-3,00",4,"205.640,00","205.640,00",FERS,2023-05-04
04.10.2023,"51.410,00","51.410,00","51.410,00","51.410,00","0,00",10,"514.100,00","514.100,00",FERS,2023-10-04
05.10.2023,"51.413,00","51.413,00","51.413,00","51.413,00","0,01",4,"205.652,00","205.652,00",FERS,2023-10-05
08.11.2023,"51.413,00",/,/,"51.413,00","0,00",0,"0,00","0,00",FERS,2023-11-08
22.11.2023,"51.400,00","51.400,00","51.400,00","51.400,00","-0,03",2,"102.800,00","102.800,00",FERS,2023-11-22
22.03.2024,"50.500,00","50.500,00","50.500,00","50.500,00","-1,75",20,"1.010.000,00","1.010.000,00",FERS,2024-03-22
05.04.2024,"52.002,00","52.002,00","52.002,00","52.002,00","2,97",1,"52.002,00","52.002,00",FERS,2024-04-05
30.04.2024,"52.075,00","52.075,00","52.075,00","52.075,00","0,14",20,"1.041.500,00","1.041.500,00",FERS,2024-04-30
13.05.2024,"52.000,00","52.000,00","52.000,00","52.000,00","-0,14",1,"52.000,00","52.000,00",FERS,2024-05-13
11.06.2024,"53.560,00","53.560,00","53.560,00","53.560,00","3,00",4,"214.240,00","214.240,00",FERS,2024-06-11
24.07.2024,"53.560,00","53.560,00","53.560,00","53.560,00","0,00",4,"214.240,00","214.240,00",FERS,2024-07-24
05.09.2024,"53.561,00","53.561,00","53.561,00","53.561,00","0,00",3,"160.683,00","160.683,00",FERS,2024-09-05
16.09.2024,"53.561,00","53.561,00","53.561,00","53.561,00","0,00",1,"53.561,00","53.561,00",FERS,2024-09-16
20.09.2024,"53.561,00","53.561,00","53.561,00","53.561,00","0,00",11,"589.171,00","589.171,00",FERS,2024-09-20
07.11.2024,"53.561,00",/,/,"53.561,00","0,00",0,"0,00","0,00",FERS,2024-11-07
12.09.2023,"620,00","620,00","620,00","620,00",/,"1,250","775.000,00","775.000,00",FKTL,2023-09-12
08.11.2023,"620,00",/,/,"620,00","0,00",0,"0,00","0,00",FKTL,2023-11-08
07.11.2024,"620,00",/,/,"620,00","0,00",0,"0,00","0,00",FKTL,2024-11-07
10.11.2015,"120,00",/,/,"120,00","0,00",0,"0,00","0,00",FROT,2015-11-10
29.12.2015,"120,00",/,/,"120,00","0,00",0,"0,00","0,00",FROT,2015-12-29
09.11.2018,"120,00",/,/,"120,00","0,00",0,"0,00","0,00",FROT,2018-11-09
03.05.2019,"120,00","120,00","120,00","120,00","0,00","2,506","300.720,00","300.720,00",FROT,2019-05-03
08.11.2019,"120,00",/,/,"120,00","0,00",0,"0,00","0,00",FROT,2019-11-08
06.11.2020,"120,00",/,/,"120,00","0,00",0,"0,00","0,00",FROT,2020-11-06
30.12.2020,"120,00",/,/,"120,00","0,00",0,"0,00","0,00",FROT,2020-12-30
25.01.2022,"185,00","185,00","185,00","185,00","54,17",366,"67.710,00","67.710,00",FROT,2022-01-25
08.11.2022,"185,00",/,/,"185,00","0,00",0,"0,00","0,00",FROT,2022-11-08
08.11.2023,"185,00",/,/,"185,00","0,00",0,"0,00","0,00",FROT,2023-11-08
07.11.2024,"185,00",/,/,"185,00","0,00",0,"0,00","0,00",FROT,2024-11-07
12.11.2014,"500,00","500,00","500,00","500,00","0,00",120,"60.000,00","60.000,00",FUBT,2014-11-12
21.01.2015,"500,00","500,00","500,00","500,00","0,00",60,"30.000,00","30.000,00",FUBT,2015-01-21
27.02.2015,"500,00","500,00","500,00","500,00","0,00",43,"21.500,00","21.500,00",FUBT,2015-02-27
01.04.2015,"500,00","500,00","500,00","500,00","0,00",130,"65.000,00","65.000,00",FUBT,2015-04-01
28.04.2015,"500,00","500,00","500,00","500,00","0,00",14,"7.000,00","7.000,00",FUBT,2015-04-28
27.05.2015,"603,00","603,00","603,00","603,00","20,60",121,"72.963,00","72.963,00",FUBT,2015-05-27
28.05.2015,"608,00","608,00","608,00","608,00","0,83",122,"74.176,00","74.176,00",FUBT,2015-05-28
15.09.2015,"720,00","720,00","720,00","720,00","18,42",98,"70.560,00","70.560,00",FUBT,2015-09-15
03.11.2015,"800,00","800,00","800,00","800,00","11,11",102,"81.600,00","81.600,00",FUBT,2015-11-03
10.11.2015,"800,00",/,/,"800,00","0,00",0,"0,00","0,00",FUBT,2015-11-10
13.06.2016,"1.000,00","1.000,00","1.000,00","1.000,00","25,00",254,"254.000,00","254.000,00",FUBT,2016-06-13
22.08.2016,"1.200,00","1.200,00","1.200,00","1.200,00","20,00",8,"9.600,00","9.600,00",FUBT,2016-08-22
27.10.2016,"1.200,00","1.200,00","1.200,00","1.200,00","0,00",225,"270.000,00","270.000,00",FUBT,2016-10-27
08.11.2016,"1.200,00","1.200,00","1.200,00","1.200,00","0,00",363,"435.600,00","435.600,00",FUBT,2016-11-08
09.11.2016,"1.200,00",/,/,"1.200,00","0,00",0,"0,00","0,00",FUBT,2016-11-09
10.11.2016,"1.200,00","1.200,00","1.200,00","1.200,00","0,00",313,"375.600,00","375.600,00",FUBT,2016-11-10
14.11.2016,"1.200,00","1.200,00","1.200,00","1.200,00","0,00",931,"1.117.200,00","1.117.200,00",FUBT,2016-11-14
17.11.2016,"1.200,00","1.200,00","1.200,00","1.200,00","0,00",546,"655.200,00","655.200,00",FUBT,2016-11-17
22.11.2016,"1.200,00","1.200,00","1.200,00","1.200,00","0,00",390,"468.000,00","468.000,00",FUBT,2016-11-22
19.12.2016,"1.200,00","1.200,00","1.200,00","1.200,00","0,00","4,427","5.312.400,00","5.312.400,00",FUBT,2016-12-19
20.12.2016,"1.200,00","1.200,00","1.200,00","1.200,00","0,00","1,194","1.432.800,00","1.432.800,00",FUBT,2016-12-20
22.12.2016,"1.440,00","1.440,00","1.440,00","1.440,00","20,00",871,"1.254.240,00","1.254.240,00",FUBT,2016-12-22
27.12.2016,"1.200,00","1.200,00","1.200,00","1.200,00","-16,67",161,"193.200,00","193.200,00",FUBT,2016-12-27
27.01.2017,"1.150,00","1.150,00","1.150,00","1.150,00","-4,17",30,"34.500,00","34.500,00",FUBT,2017-01-27
16.02.2017,"1.200,00","1.200,00","1.200,00","1.200,00","4,35",136,"163.200,00","163.200,00",FUBT,2017-02-16
23.02.2017,"1.200,00","1.200,00","1.200,00","1.200,00","0,00",184,"220.800,00","220.800,00",FUBT,2017-02-23
09.03.2017,"1.100,00","1.100,00","1.100,00","1.100,00","-8,33",100,"110.000,00","110.000,00",FUBT,2017-03-09
10.03.2017,"1.000,00","1.000,00","1.000,00","1.000,00","-9,09",5,"5.000,00","5.000,00",FUBT,2017-03-10
09.11.2017,"1.000,00",/,/,"1.000,00","0,00",0,"0,00","0,00",FUBT,2017-11-09
15.11.2017,"900,00","900,00","900,00","900,00","-10,00",886,"797.400,00","797.400,00",FUBT,2017-11-15
31.10.2018,"900,00","900,00","900,00","900,00","0,00",176,"158.400,00","158.400,00",FUBT,2018-10-31
09.11.2018,"900,00",/,/,"900,00","0,00",0,"0,00","0,00",FUBT,2018-11-09
19.12.2018,"1.200,00","1.200,00","1.200,00","1.200,00","33,33",400,"480.000,00","480.000,00",FUBT,2018-12-19
21.12.2018,"1.399,00","1.399,00","1.399,00","1.399,00","16,58",6,"8.394,00","8.394,00",FUBT,2018-12-21
24.12.2018,"1.400,00","1.400,00","1.400,00","1.400,00","0,07","2,106","2.948.400,00","2.948.400,00",FUBT,2018-12-24
11.03.2019,"1.000,00","1.000,00","1.000,00","1.000,00","-28,57",258,"258.000,00","258.000,00",FUBT,2019-03-11
19.03.2019,"1.000,00","1.000,00","1.000,00","1.000,00","0,00",215,"215.000,00","215.000,00",FUBT,2019-03-19
16.05.2019,"1.200,00","1.200,00","1.200,00","1.200,00","20,00",245,"294.000,00","294.000,00",FUBT,2019-05-16
17.05.2019,"1.200,00","1.200,00","1.200,00","1.200,00","0,00",830,"996.000,00","996.000,00",FUBT,2019-05-17
22.05.2019,"1.200,00","1.200,00","1.200,00","1.200,00","0,00",116,"139.200,00","139.200,00",FUBT,2019-05-22
31.07.2019,"1.200,00","1.200,00","1.200,00","1.200,00","0,00",125,"150.000,00","150.000,00",FUBT,2019-07-31
10.09.2019,"1.200,00","1.200,00","1.200,00","1.200,00","0,00",10,"12.000,00","12.000,00",FUBT,2019-09-10
06.11.2019,"1.100,00","1.100,00","1.100,00","1.100,00","-8,33",100,"110.000,00","110.000,00",FUBT,2019-11-06
08.11.2019,"1.100,00",/,/,"1.100,00","0,00",0,"0,00","0,00",FUBT,2019-11-08
20.02.2020,"1.200,00","1.200,00","1.200,00","1.200,00","9,09",198,"237.600,00","237.600,00",FUBT,2020-02-20
27.04.2020,"1.080,00","1.080,00","1.080,00","1.080,00","-10,00",141,"152.280,00","152.280,00",FUBT,2020-04-27
08.05.2020,"1.200,00","1.200,00","1.200,00","1.200,00","11,11",300,"360.000,00","360.000,00",FUBT,2020-05-08
23.06.2020,"1.200,00","1.200,00","1.200,00","1.200,00","0,00",164,"196.800,00","196.800,00",FUBT,2020-06-23
06.11.2020,"1.200,00",/,/,"1.200,00","0,00",0,"0,00","0,00",FUBT,2020-11-06
05.02.2021,"1.200,00","1.200,00","1.200,00","1.200,00","0,00",11,"13.200,00","13.200,00",FUBT,2021-02-05
31.03.2021,"1.500,00","1.500,00","1.500,00","1.500,00","25,00",200,"300.000,00","300.000,00",FUBT,2021-03-31
01.04.2021,"1.500,00","1.500,00","1.500,00","1.500,00","0,00",310,"465.000,00","465.000,00",FUBT,2021-04-01
02.04.2021,"1.500,00","1.500,00","1.500,00","1.500,00","0,00",103,"154.500,00","154.500,00",FUBT,2021-04-02
04.05.2021,"1.568,00","1.568,00","1.568,00","1.568,00","4,53",25,"39.200,00","39.200,00",FUBT,2021-05-04
08.11.2021,"1.568,00",/,/,"1.568,00","0,00",0,"0,00","0,00",FUBT,2021-11-08
15.06.2022,"1.801,00","1.801,00","1.801,00","1.801,00","14,86",139,"250.339,00","250.339,00",FUBT,2022-06-15
08.11.2022,"1.801,00",/,/,"1.801,00","0,00",0,"0,00","0,00",FUBT,2022-11-08
04.01.2023,"1.800,00","1.800,00","1.800,00","1.800,00","-0,06",41,"73.800,00","73.800,00",FUBT,2023-01-04
27.03.2023,"2.101,00","2.101,00","2.101,00","2.101,00","16,72",38,"79.838,00","79.838,00",FUBT,2023-03-27
08.11.2023,"2.101,00",/,/,"2.101,00","0,00",0,"0,00","0,00",FUBT,2023-11-08
07.11.2024,"2.101,00",/,/,"2.101,00","0,00",0,"0,00","0,00",FUBT,2024-11-07
10.11.2015,"1.250,00",/,/,"1.250,00","0,00",0,"0,00","0,00",GALE,2015-11-10
09.11.2016,"1.250,00",/,/,"1.250,00","0,00",0,"0,00","0,00",GALE,2016-11-09
14.06.2017,"600,00","600,00","600,00","600,00","-52,00","2,771","1.662.600,00","1.662.600,00",GALE,2017-06-14
22.06.2017,"600,00","600,00","600,00","600,00","0,00","3,600","2.160.000,00","2.160.000,00",GALE,2017-06-22
27.06.2017,"600,00","600,00","600,00","600,00","0,00","3,600","2.160.000,00","2.160.000,00",GALE,2017-06-27
09.11.2017,"600,00",/,/,"600,00","0,00",0,"0,00","0,00",GALE,2017-11-09
09.11.2018,"600,00",/,/,"600,00","0,00",0,"0,00","0,00",GALE,2018-11-09
28.12.2018,"600,00",/,/,"600,00","0,00",0,"0,00","0,00",GALE,2018-12-28
06.11.2020,"600,00",/,/,"600,00","0,00",0,"0,00","0,00",GALE,2020-11-06
05.11.2021,"300,00","300,00","300,00","300,00","-50,00","6,637","1.991.100,00","1.991.100,00",GALE,2021-11-05
08.11.2021,"300,00",/,/,"300,00","0,00",0,"0,00","0,00",GALE,2021-11-08
08.11.2022,"300,00",/,/,"300,00","0,00",0,"0,00","0,00",GALE,2022-11-08
08.11.2023,"300,00",/,/,"300,00","0,00",0,"0,00","0,00",GALE,2023-11-08
19.03.2024,"300,00","300,00","300,00","300,00","0,00",25,"7.500,00","7.500,00",GALE,2024-03-19
07.11.2024,"300,00",/,/,"300,00","0,00",0,"0,00","0,00",GALE,2024-11-07
10.11.2015,"1.250,00",/,/,"1.250,00","0,00",0,"0,00","0,00",GDKM,2015-11-10
29.12.2015,"1.250,00",/,/,"1.250,00","0,00",0,"0,00","0,00",GDKM,2015-12-29
28.12.2017,"1.250,00","1.250,00","1.250,00","1.250,00","0,00",500,"625.000,00","625.000,00",GDKM,2017-12-28
09.11.2018,"1.250,00",/,/,"1.250,00","0,00",0,"0,00","0,00",GDKM,2018-11-09
28.12.2018,"1.250,00",/,/,"1.250,00","0,00",0,"0,00","0,00",GDKM,2018-12-28
14.09.2022,"1.213,00","1.213,00","1.213,00","1.213,00","-2,96",500,"606.500,00","606.500,00",GDKM,2022-09-14
08.11.2022,"1.213,00",/,/,"1.213,00","0,00",0,"0,00","0,00",GDKM,2022-11-08
08.11.2023,"1.213,00",/,/,"1.213,00","0,00",0,"0,00","0,00",GDKM,2023-11-08
24.11.2023,"1.240,00","1.240,00","1.240,00","1.240,00","2,23",360,"446.400,00","446.400,00",GDKM,2023-11-24
15.03.2024,"1.240,00","1.240,00","1.240,00","1.240,00","0,00",6,"7.440,00","7.440,00",GDKM,2024-03-15
20.03.2024,"1.240,00","1.240,00","1.240,00","1.240,00","0,00",390,"483.600,00","483.600,00",GDKM,2024-03-20
21.03.2024,"1.240,00","1.240,00","1.240,00","1.240,00","0,00",325,"403.000,00","403.000,00",GDKM,2024-03-21
07.11.2024,"1.240,00",/,/,"1.240,00","0,00",0,"0,00","0,00",GDKM,2024-11-07
10.11.2015,"595,00",/,/,"595,00","0,00",0,"0,00","0,00",GECK,2015-11-10
09.11.2016,"595,00",/,/,"595,00","0,00",0,"0,00","0,00",GECK,2016-11-09
18.08.2017,"300,00","300,00","300,00","300,00","-49,58","4,861","1.458.300,00","1.458.300,00",GECK,2017-08-18
09.11.2017,"300,00",/,/,"300,00","0,00",0,"0,00","0,00",GECK,2017-11-09
14.09.2018,"500,00","500,00","500,00","500,00","66,67","1,094","547.000,00","547.000,00",GECK,2018-09-14
09.11.2018,"500,00",/,/,"500,00","0,00",0,"0,00","0,00",GECK,2018-11-09
26.12.2018,"500,00","500,00","500,00","500,00","0,00","1,132","566.000,00","566.000,00",GECK,2018-12-26
21.01.2019,"500,00","500,00","500,00","500,00","0,00","1,080","540.000,00","540.000,00",GECK,2019-01-21
20.09.2019,"500,00","500,00","500,00","500,00","0,00",761,"380.500,00","380.500,00",GECK,2019-09-20
08.11.2019,"500,00",/,/,"500,00","0,00",0,"0,00","0,00",GECK,2019-11-08
12.05.2020,"500,00","500,00","500,00","500,00","0,00",791,"395.500,00","395.500,00",GECK,2020-05-12
06.11.2020,"500,00",/,/,"500,00","0,00",0,"0,00","0,00",GECK,2020-11-06
08.11.2021,"500,00",/,/,"500,00","0,00",0,"0,00","0,00",GECK,2021-11-08
16.05.2022,"500,00","500,00","500,00","500,00","0,00",738,"369.000,00","369.000,00",GECK,2022-05-16
08.11.2022,"500,00",/,/,"500,00","0,00",0,"0,00","0,00",GECK,2022-11-08
08.11.2023,"500,00",/,/,"500,00","0,00",0,"0,00","0,00",GECK,2023-11-08
10.10.2024,"310,00","310,00","310,00","310,00","-38,00",57,"17.670,00","17.670,00",GECK,2024-10-10
07.11.2024,"310,00",/,/,"310,00","0,00",0,"0,00","0,00",GECK,2024-11-07
10.11.2015,"545,00",/,/,"545,00","0,00",0,"0,00","0,00",GECT,2015-11-10
09.11.2016,"545,00",/,/,"545,00","0,00",0,"0,00","0,00",GECT,2016-11-09
09.11.2017,"545,00",/,/,"545,00","0,00",0,"0,00","0,00",GECT,2017-11-09
14.09.2018,"500,00","500,00","500,00","500,00","-8,26","1,155","577.500,00","577.500,00",GECT,2018-09-14
09.11.2018,"500,00",/,/,"500,00","0,00",0,"0,00","0,00",GECT,2018-11-09
26.12.2018,"500,00","500,00","500,00","500,00","0,00","1,182","591.000,00","591.000,00",GECT,2018-12-26
21.01.2019,"500,00","500,00","500,00","500,00","0,00","1,132","566.000,00","566.000,00",GECT,2019-01-21
20.09.2019,"500,00","500,00","500,00","500,00","0,00",799,"399.500,00","399.500,00",GECT,2019-09-20
08.11.2019,"500,00",/,/,"500,00","0,00",0,"0,00","0,00",GECT,2019-11-08
12.05.2020,"500,00","500,00","500,00","500,00","0,00",832,"416.000,00","416.000,00",GECT,2020-05-12
06.11.2020,"500,00",/,/,"500,00","0,00",0,"0,00","0,00",GECT,2020-11-06
08.11.2021,"500,00",/,/,"500,00","0,00",0,"0,00","0,00",GECT,2021-11-08
16.05.2022,"500,00","500,00","500,00","500,00","0,00",775,"387.500,00","387.500,00",GECT,2022-05-16
08.11.2022,"500,00",/,/,"500,00","0,00",0,"0,00","0,00",GECT,2022-11-08
08.11.2023,"500,00",/,/,"500,00","0,00",0,"0,00","0,00",GECT,2023-11-08
10.10.2024,"310,00","310,00","310,00","310,00","-38,00",60,"18.600,00","18.600,00",GECT,2024-10-10
07.11.2024,"310,00",/,/,"310,00","0,00",0,"0,00","0,00",GECT,2024-11-07
27.11.2014,"7.060,00","7.060,00","7.060,00","7.060,00","8,62",35,"247.100,00","247.100,00",GIMS,2014-11-27
28.11.2014,"7.555,00","7.555,00","7.555,00","7.555,00","7,01",24,"181.320,00","181.320,00",GIMS,2014-11-28
03.03.2015,"7.329,00","7.329,00","7.329,00","7.329,00","-2,99",13,"95.277,00","95.277,00",GIMS,2015-03-03
27.05.2015,"7.329,00","7.329,00","7.329,00","7.329,00","0,00",10,"73.290,00","73.290,00",GIMS,2015-05-27
10.11.2015,"7.329,00",/,/,"7.329,00","0,00",0,"0,00","0,00",GIMS,2015-11-10
09.11.2016,"7.329,00",/,/,"7.329,00","0,00",0,"0,00","0,00",GIMS,2016-11-09
09.11.2017,"7.329,00",/,/,"7.329,00","0,00",0,"0,00","0,00",GIMS,2017-11-09
06.09.2018,"7.110,00","7.110,00","7.110,00","7.110,00","-2,99",40,"284.400,00","284.400,00",GIMS,2018-09-06
09.11.2018,"7.110,00",/,/,"7.110,00","0,00",0,"0,00","0,00",GIMS,2018-11-09
08.11.2019,"7.110,00",/,/,"7.110,00","0,00",0,"0,00","0,00",GIMS,2019-11-08
02.01.2020,"7.110,00",/,/,"7.110,00","0,00",0,"0,00","0,00",GIMS,2020-01-02
01.03.2021,"9.240,00","9.240,00","9.240,00","9.240,00","29,96",103,"951.720,00","951.720,00",GIMS,2021-03-01
10.06.2021,"9.240,00","9.240,00","9.240,00","9.240,00","0,00",61,"563.640,00","563.640,00",GIMS,2021-06-10
08.11.2021,"9.240,00",/,/,"9.240,00","0,00",0,"0,00","0,00",GIMS,2021-11-08
02.03.2022,"9.240,00","9.240,00","9.240,00","9.240,00","0,00",130,"1.201.200,00","1.201.200,00",GIMS,2022-03-02
30.05.2022,"9.240,00","9.240,00","9.240,00","9.240,00","0,00",168,"1.552.320,00","1.552.320,00",GIMS,2022-05-30
01.06.2022,"9.240,00","9.240,00","9.240,00","9.240,00","0,00",10,"92.400,00","92.400,00",GIMS,2022-06-01
16.08.2022,"9.240,00","9.240,00","9.240,00","9.240,00","0,00",29,"267.960,00","267.960,00",GIMS,2022-08-16
26.09.2022,"9.240,00","9.240,00","9.240,00","9.240,00","0,00",18,"166.320,00","166.320,00",GIMS,2022-09-26
04.10.2022,"9.240,00","9.240,00","9.240,00","9.240,00","0,00",91,"840.840,00","840.840,00",GIMS,2022-10-04
10.10.2022,"9.240,00","9.240,00","9.240,00","9.240,00","0,00",84,"776.160,00","776.160,00",GIMS,2022-10-10
20.10.2022,"9.240,00","9.240,00","9.240,00","9.240,00","0,00",60,"554.400,00","554.400,00",GIMS,2022-10-20
08.11.2022,"9.240,00",/,/,"9.240,00","0,00",0,"0,00","0,00",GIMS,2022-11-08
22.12.2022,"9.240,00","9.240,00","9.240,00","9.240,00","0,00",25,"231.000,00","231.000,00",GIMS,2022-12-22
09.03.2023,"9.240,00","9.240,00","9.240,00","9.240,00","0,00",10,"92.400,00","92.400,00",GIMS,2023-03-09
08.11.2023,"9.240,00",/,/,"9.240,00","0,00",0,"0,00","0,00",GIMS,2023-11-08
07.11.2024,"9.240,00",/,/,"9.240,00","0,00",0,"0,00","0,00",GIMS,2024-11-07
24.11.2014,"310,00","310,00","310,00","310,00","0,00",55,"17.050,00","17.050,00",GRDN,2014-11-24
10.12.2014,"310,00","310,00","310,00","310,00","0,00",176,"54.560,00","54.560,00",GRDN,2014-12-10
10.11.2015,"310,00",/,/,"310,00","0,00",0,"0,00","0,00",GRDN,2015-11-10
29.12.2015,"310,00",/,/,"310,00","0,00",0,"0,00","0,00",GRDN,2015-12-29
09.05.2018,"310,00","310,00","310,00","310,00","0,00","1,625","503.750,00","503.750,00",GRDN,2018-05-09
09.11.2018,"310,00",/,/,"310,00","0,00",0,"0,00","0,00",GRDN,2018-11-09
08.11.2019,"310,00",/,/,"310,00","0,00",0,"0,00","0,00",GRDN,2019-11-08
02.01.2020,"310,00",/,/,"310,00","0,00",0,"0,00","0,00",GRDN,2020-01-02
27.05.2021,"310,00","310,00","310,00","310,00","0,00",159,"49.290,00","49.290,00",GRDN,2021-05-27
08.11.2021,"310,00",/,/,"310,00","0,00",0,"0,00","0,00",GRDN,2021-11-08
07.04.2022,"310,00","310,00","310,00","310,00","0,00",158,"48.980,00","48.980,00",GRDN,2022-04-07
08.11.2022,"310,00",/,/,"310,00","0,00",0,"0,00","0,00",GRDN,2022-11-08
16.11.2022,"310,00","310,00","310,00","310,00","0,00",233,"72.230,00","72.230,00",GRDN,2022-11-16
08.11.2023,"310,00",/,/,"310,00","0,00",0,"0,00","0,00",GRDN,2023-11-08
01.12.2023,"310,00","310,00","310,00","310,00","0,00",127,"39.370,00","39.370,00",GRDN,2023-12-01
21.12.2023,"310,00","310,00","310,00","310,00","0,00",42,"13.020,00","13.020,00",GRDN,2023-12-21
03.10.2024,"310,00","310,00","310,00","310,00","0,00",33,"10.230,00","10.230,00",GRDN,2024-10-03
07.11.2024,"310,00",/,/,"310,00","0,00",0,"0,00","0,00",GRDN,2024-11-07
11.11.2014,"570,00","570,00","559,00","560,46","-0,66",756,"423.710,00","423.710,00",GRNT,2014-11-11
12.11.2014,"580,00","580,00","569,00","572,25","2,10","1,399","800.573,00","800.573,00",GRNT,2014-11-12
13.11.2014,"575,00","576,00","575,00","575,23","0,52",452,"260.002,00","260.002,00",GRNT,2014-11-13
14.11.2014,"576,00","576,00","575,00","575,28","0,01",266,"153.025,00","153.025,00",GRNT,2014-11-14
17.11.2014,"580,00","580,00","575,00","575,51","0,04",390,"224.450,00","224.450,00",GRNT,2014-11-17
18.11.2014,"575,00","575,00","574,00","574,67","-0,15","1,194","686.156,00","686.156,00",GRNT,2014-11-18
19.11.2014,"570,00","570,00","560,00","562,99","-2,03",428,"240.960,00","240.960,00",GRNT,2014-11-19
20.11.2014,"570,00","579,00","569,00","570,33","1,30","6,991","3.987.210,00","3.987.210,00",GRNT,2014-11-20
21.11.2014,"573,00","573,00","573,00","573,00","0,47",329,"188.517,00","188.517,00",GRNT,2014-11-21
25.11.2014,"570,00","570,00","570,00","570,00","-0,52",310,"176.700,00","176.700,00",GRNT,2014-11-25
26.11.2014,"570,00","570,00","570,00","570,00","0,00",20,"11.400,00","11.400,00",GRNT,2014-11-26
27.11.2014,"570,00","570,00","570,00","570,00","0,00",100,"57.000,00","57.000,00",GRNT,2014-11-27
28.11.2014,"570,00","570,00","570,00","570,00","0,00",778,"443.460,00","443.460,00",GRNT,2014-11-28
01.12.2014,"562,00","562,00","562,00","562,00","-1,40",100,"56.200,00","56.200,00",GRNT,2014-12-01
02.12.2014,"573,00","573,00","562,00","570,13","1,45","5,522","3.148.265,00","3.148.265,00",GRNT,2014-12-02
04.12.2014,"570,00","570,00","570,00","570,00","-0,02",622,"354.540,00","354.540,00",GRNT,2014-12-04
05.12.2014,"575,00","575,00","571,00","571,92","0,34","2,658","1.520.154,00","1.520.154,00",GRNT,2014-12-05
09.12.2014,"560,00","573,00","560,00","570,40","-0,27",500,"285.200,00","285.200,00",GRNT,2014-12-09
12.12.2014,"580,00","581,00","560,00","579,23","1,55","17,741","10.276.138,00","10.276.138,00",GRNT,2014-12-12
16.12.2014,"570,00","570,00","570,00","570,00","-1,59",350,"199.500,00","199.500,00",GRNT,2014-12-16
17.12.2014,"555,00","570,00","555,00","569,27","-0,13",409,"232.830,00","232.830,00",GRNT,2014-12-17
19.12.2014,"570,00","570,00","570,00","570,00","0,13",200,"114.000,00","114.000,00",GRNT,2014-12-19
22.12.2014,"560,00","560,00","560,00","560,00","-1,75",500,"280.000,00","280.000,00",GRNT,2014-12-22
23.12.2014,"566,00","570,00","560,00","562,25","0,40","1,530","860.240,00","860.240,00",GRNT,2014-12-23
24.12.2014,"570,00","570,00","570,00","570,00","1,38","2,630","1.499.100,00","1.499.100,00",GRNT,2014-12-24
25.12.2014,"570,00","570,00","560,00","565,93","-0,71",123,"69.610,00","69.610,00",GRNT,2014-12-25
26.12.2014,"581,00","585,00","580,00","580,50","2,57","1,491","865.530,00","865.530,00",GRNT,2014-12-26
29.12.2014,"595,00","597,00","595,00","596,00","2,67","1,000","596.000,00","596.000,00",GRNT,2014-12-29
30.12.2014,"595,00","596,00","594,00","594,91","-0,18","3,013","1.792.458,00","1.792.458,00",GRNT,2014-12-30
05.01.2015,"578,00","578,00","578,00","578,00","-2,84",20,"11.560,00","11.560,00",GRNT,2015-01-05
08.01.2015,"580,00","580,00","578,00","578,65","0,11",614,"355.292,00","355.292,00",GRNT,2015-01-08
09.01.2015,"580,00","580,00","578,00","578,88","0,04",137,"79.306,00","79.306,00",GRNT,2015-01-09
12.01.2015,"580,00","580,00","580,00","580,00","0,19",100,"58.000,00","58.000,00",GRNT,2015-01-12
13.01.2015,"580,00","580,00","580,00","580,00","0,00",250,"145.000,00","145.000,00",GRNT,2015-01-13
14.01.2015,"580,00","580,00","580,00","580,00","0,00",469,"272.020,00","272.020,00",GRNT,2015-01-14
15.01.2015,"580,00","580,00","580,00","580,00","0,00",150,"87.000,00","87.000,00",GRNT,2015-01-15
16.01.2015,"580,00","580,00","580,00","580,00","0,00",663,"384.540,00","384.540,00",GRNT,2015-01-16
20.01.2015,"580,00","580,00","580,00","580,00","0,00",506,"293.480,00","293.480,00",GRNT,2015-01-20
21.01.2015,"580,00","580,00","580,00","580,00","0,00",250,"145.000,00","145.000,00",GRNT,2015-01-21
22.01.2015,"580,00","580,00","580,00","580,00","0,00",13,"7.540,00","7.540,00",GRNT,2015-01-22
23.01.2015,"580,00","580,00","580,00","580,00","0,00",460,"266.800,00","266.800,00",GRNT,2015-01-23
26.01.2015,"585,00","586,00","581,00","584,98","0,86",590,"345.140,00","345.140,00",GRNT,2015-01-26
27.01.2015,"590,00","595,00","589,00","591,13","1,05","1,307","772.610,00","772.610,00",GRNT,2015-01-27
28.01.2015,"590,00","595,00","590,00","590,32","-0,14",310,"183.000,00","183.000,00",GRNT,2015-01-28
29.01.2015,"590,00","590,00","590,00","590,00","-0,05",200,"118.000,00","118.000,00",GRNT,2015-01-29
30.01.2015,"595,00","595,00","590,00","592,80","0,47",127,"75.285,00","75.285,00",GRNT,2015-01-30
03.02.2015,"585,00","589,00","585,00","585,22","-1,28",662,"387.418,00","387.418,00",GRNT,2015-02-03
04.02.2015,"590,00","590,00","590,00","590,00","0,82",200,"118.000,00","118.000,00",GRNT,2015-02-04
05.02.2015,"595,00","595,00","590,00","593,66","0,62",149,"88.455,00","88.455,00",GRNT,2015-02-05
06.02.2015,"587,00","590,00","587,00","588,30","-0,90",352,"207.080,00","207.080,00",GRNT,2015-02-06
09.02.2015,"582,00","586,00","582,00","584,23","-0,69","1,129","659.594,00","659.594,00",GRNT,2015-02-09
10.02.2015,"582,00","582,00","582,00","582,00","-0,38",231,"134.442,00","134.442,00",GRNT,2015-02-10
11.02.2015,"580,00","581,00","580,00","580,21","-0,31",380,"220.480,00","220.480,00",GRNT,2015-02-11
12.02.2015,"576,00","576,00","576,00","576,00","-0,73",218,"125.568,00","125.568,00",GRNT,2015-02-12
13.02.2015,"575,00","575,00","571,00","574,94","-0,18","6,300","3.622.100,00","3.622.100,00",GRNT,2015-02-13
16.02.2015,"562,00","563,00","562,00","562,40","-2,18",100,"56.240,00","56.240,00",GRNT,2015-02-16
17.02.2015,"560,00","562,00","560,00","561,19","-0,22",740,"415.280,00","415.280,00",GRNT,2015-02-17
18.02.2015,"570,00","570,00","569,00","569,86","1,54",74,"42.170,00","42.170,00",GRNT,2015-02-18
19.02.2015,"570,00","570,00","570,00","570,00","0,02",277,"157.890,00","157.890,00",GRNT,2015-02-19
20.02.2015,"580,00","580,00","579,00","579,09","1,59",85,"49.223,00","49.223,00",GRNT,2015-02-20
23.02.2015,"565,00","566,00","565,00","565,98","-2,26","18,640","10.549.900,00","10.549.900,00",GRNT,2015-02-23
24.02.2015,"579,00","579,00","565,00","573,31","1,30",246,"141.034,00","141.034,00",GRNT,2015-02-24
26.02.2015,"575,00","575,00","575,00","575,00","0,29",340,"195.500,00","195.500,00",GRNT,2015-02-26
27.02.2015,"575,00","575,00","575,00","575,00","0,00",100,"57.500,00","57.500,00",GRNT,2015-02-27
03.03.2015,"580,00","580,00","570,00","576,29","0,22","1,302","750.335,00","750.335,00",GRNT,2015-03-03
04.03.2015,"589,00","589,00","580,00","582,25","1,03",700,"407.575,00","407.575,00",GRNT,2015-03-04
05.03.2015,"580,00","580,00","580,00","580,00","-0,39",200,"116.000,00","116.000,00",GRNT,2015-03-05
09.03.2015,"580,00","580,00","569,00","577,33","-0,46",132,"76.208,00","76.208,00",GRNT,2015-03-09
10.03.2015,"590,00","590,00","580,00","588,84","1,99","2,500","1.472.096,00","1.472.096,00",GRNT,2015-03-10
11.03.2015,"572,00","572,00","572,00","572,00","-2,86",15,"8.580,00","8.580,00",GRNT,2015-03-11
12.03.2015,"570,00","570,00","570,00","570,00","-0,35",123,"70.110,00","70.110,00",GRNT,2015-03-12
13.03.2015,"575,00","575,00","571,00","574,84","0,85",970,"557.590,00","557.590,00",GRNT,2015-03-13
17.03.2015,"569,00","569,00","569,00","569,00","-1,02",134,"76.246,00","76.246,00",GRNT,2015-03-17
19.03.2015,"570,00","570,00","570,00","570,00","0,18",155,"88.350,00","88.350,00",GRNT,2015-03-19
25.03.2015,"553,00","553,00","553,00","553,00","-2,98",326,"180.278,00","180.278,00",GRNT,2015-03-25
26.03.2015,"553,00","553,00","553,00","553,00","0,00",100,"55.300,00","55.300,00",GRNT,2015-03-26
27.03.2015,"537,00","537,00","537,00","537,00","-2,89",40,"21.480,00","21.480,00",GRNT,2015-03-27
30.03.2015,"537,00","537,00","537,00","537,00","0,00",500,"268.500,00","268.500,00",GRNT,2015-03-30
01.04.2015,"521,00","521,00","521,00","521,00","-2,98",35,"18.235,00","18.235,00",GRNT,2015-04-01
02.04.2015,"506,00","506,00","506,00","506,00","-2,88",840,"425.040,00","425.040,00",GRNT,2015-04-02
03.04.2015,"520,00","520,00","507,00","510,34","0,86",175,"89.310,00","89.310,00",GRNT,2015-04-03
06.04.2015,"510,00","519,00","506,00","509,98","-0,07","1,059","540.070,00","540.070,00",GRNT,2015-04-06
07.04.2015,"510,00","510,00","510,00","510,00","0,00",80,"40.800,00","40.800,00",GRNT,2015-04-07
08.04.2015,"515,00","520,00","515,00","517,15","1,40",653,"337.700,00","337.700,00",GRNT,2015-04-08
09.04.2015,"530,00","530,00","520,00","529,70","2,43","1,350","715.100,00","715.100,00",GRNT,2015-04-09
15.04.2015,"526,00","526,00","520,00","523,66","-1,14",362,"189.566,00","189.566,00",GRNT,2015-04-15
16.04.2015,"530,00","530,00","525,00","529,40","1,10",525,"277.935,00","277.935,00",GRNT,2015-04-16
17.04.2015,"540,00","540,00","539,00","539,75","1,96","1,581","853.340,00","853.340,00",GRNT,2015-04-17
20.04.2015,"526,00","530,00","526,00","527,83","-2,21",166,"87.620,00","87.620,00",GRNT,2015-04-20
21.04.2015,"516,00","517,00","516,00","516,53","-2,14",190,"98.140,00","98.140,00",GRNT,2015-04-21
22.04.2015,"520,00","520,00","520,00","520,00","0,67",200,"104.000,00","104.000,00",GRNT,2015-04-22
23.04.2015,"515,00","516,00","515,00","515,66","-0,83",986,"508.440,00","508.440,00",GRNT,2015-04-23
24.04.2015,"515,00","515,00","515,00","515,00","-0,13",70,"36.050,00","36.050,00",GRNT,2015-04-24
27.04.2015,"525,00","525,00","525,00","525,00","1,94",275,"144.375,00","144.375,00",GRNT,2015-04-27
28.04.2015,"515,00","515,00","515,00","515,00","-1,90",9,"4.635,00","4.635,00",GRNT,2015-04-28
30.04.2015,"515,00","515,00","515,00","515,00","0,00",200,"103.000,00","103.000,00",GRNT,2015-04-30
04.05.2015,"510,00","513,00","500,00","509,47","-1,07","1,331","678.110,00","678.110,00",GRNT,2015-05-04
06.05.2015,"495,00","495,00","495,00","495,00","-2,84",50,"24.750,00","24.750,00",GRNT,2015-05-06
07.05.2015,"485,00","485,00","485,00","485,00","-2,02",200,"97.000,00","97.000,00",GRNT,2015-05-07
08.05.2015,"485,00","485,00","485,00","485,00","0,00",500,"242.500,00","242.500,00",GRNT,2015-05-08
11.05.2015,"490,00","490,00","490,00","490,00","1,03",10,"4.900,00","4.900,00",GRNT,2015-05-11
12.05.2015,"473,00","481,00","472,00","477,90","-2,47","1,128","539.070,00","539.070,00",GRNT,2015-05-12
13.05.2015,"510,00","510,00","480,00","495,08","3,59","1,105","547.060,00","547.060,00",GRNT,2015-05-13
14.05.2015,"510,00","510,00","495,00","508,64","2,74",176,"89.520,00","89.520,00",GRNT,2015-05-14
15.05.2015,"520,00","520,00","505,00","519,23","2,08","1,200","623.075,00","623.075,00",GRNT,2015-05-15
18.05.2015,"505,00","505,00","505,00","505,00","-2,74",70,"35.350,00","35.350,00",GRNT,2015-05-18
19.05.2015,"500,00","500,00","498,00","499,32","-1,12",182,"90.876,00","90.876,00",GRNT,2015-05-19
20.05.2015,"496,00","496,00","496,00","496,00","-0,66",880,"436.480,00","436.480,00",GRNT,2015-05-20
21.05.2015,"496,00","496,00","495,00","495,40","-0,12",260,"128.805,00","128.805,00",GRNT,2015-05-21
22.05.2015,"485,00","485,00","485,00","485,00","-2,10",20,"9.700,00","9.700,00",GRNT,2015-05-22
26.05.2015,"486,00","499,00","486,00","495,88","2,24",104,"51.571,00","51.571,00",GRNT,2015-05-26
27.05.2015,"485,00","485,00","485,00","485,00","-2,19",60,"29.100,00","29.100,00",GRNT,2015-05-27
01.06.2015,"487,00","490,00","486,00","488,43","0,71",356,"173.880,00","173.880,00",GRNT,2015-06-01
02.06.2015,"490,00","490,00","485,00","489,79","0,28","1,300","636.730,00","636.730,00",GRNT,2015-06-02
03.06.2015,"476,00","480,00","476,00","479,71","-2,06",237,"113.692,00","113.692,00",GRNT,2015-06-03
04.06.2015,"467,00","467,00","467,00","467,00","-2,65",135,"63.045,00","63.045,00",GRNT,2015-06-04
08.06.2015,"470,00","470,00","470,00","470,00","0,64",200,"94.000,00","94.000,00",GRNT,2015-06-08
09.06.2015,"480,00","480,00","470,00","475,66","1,20","1,060","504.200,00","504.200,00",GRNT,2015-06-09
10.06.2015,"471,00","471,00","471,00","471,00","-0,98",51,"24.021,00","24.021,00",GRNT,2015-06-10
11.06.2015,"470,00","475,00","470,00","474,51","0,75",590,"279.960,00","279.960,00",GRNT,2015-06-11
12.06.2015,"471,00","471,00","471,00","471,00","-0,74",40,"18.840,00","18.840,00",GRNT,2015-06-12
16.06.2015,"470,00","471,00","470,00","470,05","-0,20","1,819","855.030,00","855.030,00",GRNT,2015-06-16
17.06.2015,"460,00","461,00","460,00","460,12","-2,11","1,200","552.150,00","552.150,00",GRNT,2015-06-17
18.06.2015,"461,00","465,00","460,00","461,75","0,35",597,"275.665,00","275.665,00",GRNT,2015-06-18
19.06.2015,"473,00","473,00","473,00","473,00","2,44",148,"70.004,00","70.004,00",GRNT,2015-06-19
22.06.2015,"465,00","465,00","465,00","465,00","-1,69",100,"46.500,00","46.500,00",GRNT,2015-06-22
24.06.2015,"470,00","470,00","460,00","468,41","0,73",270,"126.470,00","126.470,00",GRNT,2015-06-24
25.06.2015,"465,00","465,00","464,00","464,30","-0,88",735,"341.264,00","341.264,00",GRNT,2015-06-25
26.06.2015,"470,00","470,00","461,00","465,90","0,34",389,"181.235,00","181.235,00",GRNT,2015-06-26
29.06.2015,"460,00","460,00","460,00","460,00","-1,27",15,"6.900,00","6.900,00",GRNT,2015-06-29
30.06.2015,"465,00","465,00","462,00","462,55","0,55",55,"25.440,00","25.440,00",GRNT,2015-06-30
01.07.2015,"470,00","470,00","470,00","470,00","1,61",275,"129.250,00","129.250,00",GRNT,2015-07-01
02.07.2015,"461,00","470,00","461,00","463,98","-1,28",245,"113.675,00","113.675,00",GRNT,2015-07-02
03.07.2015,"470,00","470,00","465,00","469,00","1,08",651,"305.319,00","305.319,00",GRNT,2015-07-03
06.07.2015,"455,00","455,00","455,00","455,00","-2,99",57,"25.935,00","25.935,00",GRNT,2015-07-06
07.07.2015,"460,00","460,00","460,00","460,00","1,10",50,"23.000,00","23.000,00",GRNT,2015-07-07
08.07.2015,"460,00","460,00","460,00","460,00","0,00",51,"23.460,00","23.460,00",GRNT,2015-07-08
09.07.2015,"460,00","460,00","460,00","460,00","0,00",100,"46.000,00","46.000,00",GRNT,2015-07-09
10.07.2015,"469,00","469,00","469,00","469,00","1,96",206,"96.614,00","96.614,00",GRNT,2015-07-10
13.07.2015,"465,00","465,00","465,00","465,00","-0,85",50,"23.250,00","23.250,00",GRNT,2015-07-13
14.07.2015,"478,00","478,00","470,00","470,85","1,26",291,"137.018,00","137.018,00",GRNT,2015-07-14
15.07.2015,"483,00","484,00","475,00","479,60","1,86",474,"227.331,00","227.331,00",GRNT,2015-07-15
16.07.2015,"505,00","505,00","490,00","490,83","2,34",218,"107.000,00","107.000,00",GRNT,2015-07-16
20.07.2015,"500,00","500,00","495,00","497,78","1,42",293,"145.850,00","145.850,00",GRNT,2015-07-20
21.07.2015,"490,00","490,00","490,00","490,00","-1,56",200,"98.000,00","98.000,00",GRNT,2015-07-21
22.07.2015,"500,00","500,00","500,00","500,00","2,04",506,"253.000,00","253.000,00",GRNT,2015-07-22
23.07.2015,"498,00","498,00","498,00","498,00","-0,40",290,"144.420,00","144.420,00",GRNT,2015-07-23
27.07.2015,"454,00","454,00","454,00","454,00","-8,84",20,"9.080,00","9.080,00",GRNT,2015-07-27
28.07.2015,"495,00","495,00","495,00","495,00","9,03",44,"21.780,00","21.780,00",GRNT,2015-07-28
29.07.2015,"500,00","500,00","495,00","495,95","0,19",131,"64.970,00","64.970,00",GRNT,2015-07-29
30.07.2015,"482,00","482,00","482,00","482,00","-2,81",28,"13.496,00","13.496,00",GRNT,2015-07-30
04.08.2015,"485,00","485,00","485,00","485,00","0,62",100,"48.500,00","48.500,00",GRNT,2015-08-04
05.08.2015,"490,00","490,00","475,00","485,48","0,10",73,"35.440,00","35.440,00",GRNT,2015-08-05
06.08.2015,"485,00","485,00","485,00","485,00","-0,10",28,"13.580,00","13.580,00",GRNT,2015-08-06
07.08.2015,"480,00","480,00","480,00","480,00","-1,03",831,"398.880,00","398.880,00",GRNT,2015-08-07
10.08.2015,"484,00","484,00","484,00","484,00","0,83",38,"18.392,00","18.392,00",GRNT,2015-08-10
12.08.2015,"475,00","475,00","475,00","475,00","-1,86",50,"23.750,00","23.750,00",GRNT,2015-08-12
13.08.2015,"480,00","480,00","480,00","480,00","1,05",100,"48.000,00","48.000,00",GRNT,2015-08-13
14.08.2015,"485,00","485,00","480,00","481,62","0,34",222,"106.920,00","106.920,00",GRNT,2015-08-14
17.08.2015,"475,00","477,00","475,00","476,54","-1,05",195,"92.925,00","92.925,00",GRNT,2015-08-17
18.08.2015,"480,00","480,00","480,00","480,00","0,73","2,540","1.219.200,00","1.219.200,00",GRNT,2015-08-18
19.08.2015,"480,00","485,00","476,00","481,90","0,40",63,"30.360,00","30.360,00",GRNT,2015-08-19
20.08.2015,"490,00","490,00","490,00","490,00","1,68",246,"120.540,00","120.540,00",GRNT,2015-08-20
21.08.2015,"480,00","480,00","480,00","480,00","-2,04",124,"59.520,00","59.520,00",GRNT,2015-08-21
24.08.2015,"480,00","480,00","480,00","480,00","0,00",80,"38.400,00","38.400,00",GRNT,2015-08-24
25.08.2015,"475,00","476,00","475,00","475,99","-0,84","3,120","1.485.100,00","1.485.100,00",GRNT,2015-08-25
26.08.2015,"475,00","476,00","475,00","475,81","-0,04","3,715","1.767.625,00","1.767.625,00",GRNT,2015-08-26
27.08.2015,"475,00","475,00","475,00","475,00","-0,17","4,800","2.280.000,00","2.280.000,00",GRNT,2015-08-27
31.08.2015,"461,00","468,00","461,00","465,42","-2,02","3,200","1.489.340,00","1.489.340,00",GRNT,2015-08-31
01.09.2015,"460,00","463,00","460,00","460,13","-1,14","6,150","2.829.780,00","2.829.780,00",GRNT,2015-09-01
02.09.2015,"460,00","460,00","460,00","460,00","-0,03",50,"23.000,00","23.000,00",GRNT,2015-09-02
03.09.2015,"460,00","460,00","460,00","460,00","0,00",205,"94.300,00","94.300,00",GRNT,2015-09-03
04.09.2015,"470,00","470,00","470,00","470,00","2,17",224,"105.280,00","105.280,00",GRNT,2015-09-04
09.09.2015,"460,00","460,00","460,00","460,00","-2,13",20,"9.200,00","9.200,00",GRNT,2015-09-09
10.09.2015,"460,00","460,00","460,00","460,00","0,00","4,799","2.207.540,00","2.207.540,00",GRNT,2015-09-10
11.09.2015,"460,00","460,00","460,00","460,00","0,00",800,"368.000,00","368.000,00",GRNT,2015-09-11
14.09.2015,"462,00","462,00","460,00","460,28","0,06",726,"334.160,00","334.160,00",GRNT,2015-09-14
15.09.2015,"460,00","460,00","460,00","460,00","-0,06",10,"4.600,00","4.600,00",GRNT,2015-09-15
16.09.2015,"460,00","470,00","460,00","464,83","1,05",323,"150.140,00","150.140,00",GRNT,2015-09-16
18.09.2015,"472,00","472,00","470,00","470,06","1,13","6,722","3.159.720,00","3.159.720,00",GRNT,2015-09-18
21.09.2015,"480,00","480,00","480,00","480,00","2,11",55,"26.400,00","26.400,00",GRNT,2015-09-21
22.09.2015,"475,00","479,00","475,00","477,26","-0,57",230,"109.770,00","109.770,00",GRNT,2015-09-22
23.09.2015,"480,00","480,00","479,00","479,92","0,56",930,"446.328,00","446.328,00",GRNT,2015-09-23
24.09.2015,"480,00","480,00","480,00","480,00","0,02",562,"269.760,00","269.760,00",GRNT,2015-09-24
25.09.2015,"485,00","485,00","485,00","485,00","1,04",50,"24.250,00","24.250,00",GRNT,2015-09-25
28.09.2015,"480,00","480,00","476,00","479,96","-1,04","1,465","703.140,00","703.140,00",GRNT,2015-09-28
29.09.2015,"490,00","490,00","480,00","486,60","1,38",303,"147.440,00","147.440,00",GRNT,2015-09-29
30.09.2015,"490,00","490,00","488,00","489,50","0,60",600,"293.700,00","293.700,00",GRNT,2015-09-30
01.10.2015,"480,00","498,00","480,00","496,07","1,34",204,"101.198,00","101.198,00",GRNT,2015-10-01
02.10.2015,"480,00","489,00","480,00","485,21","-2,19",712,"345.468,00","345.468,00",GRNT,2015-10-02
05.10.2015,"486,00","486,00","486,00","486,00","0,16",300,"145.800,00","145.800,00",GRNT,2015-10-05
06.10.2015,"478,00","478,00","478,00","478,00","-1,65",298,"142.444,00","142.444,00",GRNT,2015-10-06
08.10.2015,"485,00","485,00","485,00","485,00","1,46",50,"24.250,00","24.250,00",GRNT,2015-10-08
09.10.2015,"480,00","480,00","480,00","480,00","-1,03",250,"120.000,00","120.000,00",GRNT,2015-10-09
13.10.2015,"480,00","480,00","480,00","480,00","0,00",310,"148.800,00","148.800,00",GRNT,2015-10-13
14.10.2015,"480,00","489,00","480,00","485,17","1,08",458,"222.207,00","222.207,00",GRNT,2015-10-14
15.10.2015,"487,00","487,00","485,00","486,74","0,32",274,"133.368,00","133.368,00",GRNT,2015-10-15
16.10.2015,"480,00","489,00","480,00","484,78","-0,40",409,"198.275,00","198.275,00",GRNT,2015-10-16
19.10.2015,"478,00","478,00","478,00","478,00","-1,40",100,"47.800,00","47.800,00",GRNT,2015-10-19
21.10.2015,"485,00","485,00","485,00","485,00","1,46",50,"24.250,00","24.250,00",GRNT,2015-10-21
22.10.2015,"484,00","484,00","484,00","484,00","-0,21",260,"125.840,00","125.840,00",GRNT,2015-10-22
26.10.2015,"476,00","480,00","476,00","478,24","-1,19",420,"200.860,00","200.860,00",GRNT,2015-10-26
27.10.2015,"475,00","476,00","475,00","475,13","-0,65","1,520","722.200,00","722.200,00",GRNT,2015-10-27
28.10.2015,"480,00","489,00","480,00","486,43","2,38",70,"34.050,00","34.050,00",GRNT,2015-10-28
29.10.2015,"480,00","480,00","480,00","480,00","-1,32","1,500","720.000,00","720.000,00",GRNT,2015-10-29
30.10.2015,"485,00","485,00","484,00","484,92","1,02",628,"304.530,00","304.530,00",GRNT,2015-10-30
02.11.2015,"484,00","484,00","484,00","484,00","-0,19",120,"58.080,00","58.080,00",GRNT,2015-11-02
03.11.2015,"484,00","484,00","480,00","483,80","-0,04",410,"198.360,00","198.360,00",GRNT,2015-11-03
05.11.2015,"485,00","485,00","480,00","481,81","-0,41",480,"231.270,00","231.270,00",GRNT,2015-11-05
09.11.2015,"480,00","480,00","480,00","480,00","-0,38",50,"24.000,00","24.000,00",GRNT,2015-11-09
10.11.2015,"480,00",/,/,"480,00","0,00",0,"0,00","82.759.254,00",GRNT,2015-11-10
11.11.2015,"480,00","481,00","480,00","480,43","0,09","1,040","499.650,00","499.650,00",GRNT,2015-11-11
12.11.2015,"480,00","480,00","480,00","480,00","-0,09",100,"48.000,00","48.000,00",GRNT,2015-11-12
13.11.2015,"480,00","480,00","480,00","480,00","0,00",392,"188.160,00","188.160,00",GRNT,2015-11-13
16.11.2015,"480,00","480,00","480,00","480,00","0,00",450,"216.000,00","216.000,00",GRNT,2015-11-16
17.11.2015,"470,00","470,00","470,00","470,00","-2,08",317,"148.990,00","148.990,00",GRNT,2015-11-17
18.11.2015,"470,00","470,00","470,00","470,00","0,00",800,"376.000,00","376.000,00",GRNT,2015-11-18
19.11.2015,"470,00","470,00","470,00","470,00","0,00",100,"47.000,00","47.000,00",GRNT,2015-11-19
20.11.2015,"480,00","480,00","479,00","479,95","2,12",999,"479.470,00","479.470,00",GRNT,2015-11-20
23.11.2015,"484,00","484,00","484,00","484,00","0,84",10,"4.840,00","4.840,00",GRNT,2015-11-23
24.11.2015,"485,00","485,00","484,00","484,90","0,19",500,"242.450,00","242.450,00",GRNT,2015-11-24
25.11.2015,"480,00","483,00","480,00","480,09","-0,99","1,045","501.690,00","501.690,00",GRNT,2015-11-25
26.11.2015,"475,00","475,00","475,00","475,00","-1,06",40,"19.000,00","19.000,00",GRNT,2015-11-26
27.11.2015,"475,00","475,00","475,00","475,00","0,00",58,"27.550,00","27.550,00",GRNT,2015-11-27
30.11.2015,"480,00","480,00","475,00","479,07","0,86","1,395","668.305,00","668.305,00",GRNT,2015-11-30
01.12.2015,"485,00","485,00","481,00","483,71","0,97",927,"448.399,00","448.399,00",GRNT,2015-12-01
03.12.2015,"485,00","487,00","485,00","486,35","0,55","1,518","738.273,00","738.273,00",GRNT,2015-12-03
07.12.2015,"476,00","480,00","476,00","479,39","-1,43","1,185","568.080,00","568.080,00",GRNT,2015-12-07
09.12.2015,"480,00","480,00","475,00","476,25","-0,65",400,"190.500,00","190.500,00",GRNT,2015-12-09
10.12.2015,"480,00","480,00","480,00","480,00","0,79",805,"386.400,00","386.400,00",GRNT,2015-12-10
11.12.2015,"480,00","480,00","480,00","480,00","0,00",907,"435.360,00","435.360,00",GRNT,2015-12-11
14.12.2015,"480,00","480,00","480,00","480,00","0,00","1,000","480.000,00","480.000,00",GRNT,2015-12-14
15.12.2015,"480,00","487,00","480,00","480,71","0,15",740,"355.725,00","355.725,00",GRNT,2015-12-15
16.12.2015,"480,00","480,00","479,00","479,69","-0,21",874,"419.250,00","419.250,00",GRNT,2015-12-16
17.12.2015,"480,00","480,00","479,00","479,76","0,01",625,"299.850,00","299.850,00",GRNT,2015-12-17
18.12.2015,"480,00","480,00","480,00","480,00","0,05",591,"283.680,00","283.680,00",GRNT,2015-12-18
21.12.2015,"480,00","480,00","480,00","480,00","0,00","1,200","576.000,00","576.000,00",GRNT,2015-12-21
22.12.2015,"480,00","481,00","480,00","480,05","0,01",949,"455.569,00","455.569,00",GRNT,2015-12-22
23.12.2015,"480,00","480,00","480,00","480,00","-0,01",855,"410.400,00","410.400,00",GRNT,2015-12-23
24.12.2015,"480,00","480,00","480,00","480,00","0,00",851,"408.480,00","408.480,00",GRNT,2015-12-24
25.12.2015,"485,00","485,00","485,00","485,00","1,04",169,"81.965,00","81.965,00",GRNT,2015-12-25
28.12.2015,"488,00","488,00","486,00","487,00","0,41",500,"243.500,00","243.500,00",GRNT,2015-12-28
29.12.2015,"490,00","490,00","490,00","490,00","0,62","2,000","980.000,00","980.000,00",GRNT,2015-12-29
30.12.2015,"490,00","490,00","490,00","490,00","0,00","2,740","1.342.600,00","1.342.600,00",GRNT,2015-12-30
11.01.2016,"490,00","495,00","490,00","490,66","0,13",753,"369.470,00","369.470,00",GRNT,2016-01-11
12.01.2016,"490,00","490,00","490,00","490,00","-0,13",556,"272.440,00","272.440,00",GRNT,2016-01-12
13.01.2016,"495,00","495,00","495,00","495,00","1,02",450,"222.750,00","222.750,00",GRNT,2016-01-13
14.01.2016,"490,00","490,00","490,00","490,00","-1,01",774,"379.260,00","379.260,00",GRNT,2016-01-14
15.01.2016,"485,00","495,00","485,00","486,34","-0,75","1,010","491.200,00","491.200,00",GRNT,2016-01-15
18.01.2016,"490,00","490,00","490,00","490,00","0,75",500,"245.000,00","245.000,00",GRNT,2016-01-18
20.01.2016,"495,00","495,00","495,00","495,00","1,02",14,"6.930,00","6.930,00",GRNT,2016-01-20
21.01.2016,"493,00","493,00","493,00","493,00","-0,40",80,"39.440,00","39.440,00",GRNT,2016-01-21
26.01.2016,"490,00","490,00","490,00","490,00","-0,61",30,"14.700,00","14.700,00",GRNT,2016-01-26
27.01.2016,"490,00","490,00","490,00","490,00","0,00",145,"71.050,00","71.050,00",GRNT,2016-01-27
28.01.2016,"490,00","500,00","490,00","495,40","1,10","1,073","531.560,00","531.560,00",GRNT,2016-01-28
29.01.2016,"523,00","539,00","510,00","517,95","4,55",488,"252.760,00","252.760,00",GRNT,2016-01-29
01.02.2016,"530,00","533,00","530,00","531,79","2,67",257,"136.669,00","136.669,00",GRNT,2016-02-01
02.02.2016,"530,00","530,00","530,00","530,00","-0,34",508,"269.240,00","269.240,00",GRNT,2016-02-02
05.02.2016,"500,00","500,00","500,00","500,00","-5,66",150,"75.000,00","75.000,00",GRNT,2016-02-05
08.02.2016,"500,00","500,00","499,00","499,66","-0,07",588,"293.800,00","293.800,00",GRNT,2016-02-08
09.02.2016,"509,00","509,00","500,00","506,65","1,40",203,"102.850,00","102.850,00",GRNT,2016-02-09
10.02.2016,"499,00","499,00","499,00","499,00","-1,51",183,"91.317,00","91.317,00",GRNT,2016-02-10
11.02.2016,"495,00","495,00","495,00","495,00","-0,80",200,"99.000,00","99.000,00",GRNT,2016-02-11
12.02.2016,"500,00","500,00","491,00","499,63","0,94",605,"302.275,00","302.275,00",GRNT,2016-02-12
16.02.2016,"495,00","495,00","495,00","495,00","-0,93",40,"19.800,00","19.800,00",GRNT,2016-02-16
17.02.2016,"492,00","495,00","492,00","492,53","-0,50",740,"364.473,00","364.473,00",GRNT,2016-02-17
18.02.2016,"495,00","495,00","490,00","490,40","-0,43",944,"462.935,00","462.935,00",GRNT,2016-02-18
22.02.2016,"485,00","495,00","485,00","493,91","0,72",595,"293.875,00","293.875,00",GRNT,2016-02-22
23.02.2016,"490,00","491,00","490,00","490,17","-0,76",605,"296.550,00","296.550,00",GRNT,2016-02-23
24.02.2016,"490,00","490,00","490,00","490,00","-0,03",905,"443.450,00","443.450,00",GRNT,2016-02-24
29.02.2016,"481,00","485,00","481,00","484,50","-1,12",80,"38.760,00","38.760,00",GRNT,2016-02-29
01.03.2016,"485,00","490,00","485,00","488,33","0,79",233,"113.780,00","113.780,00",GRNT,2016-03-01
04.03.2016,"494,00","494,00","494,00","494,00","1,16",112,"55.328,00","55.328,00",GRNT,2016-03-04
08.03.2016,"485,00","485,00","485,00","485,00","-1,82",63,"30.555,00","30.555,00",GRNT,2016-03-08
11.03.2016,"481,00","481,00","481,00","481,00","-0,82",75,"36.075,00","36.075,00",GRNT,2016-03-11
14.03.2016,"489,00","489,00","488,00","488,45","1,55",218,"106.482,00","106.482,00",GRNT,2016-03-14
16.03.2016,"485,00","485,00","485,00","485,00","-0,71",135,"65.475,00","65.475,00",GRNT,2016-03-16
17.03.2016,"480,00","484,00","480,00","481,03","-0,82",907,"436.291,00","436.291,00",GRNT,2016-03-17
18.03.2016,"480,00","480,00","480,00","480,00","-0,21",40,"19.200,00","19.200,00",GRNT,2016-03-18
25.03.2016,"475,00","475,00","475,00","475,00","-1,04","1,233","585.675,00","585.675,00",GRNT,2016-03-25
28.03.2016,"473,00","473,00","470,00","471,46","-0,75",410,"193.300,00","193.300,00",GRNT,2016-03-28
29.03.2016,"461,00","465,00","461,00","463,62","-1,66",333,"154.385,00","154.385,00",GRNT,2016-03-29
30.03.2016,"461,00","461,00","461,00","461,00","-0,57",90,"41.490,00","41.490,00",GRNT,2016-03-30
31.03.2016,"470,00","470,00","470,00","470,00","1,95",568,"266.960,00","266.960,00",GRNT,2016-03-31
01.04.2016,"480,00","480,00","480,00","480,00","2,13",180,"86.400,00","86.400,00",GRNT,2016-04-01
04.04.2016,"480,00","480,00","470,00","475,50","-0,94",333,"158.340,00","158.340,00",GRNT,2016-04-04
05.04.2016,"480,00","480,00","480,00","480,00","0,95",141,"67.680,00","67.680,00",GRNT,2016-04-05
08.04.2016,"470,00","470,00","470,00","470,00","-2,08",400,"188.000,00","188.000,00",GRNT,2016-04-08
11.04.2016,"470,00","470,00","470,00","470,00","0,00",40,"18.800,00","18.800,00",GRNT,2016-04-11
12.04.2016,"479,00","479,00","460,00","464,04","-1,27",940,"436.200,00","436.200,00",GRNT,2016-04-12
13.04.2016,"477,00","477,00","477,00","477,00","2,79",312,"148.824,00","148.824,00",GRNT,2016-04-13
15.04.2016,"470,00","473,00","470,00","470,03","-1,46",202,"94.946,00","94.946,00",GRNT,2016-04-15
18.04.2016,"470,00","473,00","462,00","471,58","0,33",218,"102.804,00","102.804,00",GRNT,2016-04-18
20.04.2016,"465,00","465,00","465,00","465,00","-1,40",100,"46.500,00","46.500,00",GRNT,2016-04-20
22.04.2016,"460,00","460,00","460,00","460,00","-1,08",634,"291.640,00","291.640,00",GRNT,2016-04-22
27.04.2016,"460,00","460,00","459,00","459,56","-0,10",154,"70.773,00","70.773,00",GRNT,2016-04-27
28.04.2016,"469,00","469,00","460,00","464,50","1,07",254,"117.983,00","117.983,00",GRNT,2016-04-28
03.05.2016,"460,00","460,00","460,00","460,00","-0,97",65,"29.900,00","29.900,00",GRNT,2016-05-03
04.05.2016,"465,00","465,00","465,00","465,00","1,09",214,"99.510,00","99.510,00",GRNT,2016-05-04
05.05.2016,"469,00","469,00","469,00","469,00","0,86",65,"30.485,00","30.485,00",GRNT,2016-05-05
06.05.2016,"469,00","469,00","460,00","466,99","-0,43",103,"48.100,00","48.100,00",GRNT,2016-05-06
09.05.2016,"470,00","470,00","470,00","470,00","0,64",100,"47.000,00","47.000,00",GRNT,2016-05-09
10.05.2016,"480,00","480,00","470,00","474,66","0,99",629,"298.560,00","298.560,00",GRNT,2016-05-10
12.05.2016,"465,00","465,00","465,00","465,00","-2,04",77,"35.805,00","35.805,00",GRNT,2016-05-12
13.05.2016,"478,00","478,00","465,00","473,25","1,77",63,"29.815,00","29.815,00",GRNT,2016-05-13
16.05.2016,"461,00","470,00","461,00","466,50","-1,43",515,"240.250,00","240.250,00",GRNT,2016-05-16
17.05.2016,"465,00","465,00","461,00","462,68","-0,82",760,"351.640,00","351.640,00",GRNT,2016-05-17
18.05.2016,"476,00","476,00","468,00","469,03","1,37","1,321","619.590,00","619.590,00",GRNT,2016-05-18
19.05.2016,"480,00","480,00","480,00","480,00","2,34",12,"5.760,00","5.760,00",GRNT,2016-05-19
20.05.2016,"480,00","480,00","480,00","480,00","0,00",38,"18.240,00","18.240,00",GRNT,2016-05-20
23.05.2016,"466,00","466,00","466,00","466,00","-2,92",100,"46.600,00","46.600,00",GRNT,2016-05-23
25.05.2016,"466,00","466,00","466,00","466,00","0,00",53,"24.698,00","24.698,00",GRNT,2016-05-25
31.05.2016,"466,00","466,00","466,00","466,00","0,00",80,"37.280,00","37.280,00",GRNT,2016-05-31
01.06.2016,"460,00","465,00","460,00","464,09","-0,41","1,100","510.500,00","510.500,00",GRNT,2016-06-01
02.06.2016,"460,00","460,00","453,00","457,18","-1,49",251,"114.753,00","114.753,00",GRNT,2016-06-02
06.06.2016,"460,00","466,00","460,00","460,83","0,80",159,"73.272,00","73.272,00",GRNT,2016-06-06
10.06.2016,"464,00","464,00","464,00","464,00","0,69",131,"60.784,00","60.784,00",GRNT,2016-06-10
13.06.2016,"456,00","456,00","455,00","455,77","-1,77",130,"59.250,00","59.250,00",GRNT,2016-06-13
14.06.2016,"460,00","460,00","460,00","460,00","0,93",20,"9.200,00","9.200,00",GRNT,2016-06-14
20.06.2016,"455,00","456,00","455,00","455,50","-0,98",200,"91.100,00","91.100,00",GRNT,2016-06-20
21.06.2016,"452,00","452,00","452,00","452,00","-0,77",250,"113.000,00","113.000,00",GRNT,2016-06-21
22.06.2016,"460,00","460,00","458,00","459,66","1,69",100,"45.966,00","45.966,00",GRNT,2016-06-22
23.06.2016,"458,00","458,00","458,00","458,00","-0,36",198,"90.684,00","90.684,00",GRNT,2016-06-23
24.06.2016,"451,00","451,00","451,00","451,00","-1,53",50,"22.550,00","22.550,00",GRNT,2016-06-24
28.06.2016,"420,00","420,00","420,00","420,00","-6,87",20,"8.400,00","8.400,00",GRNT,2016-06-28
01.07.2016,"450,00","450,00","450,00","450,00","7,14",80,"36.000,00","36.000,00",GRNT,2016-07-01
04.07.2016,"450,00","450,00","449,00","449,69","-0,07",484,"217.650,00","217.650,00",GRNT,2016-07-04
08.07.2016,"457,00","458,00","457,00","457,17","1,66",303,"138.521,00","138.521,00",GRNT,2016-07-08
11.07.2016,"449,00","449,00","449,00","449,00","-1,79",89,"39.961,00","39.961,00",GRNT,2016-07-11
12.07.2016,"449,00","449,00","449,00","449,00","0,00",35,"15.715,00","15.715,00",GRNT,2016-07-12
13.07.2016,"449,00","449,00","449,00","449,00","0,00",265,"118.985,00","118.985,00",GRNT,2016-07-13
14.07.2016,"460,00","460,00","458,00","459,58","2,36","1,026","471.530,00","471.530,00",GRNT,2016-07-14
15.07.2016,"464,00","464,00","464,00","464,00","0,96",101,"46.864,00","46.864,00",GRNT,2016-07-15
19.07.2016,"460,00","460,00","460,00","460,00","-0,86",330,"151.800,00","151.800,00",GRNT,2016-07-19
20.07.2016,"460,00","460,00","460,00","460,00","0,00","1,070","492.200,00","492.200,00",GRNT,2016-07-20
21.07.2016,"471,00","471,00","465,00","466,44","1,40",865,"403.470,00","403.470,00",GRNT,2016-07-21
22.07.2016,"470,00","471,00","470,00","470,26","0,82","1,212","569.959,00","569.959,00",GRNT,2016-07-22
25.07.2016,"480,00","480,00","480,00","480,00","2,07",10,"4.800,00","4.800,00",GRNT,2016-07-25
27.07.2016,"478,00","478,00","475,00","475,71","-0,89",51,"24.261,00","24.261,00",GRNT,2016-07-27
29.07.2016,"480,00","480,00","478,00","478,80","0,65",196,"93.844,00","93.844,00",GRNT,2016-07-29
05.08.2016,"465,00","465,00","465,00","465,00","-2,88",70,"32.550,00","32.550,00",GRNT,2016-08-05
08.08.2016,"460,00","465,00","460,00","462,97","-0,44",841,"389.360,00","389.360,00",GRNT,2016-08-08
09.08.2016,"460,00","460,00","460,00","460,00","-0,64",191,"87.860,00","87.860,00",GRNT,2016-08-09
10.08.2016,"460,00","473,00","460,00","468,79","1,91",340,"159.390,00","159.390,00",GRNT,2016-08-10
11.08.2016,"470,00","470,00","470,00","470,00","0,26",40,"18.800,00","18.800,00",GRNT,2016-08-11
15.08.2016,"476,00","476,00","476,00","476,00","1,28",40,"19.040,00","19.040,00",GRNT,2016-08-15
16.08.2016,"480,00","480,00","476,00","478,95","0,62","1,489","713.156,00","713.156,00",GRNT,2016-08-16
17.08.2016,"500,00","500,00","476,00","484,45","1,15",590,"285.826,00","285.826,00",GRNT,2016-08-17
18.08.2016,"509,00","510,00","506,00","508,45","4,95",550,"279.650,00","279.650,00",GRNT,2016-08-18
19.08.2016,"509,00","509,00","494,00","504,11","-0,85",440,"221.810,00","221.810,00",GRNT,2016-08-19
22.08.2016,"508,00","509,00","505,00","507,81","0,73",636,"322.970,00","322.970,00",GRNT,2016-08-22
23.08.2016,"509,00","510,00","505,00","509,06","0,25","1,398","711.667,00","711.667,00",GRNT,2016-08-23
24.08.2016,"524,00","524,00","508,00","512,29","0,63",898,"460.040,00","460.040,00",GRNT,2016-08-24
25.08.2016,"526,00","527,00","526,00","526,28","2,73",591,"311.034,00","311.034,00",GRNT,2016-08-25
26.08.2016,"540,00","540,00","540,00","540,00","2,61",77,"41.580,00","41.580,00",GRNT,2016-08-26
29.08.2016,"535,00","538,00","535,00","537,34","-0,49",128,"68.780,00","68.780,00",GRNT,2016-08-29
30.08.2016,"515,00","515,00","515,00","515,00","-4,16","1,122","577.830,00","577.830,00",GRNT,2016-08-30
31.08.2016,"511,00","528,00","511,00","520,33","1,03","1,223","636.364,00","636.364,00",GRNT,2016-08-31
01.09.2016,"540,00","540,00","528,00","534,55","2,73","1,732","925.846,00","925.846,00",GRNT,2016-09-01
02.09.2016,"548,00","550,00","548,00","549,18","2,74",122,"67.000,00","67.000,00",GRNT,2016-09-02
05.09.2016,"515,00","547,00","515,00","535,79","-2,44",221,"118.409,00","118.409,00",GRNT,2016-09-05
06.09.2016,"530,00","533,00","510,00","524,40","-2,13",674,"353.446,00","353.446,00",GRNT,2016-09-06
07.09.2016,"530,00","540,00","511,00","528,44","0,77",300,"158.533,00","158.533,00",GRNT,2016-09-07
13.09.2016,"513,00","525,00","513,00","518,92","-1,80",79,"40.995,00","40.995,00",GRNT,2016-09-13
14.09.2016,"520,00","520,00","520,00","520,00","0,21",479,"249.080,00","249.080,00",GRNT,2016-09-14
15.09.2016,"519,00","519,00","518,00","518,86","-0,22","1,036","537.534,00","537.534,00",GRNT,2016-09-15
22.09.2016,"506,00","520,00","506,00","517,72","-0,22",239,"123.734,00","123.734,00",GRNT,2016-09-22
23.09.2016,"530,00","530,00","526,00","527,84","1,95",374,"197.412,00","197.412,00",GRNT,2016-09-23
26.09.2016,"538,00","538,00","537,00","537,38","1,81",81,"43.528,00","43.528,00",GRNT,2016-09-26
27.09.2016,"550,00","550,00","539,00","542,53","0,96",562,"304.900,00","304.900,00",GRNT,2016-09-27
28.09.2016,"527,00","527,00","527,00","527,00","-2,86",150,"79.050,00","79.050,00",GRNT,2016-09-28
29.09.2016,"530,00","530,00","529,00","529,87","0,54",79,"41.860,00","41.860,00",GRNT,2016-09-29
30.09.2016,"529,00","529,00","520,00","526,56","-0,62",369,"194.301,00","194.301,00",GRNT,2016-09-30
03.10.2016,"537,00","537,00","537,00","537,00","1,98",100,"53.700,00","53.700,00",GRNT,2016-10-03
04.10.2016,"537,00","537,00","537,00","537,00","0,00",79,"42.423,00","42.423,00",GRNT,2016-10-04
05.10.2016,"540,00","540,00","537,00","539,26","0,42","2,032","1.095.784,00","1.095.784,00",GRNT,2016-10-05
06.10.2016,"530,00","530,00","530,00","530,00","-1,72",180,"95.400,00","95.400,00",GRNT,2016-10-06
07.10.2016,"530,00","530,00","530,00","530,00","0,00",200,"106.000,00","106.000,00",GRNT,2016-10-07
10.10.2016,"544,00","544,00","544,00","544,00","2,64",100,"54.400,00","54.400,00",GRNT,2016-10-10
12.10.2016,"545,00","545,00","540,00","544,09","0,02",994,"540.822,00","540.822,00",GRNT,2016-10-12
14.10.2016,"525,00","540,00","525,00","535,78","-1,53",160,"85.725,00","85.725,00",GRNT,2016-10-14
18.10.2016,"539,00","539,00","535,00","538,27","0,46",245,"131.875,00","131.875,00",GRNT,2016-10-18
19.10.2016,"540,00","540,00","530,00","534,25","-0,75",605,"323.220,00","323.220,00",GRNT,2016-10-19
20.10.2016,"545,00","545,00","545,00","545,00","2,01",406,"221.270,00","221.270,00",GRNT,2016-10-20
25.10.2016,"543,00","543,00","529,00","539,33","-1,04",381,"205.483,00","205.483,00",GRNT,2016-10-25
26.10.2016,"545,00","545,00","540,00","542,01","0,50","1,225","663.965,00","663.965,00",GRNT,2016-10-26
27.10.2016,"550,00","550,00","540,00","544,93","0,54","1,116","608.140,00","608.140,00",GRNT,2016-10-27
28.10.2016,"555,00","555,00","545,00","554,63","1,78","37,387","20.735.765,00","20.735.765,00",GRNT,2016-10-28
31.10.2016,"610,00","610,00","597,00","603,59","8,83","1,673","1.009.800,00","1.009.800,00",GRNT,2016-10-31
01.11.2016,"625,00","640,00","625,00","637,67","5,65","1,918","1.223.044,00","1.223.044,00",GRNT,2016-11-01
02.11.2016,"635,00","635,00","634,00","634,97","-0,42","2,311","1.467.425,00","1.467.425,00",GRNT,2016-11-02
03.11.2016,"619,00","634,00","619,00","619,12","-2,50",510,"315.750,00","315.750,00",GRNT,2016-11-03
04.11.2016,"600,00","614,00","600,00","601,23","-2,89","1,524","916.270,00","916.270,00",GRNT,2016-11-04
07.11.2016,"601,00","612,00","601,00","601,64","0,07",430,"258.705,00","258.705,00",GRNT,2016-11-07
08.11.2016,"612,00","612,00","604,00","611,75","1,68",781,"477.778,00","477.778,00",GRNT,2016-11-08
09.11.2016,"612,00","612,00","612,00","612,00","0,04",35,"21.420,00","21.420,00",GRNT,2016-11-09
10.11.2016,"612,00","612,00","610,00","611,77","-0,04",886,"542.032,00","542.032,00",GRNT,2016-11-10
11.11.2016,"603,00","610,00","603,00","604,63","-1,17",337,"203.761,00","203.761,00",GRNT,2016-11-11
14.11.2016,"613,00","613,00","613,00","613,00","1,38","1,780","1.091.140,00","1.091.140,00",GRNT,2016-11-14
15.11.2016,"617,00","619,00","611,00","614,16","0,19","1,756","1.078.463,00","1.078.463,00",GRNT,2016-11-15
16.11.2016,"619,00","620,00","618,00","619,28","0,83",803,"497.280,00","497.280,00",GRNT,2016-11-16
17.11.2016,"617,00","619,00","605,00","617,33","-0,31","1,170","722.274,00","722.274,00",GRNT,2016-11-17
18.11.2016,"625,00","635,00","619,00","628,28","1,77","5,052","3.174.051,00","3.174.051,00",GRNT,2016-11-18
21.11.2016,"637,00","637,00","625,00","630,22","0,31",69,"43.485,00","43.485,00",GRNT,2016-11-21
22.11.2016,"631,00","631,00","631,00","631,00","0,12",540,"340.740,00","340.740,00",GRNT,2016-11-22
23.11.2016,"625,00","625,00","613,00","622,36","-1,37",363,"225.915,00","225.915,00",GRNT,2016-11-23
24.11.2016,"625,00","625,00","625,00","625,00","0,42",762,"476.250,00","476.250,00",GRNT,2016-11-24
25.11.2016,"624,00","630,00","620,00","623,96","-0,17",955,"595.880,00","595.880,00",GRNT,2016-11-25
28.11.2016,"622,00","625,00","622,00","623,33","-0,10",180,"112.200,00","112.200,00",GRNT,2016-11-28
29.11.2016,"600,00","619,00","592,00","604,38","-3,04",930,"562.077,00","562.077,00",GRNT,2016-11-29
01.12.2016,"605,00","605,00","600,00","603,43","-0,16",971,"585.930,00","585.930,00",GRNT,2016-12-01
02.12.2016,"620,00","620,00","586,00","586,94","-2,73",611,"358.620,00","358.620,00",GRNT,2016-12-02
05.12.2016,"600,00","620,00","600,00","614,29","4,66",35,"21.500,00","21.500,00",GRNT,2016-12-05
06.12.2016,"610,00","615,00","610,00","610,69","-0,59",232,"141.680,00","141.680,00",GRNT,2016-12-06
07.12.2016,"615,00","615,00","610,00","613,86","0,52",308,"189.070,00","189.070,00",GRNT,2016-12-07
09.12.2016,"615,00","615,00","610,00","614,52","0,11",519,"318.935,00","318.935,00",GRNT,2016-12-09
12.12.2016,"615,00","615,00","583,00","596,33","-2,96",120,"71.560,00","71.560,00",GRNT,2016-12-12
13.12.2016,"586,00","586,00","586,00","586,00","-1,73",240,"140.640,00","140.640,00",GRNT,2016-12-13
14.12.2016,"595,00","595,00","595,00","595,00","1,54",30,"17.850,00","17.850,00",GRNT,2016-12-14
16.12.2016,"580,00","600,00","578,00","579,66","-2,58",685,"397.070,00","397.070,00",GRNT,2016-12-16
20.12.2016,"600,00","600,00","600,00","600,00","3,51",250,"150.000,00","150.000,00",GRNT,2016-12-20
21.12.2016,"610,00","610,00","610,00","610,00","1,67",70,"42.700,00","42.700,00",GRNT,2016-12-21
22.12.2016,"610,00","610,00","600,00","603,37","-1,09",178,"107.400,00","107.400,00",GRNT,2016-12-22
23.12.2016,"591,00","615,00","590,00","613,52","1,68","9,978","6.121.710,00","6.121.710,00",GRNT,2016-12-23
28.12.2016,"589,00","589,00","589,00","589,00","-4,00",100,"58.900,00","58.900,00",GRNT,2016-12-28
29.12.2016,"581,00","581,00","577,00","580,00","-1,53","1,217","705.865,00","705.865,00",GRNT,2016-12-29
03.01.2017,"582,00","582,00","582,00","582,00","0,34",15,"8.730,00","8.730,00",GRNT,2017-01-03
04.01.2017,"590,00","590,00","590,00","590,00","1,37",600,"354.000,00","354.000,00",GRNT,2017-01-04
09.01.2017,"610,00","612,00","600,00","604,45","2,45",173,"104.570,00","104.570,00",GRNT,2017-01-09
10.01.2017,"600,00","600,00","600,00","600,00","-0,74",889,"533.400,00","533.400,00",GRNT,2017-01-10
11.01.2017,"600,00","600,00","600,00","600,00","0,00",197,"118.200,00","118.200,00",GRNT,2017-01-11
12.01.2017,"612,00","612,00","612,00","612,00","2,00",115,"70.380,00","70.380,00",GRNT,2017-01-12
13.01.2017,"612,00","612,00","612,00","612,00","0,00",56,"34.272,00","34.272,00",GRNT,2017-01-13
16.01.2017,"609,00","610,00","609,00","609,47","-0,41","1,054","642.386,00","642.386,00",GRNT,2017-01-16
17.01.2017,"610,00","610,00","607,00","609,56","0,01","1,555","947.869,00","947.869,00",GRNT,2017-01-17
18.01.2017,"610,00","610,00","605,00","609,26","-0,05",470,"286.350,00","286.350,00",GRNT,2017-01-18
20.01.2017,"610,00","610,00","605,00","609,76","0,08",472,"287.805,00","287.805,00",GRNT,2017-01-20
23.01.2017,"610,00","610,00","610,00","610,00","0,04",150,"91.500,00","91.500,00",GRNT,2017-01-23
24.01.2017,"610,00","610,00","610,00","610,00","0,00",349,"212.890,00","212.890,00",GRNT,2017-01-24
25.01.2017,"610,00","610,00","610,00","610,00","0,00",135,"82.350,00","82.350,00",GRNT,2017-01-25
26.01.2017,"614,00","614,00","610,00","610,13","0,02",358,"218.428,00","218.428,00",GRNT,2017-01-26
27.01.2017,"611,00","619,00","611,00","615,00","0,80","1,500","922.503,00","922.503,00",GRNT,2017-01-27
30.01.2017,"610,00","611,00","610,00","610,33","-0,76",300,"183.100,00","183.100,00",GRNT,2017-01-30
31.01.2017,"610,00","610,00","610,00","610,00","-0,05",260,"158.600,00","158.600,00",GRNT,2017-01-31
02.02.2017,"610,00","613,00","610,00","610,66","0,11",703,"429.293,00","429.293,00",GRNT,2017-02-02
03.02.2017,"620,00","628,00","618,00","621,51","1,78","3,042","1.890.640,00","1.890.640,00",GRNT,2017-02-03
06.02.2017,"629,00","629,00","629,00","629,00","1,21",230,"144.670,00","144.670,00",GRNT,2017-02-06
07.02.2017,"611,00","634,00","611,00","620,95","-1,28","1,597","991.658,00","991.658,00",GRNT,2017-02-07
08.02.2017,"639,00","639,00","626,00","636,59","2,52","1,077","685.603,00","685.603,00",GRNT,2017-02-08
09.02.2017,"700,00","700,00","672,00","694,89","9,16","1,505","1.045.805,00","1.045.805,00",GRNT,2017-02-09
10.02.2017,"683,00","683,00","682,00","682,76","-1,75","1,510","1.030.970,00","1.030.970,00",GRNT,2017-02-10
13.02.2017,"695,00","695,00","695,00","695,00","1,79",78,"54.210,00","54.210,00",GRNT,2017-02-13
14.02.2017,"696,00","696,00","695,00","695,31","0,04",360,"250.310,00","250.310,00",GRNT,2017-02-14
15.02.2017,"695,00","695,00","680,00","689,65","-0,81",310,"213.790,00","213.790,00",GRNT,2017-02-15
16.02.2017,"685,00","697,00","685,00","693,58","0,57",800,"554.864,00","554.864,00",GRNT,2017-02-16
17.02.2017,"675,00","675,00","673,00","674,40","-2,77",235,"158.485,00","158.485,00",GRNT,2017-02-17
21.02.2017,"670,00","670,00","670,00","670,00","-0,65",100,"67.000,00","67.000,00",GRNT,2017-02-21
22.02.2017,"650,00","658,00","650,00","652,04","-2,68",963,"627.918,00","627.918,00",GRNT,2017-02-22
24.02.2017,"680,00","680,00","651,00","660,30","1,27",380,"250.915,00","250.915,00",GRNT,2017-02-24
27.02.2017,"670,00","670,00","670,00","670,00","1,47",300,"201.000,00","201.000,00",GRNT,2017-02-27
28.02.2017,"671,00","671,00","670,00","670,44","0,07","3,765","2.524.190,00","2.524.190,00",GRNT,2017-02-28
01.03.2017,"690,00","690,00","680,00","688,05","2,63","1,485","1.021.756,00","1.021.756,00",GRNT,2017-03-01
02.03.2017,"685,00","690,00","685,00","686,03","-0,29",623,"427.395,00","427.395,00",GRNT,2017-03-02
03.03.2017,"690,00","690,00","680,00","688,42","0,35",678,"466.750,00","466.750,00",GRNT,2017-03-03
06.03.2017,"681,00","690,00","681,00","689,36","0,14","2,173","1.497.971,00","1.497.971,00",GRNT,2017-03-06
07.03.2017,"680,00","690,00","680,00","680,93","-1,22","4,280","2.914.400,00","2.914.400,00",GRNT,2017-03-07
08.03.2017,"689,00","689,00","689,00","689,00","1,19",5,"3.445,00","3.445,00",GRNT,2017-03-08
09.03.2017,"680,00","680,00","679,00","679,87","-1,33","2,981","2.026.701,00","2.026.701,00",GRNT,2017-03-09
10.03.2017,"674,00","680,00","674,00","674,55","-0,78",182,"122.768,00","122.768,00",GRNT,2017-03-10
13.03.2017,"680,00","685,00","680,00","680,45","0,87",110,"74.850,00","74.850,00",GRNT,2017-03-13
14.03.2017,"684,00","685,00","680,00","682,09","0,24",412,"281.020,00","281.020,00",GRNT,2017-03-14
15.03.2017,"680,00","680,00","679,00","679,87","-0,33",763,"518.740,00","518.740,00",GRNT,2017-03-15
16.03.2017,"688,00","689,00","688,00","688,09","1,21",172,"118.351,00","118.351,00",GRNT,2017-03-16
17.03.2017,"685,00","685,00","685,00","685,00","-0,45",127,"86.995,00","86.995,00",GRNT,2017-03-17
20.03.2017,"689,00","689,00","671,00","675,45","-1,39",658,"444.444,00","444.444,00",GRNT,2017-03-20
21.03.2017,"680,00","680,00","679,00","679,64","0,62","8,328","5.660.012,00","5.660.012,00",GRNT,2017-03-21
22.03.2017,"680,00","680,00","680,00","680,00","0,05",700,"476.000,00","476.000,00",GRNT,2017-03-22
24.03.2017,"680,00","681,00","680,00","680,02","0,00","6,121","4.162.401,00","4.162.401,00",GRNT,2017-03-24
27.03.2017,"680,00","680,00","680,00","680,00","0,00","1,456","990.080,00","990.080,00",GRNT,2017-03-27
28.03.2017,"680,00","684,00","680,00","680,28","0,04","2,871","1.953.081,00","1.953.081,00",GRNT,2017-03-28
29.03.2017,"680,00","680,00","672,00","678,78","-0,22",845,"573.565,00","573.565,00",GRNT,2017-03-29
31.03.2017,"680,00","680,00","680,00","680,00","0,18",570,"387.600,00","387.600,00",GRNT,2017-03-31
03.04.2017,"670,00","671,00","670,00","670,30","-1,43","3,362","2.253.540,00","2.253.540,00",GRNT,2017-04-03
04.04.2017,"670,00","670,00","670,00","670,00","-0,04",975,"653.250,00","653.250,00",GRNT,2017-04-04
05.04.2017,"680,00","680,00","680,00","680,00","1,49","1,300","884.000,00","884.000,00",GRNT,2017-04-05
06.04.2017,"679,00","680,00","679,00","679,46","-0,08",476,"323.424,00","323.424,00",GRNT,2017-04-06
07.04.2017,"680,00","680,00","679,00","679,67","0,03",452,"307.213,00","307.213,00",GRNT,2017-04-07
10.04.2017,"684,00","684,00","680,00","680,20","0,08",143,"97.268,00","97.268,00",GRNT,2017-04-10
11.04.2017,"671,00","679,00","671,00","675,31","-0,72",960,"648.296,00","648.296,00",GRNT,2017-04-11
12.04.2017,"670,00","671,00","670,00","670,70","-0,68",492,"329.986,00","329.986,00",GRNT,2017-04-12
13.04.2017,"670,00","670,00","670,00","670,00","-0,10",725,"485.750,00","485.750,00",GRNT,2017-04-13
18.04.2017,"670,00","680,00","670,00","679,95","1,49","4,434","3.014.900,00","3.014.900,00",GRNT,2017-04-18
19.04.2017,"680,00","680,00","680,00","680,00","0,01","4,701","3.196.680,00","3.196.680,00",GRNT,2017-04-19
24.04.2017,"680,00","681,00","670,00","679,15","-0,12",822,"558.260,00","558.260,00",GRNT,2017-04-24
28.04.2017,"669,00","670,00","669,00","669,96","-1,35",520,"348.380,00","348.380,00",GRNT,2017-04-28
02.05.2017,"670,00","670,00","670,00","670,00","0,01",382,"255.940,00","255.940,00",GRNT,2017-05-02
04.05.2017,"679,00","679,00","669,00","674,05","0,60",729,"491.386,00","491.386,00",GRNT,2017-05-04
05.05.2017,"679,00","679,00","670,00","670,22","-0,57","1,493","1.000.637,00","1.000.637,00",GRNT,2017-05-05
08.05.2017,"671,00","671,00","670,00","670,83","0,09",270,"181.123,00","181.123,00",GRNT,2017-05-08
09.05.2017,"675,00","675,00","671,00","674,48","0,54","1,150","775.650,00","775.650,00",GRNT,2017-05-09
10.05.2017,"680,00","690,00","679,00","679,73","0,78","2,261","1.536.863,00","1.536.863,00",GRNT,2017-05-10
11.05.2017,"686,00","700,00","673,00","684,02","0,63","1,673","1.144.358,00","1.144.358,00",GRNT,2017-05-11
12.05.2017,"700,00","700,00","700,00","700,00","2,34","1,736","1.215.200,00","1.215.200,00",GRNT,2017-05-12
15.05.2017,"700,00","700,00","700,00","700,00","0,00",116,"81.200,00","81.200,00",GRNT,2017-05-15
16.05.2017,"680,00","680,00","680,00","680,00","-2,86",330,"224.400,00","224.400,00",GRNT,2017-05-16
17.05.2017,"700,00","700,00","690,00","697,76","2,61","1,515","1.057.100,00","1.057.100,00",GRNT,2017-05-17
18.05.2017,"710,00","710,00","705,00","708,23","1,50","1,833","1.298.185,00","1.298.185,00",GRNT,2017-05-18
19.05.2017,"740,00","740,00","710,00","725,47","2,43","1,341","972.853,00","972.853,00",GRNT,2017-05-19
22.05.2017,"749,00","750,00","747,00","749,38","3,30","1,641","1.229.727,00","1.229.727,00",GRNT,2017-05-22
23.05.2017,"742,00","742,00","732,00","737,42","-1,60",378,"278.746,00","278.746,00",GRNT,2017-05-23
26.05.2017,"720,00","735,00","720,00","731,10","-0,86",77,"56.295,00","56.295,00",GRNT,2017-05-26
29.05.2017,"734,00","734,00","721,00","724,90","-0,85",649,"470.463,00","470.463,00",GRNT,2017-05-29
30.05.2017,"725,00","735,00","725,00","730,90","0,83",122,"89.170,00","89.170,00",GRNT,2017-05-30
31.05.2017,"735,00","750,00","731,00","737,64","0,92","2,248","1.658.211,00","1.658.211,00",GRNT,2017-05-31
01.06.2017,"760,00","760,00","759,00","759,29","2,94","3,170","2.406.951,00","2.406.951,00",GRNT,2017-06-01
05.06.2017,"777,00","780,00","777,00","778,06","2,47","1,692","1.316.479,00","1.316.479,00",GRNT,2017-06-05
06.06.2017,"760,00","770,00","760,00","766,48","-1,49","1,076","824.728,00","824.728,00",GRNT,2017-06-06
07.06.2017,"756,00","760,00","756,00","759,94","-0,85",676,"513.720,00","513.720,00",GRNT,2017-06-07
08.06.2017,"760,00","760,00","760,00","760,00","0,01",580,"440.800,00","440.800,00",GRNT,2017-06-08
09.06.2017,"770,00","770,00","770,00","770,00","1,32",50,"38.500,00","38.500,00",GRNT,2017-06-09
12.06.2017,"770,00","770,00","761,00","769,63","-0,05",778,"598.772,00","598.772,00",GRNT,2017-06-12
14.06.2017,"770,00","770,00","769,00","769,89","0,03","1,787","1.375.800,00","1.375.800,00",GRNT,2017-06-14
15.06.2017,"770,00","770,00","770,00","770,00","0,01",940,"723.800,00","723.800,00",GRNT,2017-06-15
16.06.2017,"761,00","761,00","761,00","761,00","-1,17",20,"15.220,00","15.220,00",GRNT,2017-06-16
19.06.2017,"770,00","770,00","770,00","770,00","1,18","1,788","1.376.760,00","1.376.760,00",GRNT,2017-06-19
20.06.2017,"769,00","770,00","769,00","769,11","-0,12",338,"259.960,00","259.960,00",GRNT,2017-06-20
21.06.2017,"760,00","769,00","760,00","767,66","-0,19",759,"582.656,00","582.656,00",GRNT,2017-06-21
22.06.2017,"756,00","756,00","756,00","756,00","-1,52",80,"60.480,00","60.480,00",GRNT,2017-06-22
23.06.2017,"760,00","768,00","757,00","759,67","0,49",324,"246.132,00","246.132,00",GRNT,2017-06-23
27.06.2017,"757,00","757,00","752,00","755,64","-0,53","2,103","1.589.102,00","1.589.102,00",GRNT,2017-06-27
28.06.2017,"720,00","720,00","720,00","720,00","-4,72",250,"180.000,00","180.000,00",GRNT,2017-06-28
29.06.2017,"720,00","730,00","706,00","719,72","-0,04","3,027","2.178.600,00","2.178.600,00",GRNT,2017-06-29
30.06.2017,"739,00","739,00","739,00","739,00","2,68",5,"3.695,00","3.695,00",GRNT,2017-06-30
03.07.2017,"730,00","730,00","730,00","730,00","-1,22",245,"178.850,00","178.850,00",GRNT,2017-07-03
04.07.2017,"720,00","730,00","715,00","719,72","-1,41","1,321","950.750,00","950.750,00",GRNT,2017-07-04
05.07.2017,"720,00","720,00","720,00","720,00","0,04",125,"90.000,00","90.000,00",GRNT,2017-07-05
06.07.2017,"720,00","720,00","720,00","720,00","0,00",125,"90.000,00","90.000,00",GRNT,2017-07-06
10.07.2017,"740,00","740,00","722,00","737,46","2,42",741,"546.460,00","546.460,00",GRNT,2017-07-10
11.07.2017,"740,00","740,00","740,00","740,00","0,34","2,725","2.016.500,00","2.016.500,00",GRNT,2017-07-11
12.07.2017,"740,00","740,00","739,00","739,81","-0,03","6,931","5.127.600,00","5.127.600,00",GRNT,2017-07-12
13.07.2017,"750,00","751,00","740,00","743,63","0,52",399,"296.710,00","296.710,00",GRNT,2017-07-13
14.07.2017,"759,00","759,00","759,00","759,00","2,07",25,"18.975,00","18.975,00",GRNT,2017-07-14
17.07.2017,"751,00","759,00","751,00","753,91","-0,67",550,"414.650,00","414.650,00",GRNT,2017-07-17
18.07.2017,"769,00","769,00","755,00","760,39","0,86","2,677","2.035.560,00","2.035.560,00",GRNT,2017-07-18
19.07.2017,"765,00","768,00","760,00","762,41","0,27",731,"557.322,00","557.322,00",GRNT,2017-07-19
20.07.2017,"769,00","769,00","765,00","768,43","0,79","2,651","2.037.118,00","2.037.118,00",GRNT,2017-07-20
21.07.2017,"800,00","800,00","780,00","792,81","3,17","1,910","1.514.273,00","2.670.573,00",GRNT,2017-07-21
24.07.2017,"844,00","844,00","820,00","829,74","4,66","1,041","863.756,00","863.756,00",GRNT,2017-07-24
25.07.2017,"805,00","830,00","805,00","813,31","-1,98",856,"696.190,00","696.190,00",GRNT,2017-07-25
27.07.2017,"791,00","800,00","791,00","791,79","-2,65",379,"300.089,00","300.089,00",GRNT,2017-07-27
28.07.2017,"780,00","780,00","780,00","780,00","-1,49",135,"105.300,00","105.300,00",GRNT,2017-07-28
31.07.2017,"803,00","803,00","778,00","797,85","2,29",400,"319.140,00","319.140,00",GRNT,2017-07-31
01.08.2017,"815,00","815,00","814,00","814,66","2,11",400,"325.865,00","6.877.865,00",GRNT,2017-08-01
03.08.2017,"815,00","815,00","815,00","815,00","0,04",405,"330.075,00","330.075,00",GRNT,2017-08-03
04.08.2017,"820,00","821,00","820,00","820,33","0,65",317,"260.044,00","260.044,00",GRNT,2017-08-04
07.08.2017,"844,00","844,00","830,00","843,49","2,82","1,731","1.460.080,00","1.460.080,00",GRNT,2017-08-07
08.08.2017,"855,00","855,00","854,00","854,66","1,32","1,504","1.285.416,00","1.285.416,00",GRNT,2017-08-08
09.08.2017,"860,00","860,00","855,00","855,24","0,07",616,"526.830,00","526.830,00",GRNT,2017-08-09
14.08.2017,"850,00","850,00","850,00","850,00","-0,61","1,017","864.450,00","864.450,00",GRNT,2017-08-14
15.08.2017,"840,00","850,00","837,00","842,72","-0,86","2,268","1.911.300,00","1.911.300,00",GRNT,2017-08-15
16.08.2017,"840,00","840,00","835,00","836,24","-0,77","1,011","845.435,00","845.435,00",GRNT,2017-08-16
17.08.2017,"839,00","848,00","839,00","846,04","1,17",460,"389.180,00","389.180,00",GRNT,2017-08-17
18.08.2017,"837,00","840,00","836,00","839,48","-0,78",361,"303.051,00","303.051,00",GRNT,2017-08-18
21.08.2017,"837,00","837,00","837,00","837,00","-0,30",30,"25.110,00","25.110,00",GRNT,2017-08-21
22.08.2017,"848,00","850,00","845,00","848,80","1,41","1,385","1.175.590,00","1.175.590,00",GRNT,2017-08-22
23.08.2017,"870,00","870,00","855,00","869,15","2,40","1,610","1.399.330,00","1.399.330,00",GRNT,2017-08-23
24.08.2017,"873,00","875,00","873,00","873,60","0,51",666,"581.818,00","581.818,00",GRNT,2017-08-24
25.08.2017,"873,00","880,00","873,00","877,42","0,44",892,"782.655,00","782.655,00",GRNT,2017-08-25
29.08.2017,"890,00","890,00","872,00","888,88","1,31","2,325","2.066.646,00","2.066.646,00",GRNT,2017-08-29
30.08.2017,"870,00","870,00","869,00","869,98","-2,13",906,"788.199,00","788.199,00",GRNT,2017-08-30
31.08.2017,"878,00","878,00","878,00","878,00","0,92",50,"43.900,00","43.900,00",GRNT,2017-08-31
01.09.2017,"870,00","870,00","870,00","870,00","-0,91",100,"87.000,00","87.000,00",GRNT,2017-09-01
04.09.2017,"870,00","870,00","870,00","870,00","0,00",826,"718.620,00","718.620,00",GRNT,2017-09-04
05.09.2017,"870,00","875,00","870,00","871,18","0,14",600,"522.710,00","522.710,00",GRNT,2017-09-05
06.09.2017,"875,00","880,00","872,00","875,29","0,47",200,"175.058,00","175.058,00",GRNT,2017-09-06
11.09.2017,"885,00","885,00","880,00","880,82","0,63","1,340","1.180.300,00","1.180.300,00",GRNT,2017-09-11
12.09.2017,"890,00","890,00","876,00","888,58","0,88","3,930","3.492.122,00","3.492.122,00",GRNT,2017-09-12
14.09.2017,"880,00","890,00","880,00","886,73","-0,21","1,653","1.465.772,00","1.465.772,00",GRNT,2017-09-14
15.09.2017,"890,00","890,00","888,00","889,39","0,30",734,"652.813,00","652.813,00",GRNT,2017-09-15
18.09.2017,"880,00","880,00","880,00","880,00","-1,06",50,"44.000,00","44.000,00",GRNT,2017-09-18
19.09.2017,"880,00","880,00","880,00","880,00","0,00",250,"220.000,00","220.000,00",GRNT,2017-09-19
20.09.2017,"890,00","890,00","870,00","878,70","-0,15","1,909","1.677.430,00","1.677.430,00",GRNT,2017-09-20
22.09.2017,"870,00","870,00","870,00","870,00","-0,99",175,"152.250,00","152.250,00",GRNT,2017-09-22
25.09.2017,"865,00","870,00","865,00","869,20","-0,09",268,"232.945,00","232.945,00",GRNT,2017-09-25
27.09.2017,"856,00","878,00","851,00","864,84","-0,50",990,"856.190,00","856.190,00",GRNT,2017-09-27
28.09.2017,"860,00","860,00","860,00","860,00","-0,56",66,"56.760,00","56.760,00",GRNT,2017-09-28
29.09.2017,"850,00","850,00","850,00","850,00","-1,16",910,"773.500,00","773.500,00",GRNT,2017-09-29
02.10.2017,"850,00","850,00","850,00","850,00","0,00",280,"238.000,00","238.000,00",GRNT,2017-10-02
03.10.2017,"825,00","826,00","825,00","825,23","-2,91","1,295","1.068.675,00","1.068.675,00",GRNT,2017-10-03
04.10.2017,"825,00","828,00","825,00","826,32","0,13","1,129","932.914,00","932.914,00",GRNT,2017-10-04
05.10.2017,"830,00","830,00","830,00","830,00","0,45",45,"37.350,00","37.350,00",GRNT,2017-10-05
06.10.2017,"830,00","830,00","830,00","830,00","0,00",975,"809.250,00","809.250,00",GRNT,2017-10-06
09.10.2017,"853,00","854,00","850,00","852,79","2,75",116,"98.924,00","98.924,00",GRNT,2017-10-09
10.10.2017,"832,00","835,00","832,00","833,75","-2,23",60,"50.025,00","50.025,00",GRNT,2017-10-10
13.10.2017,"835,00","835,00","832,00","834,14","0,05",313,"261.085,00","261.085,00",GRNT,2017-10-13
16.10.2017,"859,00","859,00","858,00","858,35","2,90",200,"171.670,00","171.670,00",GRNT,2017-10-16
17.10.2017,"855,00","856,00","855,00","855,55","-0,33",100,"85.555,00","85.555,00",GRNT,2017-10-17
18.10.2017,"850,00","855,00","850,00","853,57","-0,23",140,"119.500,00","119.500,00",GRNT,2017-10-18
19.10.2017,"830,00","832,00","830,00","831,36","-2,60",134,"111.402,00","111.402,00",GRNT,2017-10-19
24.10.2017,"835,00","836,00","835,00","835,05","0,44","1,423","1.188.275,00","1.188.275,00",GRNT,2017-10-24
25.10.2017,"833,00","835,00","833,00","834,73","-0,04",445,"371.455,00","371.455,00",GRNT,2017-10-25
26.10.2017,"830,00","840,00","830,00","832,72","-0,24","1,063","885.180,00","885.180,00",GRNT,2017-10-26
27.10.2017,"825,00","832,00","825,00","829,22","-0,42",450,"373.150,00","373.150,00",GRNT,2017-10-27
30.10.2017,"830,00","830,00","821,00","827,09","-0,26",443,"366.403,00","366.403,00",GRNT,2017-10-30
31.10.2017,"820,00","830,00","820,00","825,00","-0,25",300,"247.500,00","247.500,00",GRNT,2017-10-31
01.11.2017,"840,00","840,00","830,00","832,00","0,85",125,"104.000,00","104.000,00",GRNT,2017-11-01
02.11.2017,"850,00","850,00","840,00","843,75","1,41",400,"337.500,00","337.500,00",GRNT,2017-11-02
03.11.2017,"836,00","836,00","836,00","836,00","-0,92",180,"150.480,00","150.480,00",GRNT,2017-11-03
06.11.2017,"835,00","849,00","835,00","836,00","0,00",325,"271.700,00","271.700,00",GRNT,2017-11-06
07.11.2017,"835,00","835,00","835,00","835,00","-0,12",160,"133.600,00","133.600,00",GRNT,2017-11-07
08.11.2017,"840,00","840,00","840,00","840,00","0,60",232,"194.880,00","194.880,00",GRNT,2017-11-08
09.11.2017,"845,00","845,00","840,00","840,36","0,04",249,"209.250,00","209.250,00",GRNT,2017-11-09
10.11.2017,"834,00","835,00","834,00","834,12","-0,74",80,"66.730,00","66.730,00",GRNT,2017-11-10
13.11.2017,"830,00","835,00","830,00","830,31","-0,46",540,"448.370,00","448.370,00",GRNT,2017-11-13
14.11.2017,"839,00","840,00","839,00","839,67","1,13",45,"37.785,00","37.785,00",GRNT,2017-11-14
15.11.2017,"830,00","830,00","830,00","830,00","-1,15",469,"389.270,00","389.270,00",GRNT,2017-11-15
16.11.2017,"830,00","831,00","830,00","830,89","0,11",437,"363.097,00","363.097,00",GRNT,2017-11-16
20.11.2017,"822,00","830,00","821,00","825,36","-0,67","1,505","1.242.166,00","1.242.166,00",GRNT,2017-11-20
21.11.2017,"801,00","801,00","801,00","801,00","-2,95",100,"80.100,00","80.100,00",GRNT,2017-11-21
22.11.2017,"785,00","818,00","785,00","808,46","0,93",195,"157.650,00","157.650,00",GRNT,2017-11-22
23.11.2017,"780,00","787,00","780,00","783,48","-3,09",544,"426.213,00","426.213,00",GRNT,2017-11-23
24.11.2017,"780,00","780,00","780,00","780,00","-0,44",40,"31.200,00","31.200,00",GRNT,2017-11-24
27.11.2017,"781,00","800,00","781,00","783,71","0,48",28,"21.944,00","21.944,00",GRNT,2017-11-27
28.11.2017,"792,00","800,00","780,00","797,43","1,75",303,"241.620,00","241.620,00",GRNT,2017-11-28
29.11.2017,"800,00","800,00","800,00","800,00","0,32",776,"620.800,00","620.800,00",GRNT,2017-11-29
30.11.2017,"799,00","799,00","799,00","799,00","-0,12",20,"15.980,00","15.980,00",GRNT,2017-11-30
05.12.2017,"781,00","786,00","781,00","781,59","-2,18",170,"132.870,00","132.870,00",GRNT,2017-12-05
13.12.2017,"759,00","759,00","759,00","759,00","-2,89",11,"8.349,00","8.349,00",GRNT,2017-12-13
14.12.2017,"759,00","759,00","750,00","755,88","-0,41",288,"217.692,00","217.692,00",GRNT,2017-12-14
15.12.2017,"760,00","775,00","751,00","762,38","0,86",360,"274.458,00","274.458,00",GRNT,2017-12-15
18.12.2017,"760,00","774,00","760,00","766,80","0,58",633,"485.385,00","485.385,00",GRNT,2017-12-18
19.12.2017,"760,00","760,00","760,00","760,00","-0,89",18,"13.680,00","13.680,00",GRNT,2017-12-19
20.12.2017,"760,00","760,00","760,00","760,00","0,00",232,"176.320,00","176.320,00",GRNT,2017-12-20
21.12.2017,"757,00","757,00","757,00","757,00","-0,39",1,"757,00","757,00",GRNT,2017-12-21
22.12.2017,"765,00","765,00","765,00","765,00","1,06",105,"80.325,00","80.325,00",GRNT,2017-12-22
25.12.2017,"757,00","770,00","757,00","763,00","-0,26",70,"53.410,00","53.410,00",GRNT,2017-12-25
27.12.2017,"752,00","757,00","752,00","752,31","-1,40",780,"586.805,00","586.805,00",GRNT,2017-12-27
28.12.2017,"775,00","775,00","767,00","771,80","2,59",674,"520.194,00","520.194,00",GRNT,2017-12-28
02.01.2018,"790,00","790,00","780,00","788,52","2,17","1,233","972.240,00","972.240,00",GRNT,2018-01-02
03.01.2018,"775,00","775,00","775,00","775,00","-1,71",48,"37.200,00","37.200,00",GRNT,2018-01-03
04.01.2018,"790,00","790,00","790,00","790,00","1,94",177,"139.830,00","139.830,00",GRNT,2018-01-04
05.01.2018,"790,00","790,00","790,00","790,00","0,00",400,"316.000,00","316.000,00",GRNT,2018-01-05
10.01.2018,"772,00","780,00","772,00","774,86","-1,92",28,"21.696,00","21.696,00",GRNT,2018-01-10
11.01.2018,"798,00","798,00","780,00","793,25","2,37",282,"223.696,00","223.696,00",GRNT,2018-01-11
12.01.2018,"797,00","797,00","797,00","797,00","0,47",50,"39.850,00","39.850,00",GRNT,2018-01-12
15.01.2018,"796,00","800,00","796,00","799,64","0,33","1,985","1.587.292,00","1.587.292,00",GRNT,2018-01-15
16.01.2018,"810,00","810,00","800,00","802,59","0,37",263,"211.080,00","211.080,00",GRNT,2018-01-16
17.01.2018,"840,00","840,00","811,00","821,42","2,35","1,445","1.186.952,00","1.186.952,00",GRNT,2018-01-17
18.01.2018,"820,00","830,00","820,00","824,02","0,32",758,"624.610,00","624.610,00",GRNT,2018-01-18
22.01.2018,"830,00","830,00","830,00","830,00","0,73",220,"182.600,00","182.600,00",GRNT,2018-01-22
23.01.2018,"830,00","830,00","830,00","830,00","0,00",420,"348.600,00","348.600,00",GRNT,2018-01-23
24.01.2018,"830,00","830,00","830,00","830,00","0,00","1,116","926.280,00","926.280,00",GRNT,2018-01-24
25.01.2018,"830,00","830,00","830,00","830,00","0,00","3,558","2.953.140,00","2.953.140,00",GRNT,2018-01-25
26.01.2018,"850,00","850,00","831,00","844,80","1,78",958,"809.315,00","809.315,00",GRNT,2018-01-26
29.01.2018,"870,00","870,00","840,00","868,97","2,86",329,"285.890,00","285.890,00",GRNT,2018-01-29
30.01.2018,"865,00","870,00","865,00","869,14","0,02",581,"504.970,00","504.970,00",GRNT,2018-01-30
31.01.2018,"852,00","870,00","850,00","857,74","-1,31",814,"698.200,00","698.200,00",GRNT,2018-01-31
01.02.2018,"865,00","865,00","865,00","865,00","0,85",315,"272.475,00","272.475,00",GRNT,2018-02-01
02.02.2018,"868,00","869,00","867,00","868,41","0,39",295,"256.180,00","256.180,00",GRNT,2018-02-02
05.02.2018,"845,00","850,00","843,00","846,44","-2,53",259,"219.227,00","219.227,00",GRNT,2018-02-05
06.02.2018,"822,00","845,00","822,00","829,00","-2,06",740,"613.460,00","613.460,00",GRNT,2018-02-06
07.02.2018,"820,00","821,00","820,00","820,51","-1,02",877,"719.587,00","719.587,00",GRNT,2018-02-07
08.02.2018,"820,00","821,00","820,00","820,87","0,04",518,"425.210,00","425.210,00",GRNT,2018-02-08
09.02.2018,"820,00","820,00","820,00","820,00","-0,11",500,"410.000,00","410.000,00",GRNT,2018-02-09
12.02.2018,"820,00","820,00","820,00","820,00","0,00",30,"24.600,00","24.600,00",GRNT,2018-02-12
13.02.2018,"815,00","820,00","814,00","816,76","-0,40","2,171","1.773.194,00","1.773.194,00",GRNT,2018-02-13
14.02.2018,"817,00","817,00","810,00","814,04","-0,33","1,154","939.403,00","939.403,00",GRNT,2018-02-14
15.02.2018,"820,00","820,00","815,00","816,03","0,24",258,"210.535,00","210.535,00",GRNT,2018-02-15
16.02.2018,"820,00","820,00","820,00","820,00","0,49",580,"475.600,00","475.600,00",GRNT,2018-02-16
19.02.2018,"810,00","811,00","810,00","810,50","-1,16",200,"162.100,00","162.100,00",GRNT,2018-02-19
20.02.2018,"810,00","810,00","810,00","810,00","-0,06",20,"16.200,00","16.200,00",GRNT,2018-02-20
21.02.2018,"810,00","810,00","806,00","809,72","-0,03",323,"261.538,00","261.538,00",GRNT,2018-02-21
22.02.2018,"810,00","810,00","810,00","810,00","0,03",600,"486.000,00","486.000,00",GRNT,2018-02-22
23.02.2018,"818,00","818,00","818,00","818,00","0,99",50,"40.900,00","40.900,00",GRNT,2018-02-23
26.02.2018,"810,00","810,00","810,00","810,00","-0,98",500,"405.000,00","405.000,00",GRNT,2018-02-26
27.02.2018,"807,00","807,00","807,00","807,00","-0,37",500,"403.500,00","403.500,00",GRNT,2018-02-27
28.02.2018,"807,00","807,00","807,00","807,00","0,00",200,"161.400,00","161.400,00",GRNT,2018-02-28
01.03.2018,"800,00","807,00","800,00","804,81","-0,27",900,"724.327,00","724.327,00",GRNT,2018-03-01
02.03.2018,"782,00","782,00","782,00","782,00","-2,83",35,"27.370,00","27.370,00",GRNT,2018-03-02
05.03.2018,"800,00","810,00","800,00","802,14","2,58",370,"296.790,00","296.790,00",GRNT,2018-03-05
06.03.2018,"790,00","800,00","790,00","799,51","-0,33",814,"650.800,00","650.800,00",GRNT,2018-03-06
07.03.2018,"790,00","790,00","790,00","790,00","-1,19",389,"307.310,00","307.310,00",GRNT,2018-03-07
08.03.2018,"790,00","791,00","790,00","790,26","0,03","1,371","1.083.440,00","1.083.440,00",GRNT,2018-03-08
09.03.2018,"790,00","790,00","790,00","790,00","-0,03",320,"252.800,00","252.800,00",GRNT,2018-03-09
12.03.2018,"790,00","790,00","790,00","790,00","0,00",128,"101.120,00","101.120,00",GRNT,2018-03-12
13.03.2018,"782,00","790,00","782,00","787,78","-0,28",338,"266.268,00","266.268,00",GRNT,2018-03-13
14.03.2018,"790,00","805,00","781,00","794,27","0,82","1,005","798.246,00","798.246,00",GRNT,2018-03-14
16.03.2018,"799,00","799,00","780,00","787,11","-0,90","1,018","801.279,00","2.314.579,00",GRNT,2018-03-16
19.03.2018,"781,00","781,00","781,00","781,00","-0,78",60,"46.860,00","46.860,00",GRNT,2018-03-19
20.03.2018,"781,00","789,00","780,00","781,65","0,08","1,002","783.212,00","783.212,00",GRNT,2018-03-20
21.03.2018,"781,00","781,00","781,00","781,00","-0,08",340,"265.540,00","265.540,00",GRNT,2018-03-21
22.03.2018,"780,00","782,00","780,00","780,19","-0,10","1,335","1.041.548,00","1.041.548,00",GRNT,2018-03-22
26.03.2018,"780,00","780,00","780,00","780,00","-0,02",150,"117.000,00","117.000,00",GRNT,2018-03-26
27.03.2018,"775,00","780,00","774,00","776,34","-0,47",440,"341.590,00","341.590,00",GRNT,2018-03-27
28.03.2018,"766,00","766,00","766,00","766,00","-1,33",20,"15.320,00","15.320,00",GRNT,2018-03-28
29.03.2018,"750,00","767,00","750,00","754,31","-1,53",535,"403.555,00","403.555,00",GRNT,2018-03-29
30.03.2018,"757,00","757,00","750,00","751,81","-0,33",323,"242.835,00","242.835,00",GRNT,2018-03-30
02.04.2018,"735,00","752,00","735,00","747,98","-0,51",214,"160.067,00","160.067,00",GRNT,2018-04-02
03.04.2018,"740,00","740,00","740,00","740,00","-1,07",100,"74.000,00","74.000,00",GRNT,2018-04-03
04.04.2018,"750,00","756,00","750,00","752,68","1,71","1,030","775.260,00","775.260,00",GRNT,2018-04-04
05.04.2018,"731,00","748,00","731,00","734,91","-2,36",470,"345.410,00","345.410,00",GRNT,2018-04-05
10.04.2018,"728,00","731,00","728,00","728,63","-0,85","1,900","1.384.400,00","1.384.400,00",GRNT,2018-04-10
11.04.2018,"700,00","713,00","700,00","707,13","-2,95",545,"385.385,00","385.385,00",GRNT,2018-04-11
13.04.2018,"690,00","699,00","690,00","691,95","-2,15","4,150","2.871.600,00","2.871.600,00",GRNT,2018-04-13
16.04.2018,"700,00","701,00","689,00","692,68","0,11","3,077","2.131.370,00","2.131.370,00",GRNT,2018-04-16
17.04.2018,"713,00","713,00","713,00","713,00","2,93",10,"7.130,00","7.130,00",GRNT,2018-04-17
18.04.2018,"730,00","734,00","713,00","728,97","2,24","4,092","2.982.932,00","2.982.932,00",GRNT,2018-04-18
19.04.2018,"730,00","730,00","730,00","730,00","0,14",89,"64.970,00","64.970,00",GRNT,2018-04-19
20.04.2018,"750,00","750,00","730,00","749,26","2,64","1,005","753.008,00","753.008,00",GRNT,2018-04-20
23.04.2018,"758,00","760,00","731,00","755,89","0,88",791,"597.910,00","597.910,00",GRNT,2018-04-23
25.04.2018,"731,00","732,00","731,00","731,20","-3,27",250,"182.800,00","182.800,00",GRNT,2018-04-25
26.04.2018,"755,00","755,00","731,00","736,15","0,68","9,160","6.743.130,00","6.743.130,00",GRNT,2018-04-26
27.04.2018,"760,00","760,00","750,00","757,65","2,92","3,361","2.546.455,00","2.546.455,00",GRNT,2018-04-27
30.04.2018,"770,00","770,00","757,00","763,50","0,77",20,"15.270,00","15.270,00",GRNT,2018-04-30
02.05.2018,"820,00","820,00","774,00","793,36","3,91","5,004","3.969.956,00","3.969.956,00",GRNT,2018-05-02
03.05.2018,"820,00","820,00","820,00","820,00","3,36","2,190","1.795.800,00","1.795.800,00",GRNT,2018-05-03
07.05.2018,"818,00","818,00","800,00","812,00","-0,98",60,"48.720,00","48.720,00",GRNT,2018-05-07
08.05.2018,"800,00","801,00","800,00","800,12","-1,46",430,"344.050,00","344.050,00",GRNT,2018-05-08
10.05.2018,"800,00","800,00","799,00","799,99","-0,02",690,"551.990,00","551.990,00",GRNT,2018-05-10
11.05.2018,"786,00","786,00","786,00","786,00","-1,75",50,"39.300,00","39.300,00",GRNT,2018-05-11
14.05.2018,"785,00","786,00","785,00","785,19","-0,10",265,"208.075,00","208.075,00",GRNT,2018-05-14
17.05.2018,"762,00","762,00","707,00","756,55","-3,65",548,"414.590,00","414.590,00",GRNT,2018-05-17
18.05.2018,"735,00","762,00","735,00","743,11","-1,78",428,"318.050,00","318.050,00",GRNT,2018-05-18
21.05.2018,"725,00","730,00","725,00","725,79","-2,33",380,"275.800,00","275.800,00",GRNT,2018-05-21
22.05.2018,"716,00","716,00","716,00","716,00","-1,35",60,"42.960,00","42.960,00",GRNT,2018-05-22
23.05.2018,"750,00","750,00","745,00","748,68","4,56","4,020","3.009.700,00","3.009.700,00",GRNT,2018-05-23
28.05.2018,"750,00","750,00","744,00","747,18","-0,20",220,"164.380,00","164.380,00",GRNT,2018-05-28
29.05.2018,"745,00","749,00","745,00","748,17","0,13",654,"489.306,00","489.306,00",GRNT,2018-05-29
30.05.2018,"749,00","749,00","740,00","747,79","-0,05",435,"325.290,00","325.290,00",GRNT,2018-05-30
31.05.2018,"750,00","750,00","749,00","749,86","0,28",800,"599.887,00","599.887,00",GRNT,2018-05-31
01.06.2018,"770,00","770,00","750,00","762,76","1,72","1,850","1.411.100,00","1.411.100,00",GRNT,2018-06-01
04.06.2018,"790,00","790,00","770,00","774,36","1,52","9,526","7.376.524,00","7.376.524,00",GRNT,2018-06-04
